,id,type,modified,language,license,rightsHolder,accessRights,references,institutionID,collectionID,datasetID,institutionCode,collectionCode,datasetName,basisOfRecord,informationWithheld,dataGeneralizations,dynamicProperties,occurrenceID,catalogNumber,occurrenceRemarks,recordNumber,recordedBy,sex,reproductiveCondition,occurrenceStatus,preparations,disposition,otherCatalogNumbers,associatedMedia,samplingProtocol,eventDate,startDayOfYear,endDayOfYear,year,month,day,verbatimEventDate,habitat,fieldNumber,higherGeography,continent,islandGroup,island,country,countryCode,stateProvince,county,municipality,locality,verbatimLocality,verbatimElevation,minimumElevationInMeters,maximumElevationInMeters,locationRemarks,decimalLatitude,decimalLongitude,geodeticDatum,coordinateUncertaintyInMeters,identifiedBy,dateIdentified,identificationReferences,identificationRemarks,identificationQualifier,typeStatus,scientificName,family,genus,specificEpithet,infraspecificEpithet,scientificNameAuthorship1,f5a04de8-41ae-4760-9d4c-c07dd36a10f4,http://purl.org/dc/dcmitype/PhysicalObject,28:16.0,en,https://huh.harvard.edu/pages/use,President and Fellows of Harvard College,https://huh.harvard.edu/access-digital-reproductions-works-public-domain,http://data.huh.harvard.edu/f5a04de8-41ae-4760-9d4c-c07dd36a10f4/image,urn:lsid:biocol.org:col:15631,urn:lsid:biocol.org:col:15631,NA,GH,GH,Harvard University Herbaria: All Records,PreservedSpecimen,NA,NA,"{huh_taxonomic_group: Vascular, huh_project_id: 7, huh_project_name: US and Canada - Mass Digitization}",f5a04de8-41ae-4760-9d4c-c07dd36a10f4,barcode-01722698,NA,52587,V. L. Cory,undetermined,NotDetermined,present,Sheet,in collection,,[see Simple Media extension],NA,4/3/47,NA,NA,1947,4,3,,along gullied drainage courses of woods hills,52587,North America;United States of America;Texas;Anderson County;,North America,NA,NA,United States of America,US,Texas,Anderson County,,2 miles north of Palestine;,2 miles north of Palestine;,,NA,NA,,NA,NA,,NA,,,,,NA,,Prunus mexicana S. Watson,Rosaceae,Prunus,mexicana,,S. Watson2,192119c3-3e0e-4c09-a9dd-01d1f4b18d83,http://purl.org/dc/dcmitype/PhysicalObject,23:55.0,en,https://huh.harvard.edu/pages/use,President and Fellows of Harvard College,https://huh.harvard.edu/access-digital-reproductions-works-public-domain,http://data.huh.harvard.edu/192119c3-3e0e-4c09-a9dd-01d1f4b18d83/image,urn:lsid:biocol.org:col:15406,urn:lsid:biocol.org:col:15406,NA,A,A,Harvard University Herbaria: All Records,PreservedSpecimen,NA,NA,"{huh_taxonomic_group: Vascular, huh_project_id: 7, huh_project_name: US and Canada - Mass Digitization}",192119c3-3e0e-4c09-a9dd-01d1f4b18d83,barcode-01722468,NA,,[data not captured],undetermined,NotDetermined,present,Sheet,in collection,,[see Simple Media extension],NA,,NA,NA,NA,NA,NA,,,,North America;United States of America;Arkansas;Ashley County;,North America,NA,NA,United States of America,US,Arkansas,Ashley County,,[data not captured],[data not captured],,NA,NA,,NA,NA,,NA,,,,,NA,,Prunus mexicana S. Watson,Rosaceae,Prunus,mexicana,,S. Watson3,ffb24e7f-889f-4327-a007-a4a8f3632be0,http://purl.org/dc/dcmitype/PhysicalObject,09:03.0,en,https://huh.harvard.edu/pages/use,President and Fellows of Harvard College,https://huh.harvard.edu/access-digital-reproductions-works-public-domain,http://data.huh.harvard.edu/ffb24e7f-889f-4327-a007-a4a8f3632be0/image,urn:lsid:biocol.org:col:15631,urn:lsid:biocol.org:col:15631,NA,GH,GH,Harvard University Herbaria: All Records,PreservedSpecimen,NA,NA,"{huh_taxonomic_group: Vascular, huh_project_id: 7, huh_project_name: US and Canada - Mass Digitization}",ffb24e7f-889f-4327-a007-a4a8f3632be0,barcode-01722514,NA,,[data not captured],undetermined,NotDetermined,present,Sheet,in collection,,[see Simple Media extension],NA,,NA,NA,NA,NA,NA,,,,North America;United States of America;Missouri;Audrain County;,North America,NA,NA,United States of America,US,Missouri,Audrain County,,[data not captured],[data not captured],,NA,NA,,NA,NA,,NA,,,,,NA,,Prunus mexicana S. Watson,Rosaceae,Prunus,mexicana,,S. Watson4,c866b5ed-e6b9-4838-b5c5-3707fd2979a2,http://purl.org/dc/dcmitype/PhysicalObject,23:53.0,en,https://huh.harvard.edu/pages/use,President and Fellows of Harvard College,https://huh.harvard.edu/access-digital-reproductions-works-public-domain,http://data.huh.harvard.edu/c866b5ed-e6b9-4838-b5c5-3707fd2979a2/image,urn:lsid:biocol.org:col:15631,urn:lsid:biocol.org:col:15631,NA,GH,GH,Harvard University Herbaria: All Records,PreservedSpecimen,NA,NA,"{huh_taxonomic_group: Vascular, huh_project_id: 7, huh_project_name: US and Canada - Mass Digitization}",c866b5ed-e6b9-4838-b5c5-3707fd2979a2,barcode-01722696,NA,249,T. Drummond,undetermined,NotDetermined,present,Sheet,in collection,,[see Simple Media extension],NA,,NA,NA,NA,NA,NA,,,249,North America;United States of America;Texas;Austin County;,North America,NA,NA,United States of America,US,Texas,Austin County,San Felipe,[no additional data],[no additional data],,NA,NA,,NA,NA,,NA,,,,,NA,,Prunus mexicana S. Watson,Rosaceae,Prunus,mexicana,,S. Watson5,8a87314f-4896-4bf1-9860-dc3ea6a9eb8a,http://purl.org/dc/dcmitype/PhysicalObject,49:47.0,en,https://huh.harvard.edu/pages/use,President and Fellows of Harvard College,https://huh.harvard.edu/access-digital-reproductions-works-public-domain,http://data.huh.harvard.edu/8a87314f-4896-4bf1-9860-dc3ea6a9eb8a/image,urn:lsid:biocol.org:col:15406,urn:lsid:biocol.org:col:15406,NA,A,A,Harvard University Herbaria: All Records,PreservedSpecimen,NA,NA,"{huh_taxonomic_group: Vascular, huh_project_id: 7, huh_project_name: US and Canada - Mass Digitization}",8a87314f-4896-4bf1-9860-dc3ea6a9eb8a,barcode-01722495,NA,,[data not captured],undetermined,NotDetermined,present,Sheet,in collection,,[see Simple Media extension],NA,,NA,NA,NA,NA,NA,,,,North America;United States of America;Kentucky;Ballard County;,North America,NA,NA,United States of America,US,Kentucky,Ballard County,,[data not captured],[data not captured],,NA,NA,,NA,NA,,NA,,,,,NA,,Prunus mexicana S. Watson,Rosaceae,Prunus,mexicana,,S. Watson6,7a6f4a04-0a55-4690-9559-23ee44ac74e1,http://purl.org/dc/dcmitype/PhysicalObject,58:31.0,en,https://huh.harvard.edu/pages/use,President and Fellows of Harvard College,https://huh.harvard.edu/access-digital-reproductions-works-public-domain,http://data.huh.harvard.edu/7a6f4a04-0a55-4690-9559-23ee44ac74e1/image,urn:lsid:biocol.org:col:15406,urn:lsid:biocol.org:col:15406,NA,A,A,Harvard University Herbaria: All Records,PreservedSpecimen,NA,NA,"{huh_taxonomic_group: Vascular, huh_project_id: 7, huh_project_name: US and Canada - Mass Digitization}",7a6f4a04-0a55-4690-9559-23ee44ac74e1,barcode-01722431,NA,,[data not captured],undetermined,NotDetermined,present,Sheet,in collection,,[see Simple Media extension],NA,,NA,NA,NA,NA,NA,,,,North America;United States of America;Arkansas;Baxter County;,North America,NA,NA,United States of America,US,Arkansas,Baxter County,,[data not captured],[data not captured],,NA,NA,,NA,NA,,NA,,,,,NA,,Prunus mexicana S. Watson,Rosaceae,Prunus,mexicana,,S. Watson7,ed30a86e-8d68-4daf-b279-aba8459b9514,http://purl.org/dc/dcmitype/PhysicalObject,17:29.0,en,https://huh.harvard.edu/pages/use,President and Fellows of Harvard College,https://huh.harvard.edu/access-digital-reproductions-works-public-domain,http://data.huh.harvard.edu/ed30a86e-8d68-4daf-b279-aba8459b9514/image,urn:lsid:biocol.org:col:15406,urn:lsid:biocol.org:col:15406,NA,A,A,Harvard University Herbaria: All Records,PreservedSpecimen,NA,NA,"{huh_taxonomic_group: Vascular, huh_project_id: 7, huh_project_name: US and Canada - Mass Digitization}",ed30a86e-8d68-4daf-b279-aba8459b9514,barcode-01722678,NA,27,B. Mackensen,undetermined,NotDetermined,present,Sheet,in collection,,[see Simple Media extension],NA,1909-12,NA,NA,1909,12,NA,,,27,North America;United States of America;Texas;Bexar County;,North America,NA,NA,United States of America,US,Texas,Bexar County,San Antonio,[no additional data],[no additional data],,NA,NA,,NA,NA,,NA,,,,,NA,,Prunus mexicana S. Watson,Rosaceae,Prunus,mexicana,,S. Watson8,1ee4dc34-06c2-4c69-892f-07e2056c5b38,http://purl.org/dc/dcmitype/PhysicalObject,18:12.0,en,https://huh.harvard.edu/pages/use,President and Fellows of Harvard College,https://huh.harvard.edu/access-digital-reproductions-works-public-domain,http://data.huh.harvard.edu/1ee4dc34-06c2-4c69-892f-07e2056c5b38/image,urn:lsid:biocol.org:col:15406,urn:lsid:biocol.org:col:15406,NA,A,A,Harvard University Herbaria: All Records,PreservedSpecimen,NA,NA,"{huh_taxonomic_group: Vascular, huh_project_id: 7, huh_project_name: US and Canada - Mass Digitization}",1ee4dc34-06c2-4c69-892f-07e2056c5b38,barcode-01722679,NA,,B. Mackensen,undetermined,NotDetermined,present,Sheet,in collection,,[see Simple Media extension],NA,1910,NA,NA,1910,NA,NA,,,,North America;United States of America;Texas;Bexar County;,North America,NA,NA,United States of America,US,Texas,Bexar County,San Antonio,Williant [illegible],Williant [illegible],,NA,NA,,NA,NA,,NA,,,,,NA,,Prunus mexicana S. Watson,Rosaceae,Prunus,mexicana,,S. Watson9,b9c197df-8eef-49d2-ae30-cd07987df374,http://purl.org/dc/dcmitype/PhysicalObject,18:46.0,en,https://huh.harvard.edu/pages/use,President and Fellows of Harvard College,https://huh.harvard.edu/access-digital-reproductions-works-public-domain,http://data.huh.harvard.edu/b9c197df-8eef-49d2-ae30-cd07987df374/image,urn:lsid:biocol.org:col:15406,urn:lsid:biocol.org:col:15406,NA,A,A,Harvard University Herbaria: All Records,PreservedSpecimen,NA,NA,"{huh_taxonomic_group: Vascular, huh_project_id: 7, huh_project_name: US and Canada - Mass Digitization}",b9c197df-8eef-49d2-ae30-cd07987df374,barcode-01722680,NA,28,B. Mackensen,undetermined,NotDetermined,present,Sheet,in collection,,[see Simple Media extension],NA,3/14/10,NA,NA,1910,3,14,,,28,North America;United States of America;Texas;Bexar County;,North America,NA,NA,United States of America,US,Texas,Bexar County,San Antonio,[no additional data],[no additional data],,NA,NA,,NA,NA,,NA,,,,,NA,,Prunus mexicana S. Watson,Rosaceae,Prunus,mexicana,,S. Watson10,01f27cf3-a549-4a24-9c9d-70e17317aedd,http://purl.org/dc/dcmitype/PhysicalObject,19:22.0,en,https://huh.harvard.edu/pages/use,President and Fellows of Harvard College,https://huh.harvard.edu/access-digital-reproductions-works-public-domain,http://data.huh.harvard.edu/01f27cf3-a549-4a24-9c9d-70e17317aedd/image,urn:lsid:biocol.org:col:15406,urn:lsid:biocol.org:col:15406,NA,A,A,Harvard University Herbaria: All Records,PreservedSpecimen,NA,NA,"{huh_taxonomic_group: Vascular, huh_project_id: 7, huh_project_name: US and Canada - Mass Digitization}",01f27cf3-a549-4a24-9c9d-70e17317aedd,barcode-01722681,NA,796,B. F. Bush,undetermined,NotDetermined,present,Sheet,in collection,,[see Simple Media extension],NA,9/16/07,NA,NA,1907,9,16,,in woods,796,North America;United States of America;Texas;Bexar County;,North America,NA,NA,United States of America,US,Texas,Bexar County,San Antonio,[no additional data],[no additional data],,NA,NA,,NA,NA,,NA,,,,,NA,,Prunus mexicana S. Watson,Rosaceae,Prunus,mexicana,,S. Watson11,b36090d5-8493-49a4-b0eb-4c94d95b4d1a,http://purl.org/dc/dcmitype/PhysicalObject,19:56.0,en,https://huh.harvard.edu/pages/use,President and Fellows of Harvard College,https://huh.harvard.edu/access-digital-reproductions-works-public-domain,http://data.huh.harvard.edu/b36090d5-8493-49a4-b0eb-4c94d95b4d1a/image,urn:lsid:biocol.org:col:15406,urn:lsid:biocol.org:col:15406,NA,A,A,Harvard University Herbaria: All Records,PreservedSpecimen,NA,NA,"{huh_taxonomic_group: Vascular, huh_project_id: 7, huh_project_name: US and Canada - Mass Digitization}",b36090d5-8493-49a4-b0eb-4c94d95b4d1a,barcode-01722682,NA,1207,B. F. Bush,undetermined,NotDetermined,present,Sheet,in collection,,[see Simple Media extension],NA,3/24/02,NA,NA,1902,3,24,,in woods,1207,North America;United States of America;Texas;Bexar County;,North America,NA,NA,United States of America,US,Texas,Bexar County,San Antonio,[no additional data],[no additional data],,NA,NA,,NA,NA,,NA,,,,,NA,,Prunus mexicana S. Watson,Rosaceae,Prunus,mexicana,,S. Watson12,ef5254b5-72cf-4bf1-bc33-1668ea284c04,http://purl.org/dc/dcmitype/PhysicalObject,20:51.0,en,https://huh.harvard.edu/pages/use,President and Fellows of Harvard College,https://huh.harvard.edu/access-digital-reproductions-works-public-domain,http://data.huh.harvard.edu/ef5254b5-72cf-4bf1-bc33-1668ea284c04/image,urn:lsid:biocol.org:col:15406,urn:lsid:biocol.org:col:15406,NA,A,A,Harvard University Herbaria: All Records,PreservedSpecimen,NA,NA,"{huh_taxonomic_group: Vascular, huh_project_id: 7, huh_project_name: US and Canada - Mass Digitization}",ef5254b5-72cf-4bf1-bc33-1668ea284c04,barcode-01722683,NA,1155,B. F. Bush,undetermined,NotDetermined,present,Sheet,in collection,,[see Simple Media extension],NA,3/22/02,NA,NA,1902,3,22,,in woods,1155,North America;United States of America;Texas;Bexar County;,North America,NA,NA,United States of America,US,Texas,Bexar County,San Antonio,[no additional data],[no additional data],,NA,NA,,NA,NA,,NA,,,,,NA,,Prunus mexicana S. Watson,Rosaceae,Prunus,mexicana,,S. Watson13,7458078f-d4e8-496f-a6f6-8419b2452870,http://purl.org/dc/dcmitype/PhysicalObject,21:42.0,en,https://huh.harvard.edu/pages/use,President and Fellows of Harvard College,https://huh.harvard.edu/access-digital-reproductions-works-public-domain,http://data.huh.harvard.edu/7458078f-d4e8-496f-a6f6-8419b2452870/image,urn:lsid:biocol.org:col:15406,urn:lsid:biocol.org:col:15406,NA,A,A,Harvard University Herbaria: All Records,PreservedSpecimen,NA,NA,"{huh_taxonomic_group: Vascular, huh_project_id: 7, huh_project_name: US and Canada - Mass Digitization}",7458078f-d4e8-496f-a6f6-8419b2452870,barcode-01722684,NA,3319,P. L. Ricker,undetermined,NotDetermined,present,Sheet,in collection,,[see Simple Media extension],NA,3/26/10,NA,NA,1910,3,26,,,3319,North America;United States of America;Texas;Bexar County;,North America,NA,NA,United States of America,US,Texas,Bexar County,San Antonio,Breckenridge Park,Breckenridge Park,,NA,NA,,NA,NA,,NA,,,,,NA,,Prunus mexicana S. Watson,Rosaceae,Prunus,mexicana,,S. Watson14,b05182ff-7368-40a9-a666-5f8f66597788,http://purl.org/dc/dcmitype/PhysicalObject,21:33.0,en,https://huh.harvard.edu/pages/use,President and Fellows of Harvard College,https://huh.harvard.edu/access-digital-reproductions-works-public-domain,http://data.huh.harvard.edu/b05182ff-7368-40a9-a666-5f8f66597788/image,urn:lsid:biocol.org:col:15406,urn:lsid:biocol.org:col:15406,NA,A,A,Harvard University Herbaria: All Records,PreservedSpecimen,NA,NA,"{huh_taxonomic_group: Vascular, huh_project_id: 7, huh_project_name: US and Canada - Mass Digitization}",b05182ff-7368-40a9-a666-5f8f66597788,barcode-01722685,NA,9260,E. J. Palmer,undetermined,NotDetermined,present,Sheet,in collection,,[see Simple Media extension],NA,3/25/16,NA,NA,1916,3,25,,Rocky river banks,9260,North America;United States of America;Texas;Bexar County;,North America,NA,NA,United States of America,US,Texas,Bexar County,,San Antonio,San Antonio,,NA,NA,,NA,NA,,NA,,,,,NA,,Prunus mexicana S. Watson,Rosaceae,Prunus,mexicana,,S. Watson15,50d84faf-4fb0-419c-a11c-f334df1690f3,http://purl.org/dc/dcmitype/PhysicalObject,22:55.0,en,https://huh.harvard.edu/pages/use,President and Fellows of Harvard College,https://huh.harvard.edu/access-digital-reproductions-works-public-domain,http://data.huh.harvard.edu/50d84faf-4fb0-419c-a11c-f334df1690f3/image,urn:lsid:biocol.org:col:15406,urn:lsid:biocol.org:col:15406,NA,A,A,Harvard University Herbaria: All Records,PreservedSpecimen,NA,NA,"{huh_taxonomic_group: Vascular, huh_project_id: 7, huh_project_name: US and Canada - Mass Digitization}",50d84faf-4fb0-419c-a11c-f334df1690f3,barcode-01722686,NA,223,S. H. Hastings,undetermined,NotDetermined,present,Sheet,in collection,,[see Simple Media extension],NA,2/23/11,NA,NA,1911,2,23,,,223,North America;United States of America;Texas;Bexar County;,North America,NA,NA,United States of America,US,Texas,Bexar County,San Antonio,[no additional data],[no additional data],,NA,NA,,NA,NA,,NA,,,,,NA,,Prunus mexicana S. Watson,Rosaceae,Prunus,mexicana,,S. Watson16,cd4e4453-d9a1-4c97-9310-657fdb7e236b,http://purl.org/dc/dcmitype/PhysicalObject,41:38.0,en,https://huh.harvard.edu/pages/use,President and Fellows of Harvard College,https://huh.harvard.edu/access-digital-reproductions-works-public-domain,http://data.huh.harvard.edu/cd4e4453-d9a1-4c97-9310-657fdb7e236b/image,urn:lsid:biocol.org:col:15406,urn:lsid:biocol.org:col:15406,NA,A,A,Harvard University Herbaria: All Records,PreservedSpecimen,NA,NA,"{huh_taxonomic_group: Vascular, huh_project_id: 7, huh_project_name: US and Canada - Mass Digitization}",cd4e4453-d9a1-4c97-9310-657fdb7e236b,barcode-01722758,NA,4990,E. J. Palmer,undetermined,NotDetermined,present,Sheet,in collection,,[see Simple Media extension],NA,3/22/14,NA,NA,1914,3,22,,Low woods,4990,North America;United States of America;Texas;Brazoria County;,North America,NA,NA,United States of America,US,Texas,Brazoria County,Columbia,Brazos River,Brazos River,,NA,NA,,NA,NA,,NA,,,,,NA,,Prunus mexicana S. Watson,Rosaceae,Prunus,mexicana,,S. Watson17,cefd03d2-0f02-4c65-b16b-b987eb78e4aa,http://purl.org/dc/dcmitype/PhysicalObject,20:40.0,en,https://huh.harvard.edu/pages/use,President and Fellows of Harvard College,https://huh.harvard.edu/access-digital-reproductions-works-public-domain,http://data.huh.harvard.edu/cefd03d2-0f02-4c65-b16b-b987eb78e4aa/image,urn:lsid:biocol.org:col:15406,urn:lsid:biocol.org:col:15406,NA,A,A,Harvard University Herbaria: All Records,PreservedSpecimen,NA,NA,"{huh_taxonomic_group: Vascular, huh_project_id: 7, huh_project_name: US and Canada - Mass Digitization}",cefd03d2-0f02-4c65-b16b-b987eb78e4aa,barcode-01722591,NA,,R. G. Reeves,undetermined,NotDetermined,present,Sheet,in collection,,[see Simple Media extension],NA,4/12/40,NA,NA,1940,4,12,,,,North America;United States of America;Texas;Brazos County;,North America,NA,NA,United States of America,US,Texas,Brazos County,,"North Oakwood, College Station","North Oakwood, College Station",,NA,NA,,NA,NA,,NA,,1940,,,NA,,Prunus mexicana S. Watson,Rosaceae,Prunus,mexicana,,S. Watson18,f9232b54-0100-496d-a004-56f09c863bbe,http://purl.org/dc/dcmitype/PhysicalObject,01:08.0,en,https://huh.harvard.edu/pages/use,President and Fellows of Harvard College,https://huh.harvard.edu/access-digital-reproductions-works-public-domain,http://data.huh.harvard.edu/f9232b54-0100-496d-a004-56f09c863bbe/image,urn:lsid:biocol.org:col:15406,urn:lsid:biocol.org:col:15406,NA,A,A,Harvard University Herbaria: All Records,PreservedSpecimen,NA,NA,"{huh_taxonomic_group: Vascular, huh_project_id: 7, huh_project_name: US and Canada - Mass Digitization}",f9232b54-0100-496d-a004-56f09c863bbe,barcode-01722741,NA,10374,E. J. Palmer,undetermined,NotDetermined,present,Sheet,in collection,,[see Simple Media extension],NA,7/5/16,NA,NA,1916,7,5,,"Woods, along small streams",10374,North America;United States of America;Texas;Brown County;,North America,NA,NA,United States of America,US,Texas,Brown County,,Brownwood,Brownwood,,NA,NA,,NA,NA,,NA,,,,,NA,,Prunus mexicana S. Watson,Rosaceae,Prunus,mexicana,,S. Watson19,05f808ed-c81e-4e21-9d19-4fcb7241371b,http://purl.org/dc/dcmitype/PhysicalObject,02:14.0,en,https://huh.harvard.edu/pages/use,President and Fellows of Harvard College,https://huh.harvard.edu/access-digital-reproductions-works-public-domain,http://data.huh.harvard.edu/05f808ed-c81e-4e21-9d19-4fcb7241371b/image,urn:lsid:biocol.org:col:15406,urn:lsid:biocol.org:col:15406,NA,A,A,Harvard University Herbaria: All Records,PreservedSpecimen,NA,NA,"{huh_taxonomic_group: Vascular, huh_project_id: 7, huh_project_name: US and Canada - Mass Digitization}",05f808ed-c81e-4e21-9d19-4fcb7241371b,barcode-01722745,NA,29534,E. J. Palmer,undetermined,NotDetermined,present,Sheet,in collection,,[see Simple Media extension],NA,11/1/25,NA,NA,1925,11,1,,Rocky ground along small creek,29534,North America;United States of America;Texas;Brown County;,North America,NA,NA,United States of America,US,Texas,Brown County,,Near Brownwood,Near Brownwood,,NA,NA,,NA,NA,,NA,,,,,NA,,Prunus mexicana S. Watson,Rosaceae,Prunus,mexicana,,S. Watson20,cf4590d4-2a59-4ca6-8df6-384083a3329a,http://purl.org/dc/dcmitype/PhysicalObject,08:34.0,en,https://huh.harvard.edu/pages/use,President and Fellows of Harvard College,https://huh.harvard.edu/access-digital-reproductions-works-public-domain,http://data.huh.harvard.edu/cf4590d4-2a59-4ca6-8df6-384083a3329a/image,urn:lsid:biocol.org:col:15406,urn:lsid:biocol.org:col:15406,NA,A,A,Harvard University Herbaria: All Records,PreservedSpecimen,NA,NA,"{huh_taxonomic_group: Vascular, huh_project_id: 7, huh_project_name: US and Canada - Mass Digitization}",cf4590d4-2a59-4ca6-8df6-384083a3329a,barcode-01722513,NA,,[data not captured],undetermined,NotDetermined,present,Sheet,in collection,,[see Simple Media extension],NA,,NA,NA,NA,NA,NA,,,,North America;United States of America;Missouri;Butler County;,North America,NA,NA,United States of America,US,Missouri,Butler County,,[data not captured],[data not captured],,NA,NA,,NA,NA,,NA,,,,,NA,,Prunus mexicana S. Watson,Rosaceae,Prunus,mexicana,,S. Watson21,91efdf94-bd12-4b2c-b12d-8d267d1c177b,http://purl.org/dc/dcmitype/PhysicalObject,01:31.0,en,https://huh.harvard.edu/pages/use,President and Fellows of Harvard College,https://huh.harvard.edu/access-digital-reproductions-works-public-domain,http://data.huh.harvard.edu/91efdf94-bd12-4b2c-b12d-8d267d1c177b/image,urn:lsid:biocol.org:col:15631,urn:lsid:biocol.org:col:15631,NA,GH,GH,Harvard University Herbaria: All Records,PreservedSpecimen,NA,NA,"{huh_taxonomic_group: Vascular, huh_project_id: 7, huh_project_name: US and Canada - Mass Digitization}",91efdf94-bd12-4b2c-b12d-8d267d1c177b,barcode-01722506,NA,,[data not captured],undetermined,NotDetermined,present,Sheet,in collection,,[see Simple Media extension],NA,,NA,NA,NA,NA,NA,,,,North America;United States of America;Louisiana;Caldwell County;,North America,NA,NA,United States of America,US,Louisiana,Caldwell County,,[data not captured],[data not captured],,NA,NA,,NA,NA,,NA,,,,,NA,,Prunus mexicana S. Watson,Rosaceae,Prunus,mexicana,,S. Watson22,a98733a6-b2ef-4cd8-89bf-9ecaa92d5429,http://purl.org/dc/dcmitype/PhysicalObject,22:32.0,en,https://huh.harvard.edu/pages/use,President and Fellows of Harvard College,https://huh.harvard.edu/access-digital-reproductions-works-public-domain,http://data.huh.harvard.edu/a98733a6-b2ef-4cd8-89bf-9ecaa92d5429/image,urn:lsid:biocol.org:col:15631,urn:lsid:biocol.org:col:15631,NA,GH,GH,Harvard University Herbaria: All Records,PreservedSpecimen,NA,NA,"{huh_taxonomic_group: Vascular, huh_project_id: 7, huh_project_name: US and Canada - Mass Digitization}",a98733a6-b2ef-4cd8-89bf-9ecaa92d5429,barcode-01722558,NA,3948,E. L. Little,undetermined,NotDetermined,present,Sheet,in collection,,[see Simple Media extension],NA,9/26/36,NA,NA,1936,9,26,,,3948,North America;United States of America;Oklahoma;Canadian County;,North America,NA,NA,United States of America,US,Oklahoma,Canadian County,,Devil's Canyon,Devil's Canyon,,NA,NA,,NA,NA,,NA,,,,,NA,,Prunus mexicana S. Watson,Rosaceae,Prunus,mexicana,,S. Watson23,d41037e0-2135-41ac-8f18-7fc11f6578e6,http://purl.org/dc/dcmitype/PhysicalObject,13:18.0,en,https://huh.harvard.edu/pages/use,President and Fellows of Harvard College,https://huh.harvard.edu/access-digital-reproductions-works-public-domain,http://data.huh.harvard.edu/d41037e0-2135-41ac-8f18-7fc11f6578e6/image,urn:lsid:biocol.org:col:15406,urn:lsid:biocol.org:col:15406,NA,A,A,Harvard University Herbaria: All Records,PreservedSpecimen,NA,NA,"{huh_taxonomic_group: Vascular, huh_project_id: 7, huh_project_name: US and Canada - Mass Digitization}",d41037e0-2135-41ac-8f18-7fc11f6578e6,barcode-01722453,NA,,[data not captured],undetermined,NotDetermined,present,Sheet,in collection,,[see Simple Media extension],NA,,NA,NA,NA,NA,NA,,,,North America;United States of America;Arkansas;Carroll County;,North America,NA,NA,United States of America,US,Arkansas,Carroll County,,[data not captured],[data not captured],,NA,NA,,NA,NA,,NA,,,,,NA,,Prunus mexicana S. Watson,Rosaceae,Prunus,mexicana,,S. Watson24,f51f5035-4124-424c-8645-164834b3469a,http://purl.org/dc/dcmitype/PhysicalObject,21:23.0,en,https://huh.harvard.edu/pages/use,President and Fellows of Harvard College,https://huh.harvard.edu/access-digital-reproductions-works-public-domain,http://data.huh.harvard.edu/f51f5035-4124-424c-8645-164834b3469a/image,urn:lsid:biocol.org:col:15631,urn:lsid:biocol.org:col:15631,NA,GH,GH,Harvard University Herbaria: All Records,PreservedSpecimen,NA,NA,"{huh_taxonomic_group: Vascular, huh_project_id: 7, huh_project_name: US and Canada - Mass Digitization}",f51f5035-4124-424c-8645-164834b3469a,barcode-01722557,NA,930,"M. Hopkins, A. Nelson & R. Nelson",undetermined,NotDetermined,present,Sheet,in collection,,[see Simple Media extension],NA,3/24/45,NA,NA,1945,3,24,,in open woods,930,North America;United States of America;Oklahoma;Carter County;,North America,NA,NA,United States of America,US,Oklahoma,Carter County,,"Wilcox Sandstone formation, Arbuckle Mountains.","Wilcox Sandstone formation, Arbuckle Mountains.",,NA,NA,,NA,NA,,NA,,,,,NA,,Prunus mexicana S. Watson,Rosaceae,Prunus,mexicana,,S. Watson25,85f07f21-3040-47f4-ace1-a0883f39640e,http://purl.org/dc/dcmitype/PhysicalObject,37:44.0,en,https://huh.harvard.edu/pages/use,President and Fellows of Harvard College,https://huh.harvard.edu/access-digital-reproductions-works-public-domain,http://data.huh.harvard.edu/85f07f21-3040-47f4-ace1-a0883f39640e/image,urn:lsid:biocol.org:col:15406,urn:lsid:biocol.org:col:15406,NA,A,A,Harvard University Herbaria: All Records,PreservedSpecimen,NA,NA,"{huh_taxonomic_group: Vascular, huh_project_id: 7, huh_project_name: US and Canada - Mass Digitization}",85f07f21-3040-47f4-ace1-a0883f39640e,barcode-01722733,NA,7137,E. J. Palmer,undetermined,NotDetermined,present,Sheet,in collection,,[see Simple Media extension],NA,4/3/15,NA,NA,1915,4,3,,Dry upland woods,7137,North America;United States of America;Texas;Cherokee County;,North America,NA,NA,United States of America,US,Texas,Cherokee County,,Jacksonville,Jacksonville,,NA,NA,,NA,NA,,NA,,,,,NA,,Prunus mexicana S. Watson,Rosaceae,Prunus,mexicana,,S. Watson26,5630c829-b765-4184-addf-b7d58c3e6d87,http://purl.org/dc/dcmitype/PhysicalObject,43:03.0,en,https://huh.harvard.edu/pages/use,President and Fellows of Harvard College,https://huh.harvard.edu/access-digital-reproductions-works-public-domain,http://data.huh.harvard.edu/5630c829-b765-4184-addf-b7d58c3e6d87/image,urn:lsid:biocol.org:col:15631,urn:lsid:biocol.org:col:15631,NA,GH,GH,Harvard University Herbaria: All Records,PreservedSpecimen,NA,NA,"{huh_taxonomic_group: Vascular, huh_project_id: 7, huh_project_name: US and Canada - Mass Digitization}",5630c829-b765-4184-addf-b7d58c3e6d87,barcode-01722740,NA,24874,L. H. Shinners,undetermined,NotDetermined,present,Sheet,in collection,,[see Simple Media extension],NA,10/4/56,NA,NA,1956,10,4,,"Young pine-hardwood stand, red sandy clay hillside",24874,North America;United States of America;Texas;Cherokee County;,North America,NA,NA,United States of America,US,Texas,Cherokee County,,2.8 miles north-northwest of Rusk,2.8 miles north-northwest of Rusk,,NA,NA,,NA,NA,,NA,,,,,NA,,Prunus mexicana S. Watson,Rosaceae,Prunus,mexicana,,S. Watson27,eb626ac3-8aad-465c-93d5-fdeea8e353b7,http://purl.org/dc/dcmitype/PhysicalObject,44:32.0,en,https://huh.harvard.edu/pages/use,President and Fellows of Harvard College,https://huh.harvard.edu/access-digital-reproductions-works-public-domain,http://data.huh.harvard.edu/eb626ac3-8aad-465c-93d5-fdeea8e353b7/image,urn:lsid:biocol.org:col:15406,urn:lsid:biocol.org:col:15406,NA,A,A,Harvard University Herbaria: All Records,PreservedSpecimen,NA,NA,"{huh_taxonomic_group: Vascular, huh_project_id: 7, huh_project_name: US and Canada - Mass Digitization}",eb626ac3-8aad-465c-93d5-fdeea8e353b7,barcode-01722763,NA,7142,E. J. Palmer,undetermined,NotDetermined,present,Sheet,in collection,,[see Simple Media extension],NA,4/3/15,NA,NA,1915,4,3,,Upland woods,7142,North America;United States of America;Texas;Cherokee County;,North America,NA,NA,United States of America,US,Texas,Cherokee County,,Jacksonville,Jacksonville,,NA,NA,,NA,NA,,NA,,,,,NA,,Prunus mexicana S. Watson,Rosaceae,Prunus,mexicana,,S. Watson28,f02d8799-c7aa-426d-99f7-b44b11761b64,http://purl.org/dc/dcmitype/PhysicalObject,49:19.0,en,https://huh.harvard.edu/pages/use,President and Fellows of Harvard College,https://huh.harvard.edu/access-digital-reproductions-works-public-domain,http://data.huh.harvard.edu/f02d8799-c7aa-426d-99f7-b44b11761b64/image,urn:lsid:biocol.org:col:15406,urn:lsid:biocol.org:col:15406,NA,A,A,Harvard University Herbaria: All Records,PreservedSpecimen,NA,NA,"{huh_taxonomic_group: Vascular, huh_project_id: 7, huh_project_name: US and Canada - Mass Digitization}",f02d8799-c7aa-426d-99f7-b44b11761b64,barcode-01722765,NA,7137,E. J. Palmer,undetermined,NotDetermined,present,Sheet,in collection,,[see Simple Media extension],NA,4/3/15,NA,NA,1915,4,3,,Dry upland woods,7137,North America;United States of America;Texas;Cherokee County;,North America,NA,NA,United States of America,US,Texas,Cherokee County,,Jacksonville,Jacksonville,,NA,NA,,NA,NA,,NA,,,,,NA,,Prunus mexicana S. Watson,Rosaceae,Prunus,mexicana,,S. Watson29,dd4cc259-7432-488f-8327-e6c72aa1d6c6,http://purl.org/dc/dcmitype/PhysicalObject,56:25.0,en,https://huh.harvard.edu/pages/use,President and Fellows of Harvard College,https://huh.harvard.edu/access-digital-reproductions-works-public-domain,http://data.huh.harvard.edu/dd4cc259-7432-488f-8327-e6c72aa1d6c6/image,urn:lsid:biocol.org:col:15406,urn:lsid:biocol.org:col:15406,NA,A,A,Harvard University Herbaria: All Records,PreservedSpecimen,NA,NA,"{huh_taxonomic_group: Vascular, huh_project_id: 7, huh_project_name: US and Canada - Mass Digitization}",dd4cc259-7432-488f-8327-e6c72aa1d6c6,barcode-01722532,NA,24067,E. J. Palmer,undetermined,NotDetermined,present,Sheet,in collection,,[see Simple Media extension],NA,10/7/23,NA,NA,1923,10,7,,Along small rocky creek,24067,North America;United States of America;Oklahoma;Choctaw County;,North America,NA,NA,United States of America,US,Oklahoma,Choctaw County,,near Hugo,near Hugo,,NA,NA,,NA,NA,,NA,,,,,NA,,Prunus mexicana S. Watson,Rosaceae,Prunus,mexicana,,S. Watson30,1fa9945b-02af-46ac-a910-29c787004944,http://purl.org/dc/dcmitype/PhysicalObject,52:47.0,en,https://huh.harvard.edu/pages/use,President and Fellows of Harvard College,https://huh.harvard.edu/access-digital-reproductions-works-public-domain,http://data.huh.harvard.edu/1fa9945b-02af-46ac-a910-29c787004944/image,urn:lsid:biocol.org:col:15406,urn:lsid:biocol.org:col:15406,NA,A,A,Harvard University Herbaria: All Records,PreservedSpecimen,NA,NA,"{huh_taxonomic_group: Vascular, huh_project_id: 7, huh_project_name: US and Canada - Mass Digitization}",1fa9945b-02af-46ac-a910-29c787004944,barcode-01722580,NA,106,B. H. Slavin,undetermined,NotDetermined,present,Sheet,in collection,,[see Simple Media extension],NA,3/26/14,NA,NA,1914,3,26,,,106,North America;United States of America;Texas;Clay County;,North America,NA,NA,United States of America,US,Texas,Clay County,Henrietta,"south of race track, east of Henrietta","south of race track, east of Henrietta",,NA,NA,,NA,NA,,NA,,,,,NA,,Prunus mexicana S. Watson,Rosaceae,Prunus,mexicana,,S. Watson31,3fd36883-07c7-4ed2-998e-c7fa9e8f5f3f,http://purl.org/dc/dcmitype/PhysicalObject,56:17.0,en,https://huh.harvard.edu/pages/use,President and Fellows of Harvard College,https://huh.harvard.edu/access-digital-reproductions-works-public-domain,http://data.huh.harvard.edu/3fd36883-07c7-4ed2-998e-c7fa9e8f5f3f/image,urn:lsid:biocol.org:col:15406,urn:lsid:biocol.org:col:15406,NA,A,A,Harvard University Herbaria: All Records,PreservedSpecimen,NA,NA,"{huh_taxonomic_group: Vascular, huh_project_id: 7, huh_project_name: US and Canada - Mass Digitization}",3fd36883-07c7-4ed2-998e-c7fa9e8f5f3f,barcode-01722585,NA,3379,P. L. Ricker,undetermined,NotDetermined,present,Sheet,in collection,,[see Simple Media extension],NA,4/7/10,NA,NA,1910,4,7,,,3379,North America;United States of America;Texas;Clay County;,North America,NA,NA,United States of America,US,Texas,Clay County,Henrietta,[no additional data],[no additional data],,NA,NA,,NA,NA,,NA,,,,,NA,,Prunus mexicana S. Watson,Rosaceae,Prunus,mexicana,,S. Watson32,7420e538-8108-42be-8b85-0bb459c310dc,http://purl.org/dc/dcmitype/PhysicalObject,57:05.0,en,https://huh.harvard.edu/pages/use,President and Fellows of Harvard College,https://huh.harvard.edu/access-digital-reproductions-works-public-domain,http://data.huh.harvard.edu/7420e538-8108-42be-8b85-0bb459c310dc/image,urn:lsid:biocol.org:col:15406,urn:lsid:biocol.org:col:15406,NA,A,A,Harvard University Herbaria: All Records,PreservedSpecimen,NA,NA,"{huh_taxonomic_group: Vascular, huh_project_id: 7, huh_project_name: US and Canada - Mass Digitization}",7420e538-8108-42be-8b85-0bb459c310dc,barcode-01722586,NA,3380,P. L. Ricker,undetermined,NotDetermined,present,Sheet,in collection,,[see Simple Media extension],NA,4/4/10,NA,NA,1910,4,4,,,3380,North America;United States of America;Texas;Clay County;,North America,NA,NA,United States of America,US,Texas,Clay County,Henrietta,[no additional data],[no additional data],,NA,NA,,NA,NA,,NA,,,,,NA,,Prunus mexicana S. Watson,Rosaceae,Prunus,mexicana,,S. Watson33,6758277e-d90c-4863-ab8f-1363ad9e49e3,http://purl.org/dc/dcmitype/PhysicalObject,08:56.0,en,https://huh.harvard.edu/pages/use,President and Fellows of Harvard College,https://huh.harvard.edu/access-digital-reproductions-works-public-domain,http://data.huh.harvard.edu/6758277e-d90c-4863-ab8f-1363ad9e49e3/image,urn:lsid:biocol.org:col:15406,urn:lsid:biocol.org:col:15406,NA,A,A,Harvard University Herbaria: All Records,PreservedSpecimen,NA,NA,"{huh_taxonomic_group: Vascular, huh_project_id: 7, huh_project_name: US and Canada - Mass Digitization}",6758277e-d90c-4863-ab8f-1363ad9e49e3,barcode-01722670,NA,4919,E. J. Palmer,undetermined,NotDetermined,present,Sheet,in collection,,[see Simple Media extension],NA,3/12/14,NA,NA,1914,3,12,,Low woods,4919,North America;United States of America;Texas;Colorado County;,North America,NA,NA,United States of America,US,Texas,Colorado County,,Eagle Lake,Eagle Lake,,NA,NA,,NA,NA,,NA,,,,,NA,,Prunus mexicana S. Watson,Rosaceae,Prunus,mexicana,,S. Watson34,7f9b6e36-4798-4068-983c-4d93872f00bb,http://purl.org/dc/dcmitype/PhysicalObject,13:59.0,en,https://huh.harvard.edu/pages/use,President and Fellows of Harvard College,https://huh.harvard.edu/access-digital-reproductions-works-public-domain,http://data.huh.harvard.edu/7f9b6e36-4798-4068-983c-4d93872f00bb/image,urn:lsid:biocol.org:col:15406,urn:lsid:biocol.org:col:15406,NA,A,A,Harvard University Herbaria: All Records,PreservedSpecimen,NA,NA,"{huh_taxonomic_group: Vascular, huh_project_id: 7, huh_project_name: US and Canada - Mass Digitization}",7f9b6e36-4798-4068-983c-4d93872f00bb,barcode-01722757,NA,4916,E. J. Palmer,undetermined,NotDetermined,present,Sheet,in collection,,[see Simple Media extension],NA,3/12/14,NA,NA,1914,3,12,,Low woods,4916,North America;United States of America;Texas;Colorado County;,North America,NA,NA,United States of America,US,Texas,Colorado County,,Eagle Lake,Eagle Lake,,NA,NA,,NA,NA,,NA,,,,,NA,,Prunus mexicana S. Watson,Rosaceae,Prunus,mexicana,,S. Watson35,62683e87-f772-4add-9a73-f664b836858d,http://purl.org/dc/dcmitype/PhysicalObject,18:39.0,en,https://huh.harvard.edu/pages/use,President and Fellows of Harvard College,https://huh.harvard.edu/access-digital-reproductions-works-public-domain,http://data.huh.harvard.edu/62683e87-f772-4add-9a73-f664b836858d/image,urn:lsid:biocol.org:col:15631,urn:lsid:biocol.org:col:15631,NA,GH,GH,Harvard University Herbaria: All Records,PreservedSpecimen,NA,NA,"{huh_taxonomic_group: Vascular, huh_project_id: 7, huh_project_name: US and Canada - Mass Digitization}",62683e87-f772-4add-9a73-f664b836858d,barcode-01722647,NA,7696,Hal. B. Parks,undetermined,NotDetermined,present,Sheet,in collection,,[see Simple Media extension],NA,11/15/33,NA,NA,1933,11,15,,,7696,North America;United States of America;Texas;Comal County;,North America,NA,NA,United States of America,US,Texas,Comal County,,Anhalt,Anhalt,,NA,NA,,NA,NA,,NA,,,,,NA,,Prunus mexicana S. Watson,Rosaceae,Prunus,mexicana,,S. Watson36,0d723829-0f8b-4eea-8e8a-9bc4d304652a,http://purl.org/dc/dcmitype/PhysicalObject,45:51.0,en,https://huh.harvard.edu/pages/use,President and Fellows of Harvard College,https://huh.harvard.edu/access-digital-reproductions-works-public-domain,http://data.huh.harvard.edu/0d723829-0f8b-4eea-8e8a-9bc4d304652a/image,urn:lsid:biocol.org:col:15406,urn:lsid:biocol.org:col:15406,NA,A,A,Harvard University Herbaria: All Records,PreservedSpecimen,NA,NA,"{huh_taxonomic_group: Vascular, huh_project_id: 7, huh_project_name: US and Canada - Mass Digitization}",0d723829-0f8b-4eea-8e8a-9bc4d304652a,barcode-01722746,NA,,C. S. Sargent,undetermined,NotDetermined,present,Sheet,in collection,,[see Simple Media extension],NA,3/24/11,NA,NA,1911,3,24,,,,North America;United States of America;Texas;Comal County;,North America,NA,NA,United States of America,US,Texas,Comal County,New Braunfels,[no additional data],[no additional data],,NA,NA,,NA,NA,,NA,,,,,NA,,Prunus mexicana S. Watson,Rosaceae,Prunus,mexicana,,S. Watson37,ee813002-4a6c-4478-a1d5-5b675d66b1f1,http://purl.org/dc/dcmitype/PhysicalObject,24:22.0,en,https://huh.harvard.edu/pages/use,President and Fellows of Harvard College,https://huh.harvard.edu/access-digital-reproductions-works-public-domain,http://data.huh.harvard.edu/ee813002-4a6c-4478-a1d5-5b675d66b1f1/image,urn:lsid:biocol.org:col:15406,urn:lsid:biocol.org:col:15406,NA,A,A,Harvard University Herbaria: All Records,PreservedSpecimen,NA,NA,"{huh_taxonomic_group: Vascular, huh_project_id: 7, huh_project_name: US and Canada - Mass Digitization}",ee813002-4a6c-4478-a1d5-5b675d66b1f1,barcode-01722747,NA,3323,P. L. Ricker,undetermined,NotDetermined,present,Sheet,in collection,,[see Simple Media extension],NA,3/28/10,NA,NA,1910,3,28,,,3323,North America;United States of America;Texas;Comal County;,North America,NA,NA,United States of America,US,Texas,Comal County,New Braunfels,[no additional data],[no additional data],,NA,NA,,NA,NA,,NA,,,,,NA,,Prunus mexicana S. Watson,Rosaceae,Prunus,mexicana,,S. Watson38,7d4b03a8-8c1a-4ef9-83a6-7f4e32146991,http://purl.org/dc/dcmitype/PhysicalObject,27:07.0,en,https://huh.harvard.edu/pages/use,President and Fellows of Harvard College,https://huh.harvard.edu/access-digital-reproductions-works-public-domain,http://data.huh.harvard.edu/7d4b03a8-8c1a-4ef9-83a6-7f4e32146991/image,urn:lsid:biocol.org:col:15406,urn:lsid:biocol.org:col:15406,NA,A,A,Harvard University Herbaria: All Records,PreservedSpecimen,NA,NA,"{huh_taxonomic_group: Vascular, huh_project_id: 7, huh_project_name: US and Canada - Mass Digitization}",7d4b03a8-8c1a-4ef9-83a6-7f4e32146991,barcode-01722749,NA,177,S. H. Hastings,undetermined,NotDetermined,present,Sheet,in collection,,[see Simple Media extension],NA,4/10/11,NA,NA,1911,4,10,,,177,North America;United States of America;Texas;Comal County;,North America,NA,NA,United States of America,US,Texas,Comal County,New Braunfels,[no additional data],[no additional data],,NA,NA,,NA,NA,,NA,,,,,NA,,Prunus mexicana S. Watson,Rosaceae,Prunus,mexicana,,S. Watson39,1d859527-79c6-43f7-96de-48457c4bdf1c,http://purl.org/dc/dcmitype/PhysicalObject,37:43.0,en,https://huh.harvard.edu/pages/use,President and Fellows of Harvard College,https://huh.harvard.edu/access-digital-reproductions-works-public-domain,http://data.huh.harvard.edu/1d859527-79c6-43f7-96de-48457c4bdf1c/image,urn:lsid:biocol.org:col:15406,urn:lsid:biocol.org:col:15406,NA,A,A,Harvard University Herbaria: All Records,PreservedSpecimen,NA,NA,"{huh_taxonomic_group: Vascular, huh_project_id: 7, huh_project_name: US and Canada - Mass Digitization}",1d859527-79c6-43f7-96de-48457c4bdf1c,barcode-01722524,NA,1432,J. C. Shirley,undetermined,NotDetermined,present,Sheet,in collection,,[see Simple Media extension],NA,6/12/33,NA,NA,1933,6,12,,Near creek,1432,North America;United States of America;Oklahoma;Comanche County;,North America,NA,NA,United States of America,US,Oklahoma,Comanche County,,Near Camp Boulder,Near Camp Boulder,,NA,NA,,NA,NA,,NA,,1/17/35,,,NA,,Prunus mexicana S. Watson,Rosaceae,Prunus,mexicana,,S. Watson40,f2b03c2b-4384-4aa7-8a21-9bebd7444fc9,http://purl.org/dc/dcmitype/PhysicalObject,00:36.0,en,https://huh.harvard.edu/pages/use,President and Fellows of Harvard College,https://huh.harvard.edu/access-digital-reproductions-works-public-domain,http://data.huh.harvard.edu/f2b03c2b-4384-4aa7-8a21-9bebd7444fc9/image,urn:lsid:biocol.org:col:15406,urn:lsid:biocol.org:col:15406,NA,A,A,Harvard University Herbaria: All Records,PreservedSpecimen,NA,NA,"{huh_taxonomic_group: Vascular, huh_project_id: 7, huh_project_name: US and Canada - Mass Digitization}",f2b03c2b-4384-4aa7-8a21-9bebd7444fc9,barcode-01722533,NA,41986,E. J. Palmer,undetermined,NotDetermined,present,Sheet,in collection,,[see Simple Media extension],NA,7/27/33,NA,NA,1933,7,27,,Rocky banks of small stream,41986,North America;United States of America;Oklahoma;Comanche County;,North America,NA,NA,United States of America,US,Oklahoma,Comanche County,,"Wichita Mts., Wichita National Forest","Wichita Mts., Wichita National Forest",,NA,NA,,NA,NA,,NA,,,,,NA,,Prunus mexicana S. Watson,Rosaceae,Prunus,mexicana,,S. Watson41,4ff70e1d-7ad5-4146-a4c3-e52ed6bb0f3a,http://purl.org/dc/dcmitype/PhysicalObject,02:27.0,en,https://huh.harvard.edu/pages/use,President and Fellows of Harvard College,https://huh.harvard.edu/access-digital-reproductions-works-public-domain,http://data.huh.harvard.edu/4ff70e1d-7ad5-4146-a4c3-e52ed6bb0f3a/image,urn:lsid:biocol.org:col:15406,urn:lsid:biocol.org:col:15406,NA,A,A,Harvard University Herbaria: All Records,PreservedSpecimen,NA,NA,"{huh_taxonomic_group: Vascular, huh_project_id: 7, huh_project_name: US and Canada - Mass Digitization}",4ff70e1d-7ad5-4146-a4c3-e52ed6bb0f3a,barcode-01722534,NA,41988,E. J. Palmer,undetermined,NotDetermined,present,Sheet,in collection,,[see Simple Media extension],NA,7/27/33,NA,NA,1933,7,27,,Rocky ground along small stream,41988,North America;United States of America;Oklahoma;Comanche County;,North America,NA,NA,United States of America,US,Oklahoma,Comanche County,,"Wichita Mtns., Wichita National Forest","Wichita Mtns., Wichita National Forest",,NA,NA,,NA,NA,,NA,,,,,NA,,Prunus mexicana S. Watson,Rosaceae,Prunus,mexicana,,S. Watson42,e3b032df-5c52-4c80-9eb3-4f2c727d0181,http://purl.org/dc/dcmitype/PhysicalObject,09:11.0,en,https://huh.harvard.edu/pages/use,President and Fellows of Harvard College,https://huh.harvard.edu/access-digital-reproductions-works-public-domain,http://data.huh.harvard.edu/e3b032df-5c52-4c80-9eb3-4f2c727d0181/image,urn:lsid:biocol.org:col:15631,urn:lsid:biocol.org:col:15631,NA,GH,GH,Harvard University Herbaria: All Records,PreservedSpecimen,NA,NA,"{huh_taxonomic_group: Vascular, huh_project_id: 7, huh_project_name: US and Canada - Mass Digitization}",e3b032df-5c52-4c80-9eb3-4f2c727d0181,barcode-01722555,NA,958,"M. Hopkins, A. Nelson & R. Nelson",undetermined,NotDetermined,present,Sheet,in collection,,[see Simple Media extension],NA,4/7/45,NA,NA,1945,4,7,,on stream bank,958,North America;United States of America;Oklahoma;Comanche County;,North America,NA,NA,United States of America,US,Oklahoma,Comanche County,,"Sunset Camp, Wild Life Refuge, Wichita Mts.","Sunset Camp, Wild Life Refuge, Wichita Mts.",,NA,NA,,NA,NA,,NA,,,,,NA,,Prunus mexicana S. Watson,Rosaceae,Prunus,mexicana,,S. Watson43,24ef97f6-d08a-4d31-9fdf-5b48a9944c31,http://purl.org/dc/dcmitype/PhysicalObject,36:15.0,en,https://huh.harvard.edu/pages/use,President and Fellows of Harvard College,https://huh.harvard.edu/access-digital-reproductions-works-public-domain,http://data.huh.harvard.edu/24ef97f6-d08a-4d31-9fdf-5b48a9944c31/image,urn:lsid:biocol.org:col:15631,urn:lsid:biocol.org:col:15631,NA,GH,GH,Harvard University Herbaria: All Records,PreservedSpecimen,NA,NA,"{huh_taxonomic_group: Vascular, huh_project_id: 7, huh_project_name: US and Canada - Mass Digitization}",24ef97f6-d08a-4d31-9fdf-5b48a9944c31,barcode-01722565,NA,1350,G. W. Stevens,undetermined,NotDetermined,present,Sheet,in collection,,[see Simple Media extension],NA,6/25/13,NA,NA,1913,6,25,,Edge of woods - creek valley,1350,North America;United States of America;Oklahoma;Comanche County;,North America,NA,NA,United States of America,US,Oklahoma,Comanche County,,Near Cache,Near Cache,,NA,NA,,NA,NA,,NA,,,,,NA,,Prunus mexicana S. Watson,Rosaceae,Prunus,mexicana,,S. Watson44,62beaad4-e15b-4b89-bc92-d9e0010754db,http://purl.org/dc/dcmitype/PhysicalObject,53:06.0,en,https://huh.harvard.edu/pages/use,President and Fellows of Harvard College,https://huh.harvard.edu/access-digital-reproductions-works-public-domain,http://data.huh.harvard.edu/62beaad4-e15b-4b89-bc92-d9e0010754db/image,urn:lsid:biocol.org:col:15406,urn:lsid:biocol.org:col:15406,NA,A,A,Harvard University Herbaria: All Records,PreservedSpecimen,NA,NA,"{huh_taxonomic_group: Vascular, huh_project_id: 7, huh_project_name: US and Canada - Mass Digitization}",62beaad4-e15b-4b89-bc92-d9e0010754db,barcode-01722569,NA,2202,B. O. Osborn,undetermined,NotDetermined,present,Sheet,in collection,,[see Simple Media extension],NA,8/27/37,NA,NA,1937,8,27,,Along small stream,2202,North America;United States of America;Oklahoma;Comanche County;,North America,NA,NA,United States of America,US,Oklahoma,Comanche County,,"Craterville Park, near Cache","Craterville Park, near Cache",,NA,NA,,NA,NA,,NA,,,,,NA,,Prunus mexicana S. Watson,Rosaceae,Prunus,mexicana,,S. Watson45,aa41f2d5-dac4-4c11-91e5-2ee21ab59b44,http://purl.org/dc/dcmitype/PhysicalObject,44:52.0,en,https://huh.harvard.edu/pages/use,President and Fellows of Harvard College,https://huh.harvard.edu/access-digital-reproductions-works-public-domain,http://data.huh.harvard.edu/aa41f2d5-dac4-4c11-91e5-2ee21ab59b44/image,urn:lsid:biocol.org:col:15406,urn:lsid:biocol.org:col:15406,NA,A,A,Harvard University Herbaria: All Records,PreservedSpecimen,NA,NA,"{huh_taxonomic_group: Vascular, huh_project_id: 7, huh_project_name: US and Canada - Mass Digitization}",aa41f2d5-dac4-4c11-91e5-2ee21ab59b44,barcode-01722487,NA,,[data not captured],undetermined,NotDetermined,present,Sheet,in collection,,[see Simple Media extension],NA,,NA,NA,NA,NA,NA,,,,North America;United States of America;Arkansas;Craighead County;,North America,NA,NA,United States of America,US,Arkansas,Craighead County,,[data not captured],[data not captured],,NA,NA,,NA,NA,,NA,,,,,NA,,Prunus mexicana S. Watson,Rosaceae,Prunus,mexicana,,S. Watson46,fd74fa1b-4339-466a-b716-8037def59789,http://purl.org/dc/dcmitype/PhysicalObject,07:49.0,en,https://huh.harvard.edu/pages/use,President and Fellows of Harvard College,https://huh.harvard.edu/access-digital-reproductions-works-public-domain,http://data.huh.harvard.edu/fd74fa1b-4339-466a-b716-8037def59789/image,urn:lsid:biocol.org:col:15406,urn:lsid:biocol.org:col:15406,NA,A,A,Harvard University Herbaria: All Records,PreservedSpecimen,NA,NA,"{huh_taxonomic_group: Vascular, huh_project_id: 7, huh_project_name: US and Canada - Mass Digitization}",fd74fa1b-4339-466a-b716-8037def59789,barcode-01722595,NA,1967,J. Reverchon,undetermined,NotDetermined,present,Sheet,in collection,,[see Simple Media extension],NA,1900-03-25/1900-05-26,NA,NA,NA,NA,NA,,,1967,North America;United States of America;Texas;Dallas County;,North America,NA,NA,United States of America,US,Texas,Dallas County,Dallas,[no additional data],[no additional data],,NA,NA,,NA,NA,,NA,,,,,NA,,Prunus mexicana S. Watson,Rosaceae,Prunus,mexicana,,S. Watson47,2e7e715f-150e-487a-9226-f5efd6514d23,http://purl.org/dc/dcmitype/PhysicalObject,21:55.0,en,https://huh.harvard.edu/pages/use,President and Fellows of Harvard College,https://huh.harvard.edu/access-digital-reproductions-works-public-domain,http://data.huh.harvard.edu/2e7e715f-150e-487a-9226-f5efd6514d23/image,urn:lsid:biocol.org:col:15406,urn:lsid:biocol.org:col:15406,NA,A,A,Harvard University Herbaria: All Records,PreservedSpecimen,NA,NA,"{huh_taxonomic_group: Vascular, huh_project_id: 7, huh_project_name: US and Canada - Mass Digitization}",2e7e715f-150e-487a-9226-f5efd6514d23,barcode-01722596,NA,269,J. Reverchon,undetermined,NotDetermined,present,Sheet,in collection,,[see Simple Media extension],NA,1880-03/1880-06,NA,NA,NA,NA,NA,,Dry woods,269,North America;United States of America;Texas;Dallas County;,North America,NA,NA,United States of America,US,Texas,Dallas County,Dallas,[no additional data],[no additional data],,NA,NA,,NA,NA,,NA,,,,,NA,,Prunus mexicana S. Watson,Rosaceae,Prunus,mexicana,,S. Watson48,9b07e3d9-6e51-45b0-b348-f0a6e291d413,http://purl.org/dc/dcmitype/PhysicalObject,24:35.0,en,https://huh.harvard.edu/pages/use,President and Fellows of Harvard College,https://huh.harvard.edu/access-digital-reproductions-works-public-domain,http://data.huh.harvard.edu/9b07e3d9-6e51-45b0-b348-f0a6e291d413/image,urn:lsid:biocol.org:col:15406,urn:lsid:biocol.org:col:15406,NA,A,A,Harvard University Herbaria: All Records,PreservedSpecimen,NA,NA,"{huh_taxonomic_group: Vascular, huh_project_id: 7, huh_project_name: US and Canada - Mass Digitization}",9b07e3d9-6e51-45b0-b348-f0a6e291d413,barcode-01722599,NA,,J. Reverchon,undetermined,NotDetermined,present,Sheet,in collection,,[see Simple Media extension],NA,9/11/02,NA,NA,1902,9,11,,,,North America;United States of America;Texas;Dallas County;,North America,NA,NA,United States of America,US,Texas,Dallas County,Dallas,[no additional data],[no additional data],,NA,NA,,NA,NA,,NA,,,,,NA,,Prunus mexicana S. Watson,Rosaceae,Prunus,mexicana,,S. Watson49,b641b51c-aa26-443e-9c17-90244ca4439d,http://purl.org/dc/dcmitype/PhysicalObject,26:06.0,en,https://huh.harvard.edu/pages/use,President and Fellows of Harvard College,https://huh.harvard.edu/access-digital-reproductions-works-public-domain,http://data.huh.harvard.edu/b641b51c-aa26-443e-9c17-90244ca4439d/image,urn:lsid:biocol.org:col:15406,urn:lsid:biocol.org:col:15406,NA,A,A,Harvard University Herbaria: All Records,PreservedSpecimen,NA,NA,"{huh_taxonomic_group: Vascular, huh_project_id: 7, huh_project_name: US and Canada - Mass Digitization}",b641b51c-aa26-443e-9c17-90244ca4439d,barcode-01722600,NA,4:00 AM,C. S. Sargent,undetermined,NotDetermined,present,Sheet,in collection,,[see Simple Media extension],NA,3/23/10,NA,NA,1910,3,23,,,4:00 AM,North America;United States of America;Texas;Dallas County;,North America,NA,NA,United States of America,US,Texas,Dallas County,Dallas,Cedar Creek knolls north of Cedar Creek Oak cliff,Cedar Creek knolls north of Cedar Creek Oak cliff,,NA,NA,,NA,NA,,NA,,,,,NA,,Prunus mexicana S. Watson,Rosaceae,Prunus,mexicana,,S. Watson50,0df73e97-bc1f-44f6-a33a-2d38d552d32b,http://purl.org/dc/dcmitype/PhysicalObject,02:57.0,en,https://huh.harvard.edu/pages/use,President and Fellows of Harvard College,https://huh.harvard.edu/access-digital-reproductions-works-public-domain,http://data.huh.harvard.edu/0df73e97-bc1f-44f6-a33a-2d38d552d32b/image,urn:lsid:biocol.org:col:15406,urn:lsid:biocol.org:col:15406,NA,A,A,Harvard University Herbaria: All Records,PreservedSpecimen,NA,NA,"{huh_taxonomic_group: Vascular, huh_project_id: 7, huh_project_name: US and Canada - Mass Digitization}",0df73e97-bc1f-44f6-a33a-2d38d552d32b,barcode-01722604,NA,4,C. S. Sargent,undetermined,NotDetermined,present,Sheet,in collection,,[see Simple Media extension],NA,3/23/09,NA,NA,1909,3,23,,,4,North America;United States of America;Texas;Dallas County;,North America,NA,NA,United States of America,US,Texas,Dallas County,Dallas,near Oak Cliffs,near Oak Cliffs,,NA,NA,,NA,NA,,NA,,,,,NA,,Prunus mexicana S. Watson,Rosaceae,Prunus,mexicana,,S. Watson51,11653d63-46b0-4999-acb8-3e04f0ef0b7c,http://purl.org/dc/dcmitype/PhysicalObject,22:07.0,en,https://huh.harvard.edu/pages/use,President and Fellows of Harvard College,https://huh.harvard.edu/access-digital-reproductions-works-public-domain,http://data.huh.harvard.edu/11653d63-46b0-4999-acb8-3e04f0ef0b7c/image,urn:lsid:biocol.org:col:15406,urn:lsid:biocol.org:col:15406,NA,A,A,Harvard University Herbaria: All Records,PreservedSpecimen,NA,NA,"{huh_taxonomic_group: Vascular, huh_project_id: 7, huh_project_name: US and Canada - Mass Digitization}",11653d63-46b0-4999-acb8-3e04f0ef0b7c,barcode-01722635,NA,,T. V. Munson,undetermined,NotDetermined,present,Sheet,in collection,,[see Simple Media extension],NA,3/12/15,NA,NA,1915,3,12,,,,North America;United States of America;Texas;Dallas County;,North America,NA,NA,United States of America,US,Texas,Dallas County,Dallas,Oak Cliff,Oak Cliff,,NA,NA,,NA,NA,,NA,,,,,NA,,Prunus mexicana S. Watson,Rosaceae,Prunus,mexicana,,S. Watson52,cf06ecab-640e-4e0e-95e3-425cb9dfe508,http://purl.org/dc/dcmitype/PhysicalObject,36:03.0,en,https://huh.harvard.edu/pages/use,President and Fellows of Harvard College,https://huh.harvard.edu/access-digital-reproductions-works-public-domain,http://data.huh.harvard.edu/cf06ecab-640e-4e0e-95e3-425cb9dfe508/image,urn:lsid:biocol.org:col:15406,urn:lsid:biocol.org:col:15406,NA,A,A,Harvard University Herbaria: All Records,PreservedSpecimen,NA,NA,"{huh_taxonomic_group: Vascular, huh_project_id: 7, huh_project_name: US and Canada - Mass Digitization}",cf06ecab-640e-4e0e-95e3-425cb9dfe508,barcode-01722639,NA,3370,P. L. Ricker,undetermined,NotDetermined,present,Sheet,in collection,,[see Simple Media extension],NA,4/4/10,NA,NA,1910,4,4,,,3370,North America;United States of America;Texas;Dallas County;,North America,NA,NA,United States of America,US,Texas,Dallas County,Dallas,[no additional data],[no additional data],,NA,NA,,NA,NA,,NA,,,,,NA,,Prunus mexicana S. Watson,Rosaceae,Prunus,mexicana,,S. Watson53,f6dc20d6-bbe0-4737-8f6f-707df1e71517,http://purl.org/dc/dcmitype/PhysicalObject,37:45.0,en,https://huh.harvard.edu/pages/use,President and Fellows of Harvard College,https://huh.harvard.edu/access-digital-reproductions-works-public-domain,http://data.huh.harvard.edu/f6dc20d6-bbe0-4737-8f6f-707df1e71517/image,urn:lsid:biocol.org:col:15406,urn:lsid:biocol.org:col:15406,NA,A,A,Harvard University Herbaria: All Records,PreservedSpecimen,NA,NA,"{huh_taxonomic_group: Vascular, huh_project_id: 7, huh_project_name: US and Canada - Mass Digitization}",f6dc20d6-bbe0-4737-8f6f-707df1e71517,barcode-01722640,NA,101,B. H. Slavin,undetermined,NotDetermined,present,Sheet,in collection,,[see Simple Media extension],NA,3/24/14,NA,NA,1914,3,24,,,101,North America;United States of America;Texas;Dallas County;,North America,NA,NA,United States of America,US,Texas,Dallas County,Dallas,West of Oak Cliff,West of Oak Cliff,,NA,NA,,NA,NA,,NA,,,,,NA,,Prunus mexicana S. Watson,Rosaceae,Prunus,mexicana,,S. Watson54,46aec3ef-835f-429d-b634-9e1079949a72,http://purl.org/dc/dcmitype/PhysicalObject,53:51.0,en,https://huh.harvard.edu/pages/use,President and Fellows of Harvard College,https://huh.harvard.edu/access-digital-reproductions-works-public-domain,http://data.huh.harvard.edu/46aec3ef-835f-429d-b634-9e1079949a72/image,urn:lsid:biocol.org:col:15406,urn:lsid:biocol.org:col:15406,NA,A,A,Harvard University Herbaria: All Records,PreservedSpecimen,NA,NA,"{huh_taxonomic_group: Vascular, huh_project_id: 7, huh_project_name: US and Canada - Mass Digitization}",46aec3ef-835f-429d-b634-9e1079949a72,barcode-01722642,NA,99,B. H. Slavin,undetermined,NotDetermined,present,Sheet,in collection,,[see Simple Media extension],NA,3/24/14,NA,NA,1914,3,24,,,99,North America;United States of America;Texas;Dallas County;,North America,NA,NA,United States of America,US,Texas,Dallas County,Dallas,West of Oak Cliff,West of Oak Cliff,,NA,NA,,NA,NA,,NA,,,,,NA,,Prunus mexicana S. Watson,Rosaceae,Prunus,mexicana,,S. Watson55,1582eff3-8174-4557-90b5-4b99fcbb3f7b,http://purl.org/dc/dcmitype/PhysicalObject,01:05.0,en,https://huh.harvard.edu/pages/use,President and Fellows of Harvard College,https://huh.harvard.edu/access-digital-reproductions-works-public-domain,http://data.huh.harvard.edu/1582eff3-8174-4557-90b5-4b99fcbb3f7b/image,urn:lsid:biocol.org:col:15406,urn:lsid:biocol.org:col:15406,NA,A,A,Harvard University Herbaria: All Records,PreservedSpecimen,NA,NA,"{huh_taxonomic_group: Vascular, huh_project_id: 7, huh_project_name: US and Canada - Mass Digitization}",1582eff3-8174-4557-90b5-4b99fcbb3f7b,barcode-01722664,NA,101,B. H. Slavin,undetermined,NotDetermined,present,Sheet,in collection,,[see Simple Media extension],NA,6/24/14,NA,NA,1914,6,24,,,101,North America;United States of America;Texas;Dallas County;,North America,NA,NA,United States of America,US,Texas,Dallas County,Dallas,W. of Oak cliffs,W. of Oak cliffs,,NA,NA,,NA,NA,,NA,,,,,NA,,Prunus mexicana S. Watson,Rosaceae,Prunus,mexicana,,S. Watson56,ea84d900-aa62-4b0b-a415-596a5a7d9248,http://purl.org/dc/dcmitype/PhysicalObject,51:27.0,en,https://huh.harvard.edu/pages/use,President and Fellows of Harvard College,https://huh.harvard.edu/access-digital-reproductions-works-public-domain,http://data.huh.harvard.edu/ea84d900-aa62-4b0b-a415-596a5a7d9248/image,urn:lsid:biocol.org:col:15631,urn:lsid:biocol.org:col:15631,NA,GH,GH,Harvard University Herbaria: All Records,PreservedSpecimen,NA,NA,"{huh_taxonomic_group: Vascular, huh_project_id: 7, huh_project_name: US and Canada - Mass Digitization}",ea84d900-aa62-4b0b-a415-596a5a7d9248,barcode-01722692,NA,6915,R. McVaugh,undetermined,NotDetermined,present,Sheet,in collection,,[see Simple Media extension],NA,5/18/45,NA,NA,1945,5,18,,Dry shallow gully,6915,North America;United States of America;Texas;Dallas County;,North America,NA,NA,United States of America,US,Texas,Dallas County,,"off Combine Road, 3.5 miles south of Seagoville","off Combine Road, 3.5 miles south of Seagoville",,NA,NA,,NA,NA,,NA,,,,,NA,,Prunus mexicana S. Watson,Rosaceae,Prunus,mexicana,,S. Watson57,092c0afc-de8c-4571-9599-59d4152c3976,http://purl.org/dc/dcmitype/PhysicalObject,55:20.0,en,https://huh.harvard.edu/pages/use,President and Fellows of Harvard College,https://huh.harvard.edu/access-digital-reproductions-works-public-domain,http://data.huh.harvard.edu/092c0afc-de8c-4571-9599-59d4152c3976/image,urn:lsid:biocol.org:col:15631,urn:lsid:biocol.org:col:15631,NA,GH,GH,Harvard University Herbaria: All Records,PreservedSpecimen,NA,NA,"{huh_taxonomic_group: Vascular, huh_project_id: 7, huh_project_name: US and Canada - Mass Digitization}",092c0afc-de8c-4571-9599-59d4152c3976,barcode-01722693,NA,6915,R. McVaugh,undetermined,NotDetermined,present,Sheet,in collection,,[see Simple Media extension],NA,5/18/45,NA,NA,1945,5,18,,Dry shallow gully,6915,North America;United States of America;Texas;Dallas County;,North America,NA,NA,United States of America,US,Texas,Dallas County,,"off Combine Road, 3.5 miles south of Seagonville","off Combine Road, 3.5 miles south of Seagonville",,NA,NA,,NA,NA,,NA,,,,,NA,,Prunus mexicana S. Watson,Rosaceae,Prunus,mexicana,,S. Watson58,7239fe7e-c920-4a6e-bc95-613892892c32,http://purl.org/dc/dcmitype/PhysicalObject,01:04.0,en,https://huh.harvard.edu/pages/use,President and Fellows of Harvard College,https://huh.harvard.edu/access-digital-reproductions-works-public-domain,http://data.huh.harvard.edu/7239fe7e-c920-4a6e-bc95-613892892c32/image,urn:lsid:biocol.org:col:15631,urn:lsid:biocol.org:col:15631,NA,GH,GH,Harvard University Herbaria: All Records,PreservedSpecimen,NA,NA,"{huh_taxonomic_group: Vascular, huh_project_id: 7, huh_project_name: US and Canada - Mass Digitization}",7239fe7e-c920-4a6e-bc95-613892892c32,barcode-01722689,NA,7191,R. McVaugh,undetermined,NotDetermined,present,Sheet,in collection,,[see Simple Media extension],NA,6/19/45,NA,NA,1945,6,19,,Woods along stream in Grand Prairie,7191,North America;United States of America;Texas;Denton County;,North America,NA,NA,United States of America,US,Texas,Denton County,,11 miles west-northwest of Grapevine,11 miles west-northwest of Grapevine,,NA,NA,,NA,NA,,NA,,,,,NA,,Prunus mexicana S. Watson,Rosaceae,Prunus,mexicana,,S. Watson59,5cb98549-cba0-49c5-95e1-4d230e6e6f48,http://purl.org/dc/dcmitype/PhysicalObject,37:16.0,en,https://huh.harvard.edu/pages/use,President and Fellows of Harvard College,https://huh.harvard.edu/access-digital-reproductions-works-public-domain,http://data.huh.harvard.edu/5cb98549-cba0-49c5-95e1-4d230e6e6f48/image,urn:lsid:biocol.org:col:15631,urn:lsid:biocol.org:col:15631,NA,GH,GH,Harvard University Herbaria: All Records,PreservedSpecimen,NA,NA,"{huh_taxonomic_group: Vascular, huh_project_id: 7, huh_project_name: US and Canada - Mass Digitization}",5cb98549-cba0-49c5-95e1-4d230e6e6f48,barcode-01722566,NA,874,G. W. Stevens,undetermined,NotDetermined,present,Sheet,in collection,,[see Simple Media extension],NA,6/11/13,NA,NA,1913,6,11,,In draw near creek,874,North America;United States of America;Oklahoma;Dewey County;,North America,NA,NA,United States of America,US,Oklahoma,Dewey County,,Between Canton & Seiling,Between Canton & Seiling,,NA,NA,,NA,NA,,NA,,,,,NA,,Prunus mexicana S. Watson,Rosaceae,Prunus,mexicana,,S. Watson60,dd01089d-2874-450d-af01-f407870147d8,http://purl.org/dc/dcmitype/PhysicalObject,24:13.0,en,https://huh.harvard.edu/pages/use,President and Fellows of Harvard College,https://huh.harvard.edu/access-digital-reproductions-works-public-domain,http://data.huh.harvard.edu/dd01089d-2874-450d-af01-f407870147d8/image,urn:lsid:biocol.org:col:15406,urn:lsid:biocol.org:col:15406,NA,A,A,Harvard University Herbaria: All Records,PreservedSpecimen,NA,NA,"{huh_taxonomic_group: Vascular, huh_project_id: 7, huh_project_name: US and Canada - Mass Digitization}",dd01089d-2874-450d-af01-f407870147d8,barcode-01722469,NA,,[data not captured],undetermined,NotDetermined,present,Sheet,in collection,,[see Simple Media extension],NA,,NA,NA,NA,NA,NA,,,,North America;United States of America;Arkansas;Drew County;,North America,NA,NA,United States of America,US,Arkansas,Drew County,,[data not captured],[data not captured],,NA,NA,,NA,NA,,NA,,,,,NA,,Prunus mexicana S. Watson,Rosaceae,Prunus,mexicana,,S. Watson61,918dd1e7-439c-4e04-8f60-cf54f20ff5b3,http://purl.org/dc/dcmitype/PhysicalObject,30:52.0,en,https://huh.harvard.edu/pages/use,President and Fellows of Harvard College,https://huh.harvard.edu/access-digital-reproductions-works-public-domain,http://data.huh.harvard.edu/918dd1e7-439c-4e04-8f60-cf54f20ff5b3/image,urn:lsid:biocol.org:col:15631,urn:lsid:biocol.org:col:15631,NA,GH,GH,Harvard University Herbaria: All Records,PreservedSpecimen,NA,NA,"{huh_taxonomic_group: Vascular, huh_project_id: 7, huh_project_name: US and Canada - Mass Digitization}",918dd1e7-439c-4e04-8f60-cf54f20ff5b3,barcode-01722695,NA,7532,R. McVaugh,undetermined,NotDetermined,present,Sheet,in collection,,[see Simple Media extension],NA,7/28/45,NA,NA,1945,7,28,,Woods along stream in dense shade,7532,North America;United States of America;Texas;Eastland County;,North America,NA,NA,United States of America,US,Texas,Eastland County,,4 miles south of Cisco,4 miles south of Cisco,,NA,NA,,NA,NA,,NA,,,,,NA,,Prunus mexicana S. Watson,Rosaceae,Prunus,mexicana,,S. Watson62,cbee3207-4a54-42dc-a8be-f029201435b8,http://purl.org/dc/dcmitype/PhysicalObject,14:08.0,en,https://huh.harvard.edu/pages/use,President and Fellows of Harvard College,https://huh.harvard.edu/access-digital-reproductions-works-public-domain,http://data.huh.harvard.edu/cbee3207-4a54-42dc-a8be-f029201435b8/image,urn:lsid:biocol.org:col:15406,urn:lsid:biocol.org:col:15406,NA,A,A,Harvard University Herbaria: All Records,PreservedSpecimen,NA,NA,"{huh_taxonomic_group: Vascular, huh_project_id: 7, huh_project_name: US and Canada - Mass Digitization}",cbee3207-4a54-42dc-a8be-f029201435b8,barcode-01722456,NA,,[data not captured],undetermined,NotDetermined,present,Sheet,in collection,,[see Simple Media extension],NA,,NA,NA,NA,NA,NA,,,,North America;United States of America;Arkansas;Faulkner County;,North America,NA,NA,United States of America,US,Arkansas,Faulkner County,,[data not captured],[data not captured],,NA,NA,,NA,NA,,NA,,,,,NA,,Prunus mexicana S. Watson,Rosaceae,Prunus,mexicana,,S. Watson63,aa6f0ae4-ad38-4652-bf57-b8ff817ae90a,http://purl.org/dc/dcmitype/PhysicalObject,44:29.0,en,https://huh.harvard.edu/pages/use,President and Fellows of Harvard College,https://huh.harvard.edu/access-digital-reproductions-works-public-domain,http://data.huh.harvard.edu/aa6f0ae4-ad38-4652-bf57-b8ff817ae90a/image,urn:lsid:biocol.org:col:15406,urn:lsid:biocol.org:col:15406,NA,A,A,Harvard University Herbaria: All Records,PreservedSpecimen,NA,NA,"{huh_taxonomic_group: Vascular, huh_project_id: 7, huh_project_name: US and Canada - Mass Digitization}",aa6f0ae4-ad38-4652-bf57-b8ff817ae90a,barcode-01722486,NA,,[data not captured],undetermined,NotDetermined,present,Sheet,in collection,,[see Simple Media extension],NA,,NA,NA,NA,NA,NA,,,,North America;United States of America;Arkansas;Faulkner County;,North America,NA,NA,United States of America,US,Arkansas,Faulkner County,,[data not captured],[data not captured],,NA,NA,,NA,NA,,NA,,,,,NA,,Prunus mexicana S. Watson,Rosaceae,Prunus,mexicana,,S. Watson64,ce84e4ad-71fa-4df1-834a-ff2702123966,http://purl.org/dc/dcmitype/PhysicalObject,48:05.0,en,https://huh.harvard.edu/pages/use,President and Fellows of Harvard College,https://huh.harvard.edu/access-digital-reproductions-works-public-domain,http://data.huh.harvard.edu/ce84e4ad-71fa-4df1-834a-ff2702123966/image,urn:lsid:biocol.org:col:15406,urn:lsid:biocol.org:col:15406,NA,A,A,Harvard University Herbaria: All Records,PreservedSpecimen,NA,NA,"{huh_taxonomic_group: Vascular, huh_project_id: 7, huh_project_name: US and Canada - Mass Digitization}",ce84e4ad-71fa-4df1-834a-ff2702123966,barcode-01722490,NA,,[data not captured],undetermined,NotDetermined,present,Sheet,in collection,,[see Simple Media extension],NA,,NA,NA,NA,NA,NA,,,,North America;United States of America;Indiana;Floyd County;,North America,NA,NA,United States of America,US,Indiana,Floyd County,,[data not captured],[data not captured],,NA,NA,,NA,NA,,NA,,,,,NA,,Prunus mexicana S. Watson,Rosaceae,Prunus,mexicana,,S. Watson65,991b47d5-5185-44d3-9060-968160cd5088,http://purl.org/dc/dcmitype/PhysicalObject,18:39.0,en,https://huh.harvard.edu/pages/use,President and Fellows of Harvard College,https://huh.harvard.edu/access-digital-reproductions-works-public-domain,http://data.huh.harvard.edu/991b47d5-5185-44d3-9060-968160cd5088/image,urn:lsid:biocol.org:col:15631,urn:lsid:biocol.org:col:15631,NA,GH,GH,Harvard University Herbaria: All Records,PreservedSpecimen,NA,NA,"{huh_taxonomic_group: Vascular, huh_project_id: 7, huh_project_name: US and Canada - Mass Digitization}",991b47d5-5185-44d3-9060-968160cd5088,barcode-01722458,NA,,[data not captured],undetermined,NotDetermined,present,Sheet,in collection,,[see Simple Media extension],NA,,NA,NA,NA,NA,NA,,,,North America;United States of America;Arkansas;Franklin County;,North America,NA,NA,United States of America,US,Arkansas,Franklin County,,[data not captured],[data not captured],,NA,NA,,NA,NA,,NA,,,,,NA,,Prunus mexicana S. Watson,Rosaceae,Prunus,mexicana,,S. Watson66,eb2f7e42-5100-44b9-a8b7-81ea7c3a7387,http://purl.org/dc/dcmitype/PhysicalObject,47:48.0,en,https://huh.harvard.edu/pages/use,President and Fellows of Harvard College,https://huh.harvard.edu/access-digital-reproductions-works-public-domain,http://data.huh.harvard.edu/eb2f7e42-5100-44b9-a8b7-81ea7c3a7387/image,urn:lsid:biocol.org:col:15406,urn:lsid:biocol.org:col:15406,NA,A,A,Harvard University Herbaria: All Records,PreservedSpecimen,NA,NA,"{huh_taxonomic_group: Vascular, huh_project_id: 7, huh_project_name: US and Canada - Mass Digitization}",eb2f7e42-5100-44b9-a8b7-81ea7c3a7387,barcode-01722489,NA,,[data not captured],undetermined,NotDetermined,present,Sheet,in collection,,[see Simple Media extension],NA,,NA,NA,NA,NA,NA,,,,North America;United States of America;Illinois;Gallatin County;,North America,NA,NA,United States of America,US,Illinois,Gallatin County,,[data not captured],[data not captured],,NA,NA,,NA,NA,,NA,,,,,NA,,Prunus mexicana S. Watson,Rosaceae,Prunus,mexicana,,S. Watson67,c6b7ccfd-edf0-49c0-9e8e-2cb3dfa4b429,http://purl.org/dc/dcmitype/PhysicalObject,06:42.0,en,https://huh.harvard.edu/pages/use,President and Fellows of Harvard College,https://huh.harvard.edu/access-digital-reproductions-works-public-domain,http://data.huh.harvard.edu/c6b7ccfd-edf0-49c0-9e8e-2cb3dfa4b429/image,urn:lsid:biocol.org:col:15631,urn:lsid:biocol.org:col:15631,NA,GH,GH,Harvard University Herbaria: All Records,PreservedSpecimen,NA,NA,"{huh_taxonomic_group: Vascular, huh_project_id: 7, huh_project_name: US and Canada - Mass Digitization}",c6b7ccfd-edf0-49c0-9e8e-2cb3dfa4b429,barcode-01722443,NA,,[data not captured],undetermined,NotDetermined,present,Sheet,in collection,,[see Simple Media extension],NA,,NA,NA,NA,NA,NA,,,,North America;United States of America;Arkansas;Garland County;,North America,NA,NA,United States of America,US,Arkansas,Garland County,,[data not captured],[data not captured],,NA,NA,,NA,NA,,NA,,,,,NA,,Prunus mexicana S. Watson,Rosaceae,Prunus,mexicana,,S. Watson68,07d5d6fb-24af-48fc-8579-8b50af4f3ac3,http://purl.org/dc/dcmitype/PhysicalObject,08:22.0,en,https://huh.harvard.edu/pages/use,President and Fellows of Harvard College,https://huh.harvard.edu/access-digital-reproductions-works-public-domain,http://data.huh.harvard.edu/07d5d6fb-24af-48fc-8579-8b50af4f3ac3/image,urn:lsid:biocol.org:col:15406,urn:lsid:biocol.org:col:15406,NA,A,A,Harvard University Herbaria: All Records,PreservedSpecimen,NA,NA,"{huh_taxonomic_group: Vascular, huh_project_id: 7, huh_project_name: US and Canada - Mass Digitization}",07d5d6fb-24af-48fc-8579-8b50af4f3ac3,barcode-01722445,NA,,[data not captured],undetermined,NotDetermined,present,Sheet,in collection,,[see Simple Media extension],NA,,NA,NA,NA,NA,NA,,,,North America;United States of America;Arkansas;Garland County;,North America,NA,NA,United States of America,US,Arkansas,Garland County,,[data not captured],[data not captured],,NA,NA,,NA,NA,,NA,,,,,NA,,Prunus mexicana S. Watson,Rosaceae,Prunus,mexicana,,S. Watson69,3747cbb0-c34c-4083-a7d6-8653550595ab,http://purl.org/dc/dcmitype/PhysicalObject,08:46.0,en,https://huh.harvard.edu/pages/use,President and Fellows of Harvard College,https://huh.harvard.edu/access-digital-reproductions-works-public-domain,http://data.huh.harvard.edu/3747cbb0-c34c-4083-a7d6-8653550595ab/image,urn:lsid:biocol.org:col:15406,urn:lsid:biocol.org:col:15406,NA,A,A,Harvard University Herbaria: All Records,PreservedSpecimen,NA,NA,"{huh_taxonomic_group: Vascular, huh_project_id: 7, huh_project_name: US and Canada - Mass Digitization}",3747cbb0-c34c-4083-a7d6-8653550595ab,barcode-01722446,NA,,[data not captured],undetermined,NotDetermined,present,Sheet,in collection,,[see Simple Media extension],NA,,NA,NA,NA,NA,NA,,,,North America;United States of America;Arkansas;Garland County;,North America,NA,NA,United States of America,US,Arkansas,Garland County,,[data not captured],[data not captured],,NA,NA,,NA,NA,,NA,,,,,NA,,Prunus mexicana S. Watson,Rosaceae,Prunus,mexicana,,S. Watson70,61fd5581-e766-4222-bc09-175620fc7ef0,http://purl.org/dc/dcmitype/PhysicalObject,10:27.0,en,https://huh.harvard.edu/pages/use,President and Fellows of Harvard College,https://huh.harvard.edu/access-digital-reproductions-works-public-domain,http://data.huh.harvard.edu/61fd5581-e766-4222-bc09-175620fc7ef0/image,urn:lsid:biocol.org:col:15406,urn:lsid:biocol.org:col:15406,NA,A,A,Harvard University Herbaria: All Records,PreservedSpecimen,NA,NA,"{huh_taxonomic_group: Vascular, huh_project_id: 7, huh_project_name: US and Canada - Mass Digitization}",61fd5581-e766-4222-bc09-175620fc7ef0,barcode-01722447,NA,,[data not captured],undetermined,NotDetermined,present,Sheet,in collection,,[see Simple Media extension],NA,,NA,NA,NA,NA,NA,,,,North America;United States of America;Arkansas;Garland County;,North America,NA,NA,United States of America,US,Arkansas,Garland County,,[data not captured],[data not captured],,NA,NA,,NA,NA,,NA,,,,,NA,,Prunus mexicana S. Watson,Rosaceae,Prunus,mexicana,,S. Watson71,7be55ebe-9df1-45a7-80b1-8a8676779059,http://purl.org/dc/dcmitype/PhysicalObject,13:39.0,en,https://huh.harvard.edu/pages/use,President and Fellows of Harvard College,https://huh.harvard.edu/access-digital-reproductions-works-public-domain,http://data.huh.harvard.edu/7be55ebe-9df1-45a7-80b1-8a8676779059/image,urn:lsid:biocol.org:col:15406,urn:lsid:biocol.org:col:15406,NA,A,A,Harvard University Herbaria: All Records,PreservedSpecimen,NA,NA,"{huh_taxonomic_group: Vascular, huh_project_id: 7, huh_project_name: US and Canada - Mass Digitization}",7be55ebe-9df1-45a7-80b1-8a8676779059,barcode-01722454,NA,,[data not captured],undetermined,NotDetermined,present,Sheet,in collection,,[see Simple Media extension],NA,,NA,NA,NA,NA,NA,,,,North America;United States of America;Arkansas;Garland County;,North America,NA,NA,United States of America,US,Arkansas,Garland County,,[data not captured],[data not captured],,NA,NA,,NA,NA,,NA,,,,,NA,,Prunus mexicana S. Watson,Rosaceae,Prunus,mexicana,,S. Watson72,14a379b0-2106-4b89-84db-91ae943202d8,http://purl.org/dc/dcmitype/PhysicalObject,14:23.0,en,https://huh.harvard.edu/pages/use,President and Fellows of Harvard College,https://huh.harvard.edu/access-digital-reproductions-works-public-domain,http://data.huh.harvard.edu/14a379b0-2106-4b89-84db-91ae943202d8/image,urn:lsid:biocol.org:col:15406,urn:lsid:biocol.org:col:15406,NA,A,A,Harvard University Herbaria: All Records,PreservedSpecimen,NA,NA,"{huh_taxonomic_group: Vascular, huh_project_id: 7, huh_project_name: US and Canada - Mass Digitization}",14a379b0-2106-4b89-84db-91ae943202d8,barcode-01722457,NA,,[data not captured],undetermined,NotDetermined,present,Sheet,in collection,,[see Simple Media extension],NA,,NA,NA,NA,NA,NA,,,,North America;United States of America;Arkansas;Garland County;,North America,NA,NA,United States of America,US,Arkansas,Garland County,,[data not captured],[data not captured],,NA,NA,,NA,NA,,NA,,,,,NA,,Prunus mexicana S. Watson,Rosaceae,Prunus,mexicana,,S. Watson73,de972c6b-2b70-49c3-9efc-b5a705e05a96,http://purl.org/dc/dcmitype/PhysicalObject,46:40.0,en,https://huh.harvard.edu/pages/use,President and Fellows of Harvard College,https://huh.harvard.edu/access-digital-reproductions-works-public-domain,http://data.huh.harvard.edu/de972c6b-2b70-49c3-9efc-b5a705e05a96/image,urn:lsid:biocol.org:col:15406,urn:lsid:biocol.org:col:15406,NA,A,A,Harvard University Herbaria: All Records,PreservedSpecimen,NA,NA,"{huh_taxonomic_group: Vascular, huh_project_id: 7, huh_project_name: US and Canada - Mass Digitization}",de972c6b-2b70-49c3-9efc-b5a705e05a96,barcode-01722488,NA,,[data not captured],undetermined,NotDetermined,present,Sheet,in collection,,[see Simple Media extension],NA,,NA,NA,NA,NA,NA,,,,North America;United States of America;Arkansas;Garland County;,North America,NA,NA,United States of America,US,Arkansas,Garland County,,[data not captured],[data not captured],,NA,NA,,NA,NA,,NA,,,,,NA,,Prunus mexicana S. Watson,Rosaceae,Prunus,mexicana,,S. Watson74,68d342b0-9ea0-4684-aaf6-1fe214097484,http://purl.org/dc/dcmitype/PhysicalObject,05:31.0,en,https://huh.harvard.edu/pages/use,President and Fellows of Harvard College,https://huh.harvard.edu/access-digital-reproductions-works-public-domain,http://data.huh.harvard.edu/68d342b0-9ea0-4684-aaf6-1fe214097484/image,urn:lsid:biocol.org:col:15406,urn:lsid:biocol.org:col:15406,NA,A,A,Harvard University Herbaria: All Records,PreservedSpecimen,NA,NA,"{huh_taxonomic_group: Vascular, huh_project_id: 7, huh_project_name: US and Canada - Mass Digitization}",68d342b0-9ea0-4684-aaf6-1fe214097484,barcode-01722536,NA,42008,E. J. Palmer,undetermined,NotDetermined,present,Sheet,in collection,,[see Simple Media extension],NA,7/28/33,NA,NA,1933,7,28,,Open woods along small stream,42008,North America;United States of America;Oklahoma;Garvin County;,North America,NA,NA,United States of America,US,Oklahoma,Garvin County,,"Arbuckle Mtns, near Turner Falls State Park","Arbuckle Mtns, near Turner Falls State Park",,NA,NA,,NA,NA,,NA,,,,,NA,,Prunus mexicana S. Watson,Rosaceae,Prunus,mexicana,,S. Watson75,4be85191-c67d-4e6e-be8d-036aa425766d,http://purl.org/dc/dcmitype/PhysicalObject,46:13.0,en,https://huh.harvard.edu/pages/use,President and Fellows of Harvard College,https://huh.harvard.edu/access-digital-reproductions-works-public-domain,http://data.huh.harvard.edu/4be85191-c67d-4e6e-be8d-036aa425766d/image,urn:lsid:biocol.org:col:15406,urn:lsid:biocol.org:col:15406,NA,A,A,Harvard University Herbaria: All Records,PreservedSpecimen,NA,NA,"{huh_taxonomic_group: Vascular, huh_project_id: 7, huh_project_name: US and Canada - Mass Digitization}",4be85191-c67d-4e6e-be8d-036aa425766d,barcode-01722767,NA,8285,V. L. Cory,undetermined,NotDetermined,present,Sheet,in collection,,[see Simple Media extension],NA,4/16/34,NA,NA,1934,4,16,,,8285,North America;United States of America;Texas;Gonzales County;,North America,NA,NA,United States of America,US,Texas,Gonzales County,,Gonzales,Gonzales,,NA,NA,,NA,NA,,NA,,,,,NA,,Prunus mexicana S. Watson,Rosaceae,Prunus,mexicana,,S. Watson76,faf3c4b2-6c2e-4577-832b-38ae9cfbb983,http://purl.org/dc/dcmitype/PhysicalObject,46:48.0,en,https://huh.harvard.edu/pages/use,President and Fellows of Harvard College,https://huh.harvard.edu/access-digital-reproductions-works-public-domain,http://data.huh.harvard.edu/faf3c4b2-6c2e-4577-832b-38ae9cfbb983/image,urn:lsid:biocol.org:col:15406,urn:lsid:biocol.org:col:15406,NA,A,A,Harvard University Herbaria: All Records,PreservedSpecimen,NA,NA,"{huh_taxonomic_group: Vascular, huh_project_id: 7, huh_project_name: US and Canada - Mass Digitization}",faf3c4b2-6c2e-4577-832b-38ae9cfbb983,barcode-01722768,NA,8283,V. L. Cory,undetermined,NotDetermined,present,Sheet,in collection,,[see Simple Media extension],NA,4/16/34,NA,NA,1934,4,16,,,8283,North America;United States of America;Texas;Gonzales County;,North America,NA,NA,United States of America,US,Texas,Gonzales County,,Cottonwood Springs,Cottonwood Springs,,NA,NA,,NA,NA,,NA,,,,,NA,,Prunus mexicana S. Watson,Rosaceae,Prunus,mexicana,,S. Watson77,106dc762-518c-49c2-9e35-b7e252c7b7da,http://purl.org/dc/dcmitype/PhysicalObject,11:57.0,en,https://huh.harvard.edu/pages/use,President and Fellows of Harvard College,https://huh.harvard.edu/access-digital-reproductions-works-public-domain,http://data.huh.harvard.edu/106dc762-518c-49c2-9e35-b7e252c7b7da/image,urn:lsid:biocol.org:col:15406,urn:lsid:biocol.org:col:15406,NA,A,A,Harvard University Herbaria: All Records,PreservedSpecimen,NA,NA,"{huh_taxonomic_group: Vascular, huh_project_id: 7, huh_project_name: US and Canada - Mass Digitization}",106dc762-518c-49c2-9e35-b7e252c7b7da,barcode-01722611,NA,1,T. V. Munson,undetermined,NotDetermined,present,Sheet,in collection,,[see Simple Media extension],NA,6/19/14,NA,NA,1914,6,19,,,1,North America;United States of America;Texas;Grayson County;,North America,NA,NA,United States of America,US,Texas,Grayson County,Denison,[no additional data],[no additional data],,NA,NA,,NA,NA,,NA,,,,,NA,,Prunus mexicana S. Watson,Rosaceae,Prunus,mexicana,,S. Watson78,4ac50e95-ae9e-4e54-9b6f-b0a40499607f,http://purl.org/dc/dcmitype/PhysicalObject,17:14.0,en,https://huh.harvard.edu/pages/use,President and Fellows of Harvard College,https://huh.harvard.edu/access-digital-reproductions-works-public-domain,http://data.huh.harvard.edu/4ac50e95-ae9e-4e54-9b6f-b0a40499607f/image,urn:lsid:biocol.org:col:15406,urn:lsid:biocol.org:col:15406,NA,A,A,Harvard University Herbaria: All Records,PreservedSpecimen,NA,NA,"{huh_taxonomic_group: Vascular, huh_project_id: 7, huh_project_name: US and Canada - Mass Digitization}",4ac50e95-ae9e-4e54-9b6f-b0a40499607f,barcode-01722617,NA,,C. S. Sargent,undetermined,NotDetermined,present,Sheet,in collection,,[see Simple Media extension],NA,3/25/09,NA,NA,1909,3,25,,,,North America;United States of America;Texas;Grayson County;,North America,NA,NA,United States of America,US,Texas,Grayson County,Denison,[no additional data],[no additional data],,NA,NA,,NA,NA,,NA,,,,,NA,,Prunus mexicana S. Watson,Rosaceae,Prunus,mexicana,,S. Watson79,4ee3cf78-a5c5-4db4-9098-d68be23a12b5,http://purl.org/dc/dcmitype/PhysicalObject,41:35.0,en,https://huh.harvard.edu/pages/use,President and Fellows of Harvard College,https://huh.harvard.edu/access-digital-reproductions-works-public-domain,http://data.huh.harvard.edu/4ee3cf78-a5c5-4db4-9098-d68be23a12b5/image,urn:lsid:biocol.org:col:15406,urn:lsid:biocol.org:col:15406,NA,A,A,Harvard University Herbaria: All Records,PreservedSpecimen,NA,NA,"{huh_taxonomic_group: Vascular, huh_project_id: 7, huh_project_name: US and Canada - Mass Digitization}",4ee3cf78-a5c5-4db4-9098-d68be23a12b5,barcode-01722654,NA,3372,P. L. Ricker,undetermined,NotDetermined,present,Sheet,in collection,,[see Simple Media extension],NA,4/5/10,NA,NA,1910,4,5,,,3372,North America;United States of America;Texas;Grayson County;,North America,NA,NA,United States of America,US,Texas,Grayson County,Denison,[no additional data],[no additional data],,NA,NA,,NA,NA,,NA,,,,,NA,,Prunus mexicana S. Watson,Rosaceae,Prunus,mexicana,,S. Watson80,a3ed9371-e187-4f88-93db-81137206c388,http://purl.org/dc/dcmitype/PhysicalObject,30:45.0,en,https://huh.harvard.edu/pages/use,President and Fellows of Harvard College,https://huh.harvard.edu/access-digital-reproductions-works-public-domain,http://data.huh.harvard.edu/a3ed9371-e187-4f88-93db-81137206c388/image,urn:lsid:biocol.org:col:15406,urn:lsid:biocol.org:col:15406,NA,A,A,Harvard University Herbaria: All Records,PreservedSpecimen,NA,NA,"{huh_taxonomic_group: Vascular, huh_project_id: 7, huh_project_name: US and Canada - Mass Digitization}",a3ed9371-e187-4f88-93db-81137206c388,barcode-01722762,NA,7129,E. J. Palmer,undetermined,NotDetermined,present,Sheet,in collection,,[see Simple Media extension],NA,4/2/15,NA,NA,1915,4,2,,Upland woods,7129,North America;United States of America;Texas;Gregg County;,North America,NA,NA,United States of America,US,Texas,Gregg County,,Longview,Longview,,NA,NA,,NA,NA,,NA,,,,,NA,,Prunus mexicana S. Watson,Rosaceae,Prunus,mexicana,,S. Watson81,25fb3c6e-45d7-4530-b801-9765cd0b24a7,http://purl.org/dc/dcmitype/PhysicalObject,31:19.0,en,https://huh.harvard.edu/pages/use,President and Fellows of Harvard College,https://huh.harvard.edu/access-digital-reproductions-works-public-domain,http://data.huh.harvard.edu/25fb3c6e-45d7-4530-b801-9765cd0b24a7/image,urn:lsid:biocol.org:col:15406,urn:lsid:biocol.org:col:15406,NA,A,A,Harvard University Herbaria: All Records,PreservedSpecimen,NA,NA,"{huh_taxonomic_group: Vascular, huh_project_id: 7, huh_project_name: US and Canada - Mass Digitization}",25fb3c6e-45d7-4530-b801-9765cd0b24a7,barcode-01722764,NA,7131,E. J. Palmer,undetermined,NotDetermined,present,Sheet,in collection,,[see Simple Media extension],NA,4/2/15,NA,NA,1915,4,2,,Fertile ground,7131,North America;United States of America;Texas;Gregg County;,North America,NA,NA,United States of America,US,Texas,Gregg County,,Longview,Longview,,NA,NA,,NA,NA,,NA,,,,,NA,,Prunus mexicana S. Watson,Rosaceae,Prunus,mexicana,,S. Watson82,137b3db6-0354-4b6b-ac5a-054d98271b1d,http://purl.org/dc/dcmitype/PhysicalObject,56:16.0,en,https://huh.harvard.edu/pages/use,President and Fellows of Harvard College,https://huh.harvard.edu/access-digital-reproductions-works-public-domain,http://data.huh.harvard.edu/137b3db6-0354-4b6b-ac5a-054d98271b1d/image,urn:lsid:biocol.org:col:15631,urn:lsid:biocol.org:col:15631,NA,GH,GH,Harvard University Herbaria: All Records,PreservedSpecimen,NA,NA,"{huh_taxonomic_group: Vascular, huh_project_id: 7, huh_project_name: US and Canada - Mass Digitization}",137b3db6-0354-4b6b-ac5a-054d98271b1d,barcode-01722589,NA,263,A. Traverse,undetermined,NotDetermined,present,Sheet,in collection,,[see Simple Media extension],NA,3/3/57,NA,NA,1957,3,3,,"under large pine, roadside, near slope of ravine, well drained, Beaumont clay w. 2-3 soil zone",263,North America;United States of America;Texas;Harris County;,North America,NA,NA,United States of America,US,Texas,Harris County,,"N side of Memorial Dr., ca. 250 yds. E of Post Oak Rd., Houston Memorial Park","N side of Memorial Dr., ca. 250 yds. E of Post Oak Rd., Houston Memorial Park",55',NA,NA,,NA,NA,,NA,Duplicate determined by Lloyd H. Shinners,7/8/57,,,NA,,Prunus mexicana S. Watson,Rosaceae,Prunus,mexicana,,S. Watson83,9f81f675-e5a2-420e-b770-fe513b039854,http://purl.org/dc/dcmitype/PhysicalObject,26:01.0,en,https://huh.harvard.edu/pages/use,President and Fellows of Harvard College,https://huh.harvard.edu/access-digital-reproductions-works-public-domain,http://data.huh.harvard.edu/9f81f675-e5a2-420e-b770-fe513b039854/image,urn:lsid:biocol.org:col:15631,urn:lsid:biocol.org:col:15631,NA,GH,GH,Harvard University Herbaria: All Records,PreservedSpecimen,NA,NA,"{huh_taxonomic_group: Vascular, huh_project_id: 7, huh_project_name: US and Canada - Mass Digitization}",9f81f675-e5a2-420e-b770-fe513b039854,barcode-01722700,NA,185,E. Hall,undetermined,NotDetermined,present,Sheet,in collection,,[see Simple Media extension],NA,1872-04-10,NA,NA,1872,4,10,,Woods,185,North America;United States of America;Texas;Harris County;,North America,NA,NA,United States of America,US,Texas,Harris County,Houston,Eastern Texas,Eastern Texas,,NA,NA,,NA,NA,,NA,,,,,NA,,Prunus mexicana S. Watson,Rosaceae,Prunus,mexicana,,S. Watson84,dd954f31-f0a0-49a0-9874-f73ca8c0f019,http://purl.org/dc/dcmitype/PhysicalObject,30:26.0,en,https://huh.harvard.edu/pages/use,President and Fellows of Harvard College,https://huh.harvard.edu/access-digital-reproductions-works-public-domain,http://data.huh.harvard.edu/dd954f31-f0a0-49a0-9874-f73ca8c0f019/image,urn:lsid:biocol.org:col:15406,urn:lsid:biocol.org:col:15406,NA,A,A,Harvard University Herbaria: All Records,PreservedSpecimen,NA,NA,"{huh_taxonomic_group: Vascular, huh_project_id: 7, huh_project_name: US and Canada - Mass Digitization}",dd954f31-f0a0-49a0-9874-f73ca8c0f019,barcode-01722751,NA,3306,P. L. Ricker,undetermined,NotDetermined,present,Sheet,in collection,,[see Simple Media extension],NA,3/22/10,NA,NA,1910,3,22,,,3306,North America;United States of America;Texas;Harris County;,North America,NA,NA,United States of America,US,Texas,Harris County,Houston,[no additional data],[no additional data],,NA,NA,,NA,NA,,NA,,,,,NA,,Prunus mexicana S. Watson,Rosaceae,Prunus,mexicana,,S. Watson85,5fadadd1-0b7b-4344-9187-cf4578954598,http://purl.org/dc/dcmitype/PhysicalObject,56:56.0,en,https://huh.harvard.edu/pages/use,President and Fellows of Harvard College,https://huh.harvard.edu/access-digital-reproductions-works-public-domain,http://data.huh.harvard.edu/5fadadd1-0b7b-4344-9187-cf4578954598/image,urn:lsid:biocol.org:col:15406,urn:lsid:biocol.org:col:15406,NA,A,A,Harvard University Herbaria: All Records,PreservedSpecimen,NA,NA,"{huh_taxonomic_group: Vascular, huh_project_id: 7, huh_project_name: US and Canada - Mass Digitization}",5fadadd1-0b7b-4344-9187-cf4578954598,barcode-01722761,NA,5321,E. J. Palmer,undetermined,NotDetermined,present,Sheet,in collection,,[see Simple Media extension],NA,4/19/14,NA,NA,1914,4,19,,Sandy uplands,5321,North America;United States of America;Texas;Harris County;,North America,NA,NA,United States of America,US,Texas,Harris County,,Marshall,Marshall,,NA,NA,,NA,NA,,NA,,,,,NA,,Prunus mexicana S. Watson,Rosaceae,Prunus,mexicana,,S. Watson86,05e2636d-c130-4c29-857a-4ae3dd3a6471,http://purl.org/dc/dcmitype/PhysicalObject,12:19.0,en,https://huh.harvard.edu/pages/use,President and Fellows of Harvard College,https://huh.harvard.edu/access-digital-reproductions-works-public-domain,http://data.huh.harvard.edu/05e2636d-c130-4c29-857a-4ae3dd3a6471/image,urn:lsid:biocol.org:col:15406,urn:lsid:biocol.org:col:15406,NA,A,A,Harvard University Herbaria: All Records,PreservedSpecimen,NA,NA,"{huh_taxonomic_group: Vascular, huh_project_id: 7, huh_project_name: US and Canada - Mass Digitization}",05e2636d-c130-4c29-857a-4ae3dd3a6471,barcode-01722702,NA,6850,E. J. Palmer,undetermined,NotDetermined,present,Sheet,in collection,,[see Simple Media extension],NA,10/17/14,NA,NA,1914,10,17,,Sandy woods,6850,North America;United States of America;Texas;Harrison County;,North America,NA,NA,United States of America,US,Texas,Harrison County,,Marshall,Marshall,,NA,NA,,NA,NA,,NA,,,,,NA,,Prunus mexicana S. Watson,Rosaceae,Prunus,mexicana,,S. Watson87,742f49d2-69ed-415c-8baf-38f9bc67afc5,http://purl.org/dc/dcmitype/PhysicalObject,54:41.0,en,https://huh.harvard.edu/pages/use,President and Fellows of Harvard College,https://huh.harvard.edu/access-digital-reproductions-works-public-domain,http://data.huh.harvard.edu/742f49d2-69ed-415c-8baf-38f9bc67afc5/image,urn:lsid:biocol.org:col:15406,urn:lsid:biocol.org:col:15406,NA,A,A,Harvard University Herbaria: All Records,PreservedSpecimen,NA,NA,"{huh_taxonomic_group: Vascular, huh_project_id: 7, huh_project_name: US and Canada - Mass Digitization}",742f49d2-69ed-415c-8baf-38f9bc67afc5,barcode-01722426,NA,,[data not captured],undetermined,NotDetermined,present,Sheet,in collection,,[see Simple Media extension],NA,,NA,NA,NA,NA,NA,,,,North America;United States of America;Arkansas;Hempstead County;,North America,NA,NA,United States of America,US,Arkansas,Hempstead County,,[data not captured],[data not captured],,NA,NA,,NA,NA,,NA,,,,,NA,,Prunus mexicana S. Watson,Rosaceae,Prunus,mexicana,,S. Watson88,22f1662c-def1-4d02-8742-b6b1823dd990,http://purl.org/dc/dcmitype/PhysicalObject,58:51.0,en,https://huh.harvard.edu/pages/use,President and Fellows of Harvard College,https://huh.harvard.edu/access-digital-reproductions-works-public-domain,http://data.huh.harvard.edu/22f1662c-def1-4d02-8742-b6b1823dd990/image,urn:lsid:biocol.org:col:15406,urn:lsid:biocol.org:col:15406,NA,A,A,Harvard University Herbaria: All Records,PreservedSpecimen,NA,NA,"{huh_taxonomic_group: Vascular, huh_project_id: 7, huh_project_name: US and Canada - Mass Digitization}",22f1662c-def1-4d02-8742-b6b1823dd990,barcode-01722432,NA,,[data not captured],undetermined,NotDetermined,present,Sheet,in collection,,[see Simple Media extension],NA,,NA,NA,NA,NA,NA,,,,North America;United States of America;Arkansas;Hempstead County;,North America,NA,NA,United States of America,US,Arkansas,Hempstead County,,[data not captured],[data not captured],,NA,NA,,NA,NA,,NA,,,,,NA,,Prunus mexicana S. Watson,Rosaceae,Prunus,mexicana,,S. Watson89,b010896b-a8f6-4a44-a9cd-db43e87cfd40,http://purl.org/dc/dcmitype/PhysicalObject,59:06.0,en,https://huh.harvard.edu/pages/use,President and Fellows of Harvard College,https://huh.harvard.edu/access-digital-reproductions-works-public-domain,http://data.huh.harvard.edu/b010896b-a8f6-4a44-a9cd-db43e87cfd40/image,urn:lsid:biocol.org:col:15406,urn:lsid:biocol.org:col:15406,NA,A,A,Harvard University Herbaria: All Records,PreservedSpecimen,NA,NA,"{huh_taxonomic_group: Vascular, huh_project_id: 7, huh_project_name: US and Canada - Mass Digitization}",b010896b-a8f6-4a44-a9cd-db43e87cfd40,barcode-01722433,NA,,[data not captured],undetermined,NotDetermined,present,Sheet,in collection,,[see Simple Media extension],NA,,NA,NA,NA,NA,NA,,,,North America;United States of America;Arkansas;Hempstead County;,North America,NA,NA,United States of America,US,Arkansas,Hempstead County,,[data not captured],[data not captured],,NA,NA,,NA,NA,,NA,,,,,NA,,Prunus mexicana S. Watson,Rosaceae,Prunus,mexicana,,S. Watson90,d124a353-b6fd-4cf9-bc3a-603e8053fba4,http://purl.org/dc/dcmitype/PhysicalObject,59:24.0,en,https://huh.harvard.edu/pages/use,President and Fellows of Harvard College,https://huh.harvard.edu/access-digital-reproductions-works-public-domain,http://data.huh.harvard.edu/d124a353-b6fd-4cf9-bc3a-603e8053fba4/image,urn:lsid:biocol.org:col:15406,urn:lsid:biocol.org:col:15406,NA,A,A,Harvard University Herbaria: All Records,PreservedSpecimen,NA,NA,"{huh_taxonomic_group: Vascular, huh_project_id: 7, huh_project_name: US and Canada - Mass Digitization}",d124a353-b6fd-4cf9-bc3a-603e8053fba4,barcode-01722434,NA,,[data not captured],undetermined,NotDetermined,present,Sheet,in collection,,[see Simple Media extension],NA,,NA,NA,NA,NA,NA,,,,North America;United States of America;Arkansas;Hempstead County;,North America,NA,NA,United States of America,US,Arkansas,Hempstead County,,[data not captured],[data not captured],,NA,NA,,NA,NA,,NA,,,,,NA,,Prunus mexicana S. Watson,Rosaceae,Prunus,mexicana,,S. Watson91,20410d7f-4b18-43e6-b0b3-d87d3a7b803a,http://purl.org/dc/dcmitype/PhysicalObject,59:59.0,en,https://huh.harvard.edu/pages/use,President and Fellows of Harvard College,https://huh.harvard.edu/access-digital-reproductions-works-public-domain,http://data.huh.harvard.edu/20410d7f-4b18-43e6-b0b3-d87d3a7b803a/image,urn:lsid:biocol.org:col:15406,urn:lsid:biocol.org:col:15406,NA,A,A,Harvard University Herbaria: All Records,PreservedSpecimen,NA,NA,"{huh_taxonomic_group: Vascular, huh_project_id: 7, huh_project_name: US and Canada - Mass Digitization}",20410d7f-4b18-43e6-b0b3-d87d3a7b803a,barcode-01722435,NA,,[data not captured],undetermined,NotDetermined,present,Sheet,in collection,,[see Simple Media extension],NA,,NA,NA,NA,NA,NA,,,,North America;United States of America;Arkansas;Hempstead County;,North America,NA,NA,United States of America,US,Arkansas,Hempstead County,,[data not captured],[data not captured],,NA,NA,,NA,NA,,NA,,,,,NA,,Prunus mexicana S. Watson,Rosaceae,Prunus,mexicana,,S. Watson92,38df89dd-7484-41bb-a207-10eb2ea273ca,http://purl.org/dc/dcmitype/PhysicalObject,02:46.0,en,https://huh.harvard.edu/pages/use,President and Fellows of Harvard College,https://huh.harvard.edu/access-digital-reproductions-works-public-domain,http://data.huh.harvard.edu/38df89dd-7484-41bb-a207-10eb2ea273ca/image,urn:lsid:biocol.org:col:15406,urn:lsid:biocol.org:col:15406,NA,A,A,Harvard University Herbaria: All Records,PreservedSpecimen,NA,NA,"{huh_taxonomic_group: Vascular, huh_project_id: 7, huh_project_name: US and Canada - Mass Digitization}",38df89dd-7484-41bb-a207-10eb2ea273ca,barcode-01722437,NA,,[data not captured],undetermined,NotDetermined,present,Sheet,in collection,,[see Simple Media extension],NA,,NA,NA,NA,NA,NA,,,,North America;United States of America;Arkansas;Hempstead County;,North America,NA,NA,United States of America,US,Arkansas,Hempstead County,,[data not captured],[data not captured],,NA,NA,,NA,NA,,NA,,,,,NA,,Prunus mexicana S. Watson,Rosaceae,Prunus,mexicana,,S. Watson93,62e30bfe-c81b-4880-9e99-4395278a4ff5,http://purl.org/dc/dcmitype/PhysicalObject,03:12.0,en,https://huh.harvard.edu/pages/use,President and Fellows of Harvard College,https://huh.harvard.edu/access-digital-reproductions-works-public-domain,http://data.huh.harvard.edu/62e30bfe-c81b-4880-9e99-4395278a4ff5/image,urn:lsid:biocol.org:col:15406,urn:lsid:biocol.org:col:15406,NA,A,A,Harvard University Herbaria: All Records,PreservedSpecimen,NA,NA,"{huh_taxonomic_group: Vascular, huh_project_id: 7, huh_project_name: US and Canada - Mass Digitization}",62e30bfe-c81b-4880-9e99-4395278a4ff5,barcode-01722438,NA,,[data not captured],undetermined,NotDetermined,present,Sheet,in collection,,[see Simple Media extension],NA,,NA,NA,NA,NA,NA,,,,North America;United States of America;Arkansas;Hempstead County;,North America,NA,NA,United States of America,US,Arkansas,Hempstead County,,[data not captured],[data not captured],,NA,NA,,NA,NA,,NA,,,,,NA,,Prunus mexicana S. Watson,Rosaceae,Prunus,mexicana,,S. Watson94,75eb0bd5-e450-461a-bf76-5855c29b578a,http://purl.org/dc/dcmitype/PhysicalObject,11:05.0,en,https://huh.harvard.edu/pages/use,President and Fellows of Harvard College,https://huh.harvard.edu/access-digital-reproductions-works-public-domain,http://data.huh.harvard.edu/75eb0bd5-e450-461a-bf76-5855c29b578a/image,urn:lsid:biocol.org:col:15631,urn:lsid:biocol.org:col:15631,NA,GH,GH,Harvard University Herbaria: All Records,PreservedSpecimen,NA,NA,"{huh_taxonomic_group: Vascular, huh_project_id: 7, huh_project_name: US and Canada - Mass Digitization}",75eb0bd5-e450-461a-bf76-5855c29b578a,barcode-01722449,NA,,[data not captured],undetermined,NotDetermined,present,Sheet,in collection,,[see Simple Media extension],NA,,NA,NA,NA,NA,NA,,,,North America;United States of America;Arkansas;Hempstead County;,North America,NA,NA,United States of America,US,Arkansas,Hempstead County,,[data not captured],[data not captured],,NA,NA,,NA,NA,,NA,,,,,NA,,Prunus mexicana S. Watson,Rosaceae,Prunus,mexicana,,S. Watson95,4fe16772-8ea7-4a5a-a0e0-cfa2168fcf5b,http://purl.org/dc/dcmitype/PhysicalObject,19:17.0,en,https://huh.harvard.edu/pages/use,President and Fellows of Harvard College,https://huh.harvard.edu/access-digital-reproductions-works-public-domain,http://data.huh.harvard.edu/4fe16772-8ea7-4a5a-a0e0-cfa2168fcf5b/image,urn:lsid:biocol.org:col:15406,urn:lsid:biocol.org:col:15406,NA,A,A,Harvard University Herbaria: All Records,PreservedSpecimen,NA,NA,"{huh_taxonomic_group: Vascular, huh_project_id: 7, huh_project_name: US and Canada - Mass Digitization}",4fe16772-8ea7-4a5a-a0e0-cfa2168fcf5b,barcode-01722459,NA,,[data not captured],undetermined,NotDetermined,present,Sheet,in collection,,[see Simple Media extension],NA,,NA,NA,NA,NA,NA,,,,North America;United States of America;Arkansas;Hempstead County;,North America,NA,NA,United States of America,US,Arkansas,Hempstead County,,[data not captured],[data not captured],,NA,NA,,NA,NA,,NA,,,,,NA,,Prunus mexicana S. Watson,Rosaceae,Prunus,mexicana,,S. Watson96,28fda042-6638-4b20-b912-a1020905378f,http://purl.org/dc/dcmitype/PhysicalObject,24:56.0,en,https://huh.harvard.edu/pages/use,President and Fellows of Harvard College,https://huh.harvard.edu/access-digital-reproductions-works-public-domain,http://data.huh.harvard.edu/28fda042-6638-4b20-b912-a1020905378f/image,urn:lsid:biocol.org:col:15406,urn:lsid:biocol.org:col:15406,NA,A,A,Harvard University Herbaria: All Records,PreservedSpecimen,NA,NA,"{huh_taxonomic_group: Vascular, huh_project_id: 7, huh_project_name: US and Canada - Mass Digitization}",28fda042-6638-4b20-b912-a1020905378f,barcode-01722471,NA,,[data not captured],undetermined,NotDetermined,present,Sheet,in collection,,[see Simple Media extension],NA,,NA,NA,NA,NA,NA,,,,North America;United States of America;Arkansas;Hempstead County;,North America,NA,NA,United States of America,US,Arkansas,Hempstead County,,[data not captured],[data not captured],,NA,NA,,NA,NA,,NA,,,,,NA,,Prunus mexicana S. Watson,Rosaceae,Prunus,mexicana,,S. Watson97,35eb6e15-257c-4b3e-b97c-4cdcca316f1f,http://purl.org/dc/dcmitype/PhysicalObject,25:13.0,en,https://huh.harvard.edu/pages/use,President and Fellows of Harvard College,https://huh.harvard.edu/access-digital-reproductions-works-public-domain,http://data.huh.harvard.edu/35eb6e15-257c-4b3e-b97c-4cdcca316f1f/image,urn:lsid:biocol.org:col:15406,urn:lsid:biocol.org:col:15406,NA,A,A,Harvard University Herbaria: All Records,PreservedSpecimen,NA,NA,"{huh_taxonomic_group: Vascular, huh_project_id: 7, huh_project_name: US and Canada - Mass Digitization}",35eb6e15-257c-4b3e-b97c-4cdcca316f1f,barcode-01722472,NA,,[data not captured],undetermined,NotDetermined,present,Sheet,in collection,,[see Simple Media extension],NA,,NA,NA,NA,NA,NA,,,,North America;United States of America;Arkansas;Hempstead County;,North America,NA,NA,United States of America,US,Arkansas,Hempstead County,,[data not captured],[data not captured],,NA,NA,,NA,NA,,NA,,,,,NA,,Prunus mexicana S. Watson,Rosaceae,Prunus,mexicana,,S. Watson98,c266e718-67ab-4c01-b02c-7f0b1dd47248,http://purl.org/dc/dcmitype/PhysicalObject,10:43.0,en,https://huh.harvard.edu/pages/use,President and Fellows of Harvard College,https://huh.harvard.edu/access-digital-reproductions-works-public-domain,http://data.huh.harvard.edu/c266e718-67ab-4c01-b02c-7f0b1dd47248/image,urn:lsid:biocol.org:col:15406,urn:lsid:biocol.org:col:15406,NA,A,A,Harvard University Herbaria: All Records,PreservedSpecimen,NA,NA,"{huh_taxonomic_group: Vascular, huh_project_id: 7, huh_project_name: US and Canada - Mass Digitization}",c266e718-67ab-4c01-b02c-7f0b1dd47248,barcode-01722448,NA,,[data not captured],undetermined,NotDetermined,present,Sheet,in collection,,[see Simple Media extension],NA,,NA,NA,NA,NA,NA,,,,North America;United States of America;Arkansas;Hot Spring County;,North America,NA,NA,United States of America,US,Arkansas,Hot Spring County,,[data not captured],[data not captured],,NA,NA,,NA,NA,,NA,,,,,NA,,Prunus mexicana S. Watson,Rosaceae,Prunus,mexicana,,S. Watson99,7fe1055f-1a51-457b-9f2e-6ba12cd5a880,http://purl.org/dc/dcmitype/PhysicalObject,12:02.0,en,https://huh.harvard.edu/pages/use,President and Fellows of Harvard College,https://huh.harvard.edu/access-digital-reproductions-works-public-domain,http://data.huh.harvard.edu/7fe1055f-1a51-457b-9f2e-6ba12cd5a880/image,urn:lsid:biocol.org:col:15406,urn:lsid:biocol.org:col:15406,NA,A,A,Harvard University Herbaria: All Records,PreservedSpecimen,NA,NA,"{huh_taxonomic_group: Vascular, huh_project_id: 7, huh_project_name: US and Canada - Mass Digitization}",7fe1055f-1a51-457b-9f2e-6ba12cd5a880,barcode-01722450,NA,,[data not captured],undetermined,NotDetermined,present,Sheet,in collection,,[see Simple Media extension],NA,,NA,NA,NA,NA,NA,,,,North America;United States of America;Arkansas;Hot Spring County;,North America,NA,NA,United States of America,US,Arkansas,Hot Spring County,,[data not captured],[data not captured],,NA,NA,,NA,NA,,NA,,,,,NA,,Prunus mexicana S. Watson,Rosaceae,Prunus,mexicana,,S. Watson100,4bfab7cf-01a1-4503-a0f8-7b298833e5b0,http://purl.org/dc/dcmitype/PhysicalObject,23:39.0,en,https://huh.harvard.edu/pages/use,President and Fellows of Harvard College,https://huh.harvard.edu/access-digital-reproductions-works-public-domain,http://data.huh.harvard.edu/4bfab7cf-01a1-4503-a0f8-7b298833e5b0/image,urn:lsid:biocol.org:col:15406,urn:lsid:biocol.org:col:15406,NA,A,A,Harvard University Herbaria: All Records,PreservedSpecimen,NA,NA,"{huh_taxonomic_group: Vascular, huh_project_id: 7, huh_project_name: US and Canada - Mass Digitization}",4bfab7cf-01a1-4503-a0f8-7b298833e5b0,barcode-01722467,NA,,[data not captured],undetermined,NotDetermined,present,Sheet,in collection,,[see Simple Media extension],NA,,NA,NA,NA,NA,NA,,,,North America;United States of America;Arkansas;Izard County;,North America,NA,NA,United States of America,US,Arkansas,Izard County,,[data not captured],[data not captured],,NA,NA,,NA,NA,,NA,,,,,NA,,Prunus mexicana S. Watson,Rosaceae,Prunus,mexicana,,S. Watson101,5e6c226e-2821-43d4-a3df-46b625df5cf6,http://purl.org/dc/dcmitype/PhysicalObject,06:48.0,en,https://huh.harvard.edu/pages/use,President and Fellows of Harvard College,https://huh.harvard.edu/access-digital-reproductions-works-public-domain,http://data.huh.harvard.edu/5e6c226e-2821-43d4-a3df-46b625df5cf6/image,urn:lsid:biocol.org:col:15631,urn:lsid:biocol.org:col:15631,NA,GH,GH,Harvard University Herbaria: All Records,PreservedSpecimen,NA,NA,"{huh_taxonomic_group: Vascular, huh_project_id: 7, huh_project_name: US and Canada - Mass Digitization}",5e6c226e-2821-43d4-a3df-46b625df5cf6,barcode-01722510,NA,,[data not captured],undetermined,NotDetermined,present,Sheet,in collection,,[see Simple Media extension],NA,,NA,NA,NA,NA,NA,,,,North America;United States of America;Mississippi;Jefferson County;,North America,NA,NA,United States of America,US,Mississippi,Jefferson County,,[data not captured],[data not captured],,NA,NA,,NA,NA,,NA,,,,,NA,,Prunus mexicana S. Watson,Rosaceae,Prunus,mexicana,,S. Watson102,8b62deff-600e-456c-988a-9a1d0d130f02,http://purl.org/dc/dcmitype/PhysicalObject,15:18.0,en,https://huh.harvard.edu/pages/use,President and Fellows of Harvard College,https://huh.harvard.edu/access-digital-reproductions-works-public-domain,http://data.huh.harvard.edu/8b62deff-600e-456c-988a-9a1d0d130f02/image,urn:lsid:biocol.org:col:15631,urn:lsid:biocol.org:col:15631,NA,GH,GH,Harvard University Herbaria: All Records,PreservedSpecimen,NA,NA,"{huh_taxonomic_group: Vascular, huh_project_id: 7, huh_project_name: US and Canada - Mass Digitization}",8b62deff-600e-456c-988a-9a1d0d130f02,barcode-01722687,NA,6877,R. McVaugh,undetermined,NotDetermined,present,Sheet,in collection,,[see Simple Media extension],NA,5/15/45,NA,NA,1945,5,15,,Edge of swampy woods,6877,North America;United States of America;Texas;Jefferson County;,North America,NA,NA,United States of America,US,Texas,Jefferson County,,4 miles southwest of Beaumont,4 miles southwest of Beaumont,,NA,NA,,NA,NA,,NA,,,,,NA,,Prunus mexicana S. Watson,Rosaceae,Prunus,mexicana,,S. Watson103,cfd2ec2c-2d83-4c45-bab2-4bb57de3ef31,http://purl.org/dc/dcmitype/PhysicalObject,55:18.0,en,https://huh.harvard.edu/pages/use,President and Fellows of Harvard College,https://huh.harvard.edu/access-digital-reproductions-works-public-domain,http://data.huh.harvard.edu/cfd2ec2c-2d83-4c45-bab2-4bb57de3ef31/image,urn:lsid:biocol.org:col:15406,urn:lsid:biocol.org:col:15406,NA,A,A,Harvard University Herbaria: All Records,PreservedSpecimen,NA,NA,"{huh_taxonomic_group: Vascular, huh_project_id: 7, huh_project_name: US and Canada - Mass Digitization}",cfd2ec2c-2d83-4c45-bab2-4bb57de3ef31,barcode-01722531,NA,6444,E. J. Palmer,undetermined,NotDetermined,present,Sheet,in collection,,[see Simple Media extension],NA,9/8/14,NA,NA,1914,9,8,,Upland woods,6444,North America;United States of America;Oklahoma;Johnston County;,North America,NA,NA,United States of America,US,Oklahoma,Johnston County,,Tishomingo,Tishomingo,,NA,NA,,NA,NA,,NA,,,,,NA,,Prunus mexicana S. Watson,Rosaceae,Prunus,mexicana,,S. Watson104,ba765373-6200-4b68-bca2-8120c4ac6fc4,http://purl.org/dc/dcmitype/PhysicalObject,31:33.0,en,https://huh.harvard.edu/pages/use,President and Fellows of Harvard College,https://huh.harvard.edu/access-digital-reproductions-works-public-domain,http://data.huh.harvard.edu/ba765373-6200-4b68-bca2-8120c4ac6fc4/image,urn:lsid:biocol.org:col:15631,urn:lsid:biocol.org:col:15631,NA,GH,GH,Harvard University Herbaria: All Records,PreservedSpecimen,NA,NA,"{huh_taxonomic_group: Vascular, huh_project_id: 7, huh_project_name: US and Canada - Mass Digitization}",ba765373-6200-4b68-bca2-8120c4ac6fc4,barcode-01722632,NA,7071,R. McVaugh,undetermined,NotDetermined,present,Sheet,in collection,,[see Simple Media extension],NA,6/3/45,NA,NA,1945,6,3,,"Dense shade among cedars, shallow limestone soil",7071,North America;United States of America;Texas;Kendall County;,North America,NA,NA,United States of America,US,Texas,Kendall County,,10 miles north of Boerne; Sisterdale road,10 miles north of Boerne; Sisterdale road,,NA,NA,,NA,NA,,NA,,2002,,,NA,,Prunus mexicana S. Watson,Rosaceae,Prunus,mexicana,,S. Watson105,39853a61-37aa-4dbf-a3e7-10cdd6e1c3ff,http://purl.org/dc/dcmitype/PhysicalObject,32:56.0,en,https://huh.harvard.edu/pages/use,President and Fellows of Harvard College,https://huh.harvard.edu/access-digital-reproductions-works-public-domain,http://data.huh.harvard.edu/39853a61-37aa-4dbf-a3e7-10cdd6e1c3ff/image,urn:lsid:biocol.org:col:15631,urn:lsid:biocol.org:col:15631,NA,GH,GH,Harvard University Herbaria: All Records,PreservedSpecimen,NA,NA,"{huh_taxonomic_group: Vascular, huh_project_id: 7, huh_project_name: US and Canada - Mass Digitization}",39853a61-37aa-4dbf-a3e7-10cdd6e1c3ff,barcode-01722694,NA,7071,R. McVaugh,undetermined,NotDetermined,present,Sheet,in collection,,[see Simple Media extension],NA,6/3/45,NA,NA,1945,6,3,,"Dense shade among cedars, shallow limestone soil",7071,North America;United States of America;Texas;Kendall County;,North America,NA,NA,United States of America,US,Texas,Kendall County,,10 miles north of Boerne; on Sisterdale road,10 miles north of Boerne; on Sisterdale road,,NA,NA,,NA,NA,,NA,,,,,NA,,Prunus mexicana S. Watson,Rosaceae,Prunus,mexicana,,S. Watson106,3cd42ec4-9686-4b47-9f24-212e46ca23fa,http://purl.org/dc/dcmitype/PhysicalObject,33:40.0,en,https://huh.harvard.edu/pages/use,President and Fellows of Harvard College,https://huh.harvard.edu/access-digital-reproductions-works-public-domain,http://data.huh.harvard.edu/3cd42ec4-9686-4b47-9f24-212e46ca23fa/image,urn:lsid:biocol.org:col:15406,urn:lsid:biocol.org:col:15406,NA,A,A,Harvard University Herbaria: All Records,PreservedSpecimen,NA,NA,"{huh_taxonomic_group: Vascular, huh_project_id: 7, huh_project_name: US and Canada - Mass Digitization}",3cd42ec4-9686-4b47-9f24-212e46ca23fa,barcode-01722743,NA,9802,E. J. Palmer,undetermined,NotDetermined,present,Sheet,in collection,,[see Simple Media extension],NA,5/18/16,NA,NA,1916,5,18,,Upland thickets,9802,North America;United States of America;Texas;Kendall County;,North America,NA,NA,United States of America,US,Texas,Kendall County,,Boerne,Boerne,,NA,NA,,NA,NA,,NA,,,,,NA,,Prunus mexicana S. Watson,Rosaceae,Prunus,mexicana,,S. Watson107,cc8c34af-370a-4259-b592-f04bb16464ec,http://purl.org/dc/dcmitype/PhysicalObject,26:24.0,en,https://huh.harvard.edu/pages/use,President and Fellows of Harvard College,https://huh.harvard.edu/access-digital-reproductions-works-public-domain,http://data.huh.harvard.edu/cc8c34af-370a-4259-b592-f04bb16464ec/image,urn:lsid:biocol.org:col:15406,urn:lsid:biocol.org:col:15406,NA,A,A,Harvard University Herbaria: All Records,PreservedSpecimen,NA,NA,"{huh_taxonomic_group: Vascular, huh_project_id: 7, huh_project_name: US and Canada - Mass Digitization}",cc8c34af-370a-4259-b592-f04bb16464ec,barcode-01722748,NA,26,B. Mackensen,undetermined,NotDetermined,present,Sheet,in collection,,[see Simple Media extension],NA,5/15/10,NA,NA,1910,5,15,,,26,North America;United States of America;Texas;Kendall County;,North America,NA,NA,United States of America,US,Texas,Kendall County,Boerne,[no additional data],[no additional data],,NA,NA,,NA,NA,,NA,,,,,NA,,Prunus mexicana S. Watson,Rosaceae,Prunus,mexicana,,S. Watson108,c4166717-c78f-4d35-a5ba-492f6d40cf05,http://purl.org/dc/dcmitype/PhysicalObject,28:13.0,en,https://huh.harvard.edu/pages/use,President and Fellows of Harvard College,https://huh.harvard.edu/access-digital-reproductions-works-public-domain,http://data.huh.harvard.edu/c4166717-c78f-4d35-a5ba-492f6d40cf05/image,urn:lsid:biocol.org:col:15406,urn:lsid:biocol.org:col:15406,NA,A,A,Harvard University Herbaria: All Records,PreservedSpecimen,NA,NA,"{huh_taxonomic_group: Vascular, huh_project_id: 7, huh_project_name: US and Canada - Mass Digitization}",c4166717-c78f-4d35-a5ba-492f6d40cf05,barcode-01722750,NA,241,S. H. Hastings,undetermined,NotDetermined,present,Sheet,in collection,,[see Simple Media extension],NA,2/22/11,NA,NA,1911,2,22,,,241,North America;United States of America;Texas;Kendall County;,North America,NA,NA,United States of America,US,Texas,Kendall County,Boerne,[no additional data],[no additional data],,NA,NA,,NA,NA,,NA,,,,,NA,,Prunus mexicana S. Watson,Rosaceae,Prunus,mexicana,,S. Watson109,476fc727-b400-4e61-9b81-666856fb1a27,http://purl.org/dc/dcmitype/PhysicalObject,08:21.0,en,https://huh.harvard.edu/pages/use,President and Fellows of Harvard College,https://huh.harvard.edu/access-digital-reproductions-works-public-domain,http://data.huh.harvard.edu/476fc727-b400-4e61-9b81-666856fb1a27/image,urn:lsid:biocol.org:col:15406,urn:lsid:biocol.org:col:15406,NA,A,A,Harvard University Herbaria: All Records,PreservedSpecimen,NA,NA,"{huh_taxonomic_group: Vascular, huh_project_id: null, huh_project_name: null}",476fc727-b400-4e61-9b81-666856fb1a27,barcode-00346597,NA,4620,W. R. Dudley & F. H. Lamb,undetermined,NotDetermined,present,Sheet,in collection,,[see Simple Media extension],NA,1896-06-22,NA,NA,1896,6,22,,,4620,North America;United States of America;California;Kern County;,North America,NA,NA,United States of America,US,California,Kern County,,"Cuddy's Caon, Mt. Pinos Region","Cuddy's Caon, Mt. Pinos Region",,NA,NA,,NA,NA,,NA,,,,,NA,,Prunus ilicifolia (Nuttall ex Hooker & Arnott) D. N. F. Dietrich,Rosaceae,Prunus,ilicifolia,,(Nuttall ex Hooker & Arnott) D. N. F. Dietrich110,86f7403a-434a-4b28-90b2-9059b9d5b908,http://purl.org/dc/dcmitype/PhysicalObject,34:17.0,en,https://huh.harvard.edu/pages/use,President and Fellows of Harvard College,https://huh.harvard.edu/access-digital-reproductions-works-public-domain,http://data.huh.harvard.edu/86f7403a-434a-4b28-90b2-9059b9d5b908/image,urn:lsid:biocol.org:col:15406,urn:lsid:biocol.org:col:15406,NA,A,A,Harvard University Herbaria: All Records,PreservedSpecimen,NA,NA,"{huh_taxonomic_group: Vascular, huh_project_id: 7, huh_project_name: US and Canada - Mass Digitization}",86f7403a-434a-4b28-90b2-9059b9d5b908,barcode-01722593,NA,41409,W. P. Taylor,undetermined,NotDetermined,present,Sheet,in collection,,[see Simple Media extension],NA,4/16/43,NA,NA,1943,4,16,,,41409,North America;United States of America;Texas;Kerr County;,North America,NA,NA,United States of America,US,Texas,Kerr County,,6 miles north of Comfort.,6 miles north of Comfort.,,NA,NA,,NA,NA,,NA,,8/31/43,,,NA,,Prunus mexicana S. Watson,Rosaceae,Prunus,mexicana,,S. Watson111,9cbf5761-0c95-488c-8c04-478622396a66,http://purl.org/dc/dcmitype/PhysicalObject,17:29.0,en,https://huh.harvard.edu/pages/use,President and Fellows of Harvard College,https://huh.harvard.edu/access-digital-reproductions-works-public-domain,http://data.huh.harvard.edu/9cbf5761-0c95-488c-8c04-478622396a66/image,urn:lsid:biocol.org:col:15631,urn:lsid:biocol.org:col:15631,NA,GH,GH,Harvard University Herbaria: All Records,PreservedSpecimen,NA,NA,"{huh_taxonomic_group: Vascular, huh_project_id: 7, huh_project_name: US and Canada - Mass Digitization}",9cbf5761-0c95-488c-8c04-478622396a66,barcode-01722691,NA,7143,R. McVaugh,undetermined,NotDetermined,present,Sheet,in collection,,[see Simple Media extension],NA,6/10/45,NA,NA,1945,6,10,,Low woodlands along dry stream bed,7143,North America;United States of America;Texas;Lamar County;,North America,NA,NA,United States of America,US,Texas,Lamar County,,2.5 miles west of Paris,2.5 miles west of Paris,,NA,NA,,NA,NA,,NA,,,,,NA,,Prunus mexicana S. Watson,Rosaceae,Prunus,mexicana,,S. Watson112,084d7f59-ccc4-45f4-93da-4f0d4616b531,http://purl.org/dc/dcmitype/PhysicalObject,31:43.0,en,https://huh.harvard.edu/pages/use,President and Fellows of Harvard College,https://huh.harvard.edu/access-digital-reproductions-works-public-domain,http://data.huh.harvard.edu/084d7f59-ccc4-45f4-93da-4f0d4616b531/image,urn:lsid:biocol.org:col:15406,urn:lsid:biocol.org:col:15406,NA,A,A,Harvard University Herbaria: All Records,PreservedSpecimen,NA,NA,"{huh_taxonomic_group: Vascular, huh_project_id: 7, huh_project_name: US and Canada - Mass Digitization}",084d7f59-ccc4-45f4-93da-4f0d4616b531,barcode-01722622,NA,10296,E. J. Palmer,undetermined,NotDetermined,present,Sheet,in collection,,[see Simple Media extension],NA,6/26/16,NA,NA,1916,6,26,,Dry upland thickets,10296,North America;United States of America;Texas;Lampasas County;,North America,NA,NA,United States of America,US,Texas,Lampasas County,,Lampasas.,Lampasas.,,NA,NA,,NA,NA,,NA,,,,,NA,,Prunus mexicana S. Watson,Rosaceae,Prunus,mexicana,,S. Watson113,2a8ddd51-7b19-466a-8e30-c9ff657991ea,http://purl.org/dc/dcmitype/PhysicalObject,33:17.0,en,https://huh.harvard.edu/pages/use,President and Fellows of Harvard College,https://huh.harvard.edu/access-digital-reproductions-works-public-domain,http://data.huh.harvard.edu/2a8ddd51-7b19-466a-8e30-c9ff657991ea/image,urn:lsid:biocol.org:col:15631,urn:lsid:biocol.org:col:15631,NA,GH,GH,Harvard University Herbaria: All Records,PreservedSpecimen,NA,NA,"{huh_taxonomic_group: Vascular, huh_project_id: 7, huh_project_name: US and Canada - Mass Digitization}",2a8ddd51-7b19-466a-8e30-c9ff657991ea,barcode-01722643,NA,2151,M. F. Enquist,undetermined,NotDetermined,present,Sheet,in collection,,[see Simple Media extension],NA,3/30/92,NA,NA,1992,3,30,,N side of road in woods along seasonal creek.,2151,North America;United States of America;Texas;Llano County;,North America,NA,NA,United States of America,US,Texas,Llano County,,"On 29, about 0.3 miles east of the Buchanan Dam turnoff.","On 29, about 0.3 miles east of the Buchanan Dam turnoff.",,NA,NA,,NA,NA,,NA,,,,,NA,,Prunus mexicana S. Watson,Rosaceae,Prunus,mexicana,,S. Watson114,2226bbe8-d8f9-4762-af4b-af1aad1631b9,http://purl.org/dc/dcmitype/PhysicalObject,45:26.0,en,https://huh.harvard.edu/pages/use,President and Fellows of Harvard College,https://huh.harvard.edu/access-digital-reproductions-works-public-domain,http://data.huh.harvard.edu/2226bbe8-d8f9-4762-af4b-af1aad1631b9/image,urn:lsid:biocol.org:col:15406,urn:lsid:biocol.org:col:15406,NA,A,A,Harvard University Herbaria: All Records,PreservedSpecimen,NA,NA,"{huh_taxonomic_group: Vascular, huh_project_id: 7, huh_project_name: US and Canada - Mass Digitization}",2226bbe8-d8f9-4762-af4b-af1aad1631b9,barcode-01722527,NA,176,G. W. Stevens,undetermined,NotDetermined,present,Sheet,in collection,,[see Simple Media extension],NA,4/25/13,NA,NA,1913,4,25,,"Small thicket, creek valley",176,North America;United States of America;Oklahoma;Logan County;,North America,NA,NA,United States of America,US,Oklahoma,Logan County,,Near Navina,Near Navina,,NA,NA,,NA,NA,,NA,,,,,NA,,Prunus mexicana S. Watson,Rosaceae,Prunus,mexicana,,S. Watson115,a5eb9994-a1e5-4756-aa51-d799af8e69aa,http://purl.org/dc/dcmitype/PhysicalObject,33:53.0,en,https://huh.harvard.edu/pages/use,President and Fellows of Harvard College,https://huh.harvard.edu/access-digital-reproductions-works-public-domain,http://data.huh.harvard.edu/a5eb9994-a1e5-4756-aa51-d799af8e69aa/image,urn:lsid:biocol.org:col:15631,urn:lsid:biocol.org:col:15631,NA,GH,GH,Harvard University Herbaria: All Records,PreservedSpecimen,NA,NA,"{huh_taxonomic_group: Vascular, huh_project_id: 7, huh_project_name: US and Canada - Mass Digitization}",a5eb9994-a1e5-4756-aa51-d799af8e69aa,barcode-01722563,NA,176,G. W. Stevens,undetermined,NotDetermined,present,Sheet,in collection,,[see Simple Media extension],NA,4/25/13,NA,NA,1913,4,25,,"Small thicket, creek valley",176,North America;United States of America;Oklahoma;Logan County;,North America,NA,NA,United States of America,US,Oklahoma,Logan County,,Near Navina,Near Navina,,NA,NA,,NA,NA,,NA,,,,,NA,,Prunus mexicana S. Watson,Rosaceae,Prunus,mexicana,,S. Watson116,c51b0efa-5eb7-43b8-ab11-d98b5c3bc267,http://purl.org/dc/dcmitype/PhysicalObject,52:49.0,en,https://huh.harvard.edu/pages/use,President and Fellows of Harvard College,https://huh.harvard.edu/access-digital-reproductions-works-public-domain,http://data.huh.harvard.edu/c51b0efa-5eb7-43b8-ab11-d98b5c3bc267/image,urn:lsid:biocol.org:col:15631,urn:lsid:biocol.org:col:15631,NA,GH,GH,Harvard University Herbaria: All Records,PreservedSpecimen,NA,NA,"{huh_taxonomic_group: Vascular, huh_project_id: null, huh_project_name: null}",c51b0efa-5eb7-43b8-ab11-d98b5c3bc267,barcode-00346672,NA,5183,C. B. Wolf,undetermined,NotDetermined,present,Sheet,in collection,,[see Simple Media extension],NA,8/2/33,NA,NA,1933,8,2,,,5183,North America;United States of America;California;Los Angeles County;,North America,NA,NA,United States of America,US,California,Los Angeles County,Claremont,,,,NA,NA,,NA,NA,,NA,,,,,NA,,Prunus ilicifolia (Nuttall ex Hooker & Arnott) D. N. F. Dietrich,Rosaceae,Prunus,ilicifolia,,(Nuttall ex Hooker & Arnott) D. N. F. Dietrich117,a54435b7-62f5-42eb-aabc-da77c4320145,http://purl.org/dc/dcmitype/PhysicalObject,38:10.0,en,https://huh.harvard.edu/pages/use,President and Fellows of Harvard College,https://huh.harvard.edu/access-digital-reproductions-works-public-domain,http://data.huh.harvard.edu/a54435b7-62f5-42eb-aabc-da77c4320145/image,urn:lsid:biocol.org:col:15406,urn:lsid:biocol.org:col:15406,NA,A,A,Harvard University Herbaria: All Records,PreservedSpecimen,NA,NA,"{huh_taxonomic_group: Vascular, huh_project_id: null, huh_project_name: null}",a54435b7-62f5-42eb-aabc-da77c4320145,barcode-00346668,NA,,B. Trask,undetermined,NotDetermined,present,Sheet,in collection,,[see Simple Media extension],NA,1901-03,NA,NA,1901,3,NA,,,,North America;United States of America;California;Los Angeles County;,North America,NA,NA,United States of America,US,California,Los Angeles County,,"Avalon, Santa Catalina Island","Avalon, Santa Catalina Island",,NA,NA,,NA,NA,,NA,,,,,NA,,Prunus ilicifolia subsp. lyonii (Eastwood) P. H. Raven,Rosaceae,Prunus,ilicifolia,lyonii,(Eastwood) P. H. Raven118,d15a8596-89c1-428b-b5a7-7d8d0f9d889c,http://purl.org/dc/dcmitype/PhysicalObject,38:30.0,en,https://huh.harvard.edu/pages/use,President and Fellows of Harvard College,https://huh.harvard.edu/access-digital-reproductions-works-public-domain,http://data.huh.harvard.edu/d15a8596-89c1-428b-b5a7-7d8d0f9d889c/image,urn:lsid:biocol.org:col:15406,urn:lsid:biocol.org:col:15406,NA,A,A,Harvard University Herbaria: All Records,PreservedSpecimen,NA,NA,"{huh_taxonomic_group: Vascular, huh_project_id: null, huh_project_name: null}",d15a8596-89c1-428b-b5a7-7d8d0f9d889c,barcode-00346667,NA,22,B. Trask,undetermined,NotDetermined,present,Sheet,in collection,,[see Simple Media extension],NA,1902-10,NA,NA,1902,10,NA,,,22,North America;United States of America;California;Los Angeles County;,North America,NA,NA,United States of America,US,California,Los Angeles County,,Santa Clemente Island,Santa Clemente Island,,NA,NA,,NA,NA,,NA,,,,,NA,,Prunus ilicifolia subsp. lyonii (Eastwood) P. H. Raven,Rosaceae,Prunus,ilicifolia,lyonii,(Eastwood) P. H. Raven119,a913a305-9096-4610-b1d9-22becfae184d,http://purl.org/dc/dcmitype/PhysicalObject,08:22.0,en,https://huh.harvard.edu/pages/use,President and Fellows of Harvard College,https://huh.harvard.edu/access-digital-reproductions-works-public-domain,http://data.huh.harvard.edu/a913a305-9096-4610-b1d9-22becfae184d/image,urn:lsid:biocol.org:col:15406,urn:lsid:biocol.org:col:15406,NA,A,A,Harvard University Herbaria: All Records,PreservedSpecimen,NA,NA,"{huh_taxonomic_group: Vascular, huh_project_id: null, huh_project_name: null}",a913a305-9096-4610-b1d9-22becfae184d,barcode-00346665,NA,316,B. Trask,undetermined,NotDetermined,present,Sheet,in collection,,[see Simple Media extension],NA,1903-06,NA,NA,1903,6,NA,,,316,North America;United States of America;California;Los Angeles County;,North America,NA,NA,United States of America,US,California,Los Angeles County,,San Clemente Island,San Clemente Island,,NA,NA,,NA,NA,,NA,,,,,NA,,Prunus ilicifolia subsp. lyonii (Eastwood) P. H. Raven,Rosaceae,Prunus,ilicifolia,lyonii,(Eastwood) P. H. Raven120,c8ac7ff1-7d71-422a-a3db-016c7b51f311,http://purl.org/dc/dcmitype/PhysicalObject,08:59.0,en,https://huh.harvard.edu/pages/use,President and Fellows of Harvard College,https://huh.harvard.edu/access-digital-reproductions-works-public-domain,http://data.huh.harvard.edu/c8ac7ff1-7d71-422a-a3db-016c7b51f311/image,urn:lsid:biocol.org:col:15406,urn:lsid:biocol.org:col:15406,NA,A,A,Harvard University Herbaria: All Records,PreservedSpecimen,NA,NA,"{huh_taxonomic_group: Vascular, huh_project_id: null, huh_project_name: null}",c8ac7ff1-7d71-422a-a3db-016c7b51f311,barcode-00346664,NA,294,B. Trask,undetermined,NotDetermined,present,Sheet,in collection,,[see Simple Media extension],NA,1903-06,NA,NA,1903,6,NA,,,294,North America;United States of America;California;Los Angeles County;,North America,NA,NA,United States of America,US,California,Los Angeles County,,San Clemente Island,San Clemente Island,,NA,NA,,NA,NA,,NA,,,,,NA,,Prunus ilicifolia subsp. lyonii (Eastwood) P. H. Raven,Rosaceae,Prunus,ilicifolia,lyonii,(Eastwood) P. H. Raven121,0a42b8d6-dda3-4ff0-854c-857bc42dd139,http://purl.org/dc/dcmitype/PhysicalObject,09:29.0,en,https://huh.harvard.edu/pages/use,President and Fellows of Harvard College,https://huh.harvard.edu/access-digital-reproductions-works-public-domain,http://data.huh.harvard.edu/0a42b8d6-dda3-4ff0-854c-857bc42dd139/image,urn:lsid:biocol.org:col:15406,urn:lsid:biocol.org:col:15406,NA,A,A,Harvard University Herbaria: All Records,PreservedSpecimen,NA,NA,"{huh_taxonomic_group: Vascular, huh_project_id: null, huh_project_name: null}",0a42b8d6-dda3-4ff0-854c-857bc42dd139,barcode-00346663,NA,314,B. Trask,undetermined,NotDetermined,present,Sheet,in collection,,[see Simple Media extension],NA,1903-06,NA,NA,1903,6,NA,,,314,North America;United States of America;California;Los Angeles County;,North America,NA,NA,United States of America,US,California,Los Angeles County,,San Clemente Island,San Clemente Island,,NA,NA,,NA,NA,,NA,,,,,NA,,Prunus ilicifolia subsp. lyonii (Eastwood) P. H. Raven,Rosaceae,Prunus,ilicifolia,lyonii,(Eastwood) P. H. Raven122,7814e08c-94f0-423a-940b-ee5620bcdeb4,http://purl.org/dc/dcmitype/PhysicalObject,10:02.0,en,https://huh.harvard.edu/pages/use,President and Fellows of Harvard College,https://huh.harvard.edu/access-digital-reproductions-works-public-domain,http://data.huh.harvard.edu/7814e08c-94f0-423a-940b-ee5620bcdeb4/image,urn:lsid:biocol.org:col:15406,urn:lsid:biocol.org:col:15406,NA,A,A,Harvard University Herbaria: All Records,PreservedSpecimen,NA,NA,"{huh_taxonomic_group: Vascular, huh_project_id: null, huh_project_name: null}",7814e08c-94f0-423a-940b-ee5620bcdeb4,barcode-00346662,NA,293,B. Trask,undetermined,NotDetermined,present,Sheet,in collection,,[see Simple Media extension],NA,1903-06,NA,NA,1903,6,NA,,,293,North America;United States of America;California;Los Angeles County;,North America,NA,NA,United States of America,US,California,Los Angeles County,,San Clemente Island,San Clemente Island,,NA,NA,,NA,NA,,NA,,,,,NA,,Prunus ilicifolia subsp. lyonii (Eastwood) P. H. Raven,Rosaceae,Prunus,ilicifolia,lyonii,(Eastwood) P. H. Raven123,c5741a17-b977-4508-9d72-7beedd8e6886,http://purl.org/dc/dcmitype/PhysicalObject,10:35.0,en,https://huh.harvard.edu/pages/use,President and Fellows of Harvard College,https://huh.harvard.edu/access-digital-reproductions-works-public-domain,http://data.huh.harvard.edu/c5741a17-b977-4508-9d72-7beedd8e6886/image,urn:lsid:biocol.org:col:15406,urn:lsid:biocol.org:col:15406,NA,A,A,Harvard University Herbaria: All Records,PreservedSpecimen,NA,NA,"{huh_taxonomic_group: Vascular, huh_project_id: null, huh_project_name: null}",c5741a17-b977-4508-9d72-7beedd8e6886,barcode-00346661,NA,315,B. Trask,undetermined,NotDetermined,present,Sheet,in collection,,[see Simple Media extension],NA,1903-06,NA,NA,1903,6,NA,,,315,North America;United States of America;California;Los Angeles County;,North America,NA,NA,United States of America,US,California,Los Angeles County,,San Clemente Island,San Clemente Island,,NA,NA,,NA,NA,,NA,,,,,NA,,Prunus ilicifolia subsp. lyonii (Eastwood) P. H. Raven,Rosaceae,Prunus,ilicifolia,lyonii,(Eastwood) P. H. Raven124,9e005937-56fd-4aae-aa39-1ef7df94b009,http://purl.org/dc/dcmitype/PhysicalObject,11:07.0,en,https://huh.harvard.edu/pages/use,President and Fellows of Harvard College,https://huh.harvard.edu/access-digital-reproductions-works-public-domain,http://data.huh.harvard.edu/9e005937-56fd-4aae-aa39-1ef7df94b009/image,urn:lsid:biocol.org:col:15406,urn:lsid:biocol.org:col:15406,NA,A,A,Harvard University Herbaria: All Records,PreservedSpecimen,NA,NA,"{huh_taxonomic_group: Vascular, huh_project_id: null, huh_project_name: null}",9e005937-56fd-4aae-aa39-1ef7df94b009,barcode-00346660,NA,,B. Trask,undetermined,NotDetermined,present,Sheet,in collection,,[see Simple Media extension],NA,1901-03,NA,NA,1901,3,NA,,,,North America;United States of America;California;Los Angeles County;,North America,NA,NA,United States of America,US,California,Los Angeles County,,"Avalon, Santa Catalina Island","Avalon, Santa Catalina Island",,NA,NA,,NA,NA,,NA,,,,,NA,,Prunus ilicifolia subsp. lyonii (Eastwood) P. H. Raven,Rosaceae,Prunus,ilicifolia,lyonii,(Eastwood) P. H. Raven125,371ec479-012d-405b-9b1e-b390d101321c,http://purl.org/dc/dcmitype/PhysicalObject,48:57.0,en,https://huh.harvard.edu/pages/use,President and Fellows of Harvard College,https://huh.harvard.edu/access-digital-reproductions-works-public-domain,http://data.huh.harvard.edu/371ec479-012d-405b-9b1e-b390d101321c/image,urn:lsid:biocol.org:col:15631,urn:lsid:biocol.org:col:15631,NA,GH,GH,Harvard University Herbaria: All Records,PreservedSpecimen,NA,NA,"{huh_taxonomic_group: Vascular, huh_project_id: null, huh_project_name: null}",371ec479-012d-405b-9b1e-b390d101321c,barcode-00346654,NA,17828,P. H. Raven,undetermined,NotDetermined,present,Sheet,in collection,,[see Simple Media extension],NA,5/22/62,NA,NA,1962,5,22,,,17828,North America;United States of America;California;Los Angeles County;,North America,NA,NA,United States of America,US,California,Los Angeles County,,Santa Catalina Island: large beautiful grove near mouth of Cherry Canyon,Santa Catalina Island: large beautiful grove near mouth of Cherry Canyon,200 feet,NA,NA,,NA,NA,,NA,,,,,NA,,Prunus ilicifolia subsp. lyonii (Eastwood) P. H. Raven,Rosaceae,Prunus,ilicifolia,lyonii,(Eastwood) P. H. Raven126,4477d058-6198-41b0-8749-c2a53b43baa4,http://purl.org/dc/dcmitype/PhysicalObject,44:03.0,en,https://huh.harvard.edu/pages/use,President and Fellows of Harvard College,https://huh.harvard.edu/access-digital-reproductions-works-public-domain,http://data.huh.harvard.edu/4477d058-6198-41b0-8749-c2a53b43baa4/image,urn:lsid:biocol.org:col:15406,urn:lsid:biocol.org:col:15406,NA,A,A,Harvard University Herbaria: All Records,PreservedSpecimen,NA,NA,"{huh_taxonomic_group: Vascular, huh_project_id: null, huh_project_name: null}",4477d058-6198-41b0-8749-c2a53b43baa4,barcode-00346651,NA,313,B. Trask,undetermined,NotDetermined,present,Sheet,in collection,,[see Simple Media extension],NA,1903-06,NA,NA,1903,6,NA,,,313,North America;United States of America;California;Los Angeles County;,North America,NA,NA,United States of America,US,California,Los Angeles County,,San Clemente Island,San Clemente Island,,NA,NA,,NA,NA,,NA,,,,,NA,,Prunus ilicifolia subsp. lyonii (Eastwood) P. H. Raven,Rosaceae,Prunus,ilicifolia,lyonii,(Eastwood) P. H. Raven127,969a557e-753c-4b8f-917a-ac916f38bd69,http://purl.org/dc/dcmitype/PhysicalObject,59:06.0,en,https://huh.harvard.edu/pages/use,President and Fellows of Harvard College,https://huh.harvard.edu/access-digital-reproductions-works-public-domain,http://data.huh.harvard.edu/969a557e-753c-4b8f-917a-ac916f38bd69/image,urn:lsid:biocol.org:col:15631,urn:lsid:biocol.org:col:15631,NA,GH,GH,Harvard University Herbaria: All Records,PreservedSpecimen,NA,NA,"{huh_taxonomic_group: Vascular, huh_project_id: null, huh_project_name: null}",969a557e-753c-4b8f-917a-ac916f38bd69,barcode-00346649,NA,4063,E. A. Mearns,undetermined,NotDetermined,present,Sheet,in collection,,[see Simple Media extension],NA,1894-08-25,NA,NA,1894,8,25,,,4063,North America;United States of America;California;Los Angeles County;,North America,NA,NA,United States of America,US,California,Los Angeles County,,San Clemente Is.,San Clemente Is.,,NA,NA,,NA,NA,,NA,,,,,NA,,Prunus ilicifolia subsp. lyonii (Eastwood) P. H. Raven,Rosaceae,Prunus,ilicifolia,lyonii,(Eastwood) P. H. Raven128,7997af59-cc3d-408c-be31-8b4c97af4b1b,http://purl.org/dc/dcmitype/PhysicalObject,32:52.0,en,https://huh.harvard.edu/pages/use,President and Fellows of Harvard College,https://huh.harvard.edu/access-digital-reproductions-works-public-domain,http://data.huh.harvard.edu/7997af59-cc3d-408c-be31-8b4c97af4b1b/image,urn:lsid:biocol.org:col:15631,urn:lsid:biocol.org:col:15631,NA,GH,GH,Harvard University Herbaria: All Records,PreservedSpecimen,NA,NA,"{huh_taxonomic_group: Vascular, huh_project_id: null, huh_project_name: null}",7997af59-cc3d-408c-be31-8b4c97af4b1b,barcode-00346648,NA,314,L. Abrams & I. L. Wiggins,undetermined,NotDetermined,present,Sheet,in collection,,[see Simple Media extension],NA,7/4/31,NA,NA,1931,7,4,,,314,North America;United States of America;California;Los Angeles County;,North America,NA,NA,United States of America,US,California,Los Angeles County,,"White's Landing, Santa Catalina Island","White's Landing, Santa Catalina Island",,NA,NA,,NA,NA,,NA,,,,,NA,,Prunus ilicifolia subsp. lyonii (Eastwood) P. H. Raven,Rosaceae,Prunus,ilicifolia,lyonii,(Eastwood) P. H. Raven129,5af2ccdf-bdd6-4d40-bec9-ece05636db3f,http://purl.org/dc/dcmitype/PhysicalObject,37:22.0,en,https://huh.harvard.edu/pages/use,President and Fellows of Harvard College,https://huh.harvard.edu/access-digital-reproductions-works-public-domain,http://data.huh.harvard.edu/5af2ccdf-bdd6-4d40-bec9-ece05636db3f/image,urn:lsid:biocol.org:col:15631,urn:lsid:biocol.org:col:15631,NA,GH,GH,Harvard University Herbaria: All Records,PreservedSpecimen,NA,NA,"{huh_taxonomic_group: Vascular, huh_project_id: null, huh_project_name: null}",5af2ccdf-bdd6-4d40-bec9-ece05636db3f,barcode-00346645,NA,,M. E. Jones,undetermined,NotDetermined,present,Sheet,in collection,,[see Simple Media extension],NA,3/16/26,NA,NA,1926,3,16,,,,North America;United States of America;California;Los Angeles County;,North America,NA,NA,United States of America,US,California,Los Angeles County,,Claremont,Claremont,,NA,NA,,NA,NA,,NA,,,,,NA,,Prunus ilicifolia subsp. lyonii (Eastwood) P. H. Raven,Rosaceae,Prunus,ilicifolia,lyonii,(Eastwood) P. H. Raven130,156b5766-4c34-423d-bcd3-5772047b48ae,http://purl.org/dc/dcmitype/PhysicalObject,02:08.0,en,https://huh.harvard.edu/pages/use,President and Fellows of Harvard College,https://huh.harvard.edu/access-digital-reproductions-works-public-domain,http://data.huh.harvard.edu/156b5766-4c34-423d-bcd3-5772047b48ae/image,urn:lsid:biocol.org:col:15631,urn:lsid:biocol.org:col:15631,NA,GH,GH,Harvard University Herbaria: All Records,PreservedSpecimen,NA,NA,"{huh_taxonomic_group: Vascular, huh_project_id: null, huh_project_name: null}",156b5766-4c34-423d-bcd3-5772047b48ae,barcode-00346643,NA,35970,R. F. Thorne,undetermined,NotDetermined,present,Sheet,in collection,,[see Simple Media extension],NA,4/7/66,NA,NA,1966,4,7,,,35970,North America;United States of America;California;Los Angeles County;,North America,NA,NA,United States of America,US,California,Los Angeles County,,Santa Catalina Island: along stream bed in Howland Landing Canyon near road to Johnson's Landing,Santa Catalina Island: along stream bed in Howland Landing Canyon near road to Johnson's Landing,ca. 75',NA,NA,,NA,NA,,NA,,,,,NA,,Prunus ilicifolia subsp. lyonii (Eastwood) P. H. Raven,Rosaceae,Prunus,ilicifolia,lyonii,(Eastwood) P. H. Raven131,5aa2037c-b004-491b-8e4a-9cda5c933066,http://purl.org/dc/dcmitype/PhysicalObject,19:49.0,en,https://huh.harvard.edu/pages/use,President and Fellows of Harvard College,https://huh.harvard.edu/access-digital-reproductions-works-public-domain,http://data.huh.harvard.edu/5aa2037c-b004-491b-8e4a-9cda5c933066/image,urn:lsid:biocol.org:col:15406,urn:lsid:biocol.org:col:15406,NA,A,A,Harvard University Herbaria: All Records,PreservedSpecimen,NA,NA,"{huh_taxonomic_group: Vascular, huh_project_id: null, huh_project_name: null}",5aa2037c-b004-491b-8e4a-9cda5c933066,barcode-00346642,NA,,J. G. Jack,undetermined,NotDetermined,present,Sheet,in collection,,[see Simple Media extension],NA,7/16/07,NA,NA,1907,7,16,,,,North America;United States of America;California;Los Angeles County;,North America,NA,NA,United States of America,US,California,Los Angeles County,,Santa Catalina Is.,Santa Catalina Is.,,NA,NA,,NA,NA,,NA,,,,,NA,,Prunus ilicifolia subsp. lyonii (Eastwood) P. H. Raven,Rosaceae,Prunus,ilicifolia,lyonii,(Eastwood) P. H. Raven132,436769c9-c6d3-416d-b3a9-b97f4c272c5b,http://purl.org/dc/dcmitype/PhysicalObject,04:37.0,en,https://huh.harvard.edu/pages/use,President and Fellows of Harvard College,https://huh.harvard.edu/access-digital-reproductions-works-public-domain,http://data.huh.harvard.edu/436769c9-c6d3-416d-b3a9-b97f4c272c5b/image,urn:lsid:biocol.org:col:15406,urn:lsid:biocol.org:col:15406,NA,A,A,Harvard University Herbaria: All Records,PreservedSpecimen,NA,NA,"{huh_taxonomic_group: Vascular, huh_project_id: null, huh_project_name: null}",436769c9-c6d3-416d-b3a9-b97f4c272c5b,barcode-00346637,NA,,A. Eastwood,undetermined,NotDetermined,present,Sheet,in collection,,[see Simple Media extension],NA,1917-07,NA,NA,1917,7,NA,July 20-25,,,North America;United States of America;California;Los Angeles County;,North America,NA,NA,United States of America,US,California,Los Angeles County,,Santa Catalina Island,Santa Catalina Island,,NA,NA,,NA,NA,,NA,,,,,NA,,Prunus ilicifolia subsp. lyonii (Eastwood) P. H. Raven,Rosaceae,Prunus,ilicifolia,lyonii,(Eastwood) P. H. Raven133,26f3433d-297d-46cb-88c2-398a25d63fbb,http://purl.org/dc/dcmitype/PhysicalObject,06:12.0,en,https://huh.harvard.edu/pages/use,President and Fellows of Harvard College,https://huh.harvard.edu/access-digital-reproductions-works-public-domain,http://data.huh.harvard.edu/26f3433d-297d-46cb-88c2-398a25d63fbb/image,urn:lsid:biocol.org:col:15631,urn:lsid:biocol.org:col:15631,NA,GH,GH,Harvard University Herbaria: All Records,PreservedSpecimen,NA,NA,"{huh_taxonomic_group: Vascular, huh_project_id: null, huh_project_name: null}",26f3433d-297d-46cb-88c2-398a25d63fbb,barcode-00346634,NA,17643,P. H. Raven,undetermined,NotDetermined,present,Sheet,in collection,,[see Simple Media extension],NA,5/9/62,NA,NA,1962,5,9,,,17643,North America;United States of America;California;Los Angeles County;,North America,NA,NA,United States of America,US,California,Los Angeles County,,"in canyon just north of Guds, San Clemente Island","in canyon just north of Guds, San Clemente Island",650 feet,NA,NA,,NA,NA,,NA,,,,,NA,,Prunus ilicifolia subsp. lyonii (Eastwood) P. H. Raven,Rosaceae,Prunus,ilicifolia,lyonii,(Eastwood) P. H. Raven134,5ba3137e-0fb7-474c-93ac-be8c959fdd8d,http://purl.org/dc/dcmitype/PhysicalObject,40:20.0,en,https://huh.harvard.edu/pages/use,President and Fellows of Harvard College,https://huh.harvard.edu/access-digital-reproductions-works-public-domain,http://data.huh.harvard.edu/5ba3137e-0fb7-474c-93ac-be8c959fdd8d/image,urn:lsid:biocol.org:col:15406,urn:lsid:biocol.org:col:15406,NA,A,A,Harvard University Herbaria: All Records,PreservedSpecimen,NA,NA,"{huh_taxonomic_group: Vascular, huh_project_id: null, huh_project_name: null}",5ba3137e-0fb7-474c-93ac-be8c959fdd8d,barcode-00346632,NA,,J. G. Jack,undetermined,NotDetermined,present,Sheet,in collection,,[see Simple Media extension],NA,7/16/07,NA,NA,1907,7,16,,,,North America;United States of America;California;Los Angeles County;,North America,NA,NA,United States of America,US,California,Los Angeles County,,Santa Catalina Is.,Santa Catalina Is.,,NA,NA,,NA,NA,,NA,,,,,NA,,Prunus ilicifolia subsp. lyonii (Eastwood) P. H. Raven,Rosaceae,Prunus,ilicifolia,lyonii,(Eastwood) P. H. Raven135,69033437-bb52-449a-ad02-c6ad240d5d8a,http://purl.org/dc/dcmitype/PhysicalObject,54:15.0,en,https://huh.harvard.edu/pages/use,President and Fellows of Harvard College,https://huh.harvard.edu/access-digital-reproductions-works-public-domain,http://data.huh.harvard.edu/69033437-bb52-449a-ad02-c6ad240d5d8a/image,urn:lsid:biocol.org:col:15631,urn:lsid:biocol.org:col:15631,NA,GH,GH,Harvard University Herbaria: All Records,PreservedSpecimen,NA,NA,"{huh_taxonomic_group: Vascular, huh_project_id: null, huh_project_name: null}",69033437-bb52-449a-ad02-c6ad240d5d8a,barcode-00346631,NA,33302,R. F. Thorne & P. C. Everett,undetermined,NotDetermined,present,Sheet,in collection,,[see Simple Media extension],NA,2/6/64,NA,NA,1964,2,6,,,33302,North America;United States of America;California;Los Angeles County;,North America,NA,NA,United States of America,US,California,Los Angeles County,,Santa Catalina Island,Santa Catalina Island,ca 75',NA,NA,,NA,NA,,NA,,,,,NA,,Prunus ilicifolia subsp. lyonii (Eastwood) P. H. Raven,Rosaceae,Prunus,ilicifolia,lyonii,(Eastwood) P. H. Raven136,62f9be45-715a-44e8-9f9e-639f0a85b6a4,http://purl.org/dc/dcmitype/PhysicalObject,15:05.0,en,https://huh.harvard.edu/pages/use,President and Fellows of Harvard College,https://huh.harvard.edu/access-digital-reproductions-works-public-domain,http://data.huh.harvard.edu/62f9be45-715a-44e8-9f9e-639f0a85b6a4/image,urn:lsid:biocol.org:col:15406,urn:lsid:biocol.org:col:15406,NA,A,A,Harvard University Herbaria: All Records,PreservedSpecimen,NA,NA,"{huh_taxonomic_group: Vascular, huh_project_id: null, huh_project_name: null}",62f9be45-715a-44e8-9f9e-639f0a85b6a4,barcode-00346620,NA,3670,C. F. Baker,undetermined,NotDetermined,present,Sheet,in collection,,[see Simple Media extension],NA,8/2/03,NA,NA,1903,8,2,,,3670,North America;United States of America;California;Los Angeles County;,North America,NA,NA,United States of America,US,California,Los Angeles County,Claremont,San Antonio Canyon near Claremont,San Antonio Canyon near Claremont,,NA,NA,,NA,NA,,NA,,,,,NA,,Prunus ilicifolia (Nuttall ex Hooker & Arnott) D. N. F. Dietrich,Rosaceae,Prunus,ilicifolia,,(Nuttall ex Hooker & Arnott) D. N. F. Dietrich137,0724754c-fe02-4ad2-b2f4-8348bcf6b7f1,http://purl.org/dc/dcmitype/PhysicalObject,23:07.0,en,https://huh.harvard.edu/pages/use,President and Fellows of Harvard College,https://huh.harvard.edu/access-digital-reproductions-works-public-domain,http://data.huh.harvard.edu/0724754c-fe02-4ad2-b2f4-8348bcf6b7f1/image,urn:lsid:biocol.org:col:15631,urn:lsid:biocol.org:col:15631,NA,GH,GH,Harvard University Herbaria: All Records,PreservedSpecimen,NA,NA,"{huh_taxonomic_group: Vascular, huh_project_id: null, huh_project_name: null}",0724754c-fe02-4ad2-b2f4-8348bcf6b7f1,barcode-00346603,NA,1892,H. J. Thompson,undetermined,NotDetermined,present,Sheet,in collection,,[see Simple Media extension],NA,3/27/59,NA,NA,1959,3,27,,,1892,North America;United States of America;California;Los Angeles County;,North America,NA,NA,United States of America,US,California,Los Angeles County,,Saddle Peak,Saddle Peak,2400 feet,NA,NA,,NA,NA,,NA,,,,,NA,,Prunus ilicifolia (Nuttall ex Hooker & Arnott) D. N. F. Dietrich,Rosaceae,Prunus,ilicifolia,,(Nuttall ex Hooker & Arnott) D. N. F. Dietrich138,81e295f8-7d1f-4cf4-b17e-8d1f0f1fc454,http://purl.org/dc/dcmitype/PhysicalObject,23:31.0,en,https://huh.harvard.edu/pages/use,President and Fellows of Harvard College,https://huh.harvard.edu/access-digital-reproductions-works-public-domain,http://data.huh.harvard.edu/81e295f8-7d1f-4cf4-b17e-8d1f0f1fc454/image,urn:lsid:biocol.org:col:15631,urn:lsid:biocol.org:col:15631,NA,GH,GH,Harvard University Herbaria: All Records,PreservedSpecimen,NA,NA,"{huh_taxonomic_group: Vascular, huh_project_id: null, huh_project_name: null}",81e295f8-7d1f-4cf4-b17e-8d1f0f1fc454,barcode-00346581,NA,2551,L. Abrams,undetermined,NotDetermined,present,Sheet,in collection,,[see Simple Media extension],NA,6/3/03,NA,NA,1903,6,3,,,2551,North America;United States of America;California;Los Angeles County;,North America,NA,NA,United States of America,US,California,Los Angeles County,,Sepulveda canyon. Santa Monica mountains,Sepulveda canyon. Santa Monica mountains,,NA,NA,,NA,NA,,NA,,,,,NA,,Prunus ilicifolia (Nuttall ex Hooker & Arnott) D. N. F. Dietrich,Rosaceae,Prunus,ilicifolia,,(Nuttall ex Hooker & Arnott) D. N. F. Dietrich139,c57ffb99-60e6-4f9c-a85b-34d409e4952b,http://purl.org/dc/dcmitype/PhysicalObject,03:58.0,en,https://huh.harvard.edu/pages/use,President and Fellows of Harvard College,https://huh.harvard.edu/access-digital-reproductions-works-public-domain,http://data.huh.harvard.edu/c57ffb99-60e6-4f9c-a85b-34d409e4952b/image,urn:lsid:biocol.org:col:15631,urn:lsid:biocol.org:col:15631,NA,GH,GH,Harvard University Herbaria: All Records,PreservedSpecimen,NA,NA,"{huh_taxonomic_group: Vascular, huh_project_id: null, huh_project_name: null}",c57ffb99-60e6-4f9c-a85b-34d409e4952b,barcode-00346580,NA,1046,G. B. Grant,undetermined,NotDetermined,present,"Sheet,Sheet",in collection,,[see Simple Media extension],NA,1901-06,NA,NA,1901,6,NA,,,1046,North America;United States of America;California;Los Angeles County;,North America,NA,NA,United States of America,US,California,Los Angeles County,,Mount Lowe,Mount Lowe,3000,NA,NA,,NA,NA,,NA,,,,,NA,,Prunus ilicifolia (Nuttall ex Hooker & Arnott) D. N. F. Dietrich,Rosaceae,Prunus,ilicifolia,,(Nuttall ex Hooker & Arnott) D. N. F. Dietrich140,8b9cfbb7-8e5a-4f2a-8cff-99c14b19a8fc,http://purl.org/dc/dcmitype/PhysicalObject,03:58.0,en,https://huh.harvard.edu/pages/use,President and Fellows of Harvard College,https://huh.harvard.edu/access-digital-reproductions-works-public-domain,http://data.huh.harvard.edu/8b9cfbb7-8e5a-4f2a-8cff-99c14b19a8fc/image,urn:lsid:biocol.org:col:15631,urn:lsid:biocol.org:col:15631,NA,GH,GH,Harvard University Herbaria: All Records,PreservedSpecimen,NA,NA,"{huh_taxonomic_group: Vascular, huh_project_id: null, huh_project_name: null}",8b9cfbb7-8e5a-4f2a-8cff-99c14b19a8fc,barcode-00346579,NA,1046,G. B. Grant,undetermined,NotDetermined,present,"Sheet,Sheet",in collection,,[see Simple Media extension],NA,1901-06,NA,NA,1901,6,NA,,,1046,North America;United States of America;California;Los Angeles County;,North America,NA,NA,United States of America,US,California,Los Angeles County,,Mount Lowe,Mount Lowe,3000,NA,NA,,NA,NA,,NA,,,,,NA,,Prunus ilicifolia (Nuttall ex Hooker & Arnott) D. N. F. Dietrich,Rosaceae,Prunus,ilicifolia,,(Nuttall ex Hooker & Arnott) D. N. F. Dietrich141,a99c539d-371f-4f96-aa63-5b167a36133a,http://purl.org/dc/dcmitype/PhysicalObject,01:36.0,en,https://huh.harvard.edu/pages/use,President and Fellows of Harvard College,https://huh.harvard.edu/access-digital-reproductions-works-public-domain,http://data.huh.harvard.edu/a99c539d-371f-4f96-aa63-5b167a36133a/image,urn:lsid:biocol.org:col:15631,urn:lsid:biocol.org:col:15631,NA,GH,GH,Harvard University Herbaria: All Records,PreservedSpecimen,NA,NA,"{huh_taxonomic_group: Vascular, huh_project_id: null, huh_project_name: null}",a99c539d-371f-4f96-aa63-5b167a36133a,barcode-00346576,NA,83,F. W. Peirson,undetermined,NotDetermined,present,Sheet,in collection,,[see Simple Media extension],NA,5/21/18,NA,NA,1918,5,21,,,83,North America;United States of America;California;Los Angeles County;,North America,NA,NA,United States of America,US,California,Los Angeles County,,"Arroyo Seco, San Gabriel Mts.","Arroyo Seco, San Gabriel Mts.",1250 feet,NA,NA,,NA,NA,,NA,,,,,NA,,Prunus ilicifolia (Nuttall ex Hooker & Arnott) D. N. F. Dietrich,Rosaceae,Prunus,ilicifolia,,(Nuttall ex Hooker & Arnott) D. N. F. Dietrich142,375b5677-ec6e-4985-b95c-e0de67a99821,http://purl.org/dc/dcmitype/PhysicalObject,27:01.0,en,https://huh.harvard.edu/pages/use,President and Fellows of Harvard College,https://huh.harvard.edu/access-digital-reproductions-works-public-domain,http://data.huh.harvard.edu/375b5677-ec6e-4985-b95c-e0de67a99821/image,urn:lsid:biocol.org:col:15406,urn:lsid:biocol.org:col:15406,NA,A,A,Harvard University Herbaria: All Records,PreservedSpecimen,NA,NA,"{huh_taxonomic_group: Vascular, huh_project_id: null, huh_project_name: null}",375b5677-ec6e-4985-b95c-e0de67a99821,barcode-00346570,NA,,,,,present,Sheet,in collection,,[see Simple Media extension],NA,1894-11,NA,NA,1894,11,NA,,,,North America;United States of America;California;Los Angeles County;,North America,NA,NA,United States of America,US,California,Los Angeles County,,Catalina Isl.,Catalina Isl.,,NA,NA,,NA,NA,,NA,,,,,NA,,Prunus ilicifolia (Nuttall ex Hooker & Arnott) D. N. F. Dietrich,Rosaceae,Prunus,ilicifolia,,(Nuttall ex Hooker & Arnott) D. N. F. Dietrich143,163ea6ae-9693-405c-af0f-97e532f08e92,http://purl.org/dc/dcmitype/PhysicalObject,56:58.0,en,https://huh.harvard.edu/pages/use,President and Fellows of Harvard College,https://huh.harvard.edu/access-digital-reproductions-works-public-domain,http://data.huh.harvard.edu/163ea6ae-9693-405c-af0f-97e532f08e92/image,urn:lsid:biocol.org:col:15631,urn:lsid:biocol.org:col:15631,NA,GH,GH,Harvard University Herbaria: All Records,PreservedSpecimen,NA,NA,"{huh_taxonomic_group: Vascular, huh_project_id: null, huh_project_name: null}",163ea6ae-9693-405c-af0f-97e532f08e92,barcode-00346564,NA,4482,I. W. Clokey & B. C. Templeton,undetermined,NotDetermined,present,Sheet,in collection,,[see Simple Media extension],NA,1929-05,NA,NA,1929,5,NA,,,4482,North America;United States of America;California;Los Angeles County;,North America,NA,NA,United States of America,US,California,Los Angeles County,,"Mandeville Canyon, Santa Monica Mountains","Mandeville Canyon, Santa Monica Mountains",259 M.,NA,NA,,NA,NA,,NA,,,,,NA,,Prunus ilicifolia (Nuttall ex Hooker & Arnott) D. N. F. Dietrich,Rosaceae,Prunus,ilicifolia,,(Nuttall ex Hooker & Arnott) D. N. F. Dietrich144,e4ccb512-940d-43b7-aa40-bb9469da749d,http://purl.org/dc/dcmitype/PhysicalObject,51:53.0,en,https://huh.harvard.edu/pages/use,President and Fellows of Harvard College,https://huh.harvard.edu/access-digital-reproductions-works-public-domain,http://data.huh.harvard.edu/e4ccb512-940d-43b7-aa40-bb9469da749d/image,urn:lsid:biocol.org:col:15631,urn:lsid:biocol.org:col:15631,NA,GH,GH,Harvard University Herbaria: All Records,PreservedSpecimen,NA,NA,"{huh_taxonomic_group: Vascular, huh_project_id: null, huh_project_name: null}",e4ccb512-940d-43b7-aa40-bb9469da749d,barcode-00346561,NA,13E,F. A. MacFadden,undetermined,NotDetermined,present,Sheet,in collection,,[see Simple Media extension],NA,3/17/31,NA,NA,1931,3,17,,,13E,North America;United States of America;California;Los Angeles County;,North America,NA,NA,United States of America,US,California,Los Angeles County,,"Tuna Canyon, Verduga Hills","Tuna Canyon, Verduga Hills",,NA,NA,,NA,NA,,NA,,,,,NA,,Prunus ilicifolia (Nuttall ex Hooker & Arnott) D. N. F. Dietrich,Rosaceae,Prunus,ilicifolia,,(Nuttall ex Hooker & Arnott) D. N. F. Dietrich145,75594047-ffd3-4d9a-9eef-1287541e5e9a,http://purl.org/dc/dcmitype/PhysicalObject,45:46.0,en,https://huh.harvard.edu/pages/use,President and Fellows of Harvard College,https://huh.harvard.edu/access-digital-reproductions-works-public-domain,http://data.huh.harvard.edu/75594047-ffd3-4d9a-9eef-1287541e5e9a/image,urn:lsid:biocol.org:col:15631,urn:lsid:biocol.org:col:15631,NA,GH,GH,Harvard University Herbaria: All Records,PreservedSpecimen,NA,NA,"{huh_taxonomic_group: Vascular, huh_project_id: null, huh_project_name: null}",75594047-ffd3-4d9a-9eef-1287541e5e9a,barcode-00346559,NA,9849,S. D. Boyd & L. Raz,undetermined,NotDetermined,present,Sheet,in collection,,[see Simple Media extension],NA,5/28/97,NA,NA,1997,5,28,,,9849,North America;United States of America;California;Los Angeles County;,North America,NA,NA,United States of America,US,California,Los Angeles County,,"Liebre Mountains Region: Knapp Ranch area at upper end of Castaic Creek drainage in broad alluvial valley at head of Cienaga Canyon, south of Liebre Mountain. Near 34 40' 54.3 N 118 40' 07.1 W. T7N R17W E 1/2 SW 1/4 sec. 14: 7N 17W W 1/2 SE 1/4 sec 1.4","Liebre Mountains Region: Knapp Ranch area at upper end of Castaic Creek drainage in broad alluvial valley at head of Cienaga Canyon, south of Liebre Mountain. Near 34 40' 54.3 N 118 40' 07.1 W. T7N R17W E 1/2 SW 1/4 sec. 14: 7N 17W W 1/2 SE 1/4 sec 1.4",2840-3080 Feet,NA,NA,,NA,NA,,NA,,,,,NA,,Prunus ilicifolia (Nuttall ex Hooker & Arnott) D. N. F. Dietrich,Rosaceae,Prunus,ilicifolia,,(Nuttall ex Hooker & Arnott) D. N. F. Dietrich146,8adb8269-2d26-4846-b770-7d3be2bb7c97,http://purl.org/dc/dcmitype/PhysicalObject,23:03.0,en,https://huh.harvard.edu/pages/use,President and Fellows of Harvard College,https://huh.harvard.edu/access-digital-reproductions-works-public-domain,http://data.huh.harvard.edu/8adb8269-2d26-4846-b770-7d3be2bb7c97/image,urn:lsid:biocol.org:col:15406,urn:lsid:biocol.org:col:15406,NA,A,A,Harvard University Herbaria: All Records,PreservedSpecimen,NA,NA,"{huh_taxonomic_group: Vascular, huh_project_id: null, huh_project_name: null}",8adb8269-2d26-4846-b770-7d3be2bb7c97,barcode-00346554,NA,1380,L. Abrams,undetermined,NotDetermined,present,Sheet,in collection,,[see Simple Media extension],NA,1901-04,NA,NA,1901,4,NA,,,1380,North America;United States of America;California;Los Angeles County;,North America,NA,NA,United States of America,US,California,Los Angeles County,,Verdugo Hills,Verdugo Hills,,NA,NA,,NA,NA,,NA,,,,,NA,,Prunus ilicifolia (Nuttall ex Hooker & Arnott) D. N. F. Dietrich,Rosaceae,Prunus,ilicifolia,,(Nuttall ex Hooker & Arnott) D. N. F. Dietrich147,a8a41a4c-2e74-46de-b0af-247c67997328,http://purl.org/dc/dcmitype/PhysicalObject,54:32.0,en,https://huh.harvard.edu/pages/use,President and Fellows of Harvard College,https://huh.harvard.edu/access-digital-reproductions-works-public-domain,http://data.huh.harvard.edu/a8a41a4c-2e74-46de-b0af-247c67997328/image,urn:lsid:biocol.org:col:15406,urn:lsid:biocol.org:col:15406,NA,A,A,Harvard University Herbaria: All Records,PreservedSpecimen,NA,NA,"{huh_taxonomic_group: Vascular, huh_project_id: null, huh_project_name: null}",a8a41a4c-2e74-46de-b0af-247c67997328,barcode-00346546,NA,131,G. L. Fisher,undetermined,NotDetermined,present,Sheet,in collection,,[see Simple Media extension],NA,6/28/22,NA,NA,1922,6,28,,,131,North America;United States of America;California;Los Angeles County;,North America,NA,NA,United States of America,US,California,Los Angeles County,,Mt. Wilson,Mt. Wilson,4400 ft.,NA,NA,,NA,NA,,NA,,,,,NA,,Prunus ilicifolia (Nuttall ex Hooker & Arnott) D. N. F. Dietrich,Rosaceae,Prunus,ilicifolia,,(Nuttall ex Hooker & Arnott) D. N. F. Dietrich148,94265734-8327-4995-8af7-5a3d3f93ebf2,http://purl.org/dc/dcmitype/PhysicalObject,47:57.0,en,https://huh.harvard.edu/pages/use,President and Fellows of Harvard College,https://huh.harvard.edu/access-digital-reproductions-works-public-domain,http://data.huh.harvard.edu/94265734-8327-4995-8af7-5a3d3f93ebf2/image,urn:lsid:biocol.org:col:15406,urn:lsid:biocol.org:col:15406,NA,A,A,Harvard University Herbaria: All Records,PreservedSpecimen,NA,NA,"{huh_taxonomic_group: Vascular, huh_project_id: null, huh_project_name: null}",94265734-8327-4995-8af7-5a3d3f93ebf2,barcode-00346544,NA,9376,C. B. Wolf & P. C. Everett,undetermined,NotDetermined,present,Sheet,in collection,,[see Simple Media extension],NA,10/19/37,NA,NA,1937,10,19,,,9376,North America;United States of America;California;Los Angeles County;,North America,NA,NA,United States of America,US,California,Los Angeles County,,"Placerita Canyon, along Placerita Creek, 1 Mi. E. of Newhall","Placerita Canyon, along Placerita Creek, 1 Mi. E. of Newhall",1300 ft.,NA,NA,,NA,NA,,NA,,,,,NA,,Prunus ilicifolia (Nuttall ex Hooker & Arnott) D. N. F. Dietrich,Rosaceae,Prunus,ilicifolia,,(Nuttall ex Hooker & Arnott) D. N. F. Dietrich149,a3cbbc16-7f4d-4a11-9df9-1fa8f9ab93be,http://purl.org/dc/dcmitype/PhysicalObject,36:47.0,en,https://huh.harvard.edu/pages/use,President and Fellows of Harvard College,https://huh.harvard.edu/access-digital-reproductions-works-public-domain,http://data.huh.harvard.edu/a3cbbc16-7f4d-4a11-9df9-1fa8f9ab93be/image,urn:lsid:biocol.org:col:15406,urn:lsid:biocol.org:col:15406,NA,A,A,Harvard University Herbaria: All Records,PreservedSpecimen,NA,NA,"{huh_taxonomic_group: Vascular, huh_project_id: null, huh_project_name: null}",a3cbbc16-7f4d-4a11-9df9-1fa8f9ab93be,barcode-00346541,NA,543,S. F. Blake,undetermined,NotDetermined,present,Sheet,in collection,,[see Simple Media extension],NA,7/31/10,NA,NA,1910,7,31,,,543,North America;United States of America;California;Los Angeles County;,North America,NA,NA,United States of America,US,California,Los Angeles County,,Mt. Hollywood,Mt. Hollywood,,NA,NA,,NA,NA,,NA,,,,,NA,,Prunus ilicifolia (Nuttall ex Hooker & Arnott) D. N. F. Dietrich,Rosaceae,Prunus,ilicifolia,,(Nuttall ex Hooker & Arnott) D. N. F. Dietrich150,cae7eb87-59ba-4a63-963c-9bbc6dac0fd8,http://purl.org/dc/dcmitype/PhysicalObject,08:29.0,en,https://huh.harvard.edu/pages/use,President and Fellows of Harvard College,https://huh.harvard.edu/access-digital-reproductions-works-public-domain,http://data.huh.harvard.edu/cae7eb87-59ba-4a63-963c-9bbc6dac0fd8/image,urn:lsid:biocol.org:col:15631,urn:lsid:biocol.org:col:15631,NA,GH,GH,Harvard University Herbaria: All Records,PreservedSpecimen,NA,NA,"{huh_taxonomic_group: Vascular, huh_project_id: null, huh_project_name: null}",cae7eb87-59ba-4a63-963c-9bbc6dac0fd8,barcode-00518828,NA,21,W. S. Lyon,,Sterile,present,Sheet,in collection,,[see Simple Media extension],NA,1885,NA,NA,1885,NA,NA,,,21,North America;United States of America;California;Los Angeles County;,North America,NA,NA,United States of America,US,California,Los Angeles County,,Sa [Santa] Catalina Isl [Island],Sa [Santa] Catalina Isl [Island],,NA,NA,,NA,NA,,NA,,,,,NA,,Prunus ilicifolia (Nuttall ex Hooker & Arnott) D. N. F. Dietrich,Rosaceae,Prunus,ilicifolia,,(Nuttall ex Hooker & Arnott) D. N. F. Dietrich151,17956cbe-b9b8-4dfa-b5f1-c7c832e23437,http://purl.org/dc/dcmitype/PhysicalObject,57:19.0,en,https://huh.harvard.edu/pages/use,President and Fellows of Harvard College,https://huh.harvard.edu/access-digital-reproductions-works-public-domain,http://data.huh.harvard.edu/17956cbe-b9b8-4dfa-b5f1-c7c832e23437/image,urn:lsid:biocol.org:col:15406,urn:lsid:biocol.org:col:15406,NA,A,A,Harvard University Herbaria: All Records,PreservedSpecimen,NA,NA,"{huh_taxonomic_group: Vascular, huh_project_id: 7, huh_project_name: US and Canada - Mass Digitization}",17956cbe-b9b8-4dfa-b5f1-c7c832e23437,barcode-01722427,NA,,[data not captured],undetermined,NotDetermined,present,Sheet,in collection,,[see Simple Media extension],NA,,NA,NA,NA,NA,NA,,,,North America;United States of America;Arkansas;Marion County;,North America,NA,NA,United States of America,US,Arkansas,Marion County,,[data not captured],[data not captured],,NA,NA,,NA,NA,,NA,,,,,NA,,Prunus mexicana S. Watson,Rosaceae,Prunus,mexicana,,S. Watson152,7e659a64-d642-4b93-84c5-c2343e4a1fd6,http://purl.org/dc/dcmitype/PhysicalObject,19:45.0,en,https://huh.harvard.edu/pages/use,President and Fellows of Harvard College,https://huh.harvard.edu/access-digital-reproductions-works-public-domain,http://data.huh.harvard.edu/7e659a64-d642-4b93-84c5-c2343e4a1fd6/image,urn:lsid:biocol.org:col:15406,urn:lsid:biocol.org:col:15406,NA,A,A,Harvard University Herbaria: All Records,PreservedSpecimen,NA,NA,"{huh_taxonomic_group: Vascular, huh_project_id: 7, huh_project_name: US and Canada - Mass Digitization}",7e659a64-d642-4b93-84c5-c2343e4a1fd6,barcode-01722460,NA,,[data not captured],undetermined,NotDetermined,present,Sheet,in collection,,[see Simple Media extension],NA,,NA,NA,NA,NA,NA,,,,North America;United States of America;Arkansas;Marion County;,North America,NA,NA,United States of America,US,Arkansas,Marion County,,[data not captured],[data not captured],,NA,NA,,NA,NA,,NA,,,,,NA,,Prunus mexicana S. Watson,Rosaceae,Prunus,mexicana,,S. Watson153,b48432a6-ecce-47be-9c2e-20861949498b,http://purl.org/dc/dcmitype/PhysicalObject,22:32.0,en,https://huh.harvard.edu/pages/use,President and Fellows of Harvard College,https://huh.harvard.edu/access-digital-reproductions-works-public-domain,http://data.huh.harvard.edu/b48432a6-ecce-47be-9c2e-20861949498b/image,urn:lsid:biocol.org:col:15406,urn:lsid:biocol.org:col:15406,NA,A,A,Harvard University Herbaria: All Records,PreservedSpecimen,NA,NA,"{huh_taxonomic_group: Vascular, huh_project_id: 7, huh_project_name: US and Canada - Mass Digitization}",b48432a6-ecce-47be-9c2e-20861949498b,barcode-01722464,NA,,[data not captured],undetermined,NotDetermined,present,Sheet,in collection,,[see Simple Media extension],NA,,NA,NA,NA,NA,NA,,,,North America;United States of America;Arkansas;Marion County;,North America,NA,NA,United States of America,US,Arkansas,Marion County,,[data not captured],[data not captured],,NA,NA,,NA,NA,,NA,,,,,NA,,Prunus mexicana S. Watson,Rosaceae,Prunus,mexicana,,S. Watson154,d57ac05c-a84f-4bef-9985-0652448dff61,http://purl.org/dc/dcmitype/PhysicalObject,07:07.0,en,https://huh.harvard.edu/pages/use,President and Fellows of Harvard College,https://huh.harvard.edu/access-digital-reproductions-works-public-domain,http://data.huh.harvard.edu/d57ac05c-a84f-4bef-9985-0652448dff61/image,urn:lsid:biocol.org:col:15631,urn:lsid:biocol.org:col:15631,NA,GH,GH,Harvard University Herbaria: All Records,PreservedSpecimen,NA,NA,"{huh_taxonomic_group: Vascular, huh_project_id: 7, huh_project_name: US and Canada - Mass Digitization}",d57ac05c-a84f-4bef-9985-0652448dff61,barcode-01722511,NA,,[data not captured],undetermined,NotDetermined,present,Sheet,in collection,,[see Simple Media extension],NA,,NA,NA,NA,NA,NA,,,,North America;United States of America;Mississippi;Marion County;,North America,NA,NA,United States of America,US,Mississippi,Marion County,,[data not captured],[data not captured],,NA,NA,,NA,NA,,NA,,,,,NA,,Prunus mexicana S. Watson,Rosaceae,Prunus,mexicana,,S. Watson155,368f82a5-76e8-4fe6-a8e3-cc490d639ab2,http://purl.org/dc/dcmitype/PhysicalObject,11:56.0,en,https://huh.harvard.edu/pages/use,President and Fellows of Harvard College,https://huh.harvard.edu/access-digital-reproductions-works-public-domain,http://data.huh.harvard.edu/368f82a5-76e8-4fe6-a8e3-cc490d639ab2/image,urn:lsid:biocol.org:col:15406,urn:lsid:biocol.org:col:15406,NA,A,A,Harvard University Herbaria: All Records,PreservedSpecimen,NA,NA,"{huh_taxonomic_group: Vascular, huh_project_id: 7, huh_project_name: US and Canada - Mass Digitization}",368f82a5-76e8-4fe6-a8e3-cc490d639ab2,barcode-01722520,NA,,[data not captured],undetermined,NotDetermined,present,Sheet,in collection,,[see Simple Media extension],NA,,NA,NA,NA,NA,NA,,,,North America;United States of America;Missouri;Marion County;,North America,NA,NA,United States of America,US,Missouri,Marion County,,[data not captured],[data not captured],,NA,NA,,NA,NA,,NA,,,,,NA,,Prunus mexicana S. Watson,Rosaceae,Prunus,mexicana,,S. Watson156,e3fb31b5-ded8-4d7e-a07f-821da29dc758,http://purl.org/dc/dcmitype/PhysicalObject,17:15.0,en,https://huh.harvard.edu/pages/use,President and Fellows of Harvard College,https://huh.harvard.edu/access-digital-reproductions-works-public-domain,http://data.huh.harvard.edu/e3fb31b5-ded8-4d7e-a07f-821da29dc758/image,urn:lsid:biocol.org:col:15631,urn:lsid:biocol.org:col:15631,NA,GH,GH,Harvard University Herbaria: All Records,PreservedSpecimen,NA,NA,"{huh_taxonomic_group: Vascular, huh_project_id: 7, huh_project_name: US and Canada - Mass Digitization}",e3fb31b5-ded8-4d7e-a07f-821da29dc758,barcode-01722539,NA,6308,G. J. Goodman,undetermined,NotDetermined,present,Sheet,in collection,,[see Simple Media extension],NA,6/19/56,NA,NA,1956,6,19,,in forest and ravines.,6308,North America;United States of America;Oklahoma;Marshall County;,North America,NA,NA,United States of America,US,Oklahoma,Marshall County,,Near Univ. of Okla. Biol. Station,Near Univ. of Okla. Biol. Station,,NA,NA,,NA,NA,,NA,,,,,NA,,Prunus mexicana S. Watson,Rosaceae,Prunus,mexicana,,S. Watson157,38e986e1-0e80-422d-89b7-b3f8eb6ef7f2,http://purl.org/dc/dcmitype/PhysicalObject,31:53.0,en,https://huh.harvard.edu/pages/use,President and Fellows of Harvard College,https://huh.harvard.edu/access-digital-reproductions-works-public-domain,http://data.huh.harvard.edu/38e986e1-0e80-422d-89b7-b3f8eb6ef7f2/image,urn:lsid:biocol.org:col:15631,urn:lsid:biocol.org:col:15631,NA,GH,GH,Harvard University Herbaria: All Records,PreservedSpecimen,NA,NA,"{huh_taxonomic_group: Vascular, huh_project_id: 7, huh_project_name: US and Canada - Mass Digitization}",38e986e1-0e80-422d-89b7-b3f8eb6ef7f2,barcode-01722578,NA,,[data not captured],undetermined,NotDetermined,present,Sheet,in collection,,[see Simple Media extension],NA,,NA,NA,NA,NA,NA,,,,North America;United States of America;Tennessee;Maury County;,North America,NA,NA,United States of America,US,Tennessee,Maury County,,[data not captured],[data not captured],,NA,NA,,NA,NA,,NA,,,,,NA,,Prunus mexicana S. Watson,Rosaceae,Prunus,mexicana,,S. Watson158,0bdb4e3f-a0ce-4ffe-821e-cf157411b21d,http://purl.org/dc/dcmitype/PhysicalObject,28:03.0,en,https://huh.harvard.edu/pages/use,President and Fellows of Harvard College,https://huh.harvard.edu/access-digital-reproductions-works-public-domain,http://data.huh.harvard.edu/0bdb4e3f-a0ce-4ffe-821e-cf157411b21d/image,urn:lsid:biocol.org:col:15631,urn:lsid:biocol.org:col:15631,NA,GH,GH,Harvard University Herbaria: All Records,PreservedSpecimen,NA,NA,"{huh_taxonomic_group: Vascular, huh_project_id: 7, huh_project_name: US and Canada - Mass Digitization}",0bdb4e3f-a0ce-4ffe-821e-cf157411b21d,barcode-01722560,NA,2140,G. J. Goodman,undetermined,NotDetermined,present,Sheet,in collection,,[see Simple Media extension],NA,6/17/34,NA,NA,1934,6,17,,Bottom of damp ravine,2140,North America;United States of America;Oklahoma;McClain County (Oklahoma);,North America,NA,NA,United States of America,US,Oklahoma,McClain County (Oklahoma),,[no additional data],[no additional data],,NA,NA,,NA,NA,,NA,,,,,NA,,Prunus mexicana S. Watson,Rosaceae,Prunus,mexicana,,S. Watson159,e997c243-08e5-4f4c-96c0-cfb6ace1ff18,http://purl.org/dc/dcmitype/PhysicalObject,35:04.0,en,https://huh.harvard.edu/pages/use,President and Fellows of Harvard College,https://huh.harvard.edu/access-digital-reproductions-works-public-domain,http://data.huh.harvard.edu/e997c243-08e5-4f4c-96c0-cfb6ace1ff18/image,urn:lsid:biocol.org:col:15631,urn:lsid:biocol.org:col:15631,NA,GH,GH,Harvard University Herbaria: All Records,PreservedSpecimen,NA,NA,"{huh_taxonomic_group: Vascular, huh_project_id: 7, huh_project_name: US and Canada - Mass Digitization}",e997c243-08e5-4f4c-96c0-cfb6ace1ff18,barcode-01722564,NA,135,G. W. Stevens,undetermined,NotDetermined,present,Sheet,in collection,,[see Simple Media extension],NA,4/20/13,NA,NA,1913,4,20,,In small draw not in timber.,135,North America;United States of America;Oklahoma;McClain County (Oklahoma);,North America,NA,NA,United States of America,US,Oklahoma,McClain County (Oklahoma),,Near Purcell,Near Purcell,,NA,NA,,NA,NA,,NA,,,,,NA,,Prunus mexicana S. Watson,Rosaceae,Prunus,mexicana,,S. Watson160,2607733e-df29-4794-92a4-1d3634ec06b9,http://purl.org/dc/dcmitype/PhysicalObject,51:19.0,en,https://huh.harvard.edu/pages/use,President and Fellows of Harvard College,https://huh.harvard.edu/access-digital-reproductions-works-public-domain,http://data.huh.harvard.edu/2607733e-df29-4794-92a4-1d3634ec06b9/image,urn:lsid:biocol.org:col:15631,urn:lsid:biocol.org:col:15631,NA,GH,GH,Harvard University Herbaria: All Records,PreservedSpecimen,NA,NA,"{huh_taxonomic_group: Vascular, huh_project_id: 7, huh_project_name: US and Canada - Mass Digitization}",2607733e-df29-4794-92a4-1d3634ec06b9,barcode-01722567,NA,4083,G. J. Goodman,undetermined,NotDetermined,present,Sheet,in collection,,[see Simple Media extension],NA,10/19/46,NA,NA,1946,10,19,,Wooded ravine,4083,North America;United States of America;Oklahoma;McClain County (Oklahoma);,North America,NA,NA,United States of America,US,Oklahoma,McClain County (Oklahoma),,[no additional data],[no additional data],,NA,NA,,NA,NA,,NA,,,,,NA,,Prunus mexicana S. Watson,Rosaceae,Prunus,mexicana,,S. Watson161,1ad521fd-3a3b-4038-9d31-1d6ea849e50d,http://purl.org/dc/dcmitype/PhysicalObject,21:37.0,en,https://huh.harvard.edu/pages/use,President and Fellows of Harvard College,https://huh.harvard.edu/access-digital-reproductions-works-public-domain,http://data.huh.harvard.edu/1ad521fd-3a3b-4038-9d31-1d6ea849e50d/image,urn:lsid:biocol.org:col:15406,urn:lsid:biocol.org:col:15406,NA,A,A,Harvard University Herbaria: All Records,PreservedSpecimen,NA,NA,"{huh_taxonomic_group: Vascular, huh_project_id: 7, huh_project_name: US and Canada - Mass Digitization}",1ad521fd-3a3b-4038-9d31-1d6ea849e50d,barcode-01722620,NA,3369,P. L. Ricker,undetermined,NotDetermined,present,Sheet,in collection,,[see Simple Media extension],NA,4/19/10,NA,NA,1910,4,19,,,3369,North America;United States of America;Texas;McLennan County;,North America,NA,NA,United States of America,US,Texas,McLennan County,Waco,[no additional data],[no additional data],,NA,NA,,NA,NA,,NA,,,,,NA,,Prunus mexicana S. Watson,Rosaceae,Prunus,mexicana,,S. Watson162,bef67179-01f5-4906-a33f-9928f89c4bc9,http://purl.org/dc/dcmitype/PhysicalObject,10:49.0,en,https://huh.harvard.edu/pages/use,President and Fellows of Harvard College,https://huh.harvard.edu/access-digital-reproductions-works-public-domain,http://data.huh.harvard.edu/bef67179-01f5-4906-a33f-9928f89c4bc9/image,urn:lsid:biocol.org:col:15406,urn:lsid:biocol.org:col:15406,NA,A,A,Harvard University Herbaria: All Records,PreservedSpecimen,NA,NA,"{huh_taxonomic_group: Vascular, huh_project_id: null, huh_project_name: null}",bef67179-01f5-4906-a33f-9928f89c4bc9,barcode-00346618,NA,,T. S. Brandegee,undetermined,NotDetermined,present,Sheet,in collection,,[see Simple Media extension],NA,1885,NA,NA,1885,NA,NA,,,,North America;United States of America;California;Monterey County;,North America,NA,NA,United States of America,US,California,Monterey County,,,,,NA,NA,,NA,NA,,NA,,,,,NA,,Prunus ilicifolia (Nuttall ex Hooker & Arnott) D. N. F. Dietrich,Rosaceae,Prunus,ilicifolia,,(Nuttall ex Hooker & Arnott) D. N. F. Dietrich163,2e53e4c1-9709-4996-8635-2e48ad9ff96a,http://purl.org/dc/dcmitype/PhysicalObject,41:22.0,en,https://huh.harvard.edu/pages/use,President and Fellows of Harvard College,https://huh.harvard.edu/access-digital-reproductions-works-public-domain,http://data.huh.harvard.edu/2e53e4c1-9709-4996-8635-2e48ad9ff96a/image,urn:lsid:biocol.org:col:15631,urn:lsid:biocol.org:col:15631,NA,GH,GH,Harvard University Herbaria: All Records,PreservedSpecimen,NA,NA,"{huh_taxonomic_group: Vascular, huh_project_id: null, huh_project_name: null}",2e53e4c1-9709-4996-8635-2e48ad9ff96a,barcode-00346590,NA,258,M. E. Ferguson & E. Van E. Ferguson,undetermined,NotDetermined,present,Sheet,in collection,,[see Simple Media extension],NA,6/18/19,NA,NA,1919,6,18,,,258,North America;United States of America;California;Monterey County;,North America,NA,NA,United States of America,US,California,Monterey County,,Carmel Valley,Carmel Valley,,NA,NA,,NA,NA,,NA,,,,,NA,,Prunus ilicifolia (Nuttall ex Hooker & Arnott) D. N. F. Dietrich,Rosaceae,Prunus,ilicifolia,,(Nuttall ex Hooker & Arnott) D. N. F. Dietrich164,eb60f5ea-d025-473c-94dd-dc3d62f81308,http://purl.org/dc/dcmitype/PhysicalObject,04:03.0,en,https://huh.harvard.edu/pages/use,President and Fellows of Harvard College,https://huh.harvard.edu/access-digital-reproductions-works-public-domain,http://data.huh.harvard.edu/eb60f5ea-d025-473c-94dd-dc3d62f81308/image,urn:lsid:biocol.org:col:15406,urn:lsid:biocol.org:col:15406,NA,A,A,Harvard University Herbaria: All Records,PreservedSpecimen,NA,NA,"{huh_taxonomic_group: Vascular, huh_project_id: 7, huh_project_name: US and Canada - Mass Digitization}",eb60f5ea-d025-473c-94dd-dc3d62f81308,barcode-01722535,NA,1787,G. M. Merrill,undetermined,NotDetermined,present,Sheet,in collection,,[see Simple Media extension],NA,3/16/36,NA,NA,1936,3,16,,,1787,North America;United States of America;Oklahoma;Murray County;,North America,NA,NA,United States of America,US,Oklahoma,Murray County,,Sulphur,Sulphur,,NA,NA,,NA,NA,,NA,,,,,NA,,Prunus mexicana S. Watson,Rosaceae,Prunus,mexicana,,S. Watson165,d66693bf-a56f-4566-ab17-56525cf0f5f5,http://purl.org/dc/dcmitype/PhysicalObject,08:03.0,en,https://huh.harvard.edu/pages/use,President and Fellows of Harvard College,https://huh.harvard.edu/access-digital-reproductions-works-public-domain,http://data.huh.harvard.edu/d66693bf-a56f-4566-ab17-56525cf0f5f5/image,urn:lsid:biocol.org:col:15406,urn:lsid:biocol.org:col:15406,NA,A,A,Harvard University Herbaria: All Records,PreservedSpecimen,NA,NA,"{huh_taxonomic_group: Vascular, huh_project_id: 7, huh_project_name: US and Canada - Mass Digitization}",d66693bf-a56f-4566-ab17-56525cf0f5f5,barcode-01722537,NA,971,G. M. Merrill,undetermined,NotDetermined,present,Sheet,in collection,,[see Simple Media extension],NA,7/23/35,NA,NA,1935,7,23,,,971,North America;United States of America;Oklahoma;Murray County;,North America,NA,NA,United States of America,US,Oklahoma,Murray County,,Sulphur,Sulphur,,NA,NA,,NA,NA,,NA,,,,,NA,,Prunus mexicana S. Watson,Rosaceae,Prunus,mexicana,,S. Watson166,4d4af9ea-8046-422e-938b-f70d8590fe0f,http://purl.org/dc/dcmitype/PhysicalObject,15:32.0,en,https://huh.harvard.edu/pages/use,President and Fellows of Harvard College,https://huh.harvard.edu/access-digital-reproductions-works-public-domain,http://data.huh.harvard.edu/4d4af9ea-8046-422e-938b-f70d8590fe0f/image,urn:lsid:biocol.org:col:15406,urn:lsid:biocol.org:col:15406,NA,A,A,Harvard University Herbaria: All Records,PreservedSpecimen,NA,NA,"{huh_taxonomic_group: Vascular, huh_project_id: 7, huh_project_name: US and Canada - Mass Digitization}",4d4af9ea-8046-422e-938b-f70d8590fe0f,barcode-01722538,NA,1326,G. M. Merrill,undetermined,NotDetermined,present,Sheet,in collection,,[see Simple Media extension],NA,8/30/35,NA,NA,1935,8,30,,,1326,North America;United States of America;Oklahoma;Murray County;,North America,NA,NA,United States of America,US,Oklahoma,Murray County,,Sulphur,Sulphur,,NA,NA,,NA,NA,,NA,,,,,NA,,Prunus mexicana S. Watson,Rosaceae,Prunus,mexicana,,S. Watson167,387e6595-b275-47d6-ba91-417418c3fe64,http://purl.org/dc/dcmitype/PhysicalObject,18:23.0,en,https://huh.harvard.edu/pages/use,President and Fellows of Harvard College,https://huh.harvard.edu/access-digital-reproductions-works-public-domain,http://data.huh.harvard.edu/387e6595-b275-47d6-ba91-417418c3fe64/image,urn:lsid:biocol.org:col:15406,urn:lsid:biocol.org:col:15406,NA,A,A,Harvard University Herbaria: All Records,PreservedSpecimen,NA,NA,"{huh_taxonomic_group: Vascular, huh_project_id: 7, huh_project_name: US and Canada - Mass Digitization}",387e6595-b275-47d6-ba91-417418c3fe64,barcode-01722540,NA,1325,G. M. Merrill,undetermined,NotDetermined,present,Sheet,in collection,,[see Simple Media extension],NA,8/30/35,NA,NA,1935,8,30,,,1325,North America;United States of America;Oklahoma;Murray County;,North America,NA,NA,United States of America,US,Oklahoma,Murray County,,Sulphur,Sulphur,,NA,NA,,NA,NA,,NA,,,,,NA,,Prunus mexicana S. Watson,Rosaceae,Prunus,mexicana,,S. Watson168,ec6f63c9-1be5-4c9a-914b-613038561830,http://purl.org/dc/dcmitype/PhysicalObject,31:56.0,en,https://huh.harvard.edu/pages/use,President and Fellows of Harvard College,https://huh.harvard.edu/access-digital-reproductions-works-public-domain,http://data.huh.harvard.edu/ec6f63c9-1be5-4c9a-914b-613038561830/image,urn:lsid:biocol.org:col:15406,urn:lsid:biocol.org:col:15406,NA,A,A,Harvard University Herbaria: All Records,PreservedSpecimen,NA,NA,"{huh_taxonomic_group: Vascular, huh_project_id: 7, huh_project_name: US and Canada - Mass Digitization}",ec6f63c9-1be5-4c9a-914b-613038561830,barcode-01722541,NA,1340,E. J. Palmer,undetermined,NotDetermined,present,Sheet,in collection,,[see Simple Media extension],NA,9/3/35,NA,NA,1935,9,3,,,1340,North America;United States of America;Oklahoma;Murray County;,North America,NA,NA,United States of America,US,Oklahoma,Murray County,,Sulphur,Sulphur,,NA,NA,,NA,NA,,NA,,,,,NA,,Prunus mexicana S. Watson,Rosaceae,Prunus,mexicana,,S. Watson169,98c30571-a4dc-47a3-96eb-5b1fa51ce96d,http://purl.org/dc/dcmitype/PhysicalObject,35:13.0,en,https://huh.harvard.edu/pages/use,President and Fellows of Harvard College,https://huh.harvard.edu/access-digital-reproductions-works-public-domain,http://data.huh.harvard.edu/98c30571-a4dc-47a3-96eb-5b1fa51ce96d/image,urn:lsid:biocol.org:col:15406,urn:lsid:biocol.org:col:15406,NA,A,A,Harvard University Herbaria: All Records,PreservedSpecimen,NA,NA,"{huh_taxonomic_group: Vascular, huh_project_id: 7, huh_project_name: US and Canada - Mass Digitization}",98c30571-a4dc-47a3-96eb-5b1fa51ce96d,barcode-01722542,NA,1341,E. J. Palmer,undetermined,NotDetermined,present,Sheet,in collection,,[see Simple Media extension],NA,9/3/35,NA,NA,1935,9,3,,,1341,North America;United States of America;Oklahoma;Murray County;,North America,NA,NA,United States of America,US,Oklahoma,Murray County,,Sulphur,Sulphur,,NA,NA,,NA,NA,,NA,,,,,NA,,Prunus mexicana S. Watson,Rosaceae,Prunus,mexicana,,S. Watson170,697defe3-4768-48ac-85b3-0a87c667505b,http://purl.org/dc/dcmitype/PhysicalObject,36:59.0,en,https://huh.harvard.edu/pages/use,President and Fellows of Harvard College,https://huh.harvard.edu/access-digital-reproductions-works-public-domain,http://data.huh.harvard.edu/697defe3-4768-48ac-85b3-0a87c667505b/image,urn:lsid:biocol.org:col:15406,urn:lsid:biocol.org:col:15406,NA,A,A,Harvard University Herbaria: All Records,PreservedSpecimen,NA,NA,"{huh_taxonomic_group: Vascular, huh_project_id: 7, huh_project_name: US and Canada - Mass Digitization}",697defe3-4768-48ac-85b3-0a87c667505b,barcode-01722543,NA,1371,G. M. Merrill,undetermined,NotDetermined,present,Sheet,in collection,,[see Simple Media extension],NA,9/5/35,NA,NA,1935,9,5,,,1371,North America;United States of America;Oklahoma;Murray County;,North America,NA,NA,United States of America,US,Oklahoma,Murray County,,Sulphur,Sulphur,,NA,NA,,NA,NA,,NA,,,,,NA,,Prunus mexicana S. Watson,Rosaceae,Prunus,mexicana,,S. Watson171,cf80e5c7-f7d8-4ee5-b4c2-cedd29a3ddac,http://purl.org/dc/dcmitype/PhysicalObject,37:56.0,en,https://huh.harvard.edu/pages/use,President and Fellows of Harvard College,https://huh.harvard.edu/access-digital-reproductions-works-public-domain,http://data.huh.harvard.edu/cf80e5c7-f7d8-4ee5-b4c2-cedd29a3ddac/image,urn:lsid:biocol.org:col:15406,urn:lsid:biocol.org:col:15406,NA,A,A,Harvard University Herbaria: All Records,PreservedSpecimen,NA,NA,"{huh_taxonomic_group: Vascular, huh_project_id: 7, huh_project_name: US and Canada - Mass Digitization}",cf80e5c7-f7d8-4ee5-b4c2-cedd29a3ddac,barcode-01722544,NA,1339,G. M. Merrill,undetermined,NotDetermined,present,Sheet,in collection,,[see Simple Media extension],NA,9/3/35,NA,NA,1935,9,3,,,1339,North America;United States of America;Oklahoma;Murray County;,North America,NA,NA,United States of America,US,Oklahoma,Murray County,,Sulphur,Sulphur,,NA,NA,,NA,NA,,NA,,,,,NA,,Prunus mexicana S. Watson,Rosaceae,Prunus,mexicana,,S. Watson172,8eeb1940-775b-480d-bc50-1ccba16e04ae,http://purl.org/dc/dcmitype/PhysicalObject,42:27.0,en,https://huh.harvard.edu/pages/use,President and Fellows of Harvard College,https://huh.harvard.edu/access-digital-reproductions-works-public-domain,http://data.huh.harvard.edu/8eeb1940-775b-480d-bc50-1ccba16e04ae/image,urn:lsid:biocol.org:col:15406,urn:lsid:biocol.org:col:15406,NA,A,A,Harvard University Herbaria: All Records,PreservedSpecimen,NA,NA,"{huh_taxonomic_group: Vascular, huh_project_id: 7, huh_project_name: US and Canada - Mass Digitization}",8eeb1940-775b-480d-bc50-1ccba16e04ae,barcode-01722545,NA,1349,G. M. Merrill,undetermined,NotDetermined,present,Sheet,in collection,,[see Simple Media extension],NA,9/3/35,NA,NA,1935,9,3,,,1349,North America;United States of America;Oklahoma;Murray County;,North America,NA,NA,United States of America,US,Oklahoma,Murray County,,Sulphur,Sulphur,,NA,NA,,NA,NA,,NA,,,,,NA,,Prunus mexicana S. Watson,Rosaceae,Prunus,mexicana,,S. Watson173,673a16ba-f200-4fab-8d54-b13704c30955,http://purl.org/dc/dcmitype/PhysicalObject,46:36.0,en,https://huh.harvard.edu/pages/use,President and Fellows of Harvard College,https://huh.harvard.edu/access-digital-reproductions-works-public-domain,http://data.huh.harvard.edu/673a16ba-f200-4fab-8d54-b13704c30955/image,urn:lsid:biocol.org:col:15406,urn:lsid:biocol.org:col:15406,NA,A,A,Harvard University Herbaria: All Records,PreservedSpecimen,NA,NA,"{huh_taxonomic_group: Vascular, huh_project_id: 7, huh_project_name: US and Canada - Mass Digitization}",673a16ba-f200-4fab-8d54-b13704c30955,barcode-01722546,NA,9,E. J. Palmer,undetermined,NotDetermined,present,Sheet,in collection,,[see Simple Media extension],NA,3/15/35,NA,NA,1935,3,15,,,9,North America;United States of America;Oklahoma;Murray County;,North America,NA,NA,United States of America,US,Oklahoma,Murray County,,Sulphur,Sulphur,,NA,NA,,NA,NA,,NA,,,,,NA,,Prunus mexicana S. Watson,Rosaceae,Prunus,mexicana,,S. Watson174,09cdf62f-7856-408f-89ec-c7e21f56da66,http://purl.org/dc/dcmitype/PhysicalObject,19:10.0,en,https://huh.harvard.edu/pages/use,President and Fellows of Harvard College,https://huh.harvard.edu/access-digital-reproductions-works-public-domain,http://data.huh.harvard.edu/09cdf62f-7856-408f-89ec-c7e21f56da66/image,urn:lsid:biocol.org:col:15631,urn:lsid:biocol.org:col:15631,NA,GH,GH,Harvard University Herbaria: All Records,PreservedSpecimen,NA,NA,"{huh_taxonomic_group: Vascular, huh_project_id: 7, huh_project_name: US and Canada - Mass Digitization}",09cdf62f-7856-408f-89ec-c7e21f56da66,barcode-01722556,NA,920,"M. Hopkins, A. Nelson & R. Nelson",undetermined,NotDetermined,present,Sheet,in collection,,[see Simple Media extension],NA,4/24/45,NA,NA,1945,4,24,,growing in oak-hickory woods,920,North America;United States of America;Oklahoma;Murray County;,North America,NA,NA,United States of America,US,Oklahoma,Murray County,,"Woodford Chert formation, Arbuckle Mts.","Woodford Chert formation, Arbuckle Mts.",,NA,NA,,NA,NA,,NA,,,,,NA,,Prunus mexicana S. Watson,Rosaceae,Prunus,mexicana,,S. Watson175,2f0e7311-3843-47fb-b396-0c800e3f84cf,http://purl.org/dc/dcmitype/PhysicalObject,52:13.0,en,https://huh.harvard.edu/pages/use,President and Fellows of Harvard College,https://huh.harvard.edu/access-digital-reproductions-works-public-domain,http://data.huh.harvard.edu/2f0e7311-3843-47fb-b396-0c800e3f84cf/image,urn:lsid:biocol.org:col:15406,urn:lsid:biocol.org:col:15406,NA,A,A,Harvard University Herbaria: All Records,PreservedSpecimen,NA,NA,"{huh_taxonomic_group: Vascular, huh_project_id: 7, huh_project_name: US and Canada - Mass Digitization}",2f0e7311-3843-47fb-b396-0c800e3f84cf,barcode-01722568,NA,27,G. M. Merrill,undetermined,NotDetermined,present,Sheet,in collection,,[see Simple Media extension],NA,3/25/35,NA,NA,1935,3,25,,,27,North America;United States of America;Oklahoma;Murray County;,North America,NA,NA,United States of America,US,Oklahoma,Murray County,,Sulphur,Sulphur,,NA,NA,,NA,NA,,NA,,,,,NA,,Prunus mexicana S. Watson,Rosaceae,Prunus,mexicana,,S. Watson176,3044a68c-42f2-4e78-bdc1-3b8080778bca,http://purl.org/dc/dcmitype/PhysicalObject,01:17.0,en,https://huh.harvard.edu/pages/use,President and Fellows of Harvard College,https://huh.harvard.edu/access-digital-reproductions-works-public-domain,http://data.huh.harvard.edu/3044a68c-42f2-4e78-bdc1-3b8080778bca/image,urn:lsid:biocol.org:col:15406,urn:lsid:biocol.org:col:15406,NA,A,A,Harvard University Herbaria: All Records,PreservedSpecimen,NA,NA,"{huh_taxonomic_group: Vascular, huh_project_id: 7, huh_project_name: US and Canada - Mass Digitization}",3044a68c-42f2-4e78-bdc1-3b8080778bca,barcode-01722570,NA,43991,E. J. Palmer,undetermined,NotDetermined,present,Sheet,in collection,,[see Simple Media extension],NA,10/9/37,NA,NA,1937,10,9,,Low limestone hills and along streams,43991,North America;United States of America;Oklahoma;Murray County;,North America,NA,NA,United States of America,US,Oklahoma,Murray County,,"Arbuckle Mountains, near Davis","Arbuckle Mountains, near Davis",,NA,NA,,NA,NA,,NA,,,,,NA,,Prunus mexicana S. Watson,Rosaceae,Prunus,mexicana,,S. Watson177,eb0395fd-a2c7-423c-ac10-46a5fd4183be,http://purl.org/dc/dcmitype/PhysicalObject,59:57.0,en,https://huh.harvard.edu/pages/use,President and Fellows of Harvard College,https://huh.harvard.edu/access-digital-reproductions-works-public-domain,http://data.huh.harvard.edu/eb0395fd-a2c7-423c-ac10-46a5fd4183be/image,urn:lsid:biocol.org:col:15406,urn:lsid:biocol.org:col:15406,NA,A,A,Harvard University Herbaria: All Records,PreservedSpecimen,NA,NA,"{huh_taxonomic_group: Vascular, huh_project_id: 7, huh_project_name: US and Canada - Mass Digitization}",eb0395fd-a2c7-423c-ac10-46a5fd4183be,barcode-01722502,NA,,[data not captured],undetermined,NotDetermined,present,Sheet,in collection,,[see Simple Media extension],NA,,NA,NA,NA,NA,NA,,,,North America;United States of America;Louisiana;Natchitoches County;,North America,NA,NA,United States of America,US,Louisiana,Natchitoches County,,[data not captured],[data not captured],,NA,NA,,NA,NA,,NA,,,,,NA,,Prunus mexicana S. Watson,Rosaceae,Prunus,mexicana,,S. Watson178,7992ade0-2de6-4440-b9af-f1049d892c0c,http://purl.org/dc/dcmitype/PhysicalObject,47:14.0,en,https://huh.harvard.edu/pages/use,President and Fellows of Harvard College,https://huh.harvard.edu/access-digital-reproductions-works-public-domain,http://data.huh.harvard.edu/7992ade0-2de6-4440-b9af-f1049d892c0c/image,urn:lsid:biocol.org:col:15631,urn:lsid:biocol.org:col:15631,NA,GH,GH,Harvard University Herbaria: All Records,PreservedSpecimen,NA,NA,"{huh_taxonomic_group: Vascular, huh_project_id: 7, huh_project_name: US and Canada - Mass Digitization}",7992ade0-2de6-4440-b9af-f1049d892c0c,barcode-01722688,NA,6912,R. McVaugh,undetermined,NotDetermined,present,Sheet,in collection,,[see Simple Media extension],NA,5/17/45,NA,NA,1945,5,17,,Rolling blackland prairie,6912,North America;United States of America;Texas;Navarro County;,North America,NA,NA,United States of America,US,Texas,Navarro County,,2 miles southeast of Richland,2 miles southeast of Richland,,NA,NA,,NA,NA,,NA,,,,,NA,,Prunus mexicana S. Watson,Rosaceae,Prunus,mexicana,,S. Watson179,5217b5f4-b8cf-4792-a4bd-3469f30faea3,http://purl.org/dc/dcmitype/PhysicalObject,57:15.0,en,https://huh.harvard.edu/pages/use,President and Fellows of Harvard College,https://huh.harvard.edu/access-digital-reproductions-works-public-domain,http://data.huh.harvard.edu/5217b5f4-b8cf-4792-a4bd-3469f30faea3/image,urn:lsid:biocol.org:col:15631,urn:lsid:biocol.org:col:15631,NA,GH,GH,Harvard University Herbaria: All Records,PreservedSpecimen,NA,NA,"{huh_taxonomic_group: Vascular, huh_project_id: 7, huh_project_name: US and Canada - Mass Digitization}",5217b5f4-b8cf-4792-a4bd-3469f30faea3,barcode-01722690,NA,6912,R. McVaugh,undetermined,NotDetermined,present,Sheet,in collection,,[see Simple Media extension],NA,5/17/45,NA,NA,1945,5,17,,Rolling blackland prairie,6912,North America;United States of America;Texas;Navarro County;,North America,NA,NA,United States of America,US,Texas,Navarro County,,2 miles southeast of Richland,2 miles southeast of Richland,,NA,NA,,NA,NA,,NA,,,,,NA,,Prunus mexicana S. Watson,Rosaceae,Prunus,mexicana,,S. Watson180,cf158b78-a74e-4011-8dcc-8577f0562e0f,http://purl.org/dc/dcmitype/PhysicalObject,59:24.0,en,https://huh.harvard.edu/pages/use,President and Fellows of Harvard College,https://huh.harvard.edu/access-digital-reproductions-works-public-domain,http://data.huh.harvard.edu/cf158b78-a74e-4011-8dcc-8577f0562e0f/image,urn:lsid:biocol.org:col:15406,urn:lsid:biocol.org:col:15406,NA,A,A,Harvard University Herbaria: All Records,PreservedSpecimen,NA,NA,"{huh_taxonomic_group: Vascular, huh_project_id: null, huh_project_name: null}",cf158b78-a74e-4011-8dcc-8577f0562e0f,barcode-00423559,NA,244 [p.p.],J. H. Kellogg,,Fruit,present,Sheet,in collection,,[see Simple Media extension],NA,3/26/10,NA,NA,1910,3,26,,,244 [p.p.],North America;United States of America;Arkansas;Nevada County;,North America,NA,NA,United States of America,US,Arkansas,Nevada County,Prescott,[no additional data],[no additional data],,NA,NA,,NA,NA,,NA,[annotation on sheet],,,,NA,,Prunus mexicana S. Watson,Rosaceae,Prunus,mexicana,,S. Watson181,4953aba4-346a-4d29-837f-51818ec18077,http://purl.org/dc/dcmitype/PhysicalObject,04:25.0,en,https://huh.harvard.edu/pages/use,President and Fellows of Harvard College,https://huh.harvard.edu/access-digital-reproductions-works-public-domain,http://data.huh.harvard.edu/4953aba4-346a-4d29-837f-51818ec18077/image,urn:lsid:biocol.org:col:15406,urn:lsid:biocol.org:col:15406,NA,A,A,Harvard University Herbaria: All Records,PreservedSpecimen,NA,NA,"{huh_taxonomic_group: Vascular, huh_project_id: null, huh_project_name: null}",4953aba4-346a-4d29-837f-51818ec18077,barcode-00423560,NA,244 [p.p.],J. H. Kellogg,,Fruit,present,,in collection,,[see Simple Media extension],NA,6/25/10,NA,NA,1910,6,25,,,244 [p.p.],North America;United States of America;Arkansas;Nevada County;,North America,NA,NA,United States of America,US,Arkansas,Nevada County,Prescott,[no additional data],[no additional data],,NA,NA,,NA,NA,,NA,[annotation on sheet],,,,NA,,Prunus mexicana S. Watson,Rosaceae,Prunus,mexicana,,S. Watson182,faabc044-d17b-4f57-bc4e-8bde6e698d8e,http://purl.org/dc/dcmitype/PhysicalObject,06:40.0,en,https://huh.harvard.edu/pages/use,President and Fellows of Harvard College,https://huh.harvard.edu/access-digital-reproductions-works-public-domain,http://data.huh.harvard.edu/faabc044-d17b-4f57-bc4e-8bde6e698d8e/image,urn:lsid:biocol.org:col:15406,urn:lsid:biocol.org:col:15406,NA,A,A,Harvard University Herbaria: All Records,PreservedSpecimen,NA,NA,"{huh_taxonomic_group: Vascular, huh_project_id: null, huh_project_name: null}",faabc044-d17b-4f57-bc4e-8bde6e698d8e,barcode-00423561,NA,244 [p.p.],J. H. Kellogg,,Fruit,present,Sheet,in collection,,[see Simple Media extension],NA,9/1/10,NA,NA,1910,9,1,,,244 [p.p.],North America;United States of America;Arkansas;Nevada County;,North America,NA,NA,United States of America,US,Arkansas,Nevada County,Prescott,[no additional data],[no additional data],,NA,NA,,NA,NA,,NA,[annotation on sheet],,,,NA,,Prunus mexicana S. Watson,Rosaceae,Prunus,mexicana,,S. Watson183,19c8470a-f002-4d20-863a-496c23d95fc9,http://purl.org/dc/dcmitype/PhysicalObject,25:15.0,en,https://huh.harvard.edu/pages/use,President and Fellows of Harvard College,https://huh.harvard.edu/access-digital-reproductions-works-public-domain,http://data.huh.harvard.edu/19c8470a-f002-4d20-863a-496c23d95fc9/image,urn:lsid:biocol.org:col:15631,urn:lsid:biocol.org:col:15631,NA,GH,GH,Harvard University Herbaria: All Records,PreservedSpecimen,NA,NA,"{huh_taxonomic_group: Vascular, huh_project_id: 7, huh_project_name: US and Canada - Mass Digitization}",19c8470a-f002-4d20-863a-496c23d95fc9,barcode-01722559,NA,2261,U. T. Waterfall,undetermined,NotDetermined,present,Sheet,in collection,,[see Simple Media extension],NA,7/14/40,NA,NA,1940,7,14,,,2261,North America;United States of America;Oklahoma;Oklahoma County;,North America,NA,NA,United States of America,US,Oklahoma,Oklahoma County,,on the southeast shore of Lake Overhulser,on the southeast shore of Lake Overhulser,,NA,NA,,NA,NA,,NA,,,,,NA,,Prunus mexicana S. Watson,Rosaceae,Prunus,mexicana,,S. Watson184,12b3420d-d605-4f7c-b1b5-b7ab921733c2,http://purl.org/dc/dcmitype/PhysicalObject,29:09.0,en,https://huh.harvard.edu/pages/use,President and Fellows of Harvard College,https://huh.harvard.edu/access-digital-reproductions-works-public-domain,http://data.huh.harvard.edu/12b3420d-d605-4f7c-b1b5-b7ab921733c2/image,urn:lsid:biocol.org:col:15631,urn:lsid:biocol.org:col:15631,NA,GH,GH,Harvard University Herbaria: All Records,PreservedSpecimen,NA,NA,"{huh_taxonomic_group: Vascular, huh_project_id: 7, huh_project_name: US and Canada - Mass Digitization}",12b3420d-d605-4f7c-b1b5-b7ab921733c2,barcode-01722561,NA,165,G. W. Stevens,undetermined,NotDetermined,present,Sheet,in collection,,[see Simple Media extension],NA,4/23/13,NA,NA,1913,4,23,,On creek bank,165,North America;United States of America;Oklahoma;Oklahoma County;,North America,NA,NA,United States of America,US,Oklahoma,Oklahoma County,,Near Oklahoma City,Near Oklahoma City,,NA,NA,,NA,NA,,NA,,,,,NA,,Prunus mexicana S. Watson,Rosaceae,Prunus,mexicana,,S. Watson185,708fb039-39ac-4edf-aeda-7d82ce1f90b9,http://purl.org/dc/dcmitype/PhysicalObject,29:54.0,en,https://huh.harvard.edu/pages/use,President and Fellows of Harvard College,https://huh.harvard.edu/access-digital-reproductions-works-public-domain,http://data.huh.harvard.edu/708fb039-39ac-4edf-aeda-7d82ce1f90b9/image,urn:lsid:biocol.org:col:15631,urn:lsid:biocol.org:col:15631,NA,GH,GH,Harvard University Herbaria: All Records,PreservedSpecimen,NA,NA,"{huh_taxonomic_group: Vascular, huh_project_id: 7, huh_project_name: US and Canada - Mass Digitization}",708fb039-39ac-4edf-aeda-7d82ce1f90b9,barcode-01722562,NA,1731,G. W. Stevens,undetermined,NotDetermined,present,Sheet,in collection,,[see Simple Media extension],NA,4/23/13,NA,NA,1913,4,23,,Edge of woods in creek bottom,1731,North America;United States of America;Oklahoma;Oklahoma County;,North America,NA,NA,United States of America,US,Oklahoma,Oklahoma County,,Near Oklahoma City,Near Oklahoma City,,NA,NA,,NA,NA,,NA,,,,,NA,,Prunus mexicana S. Watson,Rosaceae,Prunus,mexicana,,S. Watson186,fb7591ee-1944-4951-9a2a-79cca6581571,http://purl.org/dc/dcmitype/PhysicalObject,02:47.0,en,https://huh.harvard.edu/pages/use,President and Fellows of Harvard College,https://huh.harvard.edu/access-digital-reproductions-works-public-domain,http://data.huh.harvard.edu/fb7591ee-1944-4951-9a2a-79cca6581571/image,urn:lsid:biocol.org:col:15631,urn:lsid:biocol.org:col:15631,NA,GH,GH,Harvard University Herbaria: All Records,PreservedSpecimen,NA,NA,"{huh_taxonomic_group: Vascular, huh_project_id: 7, huh_project_name: US and Canada - Mass Digitization}",fb7591ee-1944-4951-9a2a-79cca6581571,barcode-01722507,NA,,[data not captured],undetermined,NotDetermined,present,Sheet,in collection,,[see Simple Media extension],NA,,NA,NA,NA,NA,NA,,,,North America;United States of America;Louisiana;Ouachita County;,North America,NA,NA,United States of America,US,Louisiana,Ouachita County,,[data not captured],[data not captured],,NA,NA,,NA,NA,,NA,,,,,NA,,Prunus mexicana S. Watson,Rosaceae,Prunus,mexicana,,S. Watson187,0921cf25-2b51-429d-a94d-0a900e2f157b,http://purl.org/dc/dcmitype/PhysicalObject,09:56.0,en,https://huh.harvard.edu/pages/use,President and Fellows of Harvard College,https://huh.harvard.edu/access-digital-reproductions-works-public-domain,http://data.huh.harvard.edu/0921cf25-2b51-429d-a94d-0a900e2f157b/image,urn:lsid:biocol.org:col:15406,urn:lsid:biocol.org:col:15406,NA,A,A,Harvard University Herbaria: All Records,PreservedSpecimen,NA,NA,"{huh_taxonomic_group: Vascular, huh_project_id: 7, huh_project_name: US and Canada - Mass Digitization}",0921cf25-2b51-429d-a94d-0a900e2f157b,barcode-01722516,NA,,[data not captured],undetermined,NotDetermined,present,Sheet,in collection,,[see Simple Media extension],NA,,NA,NA,NA,NA,NA,,,,North America;United States of America;Missouri;Ozark County;,North America,NA,NA,United States of America,US,Missouri,Ozark County,,[data not captured],[data not captured],,NA,NA,,NA,NA,,NA,,,,,NA,,Prunus mexicana S. Watson,Rosaceae,Prunus,mexicana,,S. Watson188,21b7bd77-017c-4d35-bd86-da5346be8df3,http://purl.org/dc/dcmitype/PhysicalObject,15:14.0,en,https://huh.harvard.edu/pages/use,President and Fellows of Harvard College,https://huh.harvard.edu/access-digital-reproductions-works-public-domain,http://data.huh.harvard.edu/21b7bd77-017c-4d35-bd86-da5346be8df3/image,urn:lsid:biocol.org:col:15406,urn:lsid:biocol.org:col:15406,NA,A,A,Harvard University Herbaria: All Records,PreservedSpecimen,NA,NA,"{huh_taxonomic_group: Vascular, huh_project_id: 7, huh_project_name: US and Canada - Mass Digitization}",21b7bd77-017c-4d35-bd86-da5346be8df3,barcode-01722742,NA,14263,E. J. Palmer,undetermined,NotDetermined,present,Sheet,in collection,,[see Simple Media extension],NA,6/27/18,NA,NA,1918,6,27,,"Rocky woods, along creek",14263,North America;United States of America;Texas;Palo Pinto County;,North America,NA,NA,United States of America,US,Texas,Palo Pinto County,,Strawn,Strawn,,NA,NA,,NA,NA,,NA,,,,,NA,,Prunus mexicana S. Watson,Rosaceae,Prunus,mexicana,,S. Watson189,73bdec8f-026a-4a7f-a799-c2c14d327c10,http://purl.org/dc/dcmitype/PhysicalObject,39:45.0,en,https://huh.harvard.edu/pages/use,President and Fellows of Harvard College,https://huh.harvard.edu/access-digital-reproductions-works-public-domain,http://data.huh.harvard.edu/73bdec8f-026a-4a7f-a799-c2c14d327c10/image,urn:lsid:biocol.org:col:15406,urn:lsid:biocol.org:col:15406,NA,A,A,Harvard University Herbaria: All Records,PreservedSpecimen,NA,NA,"{huh_taxonomic_group: Vascular, huh_project_id: 7, huh_project_name: US and Canada - Mass Digitization}",73bdec8f-026a-4a7f-a799-c2c14d327c10,barcode-01722526,NA,6387,E. J. Palmer,undetermined,NotDetermined,present,Sheet,in collection,,[see Simple Media extension],NA,9/2/14,NA,NA,1914,9,2,,"Sandy bottoms, Arkansas River",6387,North America;United States of America;Oklahoma;Pawnee County;,North America,NA,NA,United States of America,US,Oklahoma,Pawnee County,,Cleveland,Cleveland,,NA,NA,,NA,NA,,NA,,,,,NA,,Prunus mexicana S. Watson,Rosaceae,Prunus,mexicana,,S. Watson190,a176edff-47c0-446d-af87-a65dcd018465,http://purl.org/dc/dcmitype/PhysicalObject,53:21.0,en,https://huh.harvard.edu/pages/use,President and Fellows of Harvard College,https://huh.harvard.edu/access-digital-reproductions-works-public-domain,http://data.huh.harvard.edu/a176edff-47c0-446d-af87-a65dcd018465/image,urn:lsid:biocol.org:col:15406,urn:lsid:biocol.org:col:15406,NA,A,A,Harvard University Herbaria: All Records,PreservedSpecimen,NA,NA,"{huh_taxonomic_group: Vascular, huh_project_id: 7, huh_project_name: US and Canada - Mass Digitization}",a176edff-47c0-446d-af87-a65dcd018465,barcode-01722530,NA,6391,E. J. Palmer,undetermined,NotDetermined,present,Sheet,in collection,,[see Simple Media extension],NA,9/2/14,NA,NA,1914,9,2,,"Sandy bottoms, Arkansas River",6391,North America;United States of America;Oklahoma;Pawnee County;,North America,NA,NA,United States of America,US,Oklahoma,Pawnee County,,Cleveland,Cleveland,,NA,NA,,NA,NA,,NA,,,,,NA,,Prunus mexicana S. Watson,Rosaceae,Prunus,mexicana,,S. Watson191,c0bed7c5-828b-4e74-9c3e-7ee41315355e,http://purl.org/dc/dcmitype/PhysicalObject,13:53.0,en,https://huh.harvard.edu/pages/use,President and Fellows of Harvard College,https://huh.harvard.edu/access-digital-reproductions-works-public-domain,http://data.huh.harvard.edu/c0bed7c5-828b-4e74-9c3e-7ee41315355e/image,urn:lsid:biocol.org:col:15406,urn:lsid:biocol.org:col:15406,NA,A,A,Harvard University Herbaria: All Records,PreservedSpecimen,NA,NA,"{huh_taxonomic_group: Vascular, huh_project_id: 7, huh_project_name: US and Canada - Mass Digitization}",c0bed7c5-828b-4e74-9c3e-7ee41315355e,barcode-01722455,NA,,[data not captured],undetermined,NotDetermined,present,Sheet,in collection,,[see Simple Media extension],NA,,NA,NA,NA,NA,NA,,,,North America;United States of America;Arkansas;Phillips County;,North America,NA,NA,United States of America,US,Arkansas,Phillips County,,[data not captured],[data not captured],,NA,NA,,NA,NA,,NA,,,,,NA,,Prunus mexicana S. Watson,Rosaceae,Prunus,mexicana,,S. Watson192,e63a7674-6966-448f-b5e3-4bbfc749906c,http://purl.org/dc/dcmitype/PhysicalObject,43:45.0,en,https://huh.harvard.edu/pages/use,President and Fellows of Harvard College,https://huh.harvard.edu/access-digital-reproductions-works-public-domain,http://data.huh.harvard.edu/e63a7674-6966-448f-b5e3-4bbfc749906c/image,urn:lsid:biocol.org:col:15406,urn:lsid:biocol.org:col:15406,NA,A,A,Harvard University Herbaria: All Records,PreservedSpecimen,NA,NA,"{huh_taxonomic_group: Vascular, huh_project_id: 7, huh_project_name: US and Canada - Mass Digitization}",e63a7674-6966-448f-b5e3-4bbfc749906c,barcode-01722485,NA,,[data not captured],undetermined,NotDetermined,present,Sheet,in collection,,[see Simple Media extension],NA,,NA,NA,NA,NA,NA,,,,North America;United States of America;Arkansas;Pike County;,North America,NA,NA,United States of America,US,Arkansas,Pike County,,[data not captured],[data not captured],,NA,NA,,NA,NA,,NA,,,,,NA,,Prunus mexicana S. Watson,Rosaceae,Prunus,mexicana,,S. Watson193,639db9a3-1918-4c2e-81d3-e44276889b6c,http://purl.org/dc/dcmitype/PhysicalObject,22:07.0,en,https://huh.harvard.edu/pages/use,President and Fellows of Harvard College,https://huh.harvard.edu/access-digital-reproductions-works-public-domain,http://data.huh.harvard.edu/639db9a3-1918-4c2e-81d3-e44276889b6c/image,urn:lsid:biocol.org:col:15406,urn:lsid:biocol.org:col:15406,NA,A,A,Harvard University Herbaria: All Records,PreservedSpecimen,NA,NA,"{huh_taxonomic_group: Vascular, huh_project_id: 7, huh_project_name: US and Canada - Mass Digitization}",639db9a3-1918-4c2e-81d3-e44276889b6c,barcode-01722755,NA,5162,E. J. Palmer,undetermined,NotDetermined,present,Sheet,in collection,,[see Simple Media extension],NA,4/10/14,NA,NA,1914,4,10,,Sandy hills,5162,North America;United States of America;Texas;Polk County;,North America,NA,NA,United States of America,US,Texas,Polk County,,Livingston,Livingston,,NA,NA,,NA,NA,,NA,,,,,NA,,Prunus mexicana S. Watson,Rosaceae,Prunus,mexicana,,S. Watson194,98974141-7ebe-46bd-8b4d-574dd409d0a8,http://purl.org/dc/dcmitype/PhysicalObject,48:31.0,en,https://huh.harvard.edu/pages/use,President and Fellows of Harvard College,https://huh.harvard.edu/access-digital-reproductions-works-public-domain,http://data.huh.harvard.edu/98974141-7ebe-46bd-8b4d-574dd409d0a8/image,urn:lsid:biocol.org:col:15406,urn:lsid:biocol.org:col:15406,NA,A,A,Harvard University Herbaria: All Records,PreservedSpecimen,NA,NA,"{huh_taxonomic_group: Vascular, huh_project_id: 7, huh_project_name: US and Canada - Mass Digitization}",98974141-7ebe-46bd-8b4d-574dd409d0a8,barcode-01722491,NA,,[data not captured],undetermined,NotDetermined,present,Sheet,in collection,,[see Simple Media extension],NA,,NA,NA,NA,NA,NA,,,,North America;United States of America;Indiana;Posey County;,North America,NA,NA,United States of America,US,Indiana,Posey County,,[data not captured],[data not captured],,NA,NA,,NA,NA,,NA,,,,,NA,,Prunus mexicana S. Watson,Rosaceae,Prunus,mexicana,,S. Watson195,75dc52db-12a6-4a57-a55d-8a40a2c134b0,http://purl.org/dc/dcmitype/PhysicalObject,23:21.0,en,https://huh.harvard.edu/pages/use,President and Fellows of Harvard College,https://huh.harvard.edu/access-digital-reproductions-works-public-domain,http://data.huh.harvard.edu/75dc52db-12a6-4a57-a55d-8a40a2c134b0/image,urn:lsid:biocol.org:col:15406,urn:lsid:biocol.org:col:15406,NA,A,A,Harvard University Herbaria: All Records,PreservedSpecimen,NA,NA,"{huh_taxonomic_group: Vascular, huh_project_id: 7, huh_project_name: US and Canada - Mass Digitization}",75dc52db-12a6-4a57-a55d-8a40a2c134b0,barcode-01722466,NA,,[data not captured],undetermined,NotDetermined,present,Sheet,in collection,,[see Simple Media extension],NA,,NA,NA,NA,NA,NA,,,,North America;United States of America;Arkansas;Pulaski County;,North America,NA,NA,United States of America,US,Arkansas,Pulaski County,,[data not captured],[data not captured],,NA,NA,,NA,NA,,NA,,,,,NA,,Prunus mexicana S. Watson,Rosaceae,Prunus,mexicana,,S. Watson196,ff01ac5b-4075-4cbe-9353-a9c0a90ded1c,http://purl.org/dc/dcmitype/PhysicalObject,08:03.0,en,https://huh.harvard.edu/pages/use,President and Fellows of Harvard College,https://huh.harvard.edu/access-digital-reproductions-works-public-domain,http://data.huh.harvard.edu/ff01ac5b-4075-4cbe-9353-a9c0a90ded1c/image,urn:lsid:biocol.org:col:15631,urn:lsid:biocol.org:col:15631,NA,GH,GH,Harvard University Herbaria: All Records,PreservedSpecimen,NA,NA,"{huh_taxonomic_group: Vascular, huh_project_id: 7, huh_project_name: US and Canada - Mass Digitization}",ff01ac5b-4075-4cbe-9353-a9c0a90ded1c,barcode-01722512,NA,,[data not captured],undetermined,NotDetermined,present,Sheet,in collection,,[see Simple Media extension],NA,,NA,NA,NA,NA,NA,,,,North America;United States of America;Missouri;Pulaski County;,North America,NA,NA,United States of America,US,Missouri,Pulaski County,,[data not captured],[data not captured],,NA,NA,,NA,NA,,NA,,,,,NA,,Prunus mexicana S. Watson,Rosaceae,Prunus,mexicana,,S. Watson197,5aa5fce2-b5e9-451f-a9f9-2deba082b96f,http://purl.org/dc/dcmitype/PhysicalObject,05:24.0,en,https://huh.harvard.edu/pages/use,President and Fellows of Harvard College,https://huh.harvard.edu/access-digital-reproductions-works-public-domain,http://data.huh.harvard.edu/5aa5fce2-b5e9-451f-a9f9-2deba082b96f/image,urn:lsid:biocol.org:col:15631,urn:lsid:biocol.org:col:15631,NA,GH,GH,Harvard University Herbaria: All Records,PreservedSpecimen,NA,NA,"{huh_taxonomic_group: Vascular, huh_project_id: 7, huh_project_name: US and Canada - Mass Digitization}",5aa5fce2-b5e9-451f-a9f9-2deba082b96f,barcode-01722738,NA,29518,D. S. Correll & H. B. Correll,undetermined,NotDetermined,present,Sheet,in collection,,[see Simple Media extension],NA,4/29/64,NA,NA,1964,4,29,,Moist hardwood slope,29518,North America;United States of America;Texas;Red River County;,North America,NA,NA,United States of America,US,Texas,Red River County,,about 1 mile east of Woodland,about 1 mile east of Woodland,,NA,NA,,NA,NA,,NA,,,,,NA,,Prunus mexicana S. Watson,Rosaceae,Prunus,mexicana,,S. Watson198,4e0b9e5a-409e-44a6-97bf-0c4143668310,http://purl.org/dc/dcmitype/PhysicalObject,48:59.0,en,https://huh.harvard.edu/pages/use,President and Fellows of Harvard College,https://huh.harvard.edu/access-digital-reproductions-works-public-domain,http://data.huh.harvard.edu/4e0b9e5a-409e-44a6-97bf-0c4143668310/image,urn:lsid:biocol.org:col:15406,urn:lsid:biocol.org:col:15406,NA,A,A,Harvard University Herbaria: All Records,PreservedSpecimen,NA,NA,"{huh_taxonomic_group: Vascular, huh_project_id: 7, huh_project_name: US and Canada - Mass Digitization}",4e0b9e5a-409e-44a6-97bf-0c4143668310,barcode-01722753,NA,9251,E. J. Palmer,undetermined,NotDetermined,present,Sheet,in collection,,[see Simple Media extension],NA,3/22/16,NA,NA,1916,3,22,,Low woods,9251,North America;United States of America;Texas;Refugio County;,North America,NA,NA,United States of America,US,Texas,Refugio County,,"San Antonio River, Tivoli","San Antonio River, Tivoli",,NA,NA,,NA,NA,,NA,,,,,NA,,Prunus mexicana S. Watson,Rosaceae,Prunus,mexicana,,S. Watson199,6e1d3284-a130-422a-a21b-4e76c1a5f919,http://purl.org/dc/dcmitype/PhysicalObject,37:11.0,en,https://huh.harvard.edu/pages/use,President and Fellows of Harvard College,https://huh.harvard.edu/access-digital-reproductions-works-public-domain,http://data.huh.harvard.edu/6e1d3284-a130-422a-a21b-4e76c1a5f919/image,urn:lsid:biocol.org:col:15406,urn:lsid:biocol.org:col:15406,NA,A,A,Harvard University Herbaria: All Records,PreservedSpecimen,NA,NA,"{huh_taxonomic_group: Vascular, huh_project_id: null, huh_project_name: null}",6e1d3284-a130-422a-a21b-4e76c1a5f919,barcode-00346608,NA,3666,C. B. Wolf,undetermined,NotDetermined,present,Sheet,in collection,,[see Simple Media extension],NA,5/25/32,NA,NA,1932,5,25,,,3666,North America;United States of America;California;Riverside County;,North America,NA,NA,United States of America,US,California,Riverside County,,No. Base of San Jacinto Mts. Snow Creek Canyon. Just above Fish Hatchery.,No. Base of San Jacinto Mts. Snow Creek Canyon. Just above Fish Hatchery.,c. 2200 ft.,NA,NA,,NA,NA,,NA,,,,,NA,,Prunus ilicifolia (Nuttall ex Hooker & Arnott) D. N. F. Dietrich,Rosaceae,Prunus,ilicifolia,,(Nuttall ex Hooker & Arnott) D. N. F. Dietrich200,09ee788e-c767-4f0f-b205-35d1658a6c03,http://purl.org/dc/dcmitype/PhysicalObject,03:04.0,en,https://huh.harvard.edu/pages/use,President and Fellows of Harvard College,https://huh.harvard.edu/access-digital-reproductions-works-public-domain,http://data.huh.harvard.edu/09ee788e-c767-4f0f-b205-35d1658a6c03/image,urn:lsid:biocol.org:col:15631,urn:lsid:biocol.org:col:15631,NA,GH,GH,Harvard University Herbaria: All Records,PreservedSpecimen,NA,NA,"{huh_taxonomic_group: Vascular, huh_project_id: null, huh_project_name: null}",09ee788e-c767-4f0f-b205-35d1658a6c03,barcode-00346577,NA,532,M. F. Spencer,undetermined,NotDetermined,present,Sheet,in collection,,[see Simple Media extension],NA,4/17/21,NA,NA,1921,4,17,,,532,North America;United States of America;California;Riverside County;,North America,NA,NA,United States of America,US,California,Riverside County,,Hill near Banning,Hill near Banning,1800 ft.,NA,NA,,NA,NA,,NA,,,,,NA,,Prunus ilicifolia (Nuttall ex Hooker & Arnott) D. N. F. Dietrich,Rosaceae,Prunus,ilicifolia,,(Nuttall ex Hooker & Arnott) D. N. F. Dietrich201,6a641914-6e89-49ce-ac04-eb45bafd7244,http://purl.org/dc/dcmitype/PhysicalObject,55:49.0,en,https://huh.harvard.edu/pages/use,President and Fellows of Harvard College,https://huh.harvard.edu/access-digital-reproductions-works-public-domain,http://data.huh.harvard.edu/6a641914-6e89-49ce-ac04-eb45bafd7244/image,urn:lsid:biocol.org:col:15631,urn:lsid:biocol.org:col:15631,NA,GH,GH,Harvard University Herbaria: All Records,PreservedSpecimen,NA,NA,"{huh_taxonomic_group: Vascular, huh_project_id: null, huh_project_name: null}",6a641914-6e89-49ce-ac04-eb45bafd7244,barcode-00346563,NA,8875,Munz & I. M. Johnston,undetermined,NotDetermined,present,Sheet,in collection,,[see Simple Media extension],NA,7/29/24,NA,NA,1924,7,29,,,8875,North America;United States of America;California;Riverside County;,North America,NA,NA,United States of America,US,California,Riverside County,,"above Poppet Flat, San Jacinto Mts.","above Poppet Flat, San Jacinto Mts.",4000 ft.,NA,NA,,NA,NA,,NA,,,,,NA,,Prunus ilicifolia (Nuttall ex Hooker & Arnott) D. N. F. Dietrich,Rosaceae,Prunus,ilicifolia,,(Nuttall ex Hooker & Arnott) D. N. F. Dietrich202,b6a18cf4-3dc0-42f7-b7fc-707d1aa5b0e5,http://purl.org/dc/dcmitype/PhysicalObject,08:00.0,en,https://huh.harvard.edu/pages/use,President and Fellows of Harvard College,https://huh.harvard.edu/access-digital-reproductions-works-public-domain,http://data.huh.harvard.edu/b6a18cf4-3dc0-42f7-b7fc-707d1aa5b0e5/image,urn:lsid:biocol.org:col:15406,urn:lsid:biocol.org:col:15406,NA,A,A,Harvard University Herbaria: All Records,PreservedSpecimen,NA,NA,"{huh_taxonomic_group: Vascular, huh_project_id: 7, huh_project_name: US and Canada - Mass Digitization}",b6a18cf4-3dc0-42f7-b7fc-707d1aa5b0e5,barcode-01722444,NA,,[data not captured],undetermined,NotDetermined,present,Sheet,in collection,,[see Simple Media extension],NA,,NA,NA,NA,NA,NA,,,,North America;United States of America;Arkansas;Saint Francis County;,North America,NA,NA,United States of America,US,Arkansas,Saint Francis County,,[data not captured],[data not captured],,NA,NA,,NA,NA,,NA,,,,,NA,,Prunus mexicana S. Watson,Rosaceae,Prunus,mexicana,,S. Watson203,0e72af04-5dcb-4f08-94f0-aba5786cc2fa,http://purl.org/dc/dcmitype/PhysicalObject,22:57.0,en,https://huh.harvard.edu/pages/use,President and Fellows of Harvard College,https://huh.harvard.edu/access-digital-reproductions-works-public-domain,http://data.huh.harvard.edu/0e72af04-5dcb-4f08-94f0-aba5786cc2fa/image,urn:lsid:biocol.org:col:15406,urn:lsid:biocol.org:col:15406,NA,A,A,Harvard University Herbaria: All Records,PreservedSpecimen,NA,NA,"{huh_taxonomic_group: Vascular, huh_project_id: 7, huh_project_name: US and Canada - Mass Digitization}",0e72af04-5dcb-4f08-94f0-aba5786cc2fa,barcode-01722465,NA,,[data not captured],undetermined,NotDetermined,present,Sheet,in collection,,[see Simple Media extension],NA,,NA,NA,NA,NA,NA,,,,North America;United States of America;Arkansas;Saint Francis County;,North America,NA,NA,United States of America,US,Arkansas,Saint Francis County,,[data not captured],[data not captured],,NA,NA,,NA,NA,,NA,,,,,NA,,Prunus mexicana S. Watson,Rosaceae,Prunus,mexicana,,S. Watson204,9988a560-88ee-4b0f-b2a0-d66de6b8c5e2,http://purl.org/dc/dcmitype/PhysicalObject,55:06.0,en,https://huh.harvard.edu/pages/use,President and Fellows of Harvard College,https://huh.harvard.edu/access-digital-reproductions-works-public-domain,http://data.huh.harvard.edu/9988a560-88ee-4b0f-b2a0-d66de6b8c5e2/image,urn:lsid:biocol.org:col:15406,urn:lsid:biocol.org:col:15406,NA,A,A,Harvard University Herbaria: All Records,PreservedSpecimen,NA,NA,"{huh_taxonomic_group: Vascular, huh_project_id: 7, huh_project_name: US and Canada - Mass Digitization}",9988a560-88ee-4b0f-b2a0-d66de6b8c5e2,barcode-01722754,NA,7877,E. J. Palmer,undetermined,NotDetermined,present,Sheet,in collection,,[see Simple Media extension],NA,6/5/15,NA,NA,1915,6,5,,Upland woods,7877,North America;United States of America;Texas;San Augustine County;,North America,NA,NA,United States of America,US,Texas,San Augustine County,,San Augustine,San Augustine,,NA,NA,,NA,NA,,NA,,,,,NA,,Prunus mexicana S. Watson,Rosaceae,Prunus,mexicana,,S. Watson205,62fed561-6e0e-4794-9d42-ad63fec401aa,http://purl.org/dc/dcmitype/PhysicalObject,55:51.0,en,https://huh.harvard.edu/pages/use,President and Fellows of Harvard College,https://huh.harvard.edu/access-digital-reproductions-works-public-domain,http://data.huh.harvard.edu/62fed561-6e0e-4794-9d42-ad63fec401aa/image,urn:lsid:biocol.org:col:15406,urn:lsid:biocol.org:col:15406,NA,A,A,Harvard University Herbaria: All Records,PreservedSpecimen,NA,NA,"{huh_taxonomic_group: Vascular, huh_project_id: 7, huh_project_name: US and Canada - Mass Digitization}",62fed561-6e0e-4794-9d42-ad63fec401aa,barcode-01722756,NA,7098,E. J. Palmer,undetermined,NotDetermined,present,Sheet,in collection,,[see Simple Media extension],NA,3/29/15,NA,NA,1915,3,29,,Upland woods,7098,North America;United States of America;Texas;San Augustine County;,North America,NA,NA,United States of America,US,Texas,San Augustine County,,San Augustine,San Augustine,,NA,NA,,NA,NA,,NA,,,,,NA,,Prunus mexicana S. Watson,Rosaceae,Prunus,mexicana,,S. Watson206,bfc60d75-ed7f-4fc2-ace1-1abe2287a99b,http://purl.org/dc/dcmitype/PhysicalObject,07:02.0,en,https://huh.harvard.edu/pages/use,President and Fellows of Harvard College,https://huh.harvard.edu/access-digital-reproductions-works-public-domain,http://data.huh.harvard.edu/bfc60d75-ed7f-4fc2-ace1-1abe2287a99b/image,urn:lsid:biocol.org:col:15406,urn:lsid:biocol.org:col:15406,NA,A,A,Harvard University Herbaria: All Records,PreservedSpecimen,NA,NA,"{huh_taxonomic_group: Vascular, huh_project_id: null, huh_project_name: null}",bfc60d75-ed7f-4fc2-ace1-1abe2287a99b,barcode-00346617,NA,6722,A. Eastwood,undetermined,NotDetermined,present,Sheet,in collection,,[see Simple Media extension],NA,10/21/17,NA,NA,1917,10,21,,,6722,North America;United States of America;California;San Benito County;,North America,NA,NA,United States of America,US,California,San Benito County,,The Pinnacles,The Pinnacles,,NA,NA,,NA,NA,,NA,,,,,NA,,Prunus ilicifolia (Nuttall ex Hooker & Arnott) D. N. F. Dietrich,Rosaceae,Prunus,ilicifolia,,(Nuttall ex Hooker & Arnott) D. N. F. Dietrich207,a5616c51-44bc-4a1a-a24c-1888f070c3b7,http://purl.org/dc/dcmitype/PhysicalObject,50:02.0,en,https://huh.harvard.edu/pages/use,President and Fellows of Harvard College,https://huh.harvard.edu/access-digital-reproductions-works-public-domain,http://data.huh.harvard.edu/a5616c51-44bc-4a1a-a24c-1888f070c3b7/image,urn:lsid:biocol.org:col:15631,urn:lsid:biocol.org:col:15631,NA,GH,GH,Harvard University Herbaria: All Records,PreservedSpecimen,NA,NA,"{huh_taxonomic_group: Vascular, huh_project_id: null, huh_project_name: null}",a5616c51-44bc-4a1a-a24c-1888f070c3b7,barcode-00346572,NA,4005,B. Bartholomew & B. Anderson,undetermined,NotDetermined,present,Sheet,in collection,,[see Simple Media extension],NA,5/4/86,NA,NA,1986,5,4,,,4005,North America;United States of America;California;San Benito County;,North America,NA,NA,United States of America,US,California,San Benito County,,36.7 km SE of State Highway 25 on county road J1 between Hollister and Llanada,36.7 km SE of State Highway 25 on county road J1 between Hollister and Llanada,1500 m.,NA,NA,,NA,NA,,NA,,,,,NA,,Prunus ilicifolia (Nuttall ex Hooker & Arnott) D. N. F. Dietrich,Rosaceae,Prunus,ilicifolia,,(Nuttall ex Hooker & Arnott) D. N. F. Dietrich208,afa3a8b5-dfde-4da7-98d6-f3fb05dd5f81,http://purl.org/dc/dcmitype/PhysicalObject,10:22.0,en,https://huh.harvard.edu/pages/use,President and Fellows of Harvard College,https://huh.harvard.edu/access-digital-reproductions-works-public-domain,http://data.huh.harvard.edu/afa3a8b5-dfde-4da7-98d6-f3fb05dd5f81/image,urn:lsid:biocol.org:col:15406,urn:lsid:biocol.org:col:15406,NA,A,A,Harvard University Herbaria: All Records,PreservedSpecimen,NA,NA,"{huh_taxonomic_group: Vascular, huh_project_id: null, huh_project_name: null}",afa3a8b5-dfde-4da7-98d6-f3fb05dd5f81,barcode-00346598,NA,1531,H. E. McMinn,undetermined,NotDetermined,present,Sheet,in collection,,[see Simple Media extension],NA,8/1/25,NA,NA,1925,8,1,,,1531,North America;United States of America;California;San Bernardino County;,North America,NA,NA,United States of America,US,California,San Bernardino County,,Cajon Pass,Cajon Pass,,NA,NA,,NA,NA,,NA,,,,,NA,,Prunus ilicifolia (Nuttall ex Hooker & Arnott) D. N. F. Dietrich,Rosaceae,Prunus,ilicifolia,,(Nuttall ex Hooker & Arnott) D. N. F. Dietrich209,21198ff2-b840-4d1a-abc6-71f8b2dca74f,http://purl.org/dc/dcmitype/PhysicalObject,35:00.0,en,https://huh.harvard.edu/pages/use,President and Fellows of Harvard College,https://huh.harvard.edu/access-digital-reproductions-works-public-domain,http://data.huh.harvard.edu/21198ff2-b840-4d1a-abc6-71f8b2dca74f/image,urn:lsid:biocol.org:col:15631,urn:lsid:biocol.org:col:15631,NA,GH,GH,Harvard University Herbaria: All Records,PreservedSpecimen,NA,NA,"{huh_taxonomic_group: Vascular, huh_project_id: null, huh_project_name: null}",21198ff2-b840-4d1a-abc6-71f8b2dca74f,barcode-00346558,NA,,M. E. Jones,undetermined,NotDetermined,present,Sheet,in collection,,[see Simple Media extension],NA,5/20/29,NA,NA,1929,5,20,,,,North America;United States of America;California;San Bernardino County;,North America,NA,NA,United States of America,US,California,San Bernardino County,,Hesperia,Hesperia,,NA,NA,,NA,NA,,NA,,,,,NA,,Prunus ilicifolia (Nuttall ex Hooker & Arnott) D. N. F. Dietrich,Rosaceae,Prunus,ilicifolia,,(Nuttall ex Hooker & Arnott) D. N. F. Dietrich210,55e44f7b-935e-440d-aa11-5d0ee116734f,http://purl.org/dc/dcmitype/PhysicalObject,17:36.0,en,https://huh.harvard.edu/pages/use,President and Fellows of Harvard College,https://huh.harvard.edu/access-digital-reproductions-works-public-domain,http://data.huh.harvard.edu/55e44f7b-935e-440d-aa11-5d0ee116734f/image,urn:lsid:biocol.org:col:15406,urn:lsid:biocol.org:col:15406,NA,A,A,Harvard University Herbaria: All Records,PreservedSpecimen,NA,NA,"{huh_taxonomic_group: Vascular, huh_project_id: null, huh_project_name: null}",55e44f7b-935e-440d-aa11-5d0ee116734f,barcode-00346551,NA,6112,W. L. Jepson,undetermined,NotDetermined,present,Sheet,in collection,,[see Simple Media extension],NA,5/28/14,NA,NA,1914,5,28,,,6112,North America;United States of America;California;San Bernardino County;,North America,NA,NA,United States of America,US,California,San Bernardino County,,Cajon Pass,Cajon Pass,c. 3600 ft.,NA,NA,,NA,NA,,NA,,,,,NA,,Prunus ilicifolia (Nuttall ex Hooker & Arnott) D. N. F. Dietrich,Rosaceae,Prunus,ilicifolia,,(Nuttall ex Hooker & Arnott) D. N. F. Dietrich211,74216764-6236-43b0-89cb-1fd4f3d4f1e0,http://purl.org/dc/dcmitype/PhysicalObject,45:27.0,en,https://huh.harvard.edu/pages/use,President and Fellows of Harvard College,https://huh.harvard.edu/access-digital-reproductions-works-public-domain,http://data.huh.harvard.edu/74216764-6236-43b0-89cb-1fd4f3d4f1e0/image,urn:lsid:biocol.org:col:15406,urn:lsid:biocol.org:col:15406,NA,A,A,Harvard University Herbaria: All Records,PreservedSpecimen,NA,NA,"{huh_taxonomic_group: Vascular, huh_project_id: null, huh_project_name: null}",74216764-6236-43b0-89cb-1fd4f3d4f1e0,barcode-00346543,NA,2295,A. M. Alexander & L. Kellogg,undetermined,NotDetermined,present,Sheet,in collection,,[see Simple Media extension],NA,6/5/41,NA,NA,1941,6,5,,,2295,North America;United States of America;California;San Bernardino County;,North America,NA,NA,United States of America,US,California,San Bernardino County,,Cajon Pass,Cajon Pass,4200 feet,NA,NA,,NA,NA,,NA,,,,,NA,,Prunus ilicifolia (Nuttall ex Hooker & Arnott) D. N. F. Dietrich,Rosaceae,Prunus,ilicifolia,,(Nuttall ex Hooker & Arnott) D. N. F. Dietrich212,3becda5e-6b84-4070-ab58-006e4c73b113,http://purl.org/dc/dcmitype/PhysicalObject,12:00.0,en,https://huh.harvard.edu/pages/use,President and Fellows of Harvard College,https://huh.harvard.edu/access-digital-reproductions-works-public-domain,http://data.huh.harvard.edu/3becda5e-6b84-4070-ab58-006e4c73b113/image,urn:lsid:biocol.org:col:15406,urn:lsid:biocol.org:col:15406,NA,A,A,Harvard University Herbaria: All Records,PreservedSpecimen,NA,NA,"{huh_taxonomic_group: Vascular, huh_project_id: null, huh_project_name: null}",3becda5e-6b84-4070-ab58-006e4c73b113,barcode-00346659,NA,815a,F. G. Woodcock,undetermined,NotDetermined,present,Sheet,in collection,,[see Simple Media extension],NA,1920-04,NA,NA,1920,4,NA,,,815a,North America;United States of America;California;San Diego County;,North America,NA,NA,United States of America,US,California,San Diego County,,Canyon side nr. Bot. Bldg. West.,Canyon side nr. Bot. Bldg. West.,,NA,NA,,NA,NA,,NA,,,,,NA,,Prunus ilicifolia subsp. lyonii (Eastwood) P. H. Raven,Rosaceae,Prunus,ilicifolia,lyonii,(Eastwood) P. H. Raven213,39b2fec1-81af-4e2e-bf90-4e7dda92849f,http://purl.org/dc/dcmitype/PhysicalObject,45:16.0,en,https://huh.harvard.edu/pages/use,President and Fellows of Harvard College,https://huh.harvard.edu/access-digital-reproductions-works-public-domain,http://data.huh.harvard.edu/39b2fec1-81af-4e2e-bf90-4e7dda92849f/image,urn:lsid:biocol.org:col:15406,urn:lsid:biocol.org:col:15406,NA,A,A,Harvard University Herbaria: All Records,PreservedSpecimen,NA,NA,"{huh_taxonomic_group: Vascular, huh_project_id: null, huh_project_name: null}",39b2fec1-81af-4e2e-bf90-4e7dda92849f,barcode-00346657,NA,,E. L. Greene,undetermined,NotDetermined,present,Sheet,in collection,,[see Simple Media extension],NA,1886,NA,NA,1886,NA,NA,July and August 1886,,,North America;United States of America;California;San Diego County;,North America,NA,NA,United States of America,US,California,San Diego County,,"Canyon side above Upper Rose Garden, North End","Canyon side above Upper Rose Garden, North End",,NA,NA,,NA,NA,,NA,,,,,NA,,Prunus ilicifolia subsp. lyonii (Eastwood) P. H. Raven,Rosaceae,Prunus,ilicifolia,lyonii,(Eastwood) P. H. Raven214,16de8d14-e271-493a-a1a1-4421e85d9714,http://purl.org/dc/dcmitype/PhysicalObject,13:20.0,en,https://huh.harvard.edu/pages/use,President and Fellows of Harvard College,https://huh.harvard.edu/access-digital-reproductions-works-public-domain,http://data.huh.harvard.edu/16de8d14-e271-493a-a1a1-4421e85d9714/image,urn:lsid:biocol.org:col:15406,urn:lsid:biocol.org:col:15406,NA,A,A,Harvard University Herbaria: All Records,PreservedSpecimen,NA,NA,"{huh_taxonomic_group: Vascular, huh_project_id: null, huh_project_name: null}",16de8d14-e271-493a-a1a1-4421e85d9714,barcode-00346656,NA,815a,F. G. Woodcock,undetermined,NotDetermined,present,Sheet,in collection,,[see Simple Media extension],NA,1919-03,NA,NA,1919,3,NA,,,815a,North America;United States of America;California;San Diego County;,North America,NA,NA,United States of America,US,California,San Diego County,,"Canyon side above Upper Rose Garden, North End","Canyon side above Upper Rose Garden, North End",,NA,NA,,NA,NA,,NA,,,,,NA,,Prunus ilicifolia subsp. lyonii (Eastwood) P. H. Raven,Rosaceae,Prunus,ilicifolia,lyonii,(Eastwood) P. H. Raven215,53db0b39-ed90-4fd3-841b-5ee9874211fe,http://purl.org/dc/dcmitype/PhysicalObject,16:01.0,en,https://huh.harvard.edu/pages/use,President and Fellows of Harvard College,https://huh.harvard.edu/access-digital-reproductions-works-public-domain,http://data.huh.harvard.edu/53db0b39-ed90-4fd3-841b-5ee9874211fe/image,urn:lsid:biocol.org:col:15406,urn:lsid:biocol.org:col:15406,NA,A,A,Harvard University Herbaria: All Records,PreservedSpecimen,NA,NA,"{huh_taxonomic_group: Vascular, huh_project_id: null, huh_project_name: null}",53db0b39-ed90-4fd3-841b-5ee9874211fe,barcode-00346640,NA,815a,F. G. Woodcock,undetermined,NotDetermined,present,Sheet,in collection,,[see Simple Media extension],NA,,NA,NA,NA,NA,NA,,,815a,North America;United States of America;California;San Diego County;,North America,NA,NA,United States of America,US,California,San Diego County,,"Canyon side above Upper Rose Garden, North End","Canyon side above Upper Rose Garden, North End",,NA,NA,,NA,NA,,NA,,,,,NA,,Prunus ilicifolia subsp. lyonii (Eastwood) P. H. Raven,Rosaceae,Prunus,ilicifolia,lyonii,(Eastwood) P. H. Raven216,cfedd698-15bc-466e-8b02-c0df19d9268c,http://purl.org/dc/dcmitype/PhysicalObject,47:40.0,en,https://huh.harvard.edu/pages/use,President and Fellows of Harvard College,https://huh.harvard.edu/access-digital-reproductions-works-public-domain,http://data.huh.harvard.edu/cfedd698-15bc-466e-8b02-c0df19d9268c/image,urn:lsid:biocol.org:col:15406,urn:lsid:biocol.org:col:15406,NA,A,A,Harvard University Herbaria: All Records,PreservedSpecimen,NA,NA,"{huh_taxonomic_group: Vascular, huh_project_id: null, huh_project_name: null}",cfedd698-15bc-466e-8b02-c0df19d9268c,barcode-00346612,NA,822a,F. G. Woodcock,undetermined,NotDetermined,present,Sheet,in collection,,[see Simple Media extension],NA,1918-04,NA,NA,1918,4,NA,,,822a,North America;United States of America;California;San Diego County;,North America,NA,NA,United States of America,US,California,San Diego County,,,,,NA,NA,,NA,NA,,NA,,,,,NA,,Prunus ilicifolia (Nuttall ex Hooker & Arnott) D. N. F. Dietrich,Rosaceae,Prunus,ilicifolia,,(Nuttall ex Hooker & Arnott) D. N. F. Dietrich217,bf10074a-f7ab-4aff-a8e9-6dfa1a0f6897,http://purl.org/dc/dcmitype/PhysicalObject,46:41.0,en,https://huh.harvard.edu/pages/use,President and Fellows of Harvard College,https://huh.harvard.edu/access-digital-reproductions-works-public-domain,http://data.huh.harvard.edu/bf10074a-f7ab-4aff-a8e9-6dfa1a0f6897/image,urn:lsid:biocol.org:col:15406,urn:lsid:biocol.org:col:15406,NA,A,A,Harvard University Herbaria: All Records,PreservedSpecimen,NA,NA,"{huh_taxonomic_group: Vascular, huh_project_id: null, huh_project_name: null}",bf10074a-f7ab-4aff-a8e9-6dfa1a0f6897,barcode-00346611,NA,822b,F. G. Woodcock,undetermined,NotDetermined,present,Sheet,in collection,,[see Simple Media extension],NA,1918-04,NA,NA,1918,4,NA,,,822b,North America;United States of America;California;San Diego County;,North America,NA,NA,United States of America,US,California,San Diego County,,,,,NA,NA,,NA,NA,,NA,,,,,NA,,Prunus ilicifolia (Nuttall ex Hooker & Arnott) D. N. F. Dietrich,Rosaceae,Prunus,ilicifolia,,(Nuttall ex Hooker & Arnott) D. N. F. Dietrich218,73e3aa47-5cbc-4822-b365-41be8231387b,http://purl.org/dc/dcmitype/PhysicalObject,45:07.0,en,https://huh.harvard.edu/pages/use,President and Fellows of Harvard College,https://huh.harvard.edu/access-digital-reproductions-works-public-domain,http://data.huh.harvard.edu/73e3aa47-5cbc-4822-b365-41be8231387b/image,urn:lsid:biocol.org:col:15406,urn:lsid:biocol.org:col:15406,NA,A,A,Harvard University Herbaria: All Records,PreservedSpecimen,NA,NA,"{huh_taxonomic_group: Vascular, huh_project_id: null, huh_project_name: null}",73e3aa47-5cbc-4822-b365-41be8231387b,barcode-00346610,NA,822c,F. G. Woodcock,undetermined,NotDetermined,present,Sheet,in collection,,[see Simple Media extension],NA,1918-09,NA,NA,1918,9,NA,,,822c,North America;United States of America;California;San Diego County;,North America,NA,NA,United States of America,US,California,San Diego County,,,,,NA,NA,,NA,NA,,NA,,,,,NA,,Prunus ilicifolia (Nuttall ex Hooker & Arnott) D. N. F. Dietrich,Rosaceae,Prunus,ilicifolia,,(Nuttall ex Hooker & Arnott) D. N. F. Dietrich219,b57ef15f-3787-4849-b5b5-b649f2235282,http://purl.org/dc/dcmitype/PhysicalObject,15:28.0,en,https://huh.harvard.edu/pages/use,President and Fellows of Harvard College,https://huh.harvard.edu/access-digital-reproductions-works-public-domain,http://data.huh.harvard.edu/b57ef15f-3787-4849-b5b5-b649f2235282/image,urn:lsid:biocol.org:col:15631,urn:lsid:biocol.org:col:15631,NA,GH,GH,Harvard University Herbaria: All Records,PreservedSpecimen,NA,NA,"{huh_taxonomic_group: Vascular, huh_project_id: null, huh_project_name: null}",b57ef15f-3787-4849-b5b5-b649f2235282,barcode-00346605,NA,,,,,present,Sheet,in collection,,[see Simple Media extension],NA,1895-04-30,NA,NA,1895,4,30,,,,North America;United States of America;California;San Diego County;,North America,NA,NA,United States of America,US,California,San Diego County,San Diego,,,,NA,NA,,NA,NA,,NA,,,,,NA,,Prunus ilicifolia (Nuttall ex Hooker & Arnott) D. N. F. Dietrich,Rosaceae,Prunus,ilicifolia,,(Nuttall ex Hooker & Arnott) D. N. F. Dietrich220,9da7eadb-c3b6-4ee4-a665-68beeb24d85e,http://purl.org/dc/dcmitype/PhysicalObject,48:00.0,en,https://huh.harvard.edu/pages/use,President and Fellows of Harvard College,https://huh.harvard.edu/access-digital-reproductions-works-public-domain,http://data.huh.harvard.edu/9da7eadb-c3b6-4ee4-a665-68beeb24d85e/image,urn:lsid:biocol.org:col:15631,urn:lsid:biocol.org:col:15631,NA,GH,GH,Harvard University Herbaria: All Records,PreservedSpecimen,NA,NA,"{huh_taxonomic_group: Vascular, huh_project_id: null, huh_project_name: null}",9da7eadb-c3b6-4ee4-a665-68beeb24d85e,barcode-00346593,NA,78,E. D. Palmer,undetermined,NotDetermined,present,Sheet,in collection,,[see Simple Media extension],NA,1875,NA,NA,1875,NA,NA,,,78,North America;United States of America;California;San Diego County;,North America,NA,NA,United States of America,US,California,San Diego County,,Samuel Valley,Samuel Valley,,NA,NA,,NA,NA,,NA,,,,,NA,,Prunus ilicifolia (Nuttall ex Hooker & Arnott) D. N. F. Dietrich,Rosaceae,Prunus,ilicifolia,,(Nuttall ex Hooker & Arnott) D. N. F. Dietrich221,1491ada5-f9da-48c8-8dd0-93fd508b907b,http://purl.org/dc/dcmitype/PhysicalObject,45:09.0,en,https://huh.harvard.edu/pages/use,President and Fellows of Harvard College,https://huh.harvard.edu/access-digital-reproductions-works-public-domain,http://data.huh.harvard.edu/1491ada5-f9da-48c8-8dd0-93fd508b907b/image,urn:lsid:biocol.org:col:15631,urn:lsid:biocol.org:col:15631,NA,GH,GH,Harvard University Herbaria: All Records,PreservedSpecimen,NA,NA,"{huh_taxonomic_group: Vascular, huh_project_id: null, huh_project_name: null}",1491ada5-f9da-48c8-8dd0-93fd508b907b,barcode-00346592,NA,,D. Cleveland,undetermined,NotDetermined,present,Sheet,in collection,,[see Simple Media extension],NA,1875,NA,NA,1875,NA,NA,,,,North America;United States of America;California;San Diego County;,North America,NA,NA,United States of America,US,California,San Diego County,San Diego,,,,NA,NA,,NA,NA,,NA,,,,,NA,,Prunus ilicifolia (Nuttall ex Hooker & Arnott) D. N. F. Dietrich,Rosaceae,Prunus,ilicifolia,,(Nuttall ex Hooker & Arnott) D. N. F. Dietrich222,d54e7149-72e7-4611-9871-fc99ed5178c4,http://purl.org/dc/dcmitype/PhysicalObject,25:45.0,en,https://huh.harvard.edu/pages/use,President and Fellows of Harvard College,https://huh.harvard.edu/access-digital-reproductions-works-public-domain,http://data.huh.harvard.edu/d54e7149-72e7-4611-9871-fc99ed5178c4/image,urn:lsid:biocol.org:col:15631,urn:lsid:biocol.org:col:15631,NA,GH,GH,Harvard University Herbaria: All Records,PreservedSpecimen,NA,NA,"{huh_taxonomic_group: Vascular, huh_project_id: null, huh_project_name: null}",d54e7149-72e7-4611-9871-fc99ed5178c4,barcode-00346582,NA,527,G. Thurber,undetermined,NotDetermined,present,Sheet,in collection,,[see Simple Media extension],NA,1852-05,NA,NA,1852,5,NA,,,527,North America;United States of America;California;San Diego County;,North America,NA,NA,United States of America,US,California,San Diego County,San Diego,,,,NA,NA,,NA,NA,,NA,,,,,NA,,Prunus ilicifolia (Nuttall ex Hooker & Arnott) D. N. F. Dietrich,Rosaceae,Prunus,ilicifolia,,(Nuttall ex Hooker & Arnott) D. N. F. Dietrich223,c56c9a49-68c9-4ed5-b066-713f577d4765,http://purl.org/dc/dcmitype/PhysicalObject,20:44.0,en,https://huh.harvard.edu/pages/use,President and Fellows of Harvard College,https://huh.harvard.edu/access-digital-reproductions-works-public-domain,http://data.huh.harvard.edu/c56c9a49-68c9-4ed5-b066-713f577d4765/image,urn:lsid:biocol.org:col:15631,urn:lsid:biocol.org:col:15631,NA,GH,GH,Harvard University Herbaria: All Records,PreservedSpecimen,NA,NA,"{huh_taxonomic_group: Vascular, huh_project_id: null, huh_project_name: null}",c56c9a49-68c9-4ed5-b066-713f577d4765,barcode-00346569,NA,3741,L. Abrams,undetermined,NotDetermined,present,"Sheet,Sheet",in collection,,[see Simple Media extension],NA,6/3/03,NA,NA,1903,6,3,,,3741,North America;United States of America;California;San Diego County;,North America,NA,NA,United States of America,US,California,San Diego County,,Potrero,Potrero,,NA,NA,,NA,NA,,NA,,,,,NA,,Prunus ilicifolia (Nuttall ex Hooker & Arnott) D. N. F. Dietrich,Rosaceae,Prunus,ilicifolia,,(Nuttall ex Hooker & Arnott) D. N. F. Dietrich224,b3ec29a7-6ff4-49db-a3b6-3b2e6946f902,http://purl.org/dc/dcmitype/PhysicalObject,20:44.0,en,https://huh.harvard.edu/pages/use,President and Fellows of Harvard College,https://huh.harvard.edu/access-digital-reproductions-works-public-domain,http://data.huh.harvard.edu/b3ec29a7-6ff4-49db-a3b6-3b2e6946f902/image,urn:lsid:biocol.org:col:15406,urn:lsid:biocol.org:col:15406,NA,A,A,Harvard University Herbaria: All Records,PreservedSpecimen,NA,NA,"{huh_taxonomic_group: Vascular, huh_project_id: null, huh_project_name: null}",b3ec29a7-6ff4-49db-a3b6-3b2e6946f902,barcode-00346568,NA,3741,L. Abrams,undetermined,NotDetermined,present,"Sheet,Sheet",in collection,,[see Simple Media extension],NA,6/3/03,NA,NA,1903,6,3,,,3741,North America;United States of America;California;San Diego County;,North America,NA,NA,United States of America,US,California,San Diego County,,Potrero,Potrero,,NA,NA,,NA,NA,,NA,,,,,NA,,Prunus ilicifolia (Nuttall ex Hooker & Arnott) D. N. F. Dietrich,Rosaceae,Prunus,ilicifolia,,(Nuttall ex Hooker & Arnott) D. N. F. Dietrich225,e9a5fda7-c57d-4151-8502-9c997bed196e,http://purl.org/dc/dcmitype/PhysicalObject,03:29.0,en,https://huh.harvard.edu/pages/use,President and Fellows of Harvard College,https://huh.harvard.edu/access-digital-reproductions-works-public-domain,http://data.huh.harvard.edu/e9a5fda7-c57d-4151-8502-9c997bed196e/image,urn:lsid:biocol.org:col:15406,urn:lsid:biocol.org:col:15406,NA,A,A,Harvard University Herbaria: All Records,PreservedSpecimen,NA,NA,"{huh_taxonomic_group: Vascular, huh_project_id: null, huh_project_name: null}",e9a5fda7-c57d-4151-8502-9c997bed196e,barcode-00346566,NA,1618,F. G. Woodcock,undetermined,NotDetermined,present,Sheet,in collection,,[see Simple Media extension],NA,7/1/22,NA,NA,1922,7,1,,,1618,North America;United States of America;California;San Diego County;,North America,NA,NA,United States of America,US,California,San Diego County,,,,,NA,NA,,NA,NA,,NA,,,,,NA,,Prunus ilicifolia (Nuttall ex Hooker & Arnott) D. N. F. Dietrich,Rosaceae,Prunus,ilicifolia,,(Nuttall ex Hooker & Arnott) D. N. F. Dietrich226,87dc2fbb-0aa2-4d77-b5b0-55c8322d9f3f,http://purl.org/dc/dcmitype/PhysicalObject,58:03.0,en,https://huh.harvard.edu/pages/use,President and Fellows of Harvard College,https://huh.harvard.edu/access-digital-reproductions-works-public-domain,http://data.huh.harvard.edu/87dc2fbb-0aa2-4d77-b5b0-55c8322d9f3f/image,urn:lsid:biocol.org:col:15406,urn:lsid:biocol.org:col:15406,NA,A,A,Harvard University Herbaria: All Records,PreservedSpecimen,NA,NA,"{huh_taxonomic_group: Vascular, huh_project_id: null, huh_project_name: null}",87dc2fbb-0aa2-4d77-b5b0-55c8322d9f3f,barcode-00346565,NA,52,R. H. Peebles,undetermined,NotDetermined,present,Sheet,in collection,,[see Simple Media extension],NA,6/23/29,NA,NA,1929,6,23,,,52,North America;United States of America;California;San Diego County;,North America,NA,NA,United States of America,US,California,San Diego County,,Descanso,Descanso,,NA,NA,,NA,NA,,NA,,,,,NA,,Prunus ilicifolia (Nuttall ex Hooker & Arnott) D. N. F. Dietrich,Rosaceae,Prunus,ilicifolia,,(Nuttall ex Hooker & Arnott) D. N. F. Dietrich227,79c56cff-323c-429e-a939-0a0e6b70270e,http://purl.org/dc/dcmitype/PhysicalObject,24:15.0,en,https://huh.harvard.edu/pages/use,President and Fellows of Harvard College,https://huh.harvard.edu/access-digital-reproductions-works-public-domain,http://data.huh.harvard.edu/79c56cff-323c-429e-a939-0a0e6b70270e/image,urn:lsid:biocol.org:col:15406,urn:lsid:biocol.org:col:15406,NA,A,A,Harvard University Herbaria: All Records,PreservedSpecimen,NA,NA,"{huh_taxonomic_group: Vascular, huh_project_id: null, huh_project_name: null}",79c56cff-323c-429e-a939-0a0e6b70270e,barcode-00346555,NA,185,G. L. Fisher,undetermined,NotDetermined,present,Sheet,in collection,,[see Simple Media extension],NA,7/4/22,NA,NA,1922,7,4,,,185,North America;United States of America;California;San Diego County;,North America,NA,NA,United States of America,US,California,San Diego County,San Diego,,,50 ft.,NA,NA,,NA,NA,,NA,,,,,NA,,Prunus ilicifolia (Nuttall ex Hooker & Arnott) D. N. F. Dietrich,Rosaceae,Prunus,ilicifolia,,(Nuttall ex Hooker & Arnott) D. N. F. Dietrich228,b6ee4d94-824b-4bc5-bba0-0ee8f7046d1f,http://purl.org/dc/dcmitype/PhysicalObject,20:29.0,en,https://huh.harvard.edu/pages/use,President and Fellows of Harvard College,https://huh.harvard.edu/access-digital-reproductions-works-public-domain,http://data.huh.harvard.edu/b6ee4d94-824b-4bc5-bba0-0ee8f7046d1f/image,urn:lsid:biocol.org:col:15406,urn:lsid:biocol.org:col:15406,NA,A,A,Harvard University Herbaria: All Records,PreservedSpecimen,NA,NA,"{huh_taxonomic_group: Vascular, huh_project_id: null, huh_project_name: null}",b6ee4d94-824b-4bc5-bba0-0ee8f7046d1f,barcode-00346553,NA,,G. Engelmann & C. S. Sargent,undetermined,NotDetermined,present,Sheet,in collection,,[see Simple Media extension],NA,1880,NA,NA,1880,NA,NA,,,,North America;United States of America;California;San Diego County;,North America,NA,NA,United States of America,US,California,San Diego County,San Diego,,,,NA,NA,,NA,NA,,NA,,,,,NA,,Prunus ilicifolia (Nuttall ex Hooker & Arnott) D. N. F. Dietrich,Rosaceae,Prunus,ilicifolia,,(Nuttall ex Hooker & Arnott) D. N. F. Dietrich229,f7fcdaa1-14d4-4fd4-b841-5921abf8b4e1,http://purl.org/dc/dcmitype/PhysicalObject,00:44.0,en,https://huh.harvard.edu/pages/use,President and Fellows of Harvard College,https://huh.harvard.edu/access-digital-reproductions-works-public-domain,http://data.huh.harvard.edu/f7fcdaa1-14d4-4fd4-b841-5921abf8b4e1/image,urn:lsid:biocol.org:col:15406,urn:lsid:biocol.org:col:15406,NA,A,A,Harvard University Herbaria: All Records,PreservedSpecimen,NA,NA,"{huh_taxonomic_group: Vascular, huh_project_id: null, huh_project_name: null}",f7fcdaa1-14d4-4fd4-b841-5921abf8b4e1,barcode-00346550,NA,822 d,,,,present,Sheet,in collection,,[see Simple Media extension],NA,,NA,NA,NA,NA,NA,,,822 d,North America;United States of America;California;San Diego County;,North America,NA,NA,United States of America,US,California,San Diego County,,,,,NA,NA,,NA,NA,,NA,,,,,NA,,Prunus ilicifolia (Nuttall ex Hooker & Arnott) D. N. F. Dietrich,Rosaceae,Prunus,ilicifolia,,(Nuttall ex Hooker & Arnott) D. N. F. Dietrich230,c1f2efbb-a5d3-463f-95a3-8ab3e818a19a,http://purl.org/dc/dcmitype/PhysicalObject,58:40.0,en,https://huh.harvard.edu/pages/use,President and Fellows of Harvard College,https://huh.harvard.edu/access-digital-reproductions-works-public-domain,http://data.huh.harvard.edu/c1f2efbb-a5d3-463f-95a3-8ab3e818a19a/image,urn:lsid:biocol.org:col:15406,urn:lsid:biocol.org:col:15406,NA,A,A,Harvard University Herbaria: All Records,PreservedSpecimen,NA,NA,"{huh_taxonomic_group: Vascular, huh_project_id: null, huh_project_name: null}",c1f2efbb-a5d3-463f-95a3-8ab3e818a19a,barcode-00346548,NA,,A. Eastwood,undetermined,NotDetermined,present,Sheet,in collection,,[see Simple Media extension],NA,6/28/19,NA,NA,1919,6,28,,,,North America;United States of America;California;San Diego County;,North America,NA,NA,United States of America,US,California,San Diego County,,Laguna Mts.,Laguna Mts.,,NA,NA,,NA,NA,,NA,,,,,NA,,Prunus ilicifolia (Nuttall ex Hooker & Arnott) D. N. F. Dietrich,Rosaceae,Prunus,ilicifolia,,(Nuttall ex Hooker & Arnott) D. N. F. Dietrich231,06b8c30b-7053-4e21-a65f-1a2f70b7dc8b,http://purl.org/dc/dcmitype/PhysicalObject,29:33.0,en,https://huh.harvard.edu/pages/use,President and Fellows of Harvard College,https://huh.harvard.edu/access-digital-reproductions-works-public-domain,http://data.huh.harvard.edu/06b8c30b-7053-4e21-a65f-1a2f70b7dc8b/image,urn:lsid:biocol.org:col:15406,urn:lsid:biocol.org:col:15406,NA,A,A,Harvard University Herbaria: All Records,PreservedSpecimen,NA,NA,"{huh_taxonomic_group: Vascular, huh_project_id: null, huh_project_name: null}",06b8c30b-7053-4e21-a65f-1a2f70b7dc8b,barcode-00346539,NA,337,W. T. Swingle & R. H. Peebles,undetermined,NotDetermined,present,Sheet,in collection,,[see Simple Media extension],NA,8/4/31,NA,NA,1931,8,4,,,337,North America;United States of America;California;San Diego County;,North America,NA,NA,United States of America,US,California,San Diego County,,"Deser [Desert] View, Laguna Mt.","Deser [Desert] View, Laguna Mt.",,NA,NA,,NA,NA,,NA,,,,,NA,,Prunus ilicifolia (Nuttall ex Hooker & Arnott) D. N. F. Dietrich,Rosaceae,Prunus,ilicifolia,,(Nuttall ex Hooker & Arnott) D. N. F. Dietrich232,1bf523ef-7a56-488c-b91b-66800e173d61,http://purl.org/dc/dcmitype/PhysicalObject,01:00.0,en,https://huh.harvard.edu/pages/use,President and Fellows of Harvard College,https://huh.harvard.edu/access-digital-reproductions-works-public-domain,http://data.huh.harvard.edu/1bf523ef-7a56-488c-b91b-66800e173d61/image,urn:lsid:biocol.org:col:15406,urn:lsid:biocol.org:col:15406,NA,A,A,Harvard University Herbaria: All Records,PreservedSpecimen,NA,NA,"{huh_taxonomic_group: Vascular, huh_project_id: null, huh_project_name: null}",1bf523ef-7a56-488c-b91b-66800e173d61,barcode-00346646,NA,,A. Eastwood,undetermined,NotDetermined,present,Sheet,in collection,,[see Simple Media extension],NA,8/12/19,NA,NA,1919,8,12,,,,North America;United States of America;California;San Francisco County;,North America,NA,NA,United States of America,US,California,San Francisco County,San Francisco,Golden Gate Park,Golden Gate Park,,NA,NA,,NA,NA,,NA,,,,,NA,,Prunus ilicifolia subsp. lyonii (Eastwood) P. H. Raven,Rosaceae,Prunus,ilicifolia,lyonii,(Eastwood) P. H. Raven233,7b5db975-30c8-4083-8fcd-8ffd5f9be1d2,http://purl.org/dc/dcmitype/PhysicalObject,48:51.0,en,https://huh.harvard.edu/pages/use,President and Fellows of Harvard College,https://huh.harvard.edu/access-digital-reproductions-works-public-domain,http://data.huh.harvard.edu/7b5db975-30c8-4083-8fcd-8ffd5f9be1d2/image,urn:lsid:biocol.org:col:15406,urn:lsid:biocol.org:col:15406,NA,A,A,Harvard University Herbaria: All Records,PreservedSpecimen,NA,NA,"{huh_taxonomic_group: Vascular, huh_project_id: null, huh_project_name: null}",7b5db975-30c8-4083-8fcd-8ffd5f9be1d2,barcode-00346616,NA,353,A. Eastwood,undetermined,NotDetermined,present,"Sheet,Sheet",in collection,,[see Simple Media extension],NA,6/13/12,NA,NA,1912,6,13,,,353,North America;United States of America;California;San Francisco County;,North America,NA,NA,United States of America,US,California,San Francisco County,San Francisco,Bay-view hills,Bay-view hills,,NA,NA,,NA,NA,,NA,,,,,NA,,Prunus ilicifolia (Nuttall ex Hooker & Arnott) D. N. F. Dietrich,Rosaceae,Prunus,ilicifolia,,(Nuttall ex Hooker & Arnott) D. N. F. Dietrich234,5bdb7ff4-06b5-48f7-a20e-b686bd75cdc3,http://purl.org/dc/dcmitype/PhysicalObject,34:09.0,en,https://huh.harvard.edu/pages/use,President and Fellows of Harvard College,https://huh.harvard.edu/access-digital-reproductions-works-public-domain,http://data.huh.harvard.edu/5bdb7ff4-06b5-48f7-a20e-b686bd75cdc3/image,urn:lsid:biocol.org:col:15631,urn:lsid:biocol.org:col:15631,NA,GH,GH,Harvard University Herbaria: All Records,PreservedSpecimen,NA,NA,"{huh_taxonomic_group: Vascular, huh_project_id: null, huh_project_name: null}",5bdb7ff4-06b5-48f7-a20e-b686bd75cdc3,barcode-00346586,NA,32,C. G. Michener & F. T. Bioletti,undetermined,NotDetermined,present,Sheet,in collection,,[see Simple Media extension],NA,1891-06,NA,NA,1891,6,NA,,,32,North America;United States of America;California;San Francisco County;,North America,NA,NA,United States of America,US,California,San Francisco County,,Mission Hills,Mission Hills,,NA,NA,,NA,NA,,NA,,,,,NA,,Prunus ilicifolia (Nuttall ex Hooker & Arnott) D. N. F. Dietrich,Rosaceae,Prunus,ilicifolia,,(Nuttall ex Hooker & Arnott) D. N. F. Dietrich235,b769ef15-372c-460d-be34-2355909f7272,http://purl.org/dc/dcmitype/PhysicalObject,48:51.0,en,https://huh.harvard.edu/pages/use,President and Fellows of Harvard College,https://huh.harvard.edu/access-digital-reproductions-works-public-domain,http://data.huh.harvard.edu/b769ef15-372c-460d-be34-2355909f7272/image,urn:lsid:biocol.org:col:15631,urn:lsid:biocol.org:col:15631,NA,GH,GH,Harvard University Herbaria: All Records,PreservedSpecimen,NA,NA,"{huh_taxonomic_group: Vascular, huh_project_id: null, huh_project_name: null}",b769ef15-372c-460d-be34-2355909f7272,barcode-00346583,NA,353,A. Eastwood,undetermined,NotDetermined,present,"Sheet,Sheet",in collection,,[see Simple Media extension],NA,6/13/12,NA,NA,1912,6,13,,,353,North America;United States of America;California;San Francisco County;,North America,NA,NA,United States of America,US,California,San Francisco County,San Francisco,Bay-view hills,Bay-view hills,,NA,NA,,NA,NA,,NA,,,,,NA,,Prunus ilicifolia (Nuttall ex Hooker & Arnott) D. N. F. Dietrich,Rosaceae,Prunus,ilicifolia,,(Nuttall ex Hooker & Arnott) D. N. F. Dietrich236,d3091491-54e4-4be4-a825-fbc03f0a8180,http://purl.org/dc/dcmitype/PhysicalObject,24:31.0,en,https://huh.harvard.edu/pages/use,President and Fellows of Harvard College,https://huh.harvard.edu/access-digital-reproductions-works-public-domain,http://data.huh.harvard.edu/d3091491-54e4-4be4-a825-fbc03f0a8180/image,urn:lsid:biocol.org:col:15406,urn:lsid:biocol.org:col:15406,NA,A,A,Harvard University Herbaria: All Records,PreservedSpecimen,NA,NA,"{huh_taxonomic_group: Vascular, huh_project_id: null, huh_project_name: null}",d3091491-54e4-4be4-a825-fbc03f0a8180,barcode-00346625,NA,13847,A. Eastwood,undetermined,NotDetermined,present,Sheet,in collection,,[see Simple Media extension],NA,5/4/26,NA,NA,1926,5,4,,,13847,North America;United States of America;California;San Luis Obispo County;,North America,NA,NA,United States of America,US,California,San Luis Obispo County,,Paso Robles,Paso Robles,,NA,NA,,NA,NA,,NA,,,,,NA,,Prunus ilicifolia (Nuttall ex Hooker & Arnott) D. N. F. Dietrich,Rosaceae,Prunus,ilicifolia,,(Nuttall ex Hooker & Arnott) D. N. F. Dietrich237,e19c740d-9a0f-4a01-8435-a030c964731d,http://purl.org/dc/dcmitype/PhysicalObject,32:44.0,en,https://huh.harvard.edu/pages/use,President and Fellows of Harvard College,https://huh.harvard.edu/access-digital-reproductions-works-public-domain,http://data.huh.harvard.edu/e19c740d-9a0f-4a01-8435-a030c964731d/image,urn:lsid:biocol.org:col:15406,urn:lsid:biocol.org:col:15406,NA,A,A,Harvard University Herbaria: All Records,PreservedSpecimen,NA,NA,"{huh_taxonomic_group: Vascular, huh_project_id: null, huh_project_name: null}",e19c740d-9a0f-4a01-8435-a030c964731d,barcode-00346606,NA,7686,R. S. Ferris,undetermined,NotDetermined,present,Sheet,in collection,,[see Simple Media extension],NA,4/16/29,NA,NA,1929,4,16,,,7686,North America;United States of America;California;San Luis Obispo County;,North America,NA,NA,United States of America,US,California,San Luis Obispo County,,road to Atascadero 6 miles east of Moro Bay,road to Atascadero 6 miles east of Moro Bay,,NA,NA,,NA,NA,,NA,,,,,NA,,Prunus ilicifolia (Nuttall ex Hooker & Arnott) D. N. F. Dietrich,Rosaceae,Prunus,ilicifolia,,(Nuttall ex Hooker & Arnott) D. N. F. Dietrich238,70b68960-b99f-40b7-953f-fed6d5845355,http://purl.org/dc/dcmitype/PhysicalObject,14:30.0,en,https://huh.harvard.edu/pages/use,President and Fellows of Harvard College,https://huh.harvard.edu/access-digital-reproductions-works-public-domain,http://data.huh.harvard.edu/70b68960-b99f-40b7-953f-fed6d5845355/image,urn:lsid:biocol.org:col:15406,urn:lsid:biocol.org:col:15406,NA,A,A,Harvard University Herbaria: All Records,PreservedSpecimen,NA,NA,"{huh_taxonomic_group: Vascular, huh_project_id: null, huh_project_name: null}",70b68960-b99f-40b7-953f-fed6d5845355,barcode-00346599,NA,4470,J. T. Howell,undetermined,NotDetermined,present,Sheet,in collection,,[see Simple Media extension],NA,10/12/29,NA,NA,1929,10,12,,,4470,North America;United States of America;California;San Luis Obispo County;,North America,NA,NA,United States of America,US,California,San Luis Obispo County,,"Morro Creek, 8.1 miles west of Atascadero","Morro Creek, 8.1 miles west of Atascadero",,NA,NA,,NA,NA,,NA,,,,,NA,,Prunus ilicifolia (Nuttall ex Hooker & Arnott) D. N. F. Dietrich,Rosaceae,Prunus,ilicifolia,,(Nuttall ex Hooker & Arnott) D. N. F. Dietrich239,5caff9e4-cd95-4fab-afb0-461e1d5475a2,http://purl.org/dc/dcmitype/PhysicalObject,42:26.0,en,https://huh.harvard.edu/pages/use,President and Fellows of Harvard College,https://huh.harvard.edu/access-digital-reproductions-works-public-domain,http://data.huh.harvard.edu/5caff9e4-cd95-4fab-afb0-461e1d5475a2/image,urn:lsid:biocol.org:col:15406,urn:lsid:biocol.org:col:15406,NA,A,A,Harvard University Herbaria: All Records,PreservedSpecimen,NA,NA,"{huh_taxonomic_group: Vascular, huh_project_id: null, huh_project_name: null}",5caff9e4-cd95-4fab-afb0-461e1d5475a2,barcode-00346591,NA,,M. M. Miles,undetermined,NotDetermined,present,Sheet,in collection,,[see Simple Media extension],NA,,NA,NA,NA,NA,NA,Before 1886,,,North America;United States of America;California;San Luis Obispo County;,North America,NA,NA,United States of America,US,California,San Luis Obispo County,,,,,NA,NA,,NA,NA,,NA,,,,,NA,,Prunus ilicifolia (Nuttall ex Hooker & Arnott) D. N. F. Dietrich,Rosaceae,Prunus,ilicifolia,,(Nuttall ex Hooker & Arnott) D. N. F. Dietrich240,683fcb35-68c1-4aa5-82fc-8484d90ea7d0,http://purl.org/dc/dcmitype/PhysicalObject,44:12.0,en,https://huh.harvard.edu/pages/use,President and Fellows of Harvard College,https://huh.harvard.edu/access-digital-reproductions-works-public-domain,http://data.huh.harvard.edu/683fcb35-68c1-4aa5-82fc-8484d90ea7d0/image,urn:lsid:biocol.org:col:15406,urn:lsid:biocol.org:col:15406,NA,A,A,Harvard University Herbaria: All Records,PreservedSpecimen,NA,NA,"{huh_taxonomic_group: Vascular, huh_project_id: null, huh_project_name: null}",683fcb35-68c1-4aa5-82fc-8484d90ea7d0,barcode-00346542,NA,13779,A. Eastwood,undetermined,NotDetermined,present,Sheet,in collection,,[see Simple Media extension],NA,5/3/26,NA,NA,1926,5,3,,,13779,North America;United States of America;California;San Luis Obispo County;,North America,NA,NA,United States of America,US,California,San Luis Obispo County,,Avila,Avila,,NA,NA,,NA,NA,,NA,,,,,NA,,Prunus ilicifolia (Nuttall ex Hooker & Arnott) D. N. F. Dietrich,Rosaceae,Prunus,ilicifolia,,(Nuttall ex Hooker & Arnott) D. N. F. Dietrich241,49c8322e-976a-46c9-a48a-2d69adb70579,http://purl.org/dc/dcmitype/PhysicalObject,18:29.0,en,https://huh.harvard.edu/pages/use,President and Fellows of Harvard College,https://huh.harvard.edu/access-digital-reproductions-works-public-domain,http://data.huh.harvard.edu/49c8322e-976a-46c9-a48a-2d69adb70579/image,urn:lsid:biocol.org:col:15406,urn:lsid:biocol.org:col:15406,NA,A,A,Harvard University Herbaria: All Records,PreservedSpecimen,NA,NA,"{huh_taxonomic_group: Vascular, huh_project_id: null, huh_project_name: null}",49c8322e-976a-46c9-a48a-2d69adb70579,barcode-00346622,NA,14,J. I. W. McMurphy,undetermined,NotDetermined,present,Sheet,in collection,,[see Simple Media extension],NA,5/7/06,NA,NA,1906,5,7,,,14,North America;United States of America;California;San Mateo County;,North America,NA,NA,United States of America,US,California,San Mateo County,,"Foothills, Stanford Univ.","Foothills, Stanford Univ.",,NA,NA,,NA,NA,,NA,,,,,NA,,Prunus ilicifolia (Nuttall ex Hooker & Arnott) D. N. F. Dietrich,Rosaceae,Prunus,ilicifolia,,(Nuttall ex Hooker & Arnott) D. N. F. Dietrich242,bab490fa-fd59-4154-9d2d-a88d1d6d8632,http://purl.org/dc/dcmitype/PhysicalObject,16:44.0,en,https://huh.harvard.edu/pages/use,President and Fellows of Harvard College,https://huh.harvard.edu/access-digital-reproductions-works-public-domain,http://data.huh.harvard.edu/bab490fa-fd59-4154-9d2d-a88d1d6d8632/image,urn:lsid:biocol.org:col:15406,urn:lsid:biocol.org:col:15406,NA,A,A,Harvard University Herbaria: All Records,PreservedSpecimen,NA,NA,"{huh_taxonomic_group: Vascular, huh_project_id: null, huh_project_name: null}",bab490fa-fd59-4154-9d2d-a88d1d6d8632,barcode-00346621,NA,262,W. N. Suksdorf,undetermined,NotDetermined,present,Sheet,in collection,,[see Simple Media extension],NA,3/23/13,NA,NA,1913,3,23,,,262,North America;United States of America;California;San Mateo County;,North America,NA,NA,United States of America,US,California,San Mateo County,,Near Crystal Springs Lake,Near Crystal Springs Lake,,NA,NA,,NA,NA,,NA,,,,,NA,,Prunus ilicifolia (Nuttall ex Hooker & Arnott) D. N. F. Dietrich,Rosaceae,Prunus,ilicifolia,,(Nuttall ex Hooker & Arnott) D. N. F. Dietrich243,6e014b48-c23b-4096-b70e-8bd7467f7b00,http://purl.org/dc/dcmitype/PhysicalObject,32:13.0,en,https://huh.harvard.edu/pages/use,President and Fellows of Harvard College,https://huh.harvard.edu/access-digital-reproductions-works-public-domain,http://data.huh.harvard.edu/6e014b48-c23b-4096-b70e-8bd7467f7b00/image,urn:lsid:biocol.org:col:15631,urn:lsid:biocol.org:col:15631,NA,GH,GH,Harvard University Herbaria: All Records,PreservedSpecimen,NA,NA,"{huh_taxonomic_group: Vascular, huh_project_id: null, huh_project_name: null}",6e014b48-c23b-4096-b70e-8bd7467f7b00,barcode-00346585,NA,14,J. I. W. McMurphy,undetermined,NotDetermined,present,Sheet,in collection,,[see Simple Media extension],NA,5/7/06,NA,NA,1906,5,7,,,14,North America;United States of America;California;San Mateo County;,North America,NA,NA,United States of America,US,California,San Mateo County,,Foothills Stanford Univ.,Foothills Stanford Univ.,,NA,NA,,NA,NA,,NA,,,,,NA,,Prunus ilicifolia (Nuttall ex Hooker & Arnott) D. N. F. Dietrich,Rosaceae,Prunus,ilicifolia,,(Nuttall ex Hooker & Arnott) D. N. F. Dietrich244,4419dec6-d332-44a9-9a8a-b10ff3559779,http://purl.org/dc/dcmitype/PhysicalObject,57:33.0,en,https://huh.harvard.edu/pages/use,President and Fellows of Harvard College,https://huh.harvard.edu/access-digital-reproductions-works-public-domain,http://data.huh.harvard.edu/4419dec6-d332-44a9-9a8a-b10ff3559779/image,urn:lsid:biocol.org:col:15631,urn:lsid:biocol.org:col:15631,NA,GH,GH,Harvard University Herbaria: All Records,PreservedSpecimen,NA,NA,"{huh_taxonomic_group: Vascular, huh_project_id: null, huh_project_name: null}",4419dec6-d332-44a9-9a8a-b10ff3559779,barcode-00346575,NA,,J. F. Collins,undetermined,NotDetermined,present,Sheet,in collection,,[see Simple Media extension],NA,5/21/18,NA,NA,1918,5,21,,,,North America;United States of America;California;San Mateo County;,North America,NA,NA,United States of America,US,California,San Mateo County,,Menlo Park,Menlo Park,,NA,NA,,NA,NA,,NA,,,,,NA,,Prunus ilicifolia (Nuttall ex Hooker & Arnott) D. N. F. Dietrich,Rosaceae,Prunus,ilicifolia,,(Nuttall ex Hooker & Arnott) D. N. F. Dietrich245,cbe3dc99-8f82-41a2-9870-1cd9d8c2f62e,http://purl.org/dc/dcmitype/PhysicalObject,05:50.0,en,https://huh.harvard.edu/pages/use,President and Fellows of Harvard College,https://huh.harvard.edu/access-digital-reproductions-works-public-domain,http://data.huh.harvard.edu/cbe3dc99-8f82-41a2-9870-1cd9d8c2f62e/image,urn:lsid:biocol.org:col:15631,urn:lsid:biocol.org:col:15631,NA,GH,GH,Harvard University Herbaria: All Records,PreservedSpecimen,NA,NA,"{huh_taxonomic_group: Vascular, huh_project_id: null, huh_project_name: null}",cbe3dc99-8f82-41a2-9870-1cd9d8c2f62e,barcode-00346567,NA,42226,L. S. Rose,undetermined,NotDetermined,present,Sheet,in collection,,[see Simple Media extension],NA,8/11/42,NA,NA,1942,8,11,,,42226,North America;United States of America;California;San Mateo County;,North America,NA,NA,United States of America,US,California,San Mateo County,,"Skyline Blvd., w. of SanBruno","Skyline Blvd., w. of SanBruno",ca. 300 ft.,NA,NA,,NA,NA,,NA,,,,,NA,,Prunus ilicifolia (Nuttall ex Hooker & Arnott) D. N. F. Dietrich,Rosaceae,Prunus,ilicifolia,,(Nuttall ex Hooker & Arnott) D. N. F. Dietrich246,9b02c21b-e515-4221-a564-29f147e18faf,http://purl.org/dc/dcmitype/PhysicalObject,55:19.0,en,https://huh.harvard.edu/pages/use,President and Fellows of Harvard College,https://huh.harvard.edu/access-digital-reproductions-works-public-domain,http://data.huh.harvard.edu/9b02c21b-e515-4221-a564-29f147e18faf/image,urn:lsid:biocol.org:col:15631,urn:lsid:biocol.org:col:15631,NA,GH,GH,Harvard University Herbaria: All Records,PreservedSpecimen,NA,NA,"{huh_taxonomic_group: Vascular, huh_project_id: 7, huh_project_name: US and Canada - Mass Digitization}",9b02c21b-e515-4221-a564-29f147e18faf,barcode-01722676,NA,8334,R. McVaugh,undetermined,NotDetermined,present,Sheet,in collection,,[see Simple Media extension],NA,5/15/47,NA,NA,1947,5,15,,,8334,North America;United States of America;Texas;San Saba County;,North America,NA,NA,United States of America,US,Texas,San Saba County,,"(S. E. Corner): Cacti Lodge, Barnes Ranch, mouth of Spicewood Creek at Colorado River","(S. E. Corner): Cacti Lodge, Barnes Ranch, mouth of Spicewood Creek at Colorado River",,NA,NA,,NA,NA,,NA,,,,,NA,,Prunus mexicana S. Watson,Rosaceae,Prunus,mexicana,,S. Watson247,0afe2760-53df-4fcc-a678-7fb9d3431e79,http://purl.org/dc/dcmitype/PhysicalObject,55:52.0,en,https://huh.harvard.edu/pages/use,President and Fellows of Harvard College,https://huh.harvard.edu/access-digital-reproductions-works-public-domain,http://data.huh.harvard.edu/0afe2760-53df-4fcc-a678-7fb9d3431e79/image,urn:lsid:biocol.org:col:15406,urn:lsid:biocol.org:col:15406,NA,A,A,Harvard University Herbaria: All Records,PreservedSpecimen,NA,NA,"{huh_taxonomic_group: Vascular, huh_project_id: 7, huh_project_name: US and Canada - Mass Digitization}",0afe2760-53df-4fcc-a678-7fb9d3431e79,barcode-01722744,NA,11812,E. J. Palmer,undetermined,NotDetermined,present,Sheet,in collection,,[see Simple Media extension],NA,5/5/17,NA,NA,1917,5,5,,River bottoms,11812,North America;United States of America;Texas;San Saba County;,North America,NA,NA,United States of America,US,Texas,San Saba County,,San Saba,San Saba,,NA,NA,,NA,NA,,NA,,,,,NA,,Prunus mexicana S. Watson,Rosaceae,Prunus,mexicana,,S. Watson248,66e7ea29-d63f-46b1-ad77-83ef3bf48d0d,http://purl.org/dc/dcmitype/PhysicalObject,08:04.0,en,https://huh.harvard.edu/pages/use,President and Fellows of Harvard College,https://huh.harvard.edu/access-digital-reproductions-works-public-domain,http://data.huh.harvard.edu/66e7ea29-d63f-46b1-ad77-83ef3bf48d0d/image,urn:lsid:biocol.org:col:15406,urn:lsid:biocol.org:col:15406,NA,A,A,Harvard University Herbaria: All Records,PreservedSpecimen,NA,NA,"{huh_taxonomic_group: Vascular, huh_project_id: null, huh_project_name: null}",66e7ea29-d63f-46b1-ad77-83ef3bf48d0d,barcode-00346666,NA,,T. S. Brandegee,undetermined,NotDetermined,present,Sheet,in collection,,[see Simple Media extension],NA,1888-04,NA,NA,1888,4,NA,,,,North America;United States of America;California;Santa Barbara County;,North America,NA,NA,United States of America,US,California,Santa Barbara County,,Island of Santa Cruz,Island of Santa Cruz,,NA,NA,,NA,NA,,NA,,,,,NA,,Prunus ilicifolia subsp. lyonii (Eastwood) P. H. Raven,Rosaceae,Prunus,ilicifolia,lyonii,(Eastwood) P. H. Raven249,d8fe8b01-1e09-42e4-beaf-77c4d4708db3,http://purl.org/dc/dcmitype/PhysicalObject,14:40.0,en,https://huh.harvard.edu/pages/use,President and Fellows of Harvard College,https://huh.harvard.edu/access-digital-reproductions-works-public-domain,http://data.huh.harvard.edu/d8fe8b01-1e09-42e4-beaf-77c4d4708db3/image,urn:lsid:biocol.org:col:15631,urn:lsid:biocol.org:col:15631,NA,GH,GH,Harvard University Herbaria: All Records,PreservedSpecimen,NA,NA,"{huh_taxonomic_group: Vascular, huh_project_id: null, huh_project_name: null}",d8fe8b01-1e09-42e4-beaf-77c4d4708db3,barcode-00346658,NA,36846,R. F. Thorne & P. C. Everett,undetermined,NotDetermined,present,Sheet,in collection,,[see Simple Media extension],NA,4/18/67,NA,NA,1967,4,18,,,36846,North America;United States of America;California;Santa Barbara County;,North America,NA,NA,United States of America,US,California,Santa Barbara County,,Santa Cruz Island: Caada Puerto,Santa Cruz Island: Caada Puerto,,NA,NA,,NA,NA,,NA,,,,,NA,,Prunus ilicifolia subsp. lyonii (Eastwood) P. H. Raven,Rosaceae,Prunus,ilicifolia,lyonii,(Eastwood) P. H. Raven250,1fb549e2-b2c9-4245-93be-2f3138882758,http://purl.org/dc/dcmitype/PhysicalObject,15:06.0,en,https://huh.harvard.edu/pages/use,President and Fellows of Harvard College,https://huh.harvard.edu/access-digital-reproductions-works-public-domain,http://data.huh.harvard.edu/1fb549e2-b2c9-4245-93be-2f3138882758/image,urn:lsid:biocol.org:col:15406,urn:lsid:biocol.org:col:15406,NA,A,A,Harvard University Herbaria: All Records,PreservedSpecimen,NA,NA,"{huh_taxonomic_group: Vascular, huh_project_id: null, huh_project_name: null}",1fb549e2-b2c9-4245-93be-2f3138882758,barcode-00346655,NA,3965,I. W. Clokey,undetermined,NotDetermined,present,"Sheet,Sheet",in collection,,[see Simple Media extension],NA,7/27/30,NA,NA,1930,7,27,,,3965,North America;United States of America;California;Santa Barbara County;,North America,NA,NA,United States of America,US,California,Santa Barbara County,,Ladies Canon; Santa Cruz Island,Ladies Canon; Santa Cruz Island,40 M.,NA,NA,,NA,NA,,NA,,,,,NA,,Prunus ilicifolia subsp. lyonii (Eastwood) P. H. Raven,Rosaceae,Prunus,ilicifolia,lyonii,(Eastwood) P. H. Raven251,66c5feac-50ec-4c1a-af83-e9fcc74944a2,http://purl.org/dc/dcmitype/PhysicalObject,13:54.0,en,https://huh.harvard.edu/pages/use,President and Fellows of Harvard College,https://huh.harvard.edu/access-digital-reproductions-works-public-domain,http://data.huh.harvard.edu/66c5feac-50ec-4c1a-af83-e9fcc74944a2/image,urn:lsid:biocol.org:col:15406,urn:lsid:biocol.org:col:15406,NA,A,A,Harvard University Herbaria: All Records,PreservedSpecimen,NA,NA,"{huh_taxonomic_group: Vascular, huh_project_id: null, huh_project_name: null}",66c5feac-50ec-4c1a-af83-e9fcc74944a2,barcode-00346653,NA,3965,I. W. Clokey,undetermined,NotDetermined,present,"Sheet,Sheet",in collection,,[see Simple Media extension],NA,7/27/30,NA,NA,1930,7,27,,,3965,North America;United States of America;California;Santa Barbara County;,North America,NA,NA,United States of America,US,California,Santa Barbara County,,Ladies Canon; Santa Cruz Island,Ladies Canon; Santa Cruz Island,40 M.,NA,NA,,NA,NA,,NA,,,,,NA,,Prunus ilicifolia subsp. lyonii (Eastwood) P. H. Raven,Rosaceae,Prunus,ilicifolia,lyonii,(Eastwood) P. H. Raven252,e7d553f5-30f1-4f24-8c4c-5509ce3c3322,http://purl.org/dc/dcmitype/PhysicalObject,15:34.0,en,https://huh.harvard.edu/pages/use,President and Fellows of Harvard College,https://huh.harvard.edu/access-digital-reproductions-works-public-domain,http://data.huh.harvard.edu/e7d553f5-30f1-4f24-8c4c-5509ce3c3322/image,urn:lsid:biocol.org:col:15406,urn:lsid:biocol.org:col:15406,NA,A,A,Harvard University Herbaria: All Records,PreservedSpecimen,NA,NA,"{huh_taxonomic_group: Vascular, huh_project_id: null, huh_project_name: null}",e7d553f5-30f1-4f24-8c4c-5509ce3c3322,barcode-00346652,NA,118,R. S. Woglum,undetermined,NotDetermined,present,Sheet,in collection,,[see Simple Media extension],NA,4/18/36,NA,NA,1936,4,18,18/IV/36,,118,North America;United States of America;California;Santa Barbara County;,North America,NA,NA,United States of America,US,California,Santa Barbara County,,"Queva Valdez, Santa Cruz Island","Queva Valdez, Santa Cruz Island",,NA,NA,,NA,NA,,NA,,,,,NA,,Prunus ilicifolia subsp. lyonii (Eastwood) P. H. Raven,Rosaceae,Prunus,ilicifolia,lyonii,(Eastwood) P. H. Raven253,94c8eb0d-9894-4f52-a50d-3eb02e7e6f6b,http://purl.org/dc/dcmitype/PhysicalObject,42:25.0,en,https://huh.harvard.edu/pages/use,President and Fellows of Harvard College,https://huh.harvard.edu/access-digital-reproductions-works-public-domain,http://data.huh.harvard.edu/94c8eb0d-9894-4f52-a50d-3eb02e7e6f6b/image,urn:lsid:biocol.org:col:15406,urn:lsid:biocol.org:col:15406,NA,A,A,Harvard University Herbaria: All Records,PreservedSpecimen,NA,NA,"{huh_taxonomic_group: Vascular, huh_project_id: null, huh_project_name: null}",94c8eb0d-9894-4f52-a50d-3eb02e7e6f6b,barcode-00346650,NA,,Ralph Hoffmann,undetermined,NotDetermined,present,Sheet,in collection,,[see Simple Media extension],NA,12/1/30,NA,NA,1930,12,1,,,,North America;United States of America;California;Santa Barbara County;,North America,NA,NA,United States of America,US,California,Santa Barbara County,,"Dick's Harbor, Santa Cruz I.","Dick's Harbor, Santa Cruz I.",,NA,NA,,NA,NA,,NA,,,,,NA,,Prunus ilicifolia subsp. lyonii (Eastwood) P. H. Raven,Rosaceae,Prunus,ilicifolia,lyonii,(Eastwood) P. H. Raven254,5d99038e-fe5b-4468-b1ee-739a4fc38a72,http://purl.org/dc/dcmitype/PhysicalObject,00:19.0,en,https://huh.harvard.edu/pages/use,President and Fellows of Harvard College,https://huh.harvard.edu/access-digital-reproductions-works-public-domain,http://data.huh.harvard.edu/5d99038e-fe5b-4468-b1ee-739a4fc38a72/image,urn:lsid:biocol.org:col:15406,urn:lsid:biocol.org:col:15406,NA,A,A,Harvard University Herbaria: All Records,PreservedSpecimen,NA,NA,"{huh_taxonomic_group: Vascular, huh_project_id: null, huh_project_name: null}",5d99038e-fe5b-4468-b1ee-739a4fc38a72,barcode-00346647,NA,,L. Rowntree,undetermined,NotDetermined,present,Sheet,in collection,,[see Simple Media extension],NA,,NA,NA,NA,NA,NA,-1930 (?),,,North America;United States of America;California;Santa Barbara County;,North America,NA,NA,United States of America,US,California,Santa Barbara County,,Santa Rosa Island,Santa Rosa Island,,NA,NA,,NA,NA,,NA,,,,,NA,,Prunus ilicifolia subsp. lyonii (Eastwood) P. H. Raven,Rosaceae,Prunus,ilicifolia,lyonii,(Eastwood) P. H. Raven255,943e29e2-43c4-460b-a60a-c62df358e5a3,http://purl.org/dc/dcmitype/PhysicalObject,01:33.0,en,https://huh.harvard.edu/pages/use,President and Fellows of Harvard College,https://huh.harvard.edu/access-digital-reproductions-works-public-domain,http://data.huh.harvard.edu/943e29e2-43c4-460b-a60a-c62df358e5a3/image,urn:lsid:biocol.org:col:15631,urn:lsid:biocol.org:col:15631,NA,GH,GH,Harvard University Herbaria: All Records,PreservedSpecimen,NA,NA,"{huh_taxonomic_group: Vascular, huh_project_id: null, huh_project_name: null}",943e29e2-43c4-460b-a60a-c62df358e5a3,barcode-00346644,NA,4965,I. W. Clokey,undetermined,NotDetermined,present,Sheet,in collection,,[see Simple Media extension],NA,7/27/30,NA,NA,1930,7,27,,,4965,North America;United States of America;California;Santa Barbara County;,North America,NA,NA,United States of America,US,California,Santa Barbara County,,Ladies' Canon; Santa Cruz Island,Ladies' Canon; Santa Cruz Island,40 M.,NA,NA,,NA,NA,,NA,,,,,NA,,Prunus ilicifolia subsp. lyonii (Eastwood) P. H. Raven,Rosaceae,Prunus,ilicifolia,lyonii,(Eastwood) P. H. Raven256,84d7bbca-9f86-4ed4-a7b9-4a3071451cd5,http://purl.org/dc/dcmitype/PhysicalObject,18:18.0,en,https://huh.harvard.edu/pages/use,President and Fellows of Harvard College,https://huh.harvard.edu/access-digital-reproductions-works-public-domain,http://data.huh.harvard.edu/84d7bbca-9f86-4ed4-a7b9-4a3071451cd5/image,urn:lsid:biocol.org:col:15631,urn:lsid:biocol.org:col:15631,NA,GH,GH,Harvard University Herbaria: All Records,PreservedSpecimen,NA,NA,"{huh_taxonomic_group: Vascular, huh_project_id: null, huh_project_name: null}",84d7bbca-9f86-4ed4-a7b9-4a3071451cd5,barcode-00346641,NA,93,L. Abrams & I. L. Wiggins,undetermined,NotDetermined,present,Sheet,in collection,,[see Simple Media extension],NA,4/26/30,NA,NA,1930,4,26,,,93,North America;United States of America;California;Santa Barbara County;,North America,NA,NA,United States of America,US,California,Santa Barbara County,,Vicinity of Pelican Bay. Between the Bay and Prisoner's Harbor. Santa Cruz Island,Vicinity of Pelican Bay. Between the Bay and Prisoner's Harbor. Santa Cruz Island,,NA,NA,,NA,NA,,NA,,,,,NA,,Prunus ilicifolia subsp. lyonii (Eastwood) P. H. Raven,Rosaceae,Prunus,ilicifolia,lyonii,(Eastwood) P. H. Raven257,87828cf2-b085-43fa-a82f-1b50285819ca,http://purl.org/dc/dcmitype/PhysicalObject,14:05.0,en,https://huh.harvard.edu/pages/use,President and Fellows of Harvard College,https://huh.harvard.edu/access-digital-reproductions-works-public-domain,http://data.huh.harvard.edu/87828cf2-b085-43fa-a82f-1b50285819ca/image,urn:lsid:biocol.org:col:15631,urn:lsid:biocol.org:col:15631,NA,GH,GH,Harvard University Herbaria: All Records,PreservedSpecimen,NA,NA,"{huh_taxonomic_group: Vascular, huh_project_id: null, huh_project_name: null}",87828cf2-b085-43fa-a82f-1b50285819ca,barcode-00346639,NA,11841,P. A. Munz & E. Crow,undetermined,NotDetermined,present,Sheet,in collection,,[see Simple Media extension],NA,4/10/30,NA,NA,1930,4,10,,,11841,North America;United States of America;California;Santa Barbara County;,North America,NA,NA,United States of America,US,California,Santa Barbara County,,"Lady's Harbor, Santa Cruz Island","Lady's Harbor, Santa Cruz Island",,NA,NA,,NA,NA,,NA,,,,,NA,,Prunus ilicifolia subsp. lyonii (Eastwood) P. H. Raven,Rosaceae,Prunus,ilicifolia,lyonii,(Eastwood) P. H. Raven258,065b21b7-87ad-40b9-8344-339117dc3623,http://purl.org/dc/dcmitype/PhysicalObject,03:59.0,en,https://huh.harvard.edu/pages/use,President and Fellows of Harvard College,https://huh.harvard.edu/access-digital-reproductions-works-public-domain,http://data.huh.harvard.edu/065b21b7-87ad-40b9-8344-339117dc3623/image,urn:lsid:biocol.org:col:15406,urn:lsid:biocol.org:col:15406,NA,A,A,Harvard University Herbaria: All Records,PreservedSpecimen,NA,NA,"{huh_taxonomic_group: Vascular, huh_project_id: null, huh_project_name: null}",065b21b7-87ad-40b9-8344-339117dc3623,barcode-00346638,NA,,E. L. Greene,undetermined,NotDetermined,present,Sheet,in collection,,[see Simple Media extension],NA,1886,NA,NA,1886,NA,NA,July and August 1886,,,North America;United States of America;California;Santa Barbara County;,North America,NA,NA,United States of America,US,California,Santa Barbara County,,Island of Santa Cruz,Island of Santa Cruz,,NA,NA,,NA,NA,,NA,,,,,NA,,Prunus ilicifolia subsp. lyonii (Eastwood) P. H. Raven,Rosaceae,Prunus,ilicifolia,lyonii,(Eastwood) P. H. Raven259,06cbe2f0-a508-49d7-b81c-9b0cfe15c687,http://purl.org/dc/dcmitype/PhysicalObject,05:07.0,en,https://huh.harvard.edu/pages/use,President and Fellows of Harvard College,https://huh.harvard.edu/access-digital-reproductions-works-public-domain,http://data.huh.harvard.edu/06cbe2f0-a508-49d7-b81c-9b0cfe15c687/image,urn:lsid:biocol.org:col:15406,urn:lsid:biocol.org:col:15406,NA,A,A,Harvard University Herbaria: All Records,PreservedSpecimen,NA,NA,"{huh_taxonomic_group: Vascular, huh_project_id: null, huh_project_name: null}",06cbe2f0-a508-49d7-b81c-9b0cfe15c687,barcode-00346636,NA,,E. L. Greene,undetermined,NotDetermined,present,Sheet,in collection,,[see Simple Media extension],NA,1886,NA,NA,1886,NA,NA,July and August 1886,,,North America;United States of America;California;Santa Barbara County;,North America,NA,NA,United States of America,US,California,Santa Barbara County,,Island of Santa Cruz,Island of Santa Cruz,,NA,NA,,NA,NA,,NA,,,,,NA,,Prunus ilicifolia subsp. lyonii (Eastwood) P. H. Raven,Rosaceae,Prunus,ilicifolia,lyonii,(Eastwood) P. H. Raven260,4ec929bb-a6df-4297-ab60-00a9c0ee0def,http://purl.org/dc/dcmitype/PhysicalObject,05:41.0,en,https://huh.harvard.edu/pages/use,President and Fellows of Harvard College,https://huh.harvard.edu/access-digital-reproductions-works-public-domain,http://data.huh.harvard.edu/4ec929bb-a6df-4297-ab60-00a9c0ee0def/image,urn:lsid:biocol.org:col:15631,urn:lsid:biocol.org:col:15631,NA,GH,GH,Harvard University Herbaria: All Records,PreservedSpecimen,NA,NA,"{huh_taxonomic_group: Vascular, huh_project_id: null, huh_project_name: null}",4ec929bb-a6df-4297-ab60-00a9c0ee0def,barcode-00346635,NA,,E. L. Greene,undetermined,NotDetermined,present,Sheet,in collection,,[see Simple Media extension],NA,1886,NA,NA,1886,NA,NA,July and August 1886,,,North America;United States of America;California;Santa Barbara County;,North America,NA,NA,United States of America,US,California,Santa Barbara County,,Island of Santa Cruz,Island of Santa Cruz,,NA,NA,,NA,NA,,NA,,,,,NA,,Prunus ilicifolia subsp. lyonii (Eastwood) P. H. Raven,Rosaceae,Prunus,ilicifolia,lyonii,(Eastwood) P. H. Raven261,d1328ee4-369f-47a9-8b7e-05c2fac36646,http://purl.org/dc/dcmitype/PhysicalObject,37:21.0,en,https://huh.harvard.edu/pages/use,President and Fellows of Harvard College,https://huh.harvard.edu/access-digital-reproductions-works-public-domain,http://data.huh.harvard.edu/d1328ee4-369f-47a9-8b7e-05c2fac36646/image,urn:lsid:biocol.org:col:15406,urn:lsid:biocol.org:col:15406,NA,A,A,Harvard University Herbaria: All Records,PreservedSpecimen,NA,NA,"{huh_taxonomic_group: Vascular, huh_project_id: null, huh_project_name: null}",d1328ee4-369f-47a9-8b7e-05c2fac36646,barcode-00346630,NA,,M. E. Jones,undetermined,NotDetermined,present,Sheet,in collection,,[see Simple Media extension],NA,9/5/27,NA,NA,1927,9,5,,,,North America;United States of America;California;Santa Barbara County;,North America,NA,NA,United States of America,US,California,Santa Barbara County,,"Valdez Bay, Santa Cruz Is.","Valdez Bay, Santa Cruz Is.",,NA,NA,,NA,NA,,NA,,,,,NA,,Prunus ilicifolia subsp. lyonii (Eastwood) P. H. Raven,Rosaceae,Prunus,ilicifolia,lyonii,(Eastwood) P. H. Raven262,fa6a883d-807c-4354-9222-a949051d955d,http://purl.org/dc/dcmitype/PhysicalObject,48:51.0,en,https://huh.harvard.edu/pages/use,President and Fellows of Harvard College,https://huh.harvard.edu/access-digital-reproductions-works-public-domain,http://data.huh.harvard.edu/fa6a883d-807c-4354-9222-a949051d955d/image,urn:lsid:biocol.org:col:15406,urn:lsid:biocol.org:col:15406,NA,A,A,Harvard University Herbaria: All Records,PreservedSpecimen,NA,NA,"{huh_taxonomic_group: Vascular, huh_project_id: null, huh_project_name: null}",fa6a883d-807c-4354-9222-a949051d955d,barcode-00346629,NA,4135,C. B. Wolf,undetermined,NotDetermined,present,Sheet,in collection,,[see Simple Media extension],NA,9/21/32,NA,NA,1932,9,21,,,4135,North America;United States of America;California;Santa Barbara County;,North America,NA,NA,United States of America,US,California,Santa Barbara County,,Santa Cruz Island. Between Main Ranch & Prisoners Harbor,Santa Cruz Island. Between Main Ranch & Prisoners Harbor,100-150 ft.,NA,NA,,NA,NA,,NA,,,,,NA,,Prunus ilicifolia subsp. lyonii (Eastwood) P. H. Raven,Rosaceae,Prunus,ilicifolia,lyonii,(Eastwood) P. H. Raven263,adaede82-7bbd-4a5a-86d6-4cb875905fc7,http://purl.org/dc/dcmitype/PhysicalObject,38:26.0,en,https://huh.harvard.edu/pages/use,President and Fellows of Harvard College,https://huh.harvard.edu/access-digital-reproductions-works-public-domain,http://data.huh.harvard.edu/adaede82-7bbd-4a5a-86d6-4cb875905fc7/image,urn:lsid:biocol.org:col:15406,urn:lsid:biocol.org:col:15406,NA,A,A,Harvard University Herbaria: All Records,PreservedSpecimen,NA,NA,"{huh_taxonomic_group: Vascular, huh_project_id: null, huh_project_name: null}",adaede82-7bbd-4a5a-86d6-4cb875905fc7,barcode-00346609,NA,,J. G. Jack,undetermined,NotDetermined,present,Sheet,in collection,,[see Simple Media extension],NA,7/6/07,NA,NA,1907,7,6,,,,North America;United States of America;California;Santa Barbara County;,North America,NA,NA,United States of America,US,California,Santa Barbara County,Santa Barbara,,,,NA,NA,,NA,NA,,NA,,,,,NA,,Prunus ilicifolia (Nuttall ex Hooker & Arnott) D. N. F. Dietrich,Rosaceae,Prunus,ilicifolia,,(Nuttall ex Hooker & Arnott) D. N. F. Dietrich264,21b1b08f-dd19-48cf-8172-7c9bd68848e1,http://purl.org/dc/dcmitype/PhysicalObject,25:05.0,en,https://huh.harvard.edu/pages/use,President and Fellows of Harvard College,https://huh.harvard.edu/access-digital-reproductions-works-public-domain,http://data.huh.harvard.edu/21b1b08f-dd19-48cf-8172-7c9bd68848e1/image,urn:lsid:biocol.org:col:15631,urn:lsid:biocol.org:col:15631,NA,GH,GH,Harvard University Herbaria: All Records,PreservedSpecimen,NA,NA,"{huh_taxonomic_group: Vascular, huh_project_id: null, huh_project_name: null}",21b1b08f-dd19-48cf-8172-7c9bd68848e1,barcode-00346604,NA,,T. S. Brandegee,undetermined,NotDetermined,present,Sheet,in collection,,[see Simple Media extension],NA,1888-06,NA,NA,1888,6,NA,,,,North America;United States of America;California;Santa Barbara County;,North America,NA,NA,United States of America,US,California,Santa Barbara County,,Island of Santa Rosa,Island of Santa Rosa,,NA,NA,,NA,NA,,NA,,,,,NA,,Prunus ilicifolia (Nuttall ex Hooker & Arnott) D. N. F. Dietrich,Rosaceae,Prunus,ilicifolia,,(Nuttall ex Hooker & Arnott) D. N. F. Dietrich265,88469157-4f15-4ca9-a04f-4698303f5db7,http://purl.org/dc/dcmitype/PhysicalObject,20:24.0,en,https://huh.harvard.edu/pages/use,President and Fellows of Harvard College,https://huh.harvard.edu/access-digital-reproductions-works-public-domain,http://data.huh.harvard.edu/88469157-4f15-4ca9-a04f-4698303f5db7/image,urn:lsid:biocol.org:col:15631,urn:lsid:biocol.org:col:15631,NA,GH,GH,Harvard University Herbaria: All Records,PreservedSpecimen,NA,NA,"{huh_taxonomic_group: Vascular, huh_project_id: null, huh_project_name: null}",88469157-4f15-4ca9-a04f-4698303f5db7,barcode-00346602,NA,,T. S. Brandegee,undetermined,NotDetermined,present,Sheet,in collection,,[see Simple Media extension],NA,1888-04,NA,NA,1888,4,NA,,,,North America;United States of America;California;Santa Barbara County;,North America,NA,NA,United States of America,US,California,Santa Barbara County,,Island of Santa Cruz,Island of Santa Cruz,,NA,NA,,NA,NA,,NA,,,,,NA,,Prunus ilicifolia (Nuttall ex Hooker & Arnott) D. N. F. Dietrich,Rosaceae,Prunus,ilicifolia,,(Nuttall ex Hooker & Arnott) D. N. F. Dietrich266,9e10faf2-9962-4cd6-8b2b-f7db8266f904,http://purl.org/dc/dcmitype/PhysicalObject,19:01.0,en,https://huh.harvard.edu/pages/use,President and Fellows of Harvard College,https://huh.harvard.edu/access-digital-reproductions-works-public-domain,http://data.huh.harvard.edu/9e10faf2-9962-4cd6-8b2b-f7db8266f904/image,urn:lsid:biocol.org:col:15631,urn:lsid:biocol.org:col:15631,NA,GH,GH,Harvard University Herbaria: All Records,PreservedSpecimen,NA,NA,"{huh_taxonomic_group: Vascular, huh_project_id: null, huh_project_name: null}",9e10faf2-9962-4cd6-8b2b-f7db8266f904,barcode-00346601,NA,4966,I. W. Clokey,undetermined,NotDetermined,present,Sheet,in collection,,[see Simple Media extension],NA,5/26/30,NA,NA,1930,5,26,,,4966,North America;United States of America;California;Santa Barbara County;,North America,NA,NA,United States of America,US,California,Santa Barbara County,,Dix Canon. Santa Cruz Island,Dix Canon. Santa Cruz Island,100 M.,NA,NA,,NA,NA,,NA,,,,,NA,,Prunus ilicifolia (Nuttall ex Hooker & Arnott) D. N. F. Dietrich,Rosaceae,Prunus,ilicifolia,,(Nuttall ex Hooker & Arnott) D. N. F. Dietrich267,f375ac9d-d570-40c6-8d65-6b95815cf999,http://purl.org/dc/dcmitype/PhysicalObject,17:08.0,en,https://huh.harvard.edu/pages/use,President and Fellows of Harvard College,https://huh.harvard.edu/access-digital-reproductions-works-public-domain,http://data.huh.harvard.edu/f375ac9d-d570-40c6-8d65-6b95815cf999/image,urn:lsid:biocol.org:col:15406,urn:lsid:biocol.org:col:15406,NA,A,A,Harvard University Herbaria: All Records,PreservedSpecimen,NA,NA,"{huh_taxonomic_group: Vascular, huh_project_id: null, huh_project_name: null}",f375ac9d-d570-40c6-8d65-6b95815cf999,barcode-00346600,NA,,Ralph Hoffmann,undetermined,NotDetermined,present,Sheet,in collection,,[see Simple Media extension],NA,4/12/30,NA,NA,1930,4,12,,,,North America;United States of America;California;Santa Barbara County;,North America,NA,NA,United States of America,US,California,Santa Barbara County,,"canyon above Lady's Harbor, Santa Cruz Isl.","canyon above Lady's Harbor, Santa Cruz Isl.",,NA,NA,,NA,NA,,NA,,,,,NA,,Prunus ilicifolia (Nuttall ex Hooker & Arnott) D. N. F. Dietrich,Rosaceae,Prunus,ilicifolia,,(Nuttall ex Hooker & Arnott) D. N. F. Dietrich268,62cd4b0c-d4db-4584-8676-d4d453fa1c98,http://purl.org/dc/dcmitype/PhysicalObject,03:32.0,en,https://huh.harvard.edu/pages/use,President and Fellows of Harvard College,https://huh.harvard.edu/access-digital-reproductions-works-public-domain,http://data.huh.harvard.edu/62cd4b0c-d4db-4584-8676-d4d453fa1c98/image,urn:lsid:biocol.org:col:15406,urn:lsid:biocol.org:col:15406,NA,A,A,Harvard University Herbaria: All Records,PreservedSpecimen,NA,NA,"{huh_taxonomic_group: Vascular, huh_project_id: null, huh_project_name: null}",62cd4b0c-d4db-4584-8676-d4d453fa1c98,barcode-00346596,NA,6368,A. Eastwood,undetermined,NotDetermined,present,Sheet,in collection,,[see Simple Media extension],NA,7/16/17,NA,NA,1917,7,16,,,6368,North America;United States of America;California;Santa Barbara County;,North America,NA,NA,United States of America,US,California,Santa Barbara County,,Santa Cruz Island,Santa Cruz Island,,NA,NA,,NA,NA,,NA,,,,,NA,,Prunus ilicifolia (Nuttall ex Hooker & Arnott) D. N. F. Dietrich,Rosaceae,Prunus,ilicifolia,,(Nuttall ex Hooker & Arnott) D. N. F. Dietrich269,ddcfa0ac-c06e-40ae-99ef-22113ed9187a,http://purl.org/dc/dcmitype/PhysicalObject,04:31.0,en,https://huh.harvard.edu/pages/use,President and Fellows of Harvard College,https://huh.harvard.edu/access-digital-reproductions-works-public-domain,http://data.huh.harvard.edu/ddcfa0ac-c06e-40ae-99ef-22113ed9187a/image,urn:lsid:biocol.org:col:15406,urn:lsid:biocol.org:col:15406,NA,A,A,Harvard University Herbaria: All Records,PreservedSpecimen,NA,NA,"{huh_taxonomic_group: Vascular, huh_project_id: null, huh_project_name: null}",ddcfa0ac-c06e-40ae-99ef-22113ed9187a,barcode-00346595,NA,483,D. I. Axelrod,undetermined,NotDetermined,present,Sheet,in collection,,[see Simple Media extension],NA,6/8/35,NA,NA,1935,6,8,,,483,North America;United States of America;California;Santa Barbara County;,North America,NA,NA,United States of America,US,California,Santa Barbara County,,"head of Ballard Creek, sec. 7, T5N, R30W","head of Ballard Creek, sec. 7, T5N, R30W",1500 feet,NA,NA,,NA,NA,,NA,,,,,NA,,Prunus ilicifolia (Nuttall ex Hooker & Arnott) D. N. F. Dietrich,Rosaceae,Prunus,ilicifolia,,(Nuttall ex Hooker & Arnott) D. N. F. Dietrich270,99921bb4-a0c9-4445-990a-53aa1048a7d8,http://purl.org/dc/dcmitype/PhysicalObject,04:05.0,en,https://huh.harvard.edu/pages/use,President and Fellows of Harvard College,https://huh.harvard.edu/access-digital-reproductions-works-public-domain,http://data.huh.harvard.edu/99921bb4-a0c9-4445-990a-53aa1048a7d8/image,urn:lsid:biocol.org:col:15406,urn:lsid:biocol.org:col:15406,NA,A,A,Harvard University Herbaria: All Records,PreservedSpecimen,NA,NA,"{huh_taxonomic_group: Vascular, huh_project_id: null, huh_project_name: null}",99921bb4-a0c9-4445-990a-53aa1048a7d8,barcode-00346594,NA,,T. S. Brandegee,undetermined,NotDetermined,present,Sheet,in collection,,[see Simple Media extension],NA,1888-06,NA,NA,1888,6,NA,,,,North America;United States of America;California;Santa Barbara County;,North America,NA,NA,United States of America,US,California,Santa Barbara County,,Island of Santa Rosa,Island of Santa Rosa,,NA,NA,,NA,NA,,NA,,,,,NA,,Prunus ilicifolia (Nuttall ex Hooker & Arnott) D. N. F. Dietrich,Rosaceae,Prunus,ilicifolia,,(Nuttall ex Hooker & Arnott) D. N. F. Dietrich271,37cd98a9-8a2f-4a0b-8d57-176255f7cc34,http://purl.org/dc/dcmitype/PhysicalObject,53:00.0,en,https://huh.harvard.edu/pages/use,President and Fellows of Harvard College,https://huh.harvard.edu/access-digital-reproductions-works-public-domain,http://data.huh.harvard.edu/37cd98a9-8a2f-4a0b-8d57-176255f7cc34/image,urn:lsid:biocol.org:col:15631,urn:lsid:biocol.org:col:15631,NA,GH,GH,Harvard University Herbaria: All Records,PreservedSpecimen,NA,NA,"{huh_taxonomic_group: Vascular, huh_project_id: null, huh_project_name: null}",37cd98a9-8a2f-4a0b-8d57-176255f7cc34,barcode-00346573,NA,3775,A. D. E. Elmer,undetermined,NotDetermined,present,Sheet,in collection,,[see Simple Media extension],NA,1902-05,NA,NA,1902,5,NA,,,3775,North America;United States of America;California;Santa Barbara County;,North America,NA,NA,United States of America,US,California,Santa Barbara County,Santa Barbara,"Santa Ynez Mts., S.B.","Santa Ynez Mts., S.B.",,NA,NA,,NA,NA,,NA,,,,,NA,,Prunus ilicifolia (Nuttall ex Hooker & Arnott) D. N. F. Dietrich,Rosaceae,Prunus,ilicifolia,,(Nuttall ex Hooker & Arnott) D. N. F. Dietrich272,120ed356-82b0-4d5a-9d0c-62b4c9b807cc,http://purl.org/dc/dcmitype/PhysicalObject,42:17.0,en,https://huh.harvard.edu/pages/use,President and Fellows of Harvard College,https://huh.harvard.edu/access-digital-reproductions-works-public-domain,http://data.huh.harvard.edu/120ed356-82b0-4d5a-9d0c-62b4c9b807cc/image,urn:lsid:biocol.org:col:15406,urn:lsid:biocol.org:col:15406,NA,A,A,Harvard University Herbaria: All Records,PreservedSpecimen,NA,NA,"{huh_taxonomic_group: Vascular, huh_project_id: null, huh_project_name: null}",120ed356-82b0-4d5a-9d0c-62b4c9b807cc,barcode-00346613,NA,7418,A. A. Heller,undetermined,NotDetermined,present,"Sheet,Sheet",in collection,,[see Simple Media extension],NA,5/16/04,NA,NA,1904,5,16,,,7418,North America;United States of America;California;Santa Clara County;,North America,NA,NA,United States of America,US,California,Santa Clara County,,Between Alma and the Soda Spring,Between Alma and the Soda Spring,,NA,NA,,NA,NA,,NA,,,,,NA,,Prunus ilicifolia (Nuttall ex Hooker & Arnott) D. N. F. Dietrich,Rosaceae,Prunus,ilicifolia,,(Nuttall ex Hooker & Arnott) D. N. F. Dietrich273,22a2bc47-1f0b-4e5d-955f-e4765458b6d4,http://purl.org/dc/dcmitype/PhysicalObject,39:49.0,en,https://huh.harvard.edu/pages/use,President and Fellows of Harvard College,https://huh.harvard.edu/access-digital-reproductions-works-public-domain,http://data.huh.harvard.edu/22a2bc47-1f0b-4e5d-955f-e4765458b6d4/image,urn:lsid:biocol.org:col:15406,urn:lsid:biocol.org:col:15406,NA,A,A,Harvard University Herbaria: All Records,PreservedSpecimen,NA,NA,"{huh_taxonomic_group: Vascular, huh_project_id: null, huh_project_name: null}",22a2bc47-1f0b-4e5d-955f-e4765458b6d4,barcode-00346589,NA,,L. R. Cody,undetermined,NotDetermined,present,Sheet,in collection,,[see Simple Media extension],NA,,NA,NA,NA,NA,NA,1932-07,,,North America;United States of America;California;Santa Clara County;,North America,NA,NA,United States of America,US,California,Santa Clara County,,Vicinity of Loma Prieta,Vicinity of Loma Prieta,,NA,NA,,NA,NA,,NA,,,,,NA,,Prunus ilicifolia (Nuttall ex Hooker & Arnott) D. N. F. Dietrich,Rosaceae,Prunus,ilicifolia,,(Nuttall ex Hooker & Arnott) D. N. F. Dietrich274,1226038b-c5dd-4a20-ba70-d63906bf447c,http://purl.org/dc/dcmitype/PhysicalObject,54:54.0,en,https://huh.harvard.edu/pages/use,President and Fellows of Harvard College,https://huh.harvard.edu/access-digital-reproductions-works-public-domain,http://data.huh.harvard.edu/1226038b-c5dd-4a20-ba70-d63906bf447c/image,urn:lsid:biocol.org:col:15631,urn:lsid:biocol.org:col:15631,NA,GH,GH,Harvard University Herbaria: All Records,PreservedSpecimen,NA,NA,"{huh_taxonomic_group: Vascular, huh_project_id: null, huh_project_name: null}",1226038b-c5dd-4a20-ba70-d63906bf447c,barcode-00346574,NA,3195,C. F. Baker,undetermined,NotDetermined,present,Sheet,in collection,,[see Simple Media extension],NA,5/27/03,NA,NA,1903,5,27,,,3195,North America;United States of America;California;Santa Clara County;,North America,NA,NA,United States of America,US,California,Santa Clara County,,Foot hills near Stanford Univ.,Foot hills near Stanford Univ.,,NA,NA,,NA,NA,,NA,,,,,NA,,Prunus ilicifolia (Nuttall ex Hooker & Arnott) D. N. F. Dietrich,Rosaceae,Prunus,ilicifolia,,(Nuttall ex Hooker & Arnott) D. N. F. Dietrich275,7a13c87c-f15f-4c9d-bcfd-fd7b23a0df46,http://purl.org/dc/dcmitype/PhysicalObject,48:27.0,en,https://huh.harvard.edu/pages/use,President and Fellows of Harvard College,https://huh.harvard.edu/access-digital-reproductions-works-public-domain,http://data.huh.harvard.edu/7a13c87c-f15f-4c9d-bcfd-fd7b23a0df46/image,urn:lsid:biocol.org:col:15631,urn:lsid:biocol.org:col:15631,NA,GH,GH,Harvard University Herbaria: All Records,PreservedSpecimen,NA,NA,"{huh_taxonomic_group: Vascular, huh_project_id: null, huh_project_name: null}",7a13c87c-f15f-4c9d-bcfd-fd7b23a0df46,barcode-00346571,NA,1480,B. M. Bartholomew,undetermined,NotDetermined,present,Sheet,in collection,,[see Simple Media extension],NA,8/28/83,NA,NA,1983,8,28,,,1480,North America;United States of America;California;Santa Clara County;,North America,NA,NA,United States of America,US,California,Santa Clara County,,10.8 km NE of State Route 35 (Skyline Boulevard) on Page Mill Road,10.8 km NE of State Route 35 (Skyline Boulevard) on Page Mill Road,170 m.,NA,NA,,NA,NA,,NA,,,,,NA,,Prunus ilicifolia (Nuttall ex Hooker & Arnott) D. N. F. Dietrich,Rosaceae,Prunus,ilicifolia,,(Nuttall ex Hooker & Arnott) D. N. F. Dietrich276,9eac001c-cade-4d38-bcb7-853da8eb21d9,http://purl.org/dc/dcmitype/PhysicalObject,42:17.0,en,https://huh.harvard.edu/pages/use,President and Fellows of Harvard College,https://huh.harvard.edu/access-digital-reproductions-works-public-domain,http://data.huh.harvard.edu/9eac001c-cade-4d38-bcb7-853da8eb21d9/image,urn:lsid:biocol.org:col:15631,urn:lsid:biocol.org:col:15631,NA,GH,GH,Harvard University Herbaria: All Records,PreservedSpecimen,NA,NA,"{huh_taxonomic_group: Vascular, huh_project_id: null, huh_project_name: null}",9eac001c-cade-4d38-bcb7-853da8eb21d9,barcode-00346562,NA,7418,A. A. Heller,undetermined,NotDetermined,present,"Sheet,Sheet",in collection,,[see Simple Media extension],NA,5/16/04,NA,NA,1904,5,16,,,7418,North America;United States of America;California;Santa Clara County;,North America,NA,NA,United States of America,US,California,Santa Clara County,,Between Alma and the Soda Spring,Between Alma and the Soda Spring,,NA,NA,,NA,NA,,NA,,,,,NA,,Prunus ilicifolia (Nuttall ex Hooker & Arnott) D. N. F. Dietrich,Rosaceae,Prunus,ilicifolia,,(Nuttall ex Hooker & Arnott) D. N. F. Dietrich277,425ca7bb-fa06-4c17-b630-0c6d6bafdd90,http://purl.org/dc/dcmitype/PhysicalObject,35:47.0,en,https://huh.harvard.edu/pages/use,President and Fellows of Harvard College,https://huh.harvard.edu/access-digital-reproductions-works-public-domain,http://data.huh.harvard.edu/425ca7bb-fa06-4c17-b630-0c6d6bafdd90/image,urn:lsid:biocol.org:col:15406,urn:lsid:biocol.org:col:15406,NA,A,A,Harvard University Herbaria: All Records,PreservedSpecimen,NA,NA,"{huh_taxonomic_group: Vascular, huh_project_id: null, huh_project_name: null}",425ca7bb-fa06-4c17-b630-0c6d6bafdd90,barcode-00346540,NA,,M. S. Clemens,undetermined,NotDetermined,present,Sheet,in collection,,[see Simple Media extension],NA,4/9/21,NA,NA,1921,4,9,,,,North America;United States of America;California;Santa Clara County;,North America,NA,NA,United States of America,US,California,Santa Clara County,,Morgan Hill,Morgan Hill,,NA,NA,,NA,NA,,NA,,,,,NA,,Prunus ilicifolia (Nuttall ex Hooker & Arnott) D. N. F. Dietrich,Rosaceae,Prunus,ilicifolia,,(Nuttall ex Hooker & Arnott) D. N. F. Dietrich278,d1d1e816-5cb2-4d89-9663-31eb452a9026,http://purl.org/dc/dcmitype/PhysicalObject,21:52.0,en,https://huh.harvard.edu/pages/use,President and Fellows of Harvard College,https://huh.harvard.edu/access-digital-reproductions-works-public-domain,http://data.huh.harvard.edu/d1d1e816-5cb2-4d89-9663-31eb452a9026/image,urn:lsid:biocol.org:col:15406,urn:lsid:biocol.org:col:15406,NA,A,A,Harvard University Herbaria: All Records,PreservedSpecimen,NA,NA,"{huh_taxonomic_group: Vascular, huh_project_id: null, huh_project_name: null}",d1d1e816-5cb2-4d89-9663-31eb452a9026,barcode-00346623,NA,3076,W. L. Jepson,undetermined,NotDetermined,present,Sheet,in collection,,[see Simple Media extension],NA,8/15/08,NA,NA,1908,8,15,,,3076,North America;United States of America;California;Solano County;,North America,NA,NA,United States of America,US,California,Solano County,,Cordelia,Cordelia,,NA,NA,,NA,NA,,NA,,,,,NA,,Prunus ilicifolia (Nuttall ex Hooker & Arnott) D. N. F. Dietrich,Rosaceae,Prunus,ilicifolia,,(Nuttall ex Hooker & Arnott) D. N. F. Dietrich279,48551a27-e224-44b1-a550-921697ed94f6,http://purl.org/dc/dcmitype/PhysicalObject,44:18.0,en,https://huh.harvard.edu/pages/use,President and Fellows of Harvard College,https://huh.harvard.edu/access-digital-reproductions-works-public-domain,http://data.huh.harvard.edu/48551a27-e224-44b1-a550-921697ed94f6/image,urn:lsid:biocol.org:col:15631,urn:lsid:biocol.org:col:15631,NA,GH,GH,Harvard University Herbaria: All Records,PreservedSpecimen,NA,NA,"{huh_taxonomic_group: Vascular, huh_project_id: null, huh_project_name: null}",48551a27-e224-44b1-a550-921697ed94f6,barcode-00346670,NA,,,,,present,Sheet,in collection,,[see Simple Media extension],NA,1895,NA,NA,1895,NA,NA,,,,North America;United States of America;California;Sonoma County;,North America,NA,NA,United States of America,US,California,Sonoma County,,Napa,Napa,,NA,NA,,NA,NA,,NA,,,,,NA,,Prunus ilicifolia (Nuttall ex Hooker & Arnott) D. N. F. Dietrich,Rosaceae,Prunus,ilicifolia,,(Nuttall ex Hooker & Arnott) D. N. F. Dietrich280,79ad931d-3037-4077-a7d3-d5e08f606d4c,http://purl.org/dc/dcmitype/PhysicalObject,11:05.0,en,https://huh.harvard.edu/pages/use,President and Fellows of Harvard College,https://huh.harvard.edu/access-digital-reproductions-works-public-domain,http://data.huh.harvard.edu/79ad931d-3037-4077-a7d3-d5e08f606d4c/image,urn:lsid:biocol.org:col:15406,urn:lsid:biocol.org:col:15406,NA,A,A,Harvard University Herbaria: All Records,PreservedSpecimen,NA,NA,"{huh_taxonomic_group: Vascular, huh_project_id: 7, huh_project_name: US and Canada - Mass Digitization}",79ad931d-3037-4077-a7d3-d5e08f606d4c,barcode-01722518,NA,,[data not captured],undetermined,NotDetermined,present,Sheet,in collection,,[see Simple Media extension],NA,,NA,NA,NA,NA,NA,,,,North America;United States of America;Missouri;Stone County;,North America,NA,NA,United States of America,US,Missouri,Stone County,,[data not captured],[data not captured],,NA,NA,,NA,NA,,NA,,,,,NA,,Prunus mexicana S. Watson,Rosaceae,Prunus,mexicana,,S. Watson281,04e2a654-180f-4a4f-8c70-247c5f6a3b84,http://purl.org/dc/dcmitype/PhysicalObject,14:01.0,en,https://huh.harvard.edu/pages/use,President and Fellows of Harvard College,https://huh.harvard.edu/access-digital-reproductions-works-public-domain,http://data.huh.harvard.edu/04e2a654-180f-4a4f-8c70-247c5f6a3b84/image,urn:lsid:biocol.org:col:15631,urn:lsid:biocol.org:col:15631,NA,GH,GH,Harvard University Herbaria: All Records,PreservedSpecimen,NA,NA,"{huh_taxonomic_group: Vascular, huh_project_id: 7, huh_project_name: US and Canada - Mass Digitization}",04e2a654-180f-4a4f-8c70-247c5f6a3b84,barcode-01722521,NA,,[data not captured],undetermined,NotDetermined,present,Sheet,in collection,,[see Simple Media extension],NA,,NA,NA,NA,NA,NA,,,,North America;United States of America;Missouri;Stone County;,North America,NA,NA,United States of America,US,Missouri,Stone County,,[data not captured],[data not captured],,NA,NA,,NA,NA,,NA,,,,,NA,,Prunus mexicana S. Watson,Rosaceae,Prunus,mexicana,,S. Watson282,ecaf981e-b19d-47a8-a238-fbe0cb55e86c,http://purl.org/dc/dcmitype/PhysicalObject,10:33.0,en,https://huh.harvard.edu/pages/use,President and Fellows of Harvard College,https://huh.harvard.edu/access-digital-reproductions-works-public-domain,http://data.huh.harvard.edu/ecaf981e-b19d-47a8-a238-fbe0cb55e86c/image,urn:lsid:biocol.org:col:15406,urn:lsid:biocol.org:col:15406,NA,A,A,Harvard University Herbaria: All Records,PreservedSpecimen,NA,NA,"{huh_taxonomic_group: Vascular, huh_project_id: 7, huh_project_name: US and Canada - Mass Digitization}",ecaf981e-b19d-47a8-a238-fbe0cb55e86c,barcode-01722517,NA,,[data not captured],undetermined,NotDetermined,present,Sheet,in collection,,[see Simple Media extension],NA,,NA,NA,NA,NA,NA,,,,North America;United States of America;Missouri;Taney County;,North America,NA,NA,United States of America,US,Missouri,Taney County,,[data not captured],[data not captured],,NA,NA,,NA,NA,,NA,,,,,NA,,Prunus mexicana S. Watson,Rosaceae,Prunus,mexicana,,S. Watson283,f13569cd-0d0c-4a81-abd2-230ae64133ec,http://purl.org/dc/dcmitype/PhysicalObject,11:27.0,en,https://huh.harvard.edu/pages/use,President and Fellows of Harvard College,https://huh.harvard.edu/access-digital-reproductions-works-public-domain,http://data.huh.harvard.edu/f13569cd-0d0c-4a81-abd2-230ae64133ec/image,urn:lsid:biocol.org:col:15406,urn:lsid:biocol.org:col:15406,NA,A,A,Harvard University Herbaria: All Records,PreservedSpecimen,NA,NA,"{huh_taxonomic_group: Vascular, huh_project_id: 7, huh_project_name: US and Canada - Mass Digitization}",f13569cd-0d0c-4a81-abd2-230ae64133ec,barcode-01722519,NA,,[data not captured],undetermined,NotDetermined,present,Sheet,in collection,,[see Simple Media extension],NA,,NA,NA,NA,NA,NA,,,,North America;United States of America;Missouri;Taney County;,North America,NA,NA,United States of America,US,Missouri,Taney County,,[data not captured],[data not captured],,NA,NA,,NA,NA,,NA,,,,,NA,,Prunus mexicana S. Watson,Rosaceae,Prunus,mexicana,,S. Watson284,45bdd447-96ee-4ec7-988a-d05304a80e20,http://purl.org/dc/dcmitype/PhysicalObject,17:58.0,en,https://huh.harvard.edu/pages/use,President and Fellows of Harvard College,https://huh.harvard.edu/access-digital-reproductions-works-public-domain,http://data.huh.harvard.edu/45bdd447-96ee-4ec7-988a-d05304a80e20/image,urn:lsid:biocol.org:col:15631,urn:lsid:biocol.org:col:15631,NA,GH,GH,Harvard University Herbaria: All Records,PreservedSpecimen,NA,NA,"{huh_taxonomic_group: Vascular, huh_project_id: 7, huh_project_name: US and Canada - Mass Digitization}",45bdd447-96ee-4ec7-988a-d05304a80e20,barcode-01722644,NA,194,A. Ruth,undetermined,NotDetermined,present,Sheet,in collection,,[see Simple Media extension],NA,9/30/10,NA,NA,1910,9,30,,Rocky wood,194,North America;United States of America;Texas;Tarrant County;,North America,NA,NA,United States of America,US,Texas,Tarrant County,,Tarrant Co.,Tarrant Co.,,NA,NA,,NA,NA,,NA,"H. J. Bickley, Jr.",1976-04,,,NA,,Prunus mexicana S. Watson,Rosaceae,Prunus,mexicana,,S. Watson285,f2625062-e1a8-4788-bf11-ea158a65e120,http://purl.org/dc/dcmitype/PhysicalObject,18:44.0,en,https://huh.harvard.edu/pages/use,President and Fellows of Harvard College,https://huh.harvard.edu/access-digital-reproductions-works-public-domain,http://data.huh.harvard.edu/f2625062-e1a8-4788-bf11-ea158a65e120/image,urn:lsid:biocol.org:col:15631,urn:lsid:biocol.org:col:15631,NA,GH,GH,Harvard University Herbaria: All Records,PreservedSpecimen,NA,NA,"{huh_taxonomic_group: Vascular, huh_project_id: 7, huh_project_name: US and Canada - Mass Digitization}",f2625062-e1a8-4788-bf11-ea158a65e120,barcode-01722646,NA,194,A. Ruth,undetermined,NotDetermined,present,Sheet,in collection,,[see Simple Media extension],NA,9/25/22,NA,NA,1922,9,25,,In open woods,194,North America;United States of America;Texas;Tarrant County;,North America,NA,NA,United States of America,US,Texas,Tarrant County,,Tarrant Co.,Tarrant Co.,,NA,NA,,NA,NA,,NA,"H. J. Bickley, Jr.",1976-04,,,NA,,Prunus mexicana S. Watson,Rosaceae,Prunus,mexicana,,S. Watson286,8328cbf5-9aa9-4445-8de4-bfb7f1a8aeb1,http://purl.org/dc/dcmitype/PhysicalObject,19:30.0,en,https://huh.harvard.edu/pages/use,President and Fellows of Harvard College,https://huh.harvard.edu/access-digital-reproductions-works-public-domain,http://data.huh.harvard.edu/8328cbf5-9aa9-4445-8de4-bfb7f1a8aeb1/image,urn:lsid:biocol.org:col:15631,urn:lsid:biocol.org:col:15631,NA,GH,GH,Harvard University Herbaria: All Records,PreservedSpecimen,NA,NA,"{huh_taxonomic_group: Vascular, huh_project_id: 7, huh_project_name: US and Canada - Mass Digitization}",8328cbf5-9aa9-4445-8de4-bfb7f1a8aeb1,barcode-01722739,NA,53825,V. L. Cory,undetermined,NotDetermined,present,Sheet,in collection,,[see Simple Media extension],NA,6/11/47,NA,NA,1947,6,11,,in woods,53825,North America;United States of America;Texas;Tarrant County;,North America,NA,NA,United States of America,US,Texas,Tarrant County,,west side of Lake Worth,west side of Lake Worth,,NA,NA,,NA,NA,,NA,,,,,NA,,Prunus mexicana S. Watson,Rosaceae,Prunus,mexicana,,S. Watson287,e49f34d1-ef6e-4406-9153-08ccca091d0f,http://purl.org/dc/dcmitype/PhysicalObject,52:03.0,en,https://huh.harvard.edu/pages/use,President and Fellows of Harvard College,https://huh.harvard.edu/access-digital-reproductions-works-public-domain,http://data.huh.harvard.edu/e49f34d1-ef6e-4406-9153-08ccca091d0f/image,urn:lsid:biocol.org:col:15406,urn:lsid:biocol.org:col:15406,NA,A,A,Harvard University Herbaria: All Records,PreservedSpecimen,NA,NA,"{huh_taxonomic_group: Vascular, huh_project_id: 7, huh_project_name: US and Canada - Mass Digitization}",e49f34d1-ef6e-4406-9153-08ccca091d0f,barcode-01722582,NA,10767,E. J. Palmer,undetermined,NotDetermined,present,Sheet,in collection,,[see Simple Media extension],NA,9/22/16,NA,NA,1916,9,22,,Along streams,10767,North America;United States of America;Texas;Travis County;,North America,NA,NA,United States of America,US,Texas,Travis County,,Austin,Austin,,NA,NA,,NA,NA,,NA,,,,,NA,,Prunus mexicana S. Watson,Rosaceae,Prunus,mexicana,,S. Watson288,2e08addf-cae3-441a-958e-d6af16ebe2d3,http://purl.org/dc/dcmitype/PhysicalObject,53:42.0,en,https://huh.harvard.edu/pages/use,President and Fellows of Harvard College,https://huh.harvard.edu/access-digital-reproductions-works-public-domain,http://data.huh.harvard.edu/2e08addf-cae3-441a-958e-d6af16ebe2d3/image,urn:lsid:biocol.org:col:15406,urn:lsid:biocol.org:col:15406,NA,A,A,Harvard University Herbaria: All Records,PreservedSpecimen,NA,NA,"{huh_taxonomic_group: Vascular, huh_project_id: 7, huh_project_name: US and Canada - Mass Digitization}",2e08addf-cae3-441a-958e-d6af16ebe2d3,barcode-01722583,NA,,C. S. Sargent,undetermined,NotDetermined,present,Sheet,in collection,,[see Simple Media extension],NA,1885-03-30,NA,NA,1885,3,30,,,,North America;United States of America;Texas;Travis County;,North America,NA,NA,United States of America,US,Texas,Travis County,Austin,[no additional data],[no additional data],,NA,NA,,NA,NA,,NA,,,,,NA,,Prunus mexicana S. Watson,Rosaceae,Prunus,mexicana,,S. Watson289,469caf94-ac93-43e5-bc16-e4f49fc99932,http://purl.org/dc/dcmitype/PhysicalObject,55:27.0,en,https://huh.harvard.edu/pages/use,President and Fellows of Harvard College,https://huh.harvard.edu/access-digital-reproductions-works-public-domain,http://data.huh.harvard.edu/469caf94-ac93-43e5-bc16-e4f49fc99932/image,urn:lsid:biocol.org:col:15406,urn:lsid:biocol.org:col:15406,NA,A,A,Harvard University Herbaria: All Records,PreservedSpecimen,NA,NA,"{huh_taxonomic_group: Vascular, huh_project_id: 7, huh_project_name: US and Canada - Mass Digitization}",469caf94-ac93-43e5-bc16-e4f49fc99932,barcode-01722584,NA,3357,P. L. Ricker,undetermined,NotDetermined,present,Sheet,in collection,,[see Simple Media extension],NA,4/1/10,NA,NA,1910,4,1,,,3357,North America;United States of America;Texas;Travis County;,North America,NA,NA,United States of America,US,Texas,Travis County,Austin,[no additional data],[no additional data],,NA,NA,,NA,NA,,NA,,,,,NA,,Prunus mexicana S. Watson,Rosaceae,Prunus,mexicana,,S. Watson290,7b338a79-4be0-41ca-8ce5-d08f277f29b1,http://purl.org/dc/dcmitype/PhysicalObject,15:49.0,en,https://huh.harvard.edu/pages/use,President and Fellows of Harvard College,https://huh.harvard.edu/access-digital-reproductions-works-public-domain,http://data.huh.harvard.edu/7b338a79-4be0-41ca-8ce5-d08f277f29b1/image,urn:lsid:biocol.org:col:15631,urn:lsid:biocol.org:col:15631,NA,GH,GH,Harvard University Herbaria: All Records,PreservedSpecimen,NA,NA,"{huh_taxonomic_group: Vascular, huh_project_id: 7, huh_project_name: US and Canada - Mass Digitization}",7b338a79-4be0-41ca-8ce5-d08f277f29b1,barcode-01722677,NA,363,R. R. Innes,undetermined,NotDetermined,present,Sheet,in collection,,[see Simple Media extension],NA,3/5/41,NA,NA,1941,3,5,,In oak woods; limestone & alluvial soil,363,North America;United States of America;Texas;Travis County;,North America,NA,NA,United States of America,US,Texas,Travis County,,Outskirts of Austin,Outskirts of Austin,,NA,NA,,NA,NA,,NA,,12/6/41,,,NA,,Prunus mexicana S. Watson,Rosaceae,Prunus,mexicana,,S. Watson291,6617f3f7-63b4-4a70-9fe1-ce6629f5faf5,http://purl.org/dc/dcmitype/PhysicalObject,03:27.0,en,https://huh.harvard.edu/pages/use,President and Fellows of Harvard College,https://huh.harvard.edu/access-digital-reproductions-works-public-domain,http://data.huh.harvard.edu/6617f3f7-63b4-4a70-9fe1-ce6629f5faf5/image,urn:lsid:biocol.org:col:15631,urn:lsid:biocol.org:col:15631,NA,GH,GH,Harvard University Herbaria: All Records,PreservedSpecimen,NA,NA,"{huh_taxonomic_group: Vascular, huh_project_id: 7, huh_project_name: US and Canada - Mass Digitization}",6617f3f7-63b4-4a70-9fe1-ce6629f5faf5,barcode-01722508,NA,,[data not captured],undetermined,NotDetermined,present,Sheet,in collection,,[see Simple Media extension],NA,,NA,NA,NA,NA,NA,,,,North America;United States of America;Louisiana;Union County;,North America,NA,NA,United States of America,US,Louisiana,Union County,,[data not captured],[data not captured],,NA,NA,,NA,NA,,NA,,,,,NA,,Prunus mexicana S. Watson,Rosaceae,Prunus,mexicana,,S. Watson292,e0be08d2-5360-42ca-9cd8-404df088a311,http://purl.org/dc/dcmitype/PhysicalObject,42:40.0,en,https://huh.harvard.edu/pages/use,President and Fellows of Harvard College,https://huh.harvard.edu/access-digital-reproductions-works-public-domain,http://data.huh.harvard.edu/e0be08d2-5360-42ca-9cd8-404df088a311/image,urn:lsid:biocol.org:col:15406,urn:lsid:biocol.org:col:15406,NA,A,A,Harvard University Herbaria: All Records,PreservedSpecimen,NA,NA,"{huh_taxonomic_group: Vascular, huh_project_id: 7, huh_project_name: US and Canada - Mass Digitization}",e0be08d2-5360-42ca-9cd8-404df088a311,barcode-01722482,NA,,[data not captured],undetermined,NotDetermined,present,Sheet,in collection,,[see Simple Media extension],NA,,NA,NA,NA,NA,NA,,,,North America;United States of America;Arkansas;Van Buren County;,North America,NA,NA,United States of America,US,Arkansas,Van Buren County,,[data not captured],[data not captured],,NA,NA,,NA,NA,,NA,,,,,NA,,Prunus mexicana S. Watson,Rosaceae,Prunus,mexicana,,S. Watson293,9931a62f-e6f2-4dca-a8bd-1826b16599a9,http://purl.org/dc/dcmitype/PhysicalObject,42:58.0,en,https://huh.harvard.edu/pages/use,President and Fellows of Harvard College,https://huh.harvard.edu/access-digital-reproductions-works-public-domain,http://data.huh.harvard.edu/9931a62f-e6f2-4dca-a8bd-1826b16599a9/image,urn:lsid:biocol.org:col:15406,urn:lsid:biocol.org:col:15406,NA,A,A,Harvard University Herbaria: All Records,PreservedSpecimen,NA,NA,"{huh_taxonomic_group: Vascular, huh_project_id: 7, huh_project_name: US and Canada - Mass Digitization}",9931a62f-e6f2-4dca-a8bd-1826b16599a9,barcode-01722483,NA,,[data not captured],undetermined,NotDetermined,present,Sheet,in collection,,[see Simple Media extension],NA,,NA,NA,NA,NA,NA,,,,North America;United States of America;Arkansas;Van Buren County;,North America,NA,NA,United States of America,US,Arkansas,Van Buren County,,[data not captured],[data not captured],,NA,NA,,NA,NA,,NA,,,,,NA,,Prunus mexicana S. Watson,Rosaceae,Prunus,mexicana,,S. Watson294,1df2b8af-ecd3-4024-94f7-a93da28a000b,http://purl.org/dc/dcmitype/PhysicalObject,56:47.0,en,https://huh.harvard.edu/pages/use,President and Fellows of Harvard College,https://huh.harvard.edu/access-digital-reproductions-works-public-domain,http://data.huh.harvard.edu/1df2b8af-ecd3-4024-94f7-a93da28a000b/image,urn:lsid:biocol.org:col:15406,urn:lsid:biocol.org:col:15406,NA,A,A,Harvard University Herbaria: All Records,PreservedSpecimen,NA,NA,"{huh_taxonomic_group: Vascular, huh_project_id: null, huh_project_name: null}",1df2b8af-ecd3-4024-94f7-a93da28a000b,barcode-00346669,NA,,C. C. Epling & L. Ellison,undetermined,NotDetermined,present,Sheet,in collection,,[see Simple Media extension],NA,4/14/29,NA,NA,1929,4,14,,,,North America;United States of America;California;Ventura County;,North America,NA,NA,United States of America,US,California,Ventura County,,"Lower Sespe Cr., Sta. Barbara Natl. For.","Lower Sespe Cr., Sta. Barbara Natl. For.",,NA,NA,,NA,NA,,NA,,,,,NA,,Prunus ilicifolia (Nuttall ex Hooker & Arnott) D. N. F. Dietrich,Rosaceae,Prunus,ilicifolia,,(Nuttall ex Hooker & Arnott) D. N. F. Dietrich295,3d1ea4ff-211b-4e3f-b543-c8d86884a034,http://purl.org/dc/dcmitype/PhysicalObject,59:38.0,en,https://huh.harvard.edu/pages/use,President and Fellows of Harvard College,https://huh.harvard.edu/access-digital-reproductions-works-public-domain,http://data.huh.harvard.edu/3d1ea4ff-211b-4e3f-b543-c8d86884a034/image,urn:lsid:biocol.org:col:15406,urn:lsid:biocol.org:col:15406,NA,A,A,Harvard University Herbaria: All Records,PreservedSpecimen,NA,NA,"{huh_taxonomic_group: Vascular, huh_project_id: null, huh_project_name: null}",3d1ea4ff-211b-4e3f-b543-c8d86884a034,barcode-00346614,NA,,B. W. Evermann,undetermined,NotDetermined,present,Sheet,in collection,,[see Simple Media extension],NA,1914-09,NA,NA,1914,9,NA,,,,North America;United States of America;California;Ventura County;,North America,NA,NA,United States of America,US,California,Ventura County,,Sespe Canyon,Sespe Canyon,,NA,NA,,NA,NA,,NA,,,,,NA,,Prunus ilicifolia (Nuttall ex Hooker & Arnott) D. N. F. Dietrich,Rosaceae,Prunus,ilicifolia,,(Nuttall ex Hooker & Arnott) D. N. F. Dietrich296,257a1e5b-5369-449b-955e-19085383cd73,http://purl.org/dc/dcmitype/PhysicalObject,35:18.0,en,https://huh.harvard.edu/pages/use,President and Fellows of Harvard College,https://huh.harvard.edu/access-digital-reproductions-works-public-domain,http://data.huh.harvard.edu/257a1e5b-5369-449b-955e-19085383cd73/image,urn:lsid:biocol.org:col:15406,urn:lsid:biocol.org:col:15406,NA,A,A,Harvard University Herbaria: All Records,PreservedSpecimen,NA,NA,"{huh_taxonomic_group: Vascular, huh_project_id: null, huh_project_name: null}",257a1e5b-5369-449b-955e-19085383cd73,barcode-00346607,NA,,B. Clear,undetermined,NotDetermined,present,Sheet,in collection,,[see Simple Media extension],NA,4/27/40,NA,NA,1940,4,27,,,,North America;United States of America;California;Ventura County;,North America,NA,NA,United States of America,US,California,Ventura County,,"near Summit, Pine Mt.","near Summit, Pine Mt.",,NA,NA,,NA,NA,,NA,,,,,NA,,Prunus ilicifolia (Nuttall ex Hooker & Arnott) D. N. F. Dietrich,Rosaceae,Prunus,ilicifolia,,(Nuttall ex Hooker & Arnott) D. N. F. Dietrich297,71225e82-86f4-4312-bd84-851cfd097183,http://purl.org/dc/dcmitype/PhysicalObject,17:45.0,en,https://huh.harvard.edu/pages/use,President and Fellows of Harvard College,https://huh.harvard.edu/access-digital-reproductions-works-public-domain,http://data.huh.harvard.edu/71225e82-86f4-4312-bd84-851cfd097183/image,urn:lsid:biocol.org:col:15631,urn:lsid:biocol.org:col:15631,NA,GH,GH,Harvard University Herbaria: All Records,PreservedSpecimen,NA,NA,"{huh_taxonomic_group: Vascular, huh_project_id: 7, huh_project_name: US and Canada - Mass Digitization}",71225e82-86f4-4312-bd84-851cfd097183,barcode-01722581,NA,18425,S. R. Hill,undetermined,NotDetermined,present,Sheet,in collection,,[see Simple Media extension],NA,7/31/87,NA,NA,1987,7,31,,"Alluvial woodland, sand ridges, marshes",18425,North America;United States of America;Texas;Victoria County;,North America,NA,NA,United States of America,US,Texas,Victoria County,,O'Connor Ranch. Coleto Creek bottoms N of Fleming Prairie Road W of Rte. 77. SW of Victorial,O'Connor Ranch. Coleto Creek bottoms N of Fleming Prairie Road W of Rte. 77. SW of Victorial,,NA,NA,,NA,NA,,NA,,1987-10,,,NA,,Prunus mexicana S. Watson,Rosaceae,Prunus,mexicana,,S. Watson298,20d011d4-3152-435f-bd2e-db3b05319f12,http://purl.org/dc/dcmitype/PhysicalObject,02:26.0,en,https://huh.harvard.edu/pages/use,President and Fellows of Harvard College,https://huh.harvard.edu/access-digital-reproductions-works-public-domain,http://data.huh.harvard.edu/20d011d4-3152-435f-bd2e-db3b05319f12/image,urn:lsid:biocol.org:col:15406,urn:lsid:biocol.org:col:15406,NA,A,A,Harvard University Herbaria: All Records,PreservedSpecimen,NA,NA,"{huh_taxonomic_group: Vascular, huh_project_id: 7, huh_project_name: US and Canada - Mass Digitization}",20d011d4-3152-435f-bd2e-db3b05319f12,barcode-01722718,NA,3309,P. L. Ricker,undetermined,NotDetermined,present,Sheet,in collection,,[see Simple Media extension],NA,3/23/10,NA,NA,1910,3,23,,,3309,North America;United States of America;Texas;Victoria County;,North America,NA,NA,United States of America,US,Texas,Victoria County,Victoria,[no additional data],[no additional data],,NA,NA,,NA,NA,,NA,,,,,NA,,Prunus mexicana S. Watson,Rosaceae,Prunus,mexicana,,S. Watson299,4758694b-8eeb-40fc-93e1-94916524c616,http://purl.org/dc/dcmitype/PhysicalObject,03:09.0,en,https://huh.harvard.edu/pages/use,President and Fellows of Harvard College,https://huh.harvard.edu/access-digital-reproductions-works-public-domain,http://data.huh.harvard.edu/4758694b-8eeb-40fc-93e1-94916524c616/image,urn:lsid:biocol.org:col:15406,urn:lsid:biocol.org:col:15406,NA,A,A,Harvard University Herbaria: All Records,PreservedSpecimen,NA,NA,"{huh_taxonomic_group: Vascular, huh_project_id: 7, huh_project_name: US and Canada - Mass Digitization}",4758694b-8eeb-40fc-93e1-94916524c616,barcode-01722719,NA,3309,P. L. Ricker,undetermined,NotDetermined,present,Sheet,in collection,,[see Simple Media extension],NA,3/23/10,NA,NA,1910,3,23,,,3309,North America;United States of America;Texas;Victoria County;,North America,NA,NA,United States of America,US,Texas,Victoria County,Victoria,[no additional data],[no additional data],,NA,NA,,NA,NA,,NA,,,,,NA,,Prunus mexicana S. Watson,Rosaceae,Prunus,mexicana,,S. Watson300,00e79484-a81b-433a-bc11-272f1fee8f06,http://purl.org/dc/dcmitype/PhysicalObject,03:58.0,en,https://huh.harvard.edu/pages/use,President and Fellows of Harvard College,https://huh.harvard.edu/access-digital-reproductions-works-public-domain,http://data.huh.harvard.edu/00e79484-a81b-433a-bc11-272f1fee8f06/image,urn:lsid:biocol.org:col:15406,urn:lsid:biocol.org:col:15406,NA,A,A,Harvard University Herbaria: All Records,PreservedSpecimen,NA,NA,"{huh_taxonomic_group: Vascular, huh_project_id: 7, huh_project_name: US and Canada - Mass Digitization}",00e79484-a81b-433a-bc11-272f1fee8f06,barcode-01722720,NA,3313,P. L. Ricker,undetermined,NotDetermined,present,Sheet,in collection,,[see Simple Media extension],NA,3/24/10,NA,NA,1910,3,24,,,3313,North America;United States of America;Texas;Victoria County;,North America,NA,NA,United States of America,US,Texas,Victoria County,Victoria,[no additional data],[no additional data],,NA,NA,,NA,NA,,NA,,,,,NA,,Prunus mexicana S. Watson,Rosaceae,Prunus,mexicana,,S. Watson301,0d1bedd5-49fe-449e-a7e8-ea205d8425cc,http://purl.org/dc/dcmitype/PhysicalObject,04:43.0,en,https://huh.harvard.edu/pages/use,President and Fellows of Harvard College,https://huh.harvard.edu/access-digital-reproductions-works-public-domain,http://data.huh.harvard.edu/0d1bedd5-49fe-449e-a7e8-ea205d8425cc/image,urn:lsid:biocol.org:col:15406,urn:lsid:biocol.org:col:15406,NA,A,A,Harvard University Herbaria: All Records,PreservedSpecimen,NA,NA,"{huh_taxonomic_group: Vascular, huh_project_id: 7, huh_project_name: US and Canada - Mass Digitization}",0d1bedd5-49fe-449e-a7e8-ea205d8425cc,barcode-01722721,NA,3212,P. L. Ricker,undetermined,NotDetermined,present,Sheet,in collection,,[see Simple Media extension],NA,3/24/10,NA,NA,1910,3,24,,,3212,North America;United States of America;Texas;Victoria County;,North America,NA,NA,United States of America,US,Texas,Victoria County,Victoria,[no additional data],[no additional data],,NA,NA,,NA,NA,,NA,,,,,NA,,Prunus mexicana S. Watson,Rosaceae,Prunus,mexicana,,S. Watson302,1b2c7168-50fa-48a6-917e-209eed72b0de,http://purl.org/dc/dcmitype/PhysicalObject,05:23.0,en,https://huh.harvard.edu/pages/use,President and Fellows of Harvard College,https://huh.harvard.edu/access-digital-reproductions-works-public-domain,http://data.huh.harvard.edu/1b2c7168-50fa-48a6-917e-209eed72b0de/image,urn:lsid:biocol.org:col:15406,urn:lsid:biocol.org:col:15406,NA,A,A,Harvard University Herbaria: All Records,PreservedSpecimen,NA,NA,"{huh_taxonomic_group: Vascular, huh_project_id: 7, huh_project_name: US and Canada - Mass Digitization}",1b2c7168-50fa-48a6-917e-209eed72b0de,barcode-01722722,NA,3311,P. L. Ricker,undetermined,NotDetermined,present,Sheet,in collection,,[see Simple Media extension],NA,3/23/10,NA,NA,1910,3,23,,,3311,North America;United States of America;Texas;Victoria County;,North America,NA,NA,United States of America,US,Texas,Victoria County,Victoria,[no additional data],[no additional data],,NA,NA,,NA,NA,,NA,,,,,NA,,Prunus mexicana S. Watson,Rosaceae,Prunus,mexicana,,S. Watson303,e58607cf-b946-4d54-83be-b7c6d5b75477,http://purl.org/dc/dcmitype/PhysicalObject,06:06.0,en,https://huh.harvard.edu/pages/use,President and Fellows of Harvard College,https://huh.harvard.edu/access-digital-reproductions-works-public-domain,http://data.huh.harvard.edu/e58607cf-b946-4d54-83be-b7c6d5b75477/image,urn:lsid:biocol.org:col:15406,urn:lsid:biocol.org:col:15406,NA,A,A,Harvard University Herbaria: All Records,PreservedSpecimen,NA,NA,"{huh_taxonomic_group: Vascular, huh_project_id: 7, huh_project_name: US and Canada - Mass Digitization}",e58607cf-b946-4d54-83be-b7c6d5b75477,barcode-01722723,NA,3310,P. L. Ricker,undetermined,NotDetermined,present,Sheet,in collection,,[see Simple Media extension],NA,3/23/10,NA,NA,1910,3,23,,,3310,North America;United States of America;Texas;Victoria County;,North America,NA,NA,United States of America,US,Texas,Victoria County,Victoria,[no additional data],[no additional data],,NA,NA,,NA,NA,,NA,,,,,NA,,Prunus mexicana S. Watson,Rosaceae,Prunus,mexicana,,S. Watson304,2fbf683b-fd9a-43c5-bc96-51425ac2180f,http://purl.org/dc/dcmitype/PhysicalObject,07:01.0,en,https://huh.harvard.edu/pages/use,President and Fellows of Harvard College,https://huh.harvard.edu/access-digital-reproductions-works-public-domain,http://data.huh.harvard.edu/2fbf683b-fd9a-43c5-bc96-51425ac2180f/image,urn:lsid:biocol.org:col:15406,urn:lsid:biocol.org:col:15406,NA,A,A,Harvard University Herbaria: All Records,PreservedSpecimen,NA,NA,"{huh_taxonomic_group: Vascular, huh_project_id: 7, huh_project_name: US and Canada - Mass Digitization}",2fbf683b-fd9a-43c5-bc96-51425ac2180f,barcode-01722724,NA,3317,P. L. Ricker,undetermined,NotDetermined,present,Sheet,in collection,,[see Simple Media extension],NA,3/24/10,NA,NA,1910,3,24,,,3317,North America;United States of America;Texas;Victoria County;,North America,NA,NA,United States of America,US,Texas,Victoria County,Victoria,[no additional data],[no additional data],,NA,NA,,NA,NA,,NA,,,,,NA,,Prunus mexicana S. Watson,Rosaceae,Prunus,mexicana,,S. Watson305,4087f93c-ffad-4eb5-8d8a-501037fd9872,http://purl.org/dc/dcmitype/PhysicalObject,08:14.0,en,https://huh.harvard.edu/pages/use,President and Fellows of Harvard College,https://huh.harvard.edu/access-digital-reproductions-works-public-domain,http://data.huh.harvard.edu/4087f93c-ffad-4eb5-8d8a-501037fd9872/image,urn:lsid:biocol.org:col:15406,urn:lsid:biocol.org:col:15406,NA,A,A,Harvard University Herbaria: All Records,PreservedSpecimen,NA,NA,"{huh_taxonomic_group: Vascular, huh_project_id: 7, huh_project_name: US and Canada - Mass Digitization}",4087f93c-ffad-4eb5-8d8a-501037fd9872,barcode-01722725,NA,3307,P. L. Ricker,undetermined,NotDetermined,present,Sheet,in collection,,[see Simple Media extension],NA,3/23/10,NA,NA,1910,3,23,,,3307,North America;United States of America;Texas;Victoria County;,North America,NA,NA,United States of America,US,Texas,Victoria County,Victoria,[no additional data],[no additional data],,NA,NA,,NA,NA,,NA,,,,,NA,,Prunus mexicana S. Watson,Rosaceae,Prunus,mexicana,,S. Watson306,5e36a9ba-3a7f-4fec-9693-10b0c9a79436,http://purl.org/dc/dcmitype/PhysicalObject,09:24.0,en,https://huh.harvard.edu/pages/use,President and Fellows of Harvard College,https://huh.harvard.edu/access-digital-reproductions-works-public-domain,http://data.huh.harvard.edu/5e36a9ba-3a7f-4fec-9693-10b0c9a79436/image,urn:lsid:biocol.org:col:15406,urn:lsid:biocol.org:col:15406,NA,A,A,Harvard University Herbaria: All Records,PreservedSpecimen,NA,NA,"{huh_taxonomic_group: Vascular, huh_project_id: 7, huh_project_name: US and Canada - Mass Digitization}",5e36a9ba-3a7f-4fec-9693-10b0c9a79436,barcode-01722726,NA,3308,P. L. Ricker,undetermined,NotDetermined,present,Sheet,in collection,,[see Simple Media extension],NA,3/23/10,NA,NA,1910,3,23,,,3308,North America;United States of America;Texas;Victoria County;,North America,NA,NA,United States of America,US,Texas,Victoria County,Victoria,[no additional data],[no additional data],,NA,NA,,NA,NA,,NA,,,,,NA,,Prunus mexicana S. Watson,Rosaceae,Prunus,mexicana,,S. Watson307,0a3e2688-23dd-4b0f-ba77-2083b297d009,http://purl.org/dc/dcmitype/PhysicalObject,18:15.0,en,https://huh.harvard.edu/pages/use,President and Fellows of Harvard College,https://huh.harvard.edu/access-digital-reproductions-works-public-domain,http://data.huh.harvard.edu/0a3e2688-23dd-4b0f-ba77-2083b297d009/image,urn:lsid:biocol.org:col:15406,urn:lsid:biocol.org:col:15406,NA,A,A,Harvard University Herbaria: All Records,PreservedSpecimen,NA,NA,"{huh_taxonomic_group: Vascular, huh_project_id: 7, huh_project_name: US and Canada - Mass Digitization}",0a3e2688-23dd-4b0f-ba77-2083b297d009,barcode-01722727,NA,9212,E. J. Palmer,undetermined,NotDetermined,present,Sheet,in collection,,[see Simple Media extension],NA,3/19/16,NA,NA,1916,3,19,,Low woods,9212,North America;United States of America;Texas;Victoria County;,North America,NA,NA,United States of America,US,Texas,Victoria County,,Victoria,Victoria,,NA,NA,,NA,NA,,NA,,,,,NA,,Prunus mexicana S. Watson,Rosaceae,Prunus,mexicana,,S. Watson308,66b76355-6ad7-4399-adc6-a913afd60348,http://purl.org/dc/dcmitype/PhysicalObject,18:41.0,en,https://huh.harvard.edu/pages/use,President and Fellows of Harvard College,https://huh.harvard.edu/access-digital-reproductions-works-public-domain,http://data.huh.harvard.edu/66b76355-6ad7-4399-adc6-a913afd60348/image,urn:lsid:biocol.org:col:15406,urn:lsid:biocol.org:col:15406,NA,A,A,Harvard University Herbaria: All Records,PreservedSpecimen,NA,NA,"{huh_taxonomic_group: Vascular, huh_project_id: 7, huh_project_name: US and Canada - Mass Digitization}",66b76355-6ad7-4399-adc6-a913afd60348,barcode-01722728,NA,9170,E. J. Palmer,undetermined,NotDetermined,present,Sheet,in collection,,[see Simple Media extension],NA,3/14/16,NA,NA,1916,3,14,,Low woods,9170,North America;United States of America;Texas;Victoria County;,North America,NA,NA,United States of America,US,Texas,Victoria County,,Victoria,Victoria,,NA,NA,,NA,NA,,NA,,,,,NA,,Prunus mexicana S. Watson,Rosaceae,Prunus,mexicana,,S. Watson309,8721ff4a-6d1e-460c-8dfb-9dcddcc5a2b7,http://purl.org/dc/dcmitype/PhysicalObject,14:55.0,en,https://huh.harvard.edu/pages/use,President and Fellows of Harvard College,https://huh.harvard.edu/access-digital-reproductions-works-public-domain,http://data.huh.harvard.edu/8721ff4a-6d1e-460c-8dfb-9dcddcc5a2b7/image,urn:lsid:biocol.org:col:15631,urn:lsid:biocol.org:col:15631,NA,GH,GH,Harvard University Herbaria: All Records,PreservedSpecimen,NA,NA,"{huh_taxonomic_group: Vascular, huh_project_id: 7, huh_project_name: US and Canada - Mass Digitization}",8721ff4a-6d1e-460c-8dfb-9dcddcc5a2b7,barcode-01722701,NA,399,R. A. Dixon,undetermined,NotDetermined,present,Sheet,in collection,,[see Simple Media extension],NA,1909-07-09/1909-07-12,NA,NA,NA,NA,NA,,,399,North America;United States of America;Texas;Walker County;,North America,NA,NA,United States of America,US,Texas,Walker County,,Vicinity of Huntsville,Vicinity of Huntsville,,NA,NA,,NA,NA,,NA,,,,,NA,,Prunus mexicana S. Watson,Rosaceae,Prunus,mexicana,,S. Watson310,06e6912f-dfcd-4576-bc0e-f6b7d0092e3e,http://purl.org/dc/dcmitype/PhysicalObject,33:42.0,en,https://huh.harvard.edu/pages/use,President and Fellows of Harvard College,https://huh.harvard.edu/access-digital-reproductions-works-public-domain,http://data.huh.harvard.edu/06e6912f-dfcd-4576-bc0e-f6b7d0092e3e/image,urn:lsid:biocol.org:col:15406,urn:lsid:biocol.org:col:15406,NA,A,A,Harvard University Herbaria: All Records,PreservedSpecimen,NA,NA,"{huh_taxonomic_group: Vascular, huh_project_id: 7, huh_project_name: US and Canada - Mass Digitization}",06e6912f-dfcd-4576-bc0e-f6b7d0092e3e,barcode-01722665,NA,4983,E. J. Palmer,undetermined,NotDetermined,present,Sheet,in collection,,[see Simple Media extension],NA,3/18/14,NA,NA,1914,3,18,,low woods,4983,North America;United States of America;Texas;Wharton County;,North America,NA,NA,United States of America,US,Texas,Wharton County,,"Colorado River, Wharton","Colorado River, Wharton",,NA,NA,,NA,NA,,NA,,,,,NA,,Prunus mexicana S. Watson,Rosaceae,Prunus,mexicana,,S. Watson311,7080f9f0-74f7-41fb-9c22-ef9b75cc86e4,http://purl.org/dc/dcmitype/PhysicalObject,34:24.0,en,https://huh.harvard.edu/pages/use,President and Fellows of Harvard College,https://huh.harvard.edu/access-digital-reproductions-works-public-domain,http://data.huh.harvard.edu/7080f9f0-74f7-41fb-9c22-ef9b75cc86e4/image,urn:lsid:biocol.org:col:15406,urn:lsid:biocol.org:col:15406,NA,A,A,Harvard University Herbaria: All Records,PreservedSpecimen,NA,NA,"{huh_taxonomic_group: Vascular, huh_project_id: 7, huh_project_name: US and Canada - Mass Digitization}",7080f9f0-74f7-41fb-9c22-ef9b75cc86e4,barcode-01722666,NA,6631,E. J. Palmer,undetermined,NotDetermined,present,Sheet,in collection,,[see Simple Media extension],NA,9/24/14,NA,NA,1914,9,24,,Low wet woods,6631,North America;United States of America;Texas;Wharton County;,North America,NA,NA,United States of America,US,Texas,Wharton County,,"Colorado River, Wharton","Colorado River, Wharton",,NA,NA,,NA,NA,,NA,,,,,NA,,Prunus mexicana S. Watson,Rosaceae,Prunus,mexicana,,S. Watson312,bce4189b-0ea0-4a66-97ef-1ac62f72c36e,http://purl.org/dc/dcmitype/PhysicalObject,34:59.0,en,https://huh.harvard.edu/pages/use,President and Fellows of Harvard College,https://huh.harvard.edu/access-digital-reproductions-works-public-domain,http://data.huh.harvard.edu/bce4189b-0ea0-4a66-97ef-1ac62f72c36e/image,urn:lsid:biocol.org:col:15406,urn:lsid:biocol.org:col:15406,NA,A,A,Harvard University Herbaria: All Records,PreservedSpecimen,NA,NA,"{huh_taxonomic_group: Vascular, huh_project_id: 7, huh_project_name: US and Canada - Mass Digitization}",bce4189b-0ea0-4a66-97ef-1ac62f72c36e,barcode-01722667,NA,6631,E. J. Palmer,undetermined,NotDetermined,present,Sheet,in collection,,[see Simple Media extension],NA,9/24/14,NA,NA,1914,9,24,,Low wet woods,6631,North America;United States of America;Texas;Wharton County;,North America,NA,NA,United States of America,US,Texas,Wharton County,,"Colorado River, Wharton","Colorado River, Wharton",,NA,NA,,NA,NA,,NA,,,,,NA,,Prunus mexicana S. Watson,Rosaceae,Prunus,mexicana,,S. Watson313,8d3a7bce-fb8e-47c8-bc21-7da4ec5a4740,http://purl.org/dc/dcmitype/PhysicalObject,39:31.0,en,https://huh.harvard.edu/pages/use,President and Fellows of Harvard College,https://huh.harvard.edu/access-digital-reproductions-works-public-domain,http://data.huh.harvard.edu/8d3a7bce-fb8e-47c8-bc21-7da4ec5a4740/image,urn:lsid:biocol.org:col:15406,urn:lsid:biocol.org:col:15406,NA,A,A,Harvard University Herbaria: All Records,PreservedSpecimen,NA,NA,"{huh_taxonomic_group: Vascular, huh_project_id: 7, huh_project_name: US and Canada - Mass Digitization}",8d3a7bce-fb8e-47c8-bc21-7da4ec5a4740,barcode-01722668,NA,4970,E. J. Palmer,undetermined,NotDetermined,present,Sheet,in collection,,[see Simple Media extension],NA,3/18/14,NA,NA,1914,3,18,,low woods,4970,North America;United States of America;Texas;Wharton County;,North America,NA,NA,United States of America,US,Texas,Wharton County,,"Colorado River, Wharton","Colorado River, Wharton",,NA,NA,,NA,NA,,NA,,,,,NA,,Prunus mexicana S. Watson,Rosaceae,Prunus,mexicana,,S. Watson314,792b4071-9a40-4177-b09d-22d81b596932,http://purl.org/dc/dcmitype/PhysicalObject,41:34.0,en,https://huh.harvard.edu/pages/use,President and Fellows of Harvard College,https://huh.harvard.edu/access-digital-reproductions-works-public-domain,http://data.huh.harvard.edu/792b4071-9a40-4177-b09d-22d81b596932/image,urn:lsid:biocol.org:col:15406,urn:lsid:biocol.org:col:15406,NA,A,A,Harvard University Herbaria: All Records,PreservedSpecimen,NA,NA,"{huh_taxonomic_group: Vascular, huh_project_id: 7, huh_project_name: US and Canada - Mass Digitization}",792b4071-9a40-4177-b09d-22d81b596932,barcode-01722669,NA,4881,E. J. Palmer,undetermined,NotDetermined,present,Sheet,in collection,,[see Simple Media extension],NA,3/7/14,NA,NA,1914,3,7,,on river banks,4881,North America;United States of America;Texas;Wharton County;,North America,NA,NA,United States of America,US,Texas,Wharton County,,"Banks of Colorado River, Wharton","Banks of Colorado River, Wharton",,NA,NA,,NA,NA,,NA,,,,,NA,,Prunus mexicana S. Watson,Rosaceae,Prunus,mexicana,,S. Watson315,ed2b1985-88cd-4a73-bb90-70ee29202dea,http://purl.org/dc/dcmitype/PhysicalObject,30:37.0,en,https://huh.harvard.edu/pages/use,President and Fellows of Harvard College,https://huh.harvard.edu/access-digital-reproductions-works-public-domain,http://data.huh.harvard.edu/ed2b1985-88cd-4a73-bb90-70ee29202dea/image,urn:lsid:biocol.org:col:15406,urn:lsid:biocol.org:col:15406,NA,A,A,Harvard University Herbaria: All Records,PreservedSpecimen,NA,NA,"{huh_taxonomic_group: Vascular, huh_project_id: 7, huh_project_name: US and Canada - Mass Digitization}",ed2b1985-88cd-4a73-bb90-70ee29202dea,barcode-01722492,NA,22046,E. J. Palmer,undetermined,NotDetermined,present,Sheet,in collection,,[see Simple Media extension],NA,9/20/22,NA,NA,1922,9,20,,"Limestone hills, head of canyon",22046,North America;United States of America;Kansas;Wilson County;,North America,NA,NA,United States of America,US,Kansas,Wilson County,,near Neodesha,near Neodesha,,NA,NA,,NA,NA,,NA,,,,,NA,,Prunus mexicana S. Watson,Rosaceae,Prunus,mexicana,,S. Watson316,0310d83d-888e-4311-b062-a91b76aa7300,http://purl.org/dc/dcmitype/PhysicalObject,02:20.0,en,https://huh.harvard.edu/pages/use,President and Fellows of Harvard College,https://huh.harvard.edu/access-digital-reproductions-works-public-domain,http://data.huh.harvard.edu/0310d83d-888e-4311-b062-a91b76aa7300/image,urn:lsid:biocol.org:col:15406,urn:lsid:biocol.org:col:15406,NA,A,A,Harvard University Herbaria: All Records,PreservedSpecimen,NA,NA,"{huh_taxonomic_group: Vascular, huh_project_id: 7, huh_project_name: US and Canada - Mass Digitization}",0310d83d-888e-4311-b062-a91b76aa7300,barcode-01722716,NA,9306,E. J. Palmer,undetermined,NotDetermined,present,Sheet,in collection,,[see Simple Media extension],NA,3/30/16,NA,NA,1916,3,30,,low woods,9306,North America;United States of America;Texas;Wilson County;,North America,NA,NA,United States of America,US,Texas,Wilson County,,Sutherland Springs,Sutherland Springs,,NA,NA,,NA,NA,,NA,,,,,NA,,Prunus mexicana S. Watson,Rosaceae,Prunus,mexicana,,S. Watson317,a10c2eb9-3392-477f-bb39-f8fa28beb6dd,http://purl.org/dc/dcmitype/PhysicalObject,03:02.0,en,https://huh.harvard.edu/pages/use,President and Fellows of Harvard College,https://huh.harvard.edu/access-digital-reproductions-works-public-domain,http://data.huh.harvard.edu/a10c2eb9-3392-477f-bb39-f8fa28beb6dd/image,urn:lsid:biocol.org:col:15406,urn:lsid:biocol.org:col:15406,NA,A,A,Harvard University Herbaria: All Records,PreservedSpecimen,NA,NA,"{huh_taxonomic_group: Vascular, huh_project_id: 7, huh_project_name: US and Canada - Mass Digitization}",a10c2eb9-3392-477f-bb39-f8fa28beb6dd,barcode-01722717,NA,9194,E. J. Palmer,undetermined,NotDetermined,present,Sheet,in collection,,[see Simple Media extension],NA,3/17/16,NA,NA,1916,3,17,,Low woods,9194,North America;United States of America;Texas;Wilson County;,North America,NA,NA,United States of America,US,Texas,Wilson County,,Sutherland Springs,Sutherland Springs,,NA,NA,,NA,NA,,NA,,,,,NA,,Prunus mexicana S. Watson,Rosaceae,Prunus,mexicana,,S. Watson318,52b675bf-5ac2-42c9-ab75-47ee322d7013,http://purl.org/dc/dcmitype/PhysicalObject,46:47.0,en,https://huh.harvard.edu/pages/use,President and Fellows of Harvard College,https://huh.harvard.edu/access-digital-reproductions-works-public-domain,http://data.huh.harvard.edu/52b675bf-5ac2-42c9-ab75-47ee322d7013/image,urn:lsid:biocol.org:col:15631,urn:lsid:biocol.org:col:15631,NA,GH,GH,Harvard University Herbaria: All Records,PreservedSpecimen,NA,NA,"{huh_taxonomic_group: Vascular, huh_project_id: null, huh_project_name: null}",52b675bf-5ac2-42c9-ab75-47ee322d7013,barcode-00346671,NA,,G. Engelmann,undetermined,NotDetermined,present,Sheet,in collection,,[see Simple Media extension],NA,,NA,NA,NA,NA,NA,,,,North America;United States of America;California;,North America,NA,NA,United States of America,US,California,,,,,,NA,NA,,NA,NA,,NA,,,,,NA,,Prunus ilicifolia (Nuttall ex Hooker & Arnott) D. N. F. Dietrich,Rosaceae,Prunus,ilicifolia,,(Nuttall ex Hooker & Arnott) D. N. F. Dietrich319,05ac8c62-22c7-45c4-a13e-31abd74f6ed3,http://purl.org/dc/dcmitype/PhysicalObject,47:10.0,en,https://huh.harvard.edu/pages/use,President and Fellows of Harvard College,https://huh.harvard.edu/access-digital-reproductions-works-public-domain,http://data.huh.harvard.edu/05ac8c62-22c7-45c4-a13e-31abd74f6ed3/image,urn:lsid:biocol.org:col:15631,urn:lsid:biocol.org:col:15631,NA,GH,GH,Harvard University Herbaria: All Records,PreservedSpecimen,NA,NA,"{huh_taxonomic_group: Vascular, huh_project_id: null, huh_project_name: null}",05ac8c62-22c7-45c4-a13e-31abd74f6ed3,barcode-00346628,NA,,J. M. Bigelow,undetermined,NotDetermined,present,Sheet,in collection,,[see Simple Media extension],NA,,NA,NA,NA,NA,NA,,,,North America;United States of America;Arizona;,North America,NA,NA,United States of America,US,Arizona,,,Bill William River,Bill William River,,NA,NA,,NA,NA,,NA,,,,,NA,,Prunus ilicifolia (Nuttall ex Hooker & Arnott) D. N. F. Dietrich,Rosaceae,Prunus,ilicifolia,,(Nuttall ex Hooker & Arnott) D. N. F. Dietrich320,ccf6c1e0-c26f-492b-b18c-01dc3492cc42,http://purl.org/dc/dcmitype/PhysicalObject,08:50.0,en,https://huh.harvard.edu/pages/use,President and Fellows of Harvard College,https://huh.harvard.edu/access-digital-reproductions-works-public-domain,http://data.huh.harvard.edu/ccf6c1e0-c26f-492b-b18c-01dc3492cc42/image,urn:lsid:biocol.org:col:15631,urn:lsid:biocol.org:col:15631,NA,GH,GH,Harvard University Herbaria: All Records,PreservedSpecimen,NA,NA,"{huh_taxonomic_group: Vascular, huh_project_id: null, huh_project_name: null}",ccf6c1e0-c26f-492b-b18c-01dc3492cc42,barcode-00346627,NA,,J. C. Fremont,undetermined,NotDetermined,present,Sheet,in collection,,[see Simple Media extension],NA,1846,NA,NA,1846,NA,NA,,,,North America;United States of America;California;,North America,NA,NA,United States of America,US,California,,,,,,NA,NA,,NA,NA,,NA,,,,,NA,,Prunus ilicifolia (Nuttall ex Hooker & Arnott) D. N. F. Dietrich,Rosaceae,Prunus,ilicifolia,,(Nuttall ex Hooker & Arnott) D. N. F. Dietrich321,9ab8a1cb-8875-41e7-acab-988e43f26e02,http://purl.org/dc/dcmitype/PhysicalObject,08:22.0,en,https://huh.harvard.edu/pages/use,President and Fellows of Harvard College,https://huh.harvard.edu/access-digital-reproductions-works-public-domain,http://data.huh.harvard.edu/9ab8a1cb-8875-41e7-acab-988e43f26e02/image,urn:lsid:biocol.org:col:15631,urn:lsid:biocol.org:col:15631,NA,GH,GH,Harvard University Herbaria: All Records,PreservedSpecimen,NA,NA,"{huh_taxonomic_group: Vascular, huh_project_id: null, huh_project_name: null}",9ab8a1cb-8875-41e7-acab-988e43f26e02,barcode-00346626,NA,,D. Douglas,undetermined,NotDetermined,present,Sheet,in collection,,[see Simple Media extension],NA,,NA,NA,NA,NA,NA,,,,North America;United States of America;California;,North America,NA,NA,United States of America,US,California,,,,,,NA,NA,,NA,NA,,NA,,,,,NA,,Prunus ilicifolia (Nuttall ex Hooker & Arnott) D. N. F. Dietrich,Rosaceae,Prunus,ilicifolia,,(Nuttall ex Hooker & Arnott) D. N. F. Dietrich322,3da2ecf4-7b9e-4fdc-a346-471216f4524b,http://purl.org/dc/dcmitype/PhysicalObject,23:31.0,en,https://huh.harvard.edu/pages/use,President and Fellows of Harvard College,https://huh.harvard.edu/access-digital-reproductions-works-public-domain,http://data.huh.harvard.edu/3da2ecf4-7b9e-4fdc-a346-471216f4524b/image,urn:lsid:biocol.org:col:15406,urn:lsid:biocol.org:col:15406,NA,A,A,Harvard University Herbaria: All Records,PreservedSpecimen,NA,NA,"{huh_taxonomic_group: Vascular, huh_project_id: null, huh_project_name: null}",3da2ecf4-7b9e-4fdc-a346-471216f4524b,barcode-00346624,NA,,T. S. Brandegee,undetermined,NotDetermined,present,Sheet,in collection,,[see Simple Media extension],NA,1889-04-20,NA,NA,1889,4,20,,,,North America;United States of America;California;,North America,NA,NA,United States of America,US,California,,,San Julio Canon,San Julio Canon,,NA,NA,,NA,NA,,NA,,,,,NA,,Prunus ilicifolia (Nuttall ex Hooker & Arnott) D. N. F. Dietrich,Rosaceae,Prunus,ilicifolia,,(Nuttall ex Hooker & Arnott) D. N. F. Dietrich323,533ee063-9d6d-401b-a926-0d02ead27448,http://purl.org/dc/dcmitype/PhysicalObject,13:31.0,en,https://huh.harvard.edu/pages/use,President and Fellows of Harvard College,https://huh.harvard.edu/access-digital-reproductions-works-public-domain,http://data.huh.harvard.edu/533ee063-9d6d-401b-a926-0d02ead27448/image,urn:lsid:biocol.org:col:15406,urn:lsid:biocol.org:col:15406,NA,A,A,Harvard University Herbaria: All Records,PreservedSpecimen,NA,NA,"{huh_taxonomic_group: Vascular, huh_project_id: null, huh_project_name: null}",533ee063-9d6d-401b-a926-0d02ead27448,barcode-00346619,NA,,Mrs. E. C. Sutliffe,undetermined,NotDetermined,present,Sheet,in collection,,[see Simple Media extension],NA,5/31/20,NA,NA,1920,5,31,,,,North America;United States of America;California;,North America,NA,NA,United States of America,US,California,,,The Pinnacles,The Pinnacles,,NA,NA,,NA,NA,,NA,,,,,NA,,Prunus ilicifolia (Nuttall ex Hooker & Arnott) D. N. F. Dietrich,Rosaceae,Prunus,ilicifolia,,(Nuttall ex Hooker & Arnott) D. N. F. Dietrich324,bde8b5d9-5652-40f1-b8bd-9f55d9b87b90,http://purl.org/dc/dcmitype/PhysicalObject,01:40.0,en,https://huh.harvard.edu/pages/use,President and Fellows of Harvard College,https://huh.harvard.edu/access-digital-reproductions-works-public-domain,http://data.huh.harvard.edu/bde8b5d9-5652-40f1-b8bd-9f55d9b87b90/image,urn:lsid:biocol.org:col:15406,urn:lsid:biocol.org:col:15406,NA,A,A,Harvard University Herbaria: All Records,PreservedSpecimen,NA,NA,"{huh_taxonomic_group: Vascular, huh_project_id: null, huh_project_name: null}",bde8b5d9-5652-40f1-b8bd-9f55d9b87b90,barcode-00346615,NA,,A. Eastwood,undetermined,NotDetermined,present,Sheet,in collection,,[see Simple Media extension],NA,1913-09,NA,NA,1913,9,NA,,,,North America;United States of America;California;,North America,NA,NA,United States of America,US,California,,,along San Jose road,along San Jose road,,NA,NA,,NA,NA,,NA,,,,,NA,,Prunus ilicifolia (Nuttall ex Hooker & Arnott) D. N. F. Dietrich,Rosaceae,Prunus,ilicifolia,,(Nuttall ex Hooker & Arnott) D. N. F. Dietrich325,9763aee3-8781-48e6-9a50-8c8ecce5d647,http://purl.org/dc/dcmitype/PhysicalObject,37:22.0,en,https://huh.harvard.edu/pages/use,President and Fellows of Harvard College,https://huh.harvard.edu/access-digital-reproductions-works-public-domain,http://data.huh.harvard.edu/9763aee3-8781-48e6-9a50-8c8ecce5d647/image,urn:lsid:biocol.org:col:15631,urn:lsid:biocol.org:col:15631,NA,GH,GH,Harvard University Herbaria: All Records,PreservedSpecimen,NA,NA,"{huh_taxonomic_group: Vascular, huh_project_id: null, huh_project_name: null}",9763aee3-8781-48e6-9a50-8c8ecce5d647,barcode-00346588,NA,553,W. H. Brewer,undetermined,NotDetermined,present,Sheet,in collection,,[see Simple Media extension],NA,,NA,NA,NA,NA,NA,1860-62,,553,North America;United States of America;California;,North America,NA,NA,United States of America,US,California,,,,,,NA,NA,,NA,NA,,NA,,,,,NA,,Prunus ilicifolia (Nuttall ex Hooker & Arnott) D. N. F. Dietrich,Rosaceae,Prunus,ilicifolia,,(Nuttall ex Hooker & Arnott) D. N. F. Dietrich326,47463830-5717-4f51-9b7d-e55016998f4e,http://purl.org/dc/dcmitype/PhysicalObject,35:53.0,en,https://huh.harvard.edu/pages/use,President and Fellows of Harvard College,https://huh.harvard.edu/access-digital-reproductions-works-public-domain,http://data.huh.harvard.edu/47463830-5717-4f51-9b7d-e55016998f4e/image,urn:lsid:biocol.org:col:15631,urn:lsid:biocol.org:col:15631,NA,GH,GH,Harvard University Herbaria: All Records,PreservedSpecimen,NA,NA,"{huh_taxonomic_group: Vascular, huh_project_id: null, huh_project_name: null}",47463830-5717-4f51-9b7d-e55016998f4e,barcode-00346587,NA,,H. N. Bolander,undetermined,NotDetermined,present,Sheet,in collection,,[see Simple Media extension],NA,,NA,NA,NA,NA,NA,,,,North America;United States of America;California;,North America,NA,NA,United States of America,US,California,,,,,,NA,NA,,NA,NA,,NA,,,,,NA,,Prunus ilicifolia (Nuttall ex Hooker & Arnott) D. N. F. Dietrich,Rosaceae,Prunus,ilicifolia,,(Nuttall ex Hooker & Arnott) D. N. F. Dietrich327,48e4a04a-1478-4c69-ab48-d403d2d9cb84,http://purl.org/dc/dcmitype/PhysicalObject,28:04.0,en,https://huh.harvard.edu/pages/use,President and Fellows of Harvard College,https://huh.harvard.edu/access-digital-reproductions-works-public-domain,http://data.huh.harvard.edu/48e4a04a-1478-4c69-ab48-d403d2d9cb84/image,urn:lsid:biocol.org:col:15631,urn:lsid:biocol.org:col:15631,NA,GH,GH,Harvard University Herbaria: All Records,PreservedSpecimen,NA,NA,"{huh_taxonomic_group: Vascular, huh_project_id: null, huh_project_name: null}",48e4a04a-1478-4c69-ab48-d403d2d9cb84,barcode-00346584,NA,,T. S. Brandegee,undetermined,NotDetermined,present,Sheet,in collection,,[see Simple Media extension],NA,1888,NA,NA,1888,NA,NA,,,,North America;United States of America;California;,North America,NA,NA,United States of America,US,California,,,"Santa Inez Mountains, near Santa Barbara","Santa Inez Mountains, near Santa Barbara",,NA,NA,,NA,NA,,NA,,,,,NA,,Prunus ilicifolia (Nuttall ex Hooker & Arnott) D. N. F. Dietrich,Rosaceae,Prunus,ilicifolia,,(Nuttall ex Hooker & Arnott) D. N. F. Dietrich328,ab876976-8100-4c1d-a5a8-e54acf4afa34,http://purl.org/dc/dcmitype/PhysicalObject,11:38.0,en,https://huh.harvard.edu/pages/use,President and Fellows of Harvard College,https://huh.harvard.edu/access-digital-reproductions-works-public-domain,http://data.huh.harvard.edu/ab876976-8100-4c1d-a5a8-e54acf4afa34/image,urn:lsid:biocol.org:col:15631,urn:lsid:biocol.org:col:15631,NA,GH,GH,Harvard University Herbaria: All Records,PreservedSpecimen,NA,NA,"{huh_taxonomic_group: Vascular, huh_project_id: null, huh_project_name: null}",ab876976-8100-4c1d-a5a8-e54acf4afa34,barcode-00346578,NA,,J. C. Fremont,undetermined,NotDetermined,present,Sheet,in collection,,[see Simple Media extension],NA,,NA,NA,NA,NA,NA,1845-7,,,North America;United States of America;California;,North America,NA,NA,United States of America,US,California,,,Mountains of California,Mountains of California,,NA,NA,,NA,NA,,NA,,,,,NA,,Prunus ilicifolia (Nuttall ex Hooker & Arnott) D. N. F. Dietrich,Rosaceae,Prunus,ilicifolia,,(Nuttall ex Hooker & Arnott) D. N. F. Dietrich329,6fc4414e-37b7-4476-acfa-ef8934a9c905,http://purl.org/dc/dcmitype/PhysicalObject,50:25.0,en,https://huh.harvard.edu/pages/use,President and Fellows of Harvard College,https://huh.harvard.edu/access-digital-reproductions-works-public-domain,http://data.huh.harvard.edu/6fc4414e-37b7-4476-acfa-ef8934a9c905/image,urn:lsid:biocol.org:col:15631,urn:lsid:biocol.org:col:15631,NA,GH,GH,Harvard University Herbaria: All Records,PreservedSpecimen,NA,NA,"{huh_taxonomic_group: Vascular, huh_project_id: null, huh_project_name: null}",6fc4414e-37b7-4476-acfa-ef8934a9c905,barcode-00346560,NA,84,A. Eastwood,undetermined,NotDetermined,present,Sheet,in collection,,[see Simple Media extension],NA,5/9/08,NA,NA,1908,5,9,,,84,North America;United States of America;California;,North America,NA,NA,United States of America,US,California,,,Painted Cave Ranch,Painted Cave Ranch,,NA,NA,,NA,NA,,NA,,,,,NA,,Prunus ilicifolia (Nuttall ex Hooker & Arnott) D. N. F. Dietrich,Rosaceae,Prunus,ilicifolia,,(Nuttall ex Hooker & Arnott) D. N. F. Dietrich330,a630f505-8a3b-4c15-b5ad-c88ada48259f,http://purl.org/dc/dcmitype/PhysicalObject,30:47.0,en,https://huh.harvard.edu/pages/use,President and Fellows of Harvard College,https://huh.harvard.edu/access-digital-reproductions-works-public-domain,http://data.huh.harvard.edu/a630f505-8a3b-4c15-b5ad-c88ada48259f/image,urn:lsid:biocol.org:col:15631,urn:lsid:biocol.org:col:15631,NA,GH,GH,Harvard University Herbaria: All Records,PreservedSpecimen,NA,NA,"{huh_taxonomic_group: Vascular, huh_project_id: null, huh_project_name: null}",a630f505-8a3b-4c15-b5ad-c88ada48259f,barcode-00346557,NA,2388,M. F. Spencer,undetermined,NotDetermined,present,Sheet,in collection,,[see Simple Media extension],NA,5/30/24,NA,NA,1924,5,30,,,2388,North America;United States of America;California;,North America,NA,NA,United States of America,US,California,,,San Jacinto Mts.,San Jacinto Mts.,3000 ft.,NA,NA,,NA,NA,,NA,,,,,NA,,Prunus ilicifolia (Nuttall ex Hooker & Arnott) D. N. F. Dietrich,Rosaceae,Prunus,ilicifolia,,(Nuttall ex Hooker & Arnott) D. N. F. Dietrich331,a19c4a22-a287-42e7-b819-afed5aca1b90,http://purl.org/dc/dcmitype/PhysicalObject,28:16.0,en,https://huh.harvard.edu/pages/use,President and Fellows of Harvard College,https://huh.harvard.edu/access-digital-reproductions-works-public-domain,http://data.huh.harvard.edu/a19c4a22-a287-42e7-b819-afed5aca1b90/image,urn:lsid:biocol.org:col:15406,urn:lsid:biocol.org:col:15406,NA,A,A,Harvard University Herbaria: All Records,PreservedSpecimen,NA,NA,"{huh_taxonomic_group: Vascular, huh_project_id: null, huh_project_name: null}",a19c4a22-a287-42e7-b819-afed5aca1b90,barcode-00346556,NA,,C. G. Pringle,undetermined,NotDetermined,present,Sheet,in collection,,[see Simple Media extension],NA,1882-10-16,NA,NA,1882,10,16,,,,North America;United States of America;California;,North America,NA,NA,United States of America,US,California,,,Newhall,Newhall,,NA,NA,,NA,NA,,NA,,,,,NA,,Prunus ilicifolia (Nuttall ex Hooker & Arnott) D. N. F. Dietrich,Rosaceae,Prunus,ilicifolia,,(Nuttall ex Hooker & Arnott) D. N. F. Dietrich332,fe5d9ed1-283d-417c-aa18-2287772fa12f,http://purl.org/dc/dcmitype/PhysicalObject,18:59.0,en,https://huh.harvard.edu/pages/use,President and Fellows of Harvard College,https://huh.harvard.edu/access-digital-reproductions-works-public-domain,http://data.huh.harvard.edu/fe5d9ed1-283d-417c-aa18-2287772fa12f/image,urn:lsid:biocol.org:col:15406,urn:lsid:biocol.org:col:15406,NA,A,A,Harvard University Herbaria: All Records,PreservedSpecimen,NA,NA,"{huh_taxonomic_group: Vascular, huh_project_id: null, huh_project_name: null}",fe5d9ed1-283d-417c-aa18-2287772fa12f,barcode-00346552,NA,,T. S. Brandegee,undetermined,NotDetermined,present,Sheet,in collection,,[see Simple Media extension],NA,1888,NA,NA,1888,NA,NA,,,,North America;United States of America;California;,North America,NA,NA,United States of America,US,California,,,Near Santa Barbara,Near Santa Barbara,,NA,NA,,NA,NA,,NA,,,,,NA,,Prunus ilicifolia (Nuttall ex Hooker & Arnott) D. N. F. Dietrich,Rosaceae,Prunus,ilicifolia,,(Nuttall ex Hooker & Arnott) D. N. F. Dietrich333,a425267f-3413-4a9a-a8a3-530a65544c73,http://purl.org/dc/dcmitype/PhysicalObject,00:10.0,en,https://huh.harvard.edu/pages/use,President and Fellows of Harvard College,https://huh.harvard.edu/access-digital-reproductions-works-public-domain,http://data.huh.harvard.edu/a425267f-3413-4a9a-a8a3-530a65544c73/image,urn:lsid:biocol.org:col:15406,urn:lsid:biocol.org:col:15406,NA,A,A,Harvard University Herbaria: All Records,PreservedSpecimen,NA,NA,"{huh_taxonomic_group: Vascular, huh_project_id: null, huh_project_name: null}",a425267f-3413-4a9a-a8a3-530a65544c73,barcode-00346549,NA,148,C. V. Meyer,undetermined,NotDetermined,present,Sheet,in collection,,[see Simple Media extension],NA,5/26/27,NA,NA,1927,5,26,,,148,North America;United States of America;California;,North America,NA,NA,United States of America,US,California,,,12 mi. ne of San Diego,12 mi. ne of San Diego,,NA,NA,,NA,NA,,NA,,,,,NA,,Prunus ilicifolia (Nuttall ex Hooker & Arnott) D. N. F. Dietrich,Rosaceae,Prunus,ilicifolia,,(Nuttall ex Hooker & Arnott) D. N. F. Dietrich334,de84c616-3247-4199-b5c0-cf5c336766d9,http://purl.org/dc/dcmitype/PhysicalObject,57:08.0,en,https://huh.harvard.edu/pages/use,President and Fellows of Harvard College,https://huh.harvard.edu/access-digital-reproductions-works-public-domain,http://data.huh.harvard.edu/de84c616-3247-4199-b5c0-cf5c336766d9/image,urn:lsid:biocol.org:col:15631,urn:lsid:biocol.org:col:15631,NA,GH,GH,Harvard University Herbaria: All Records,PreservedSpecimen,NA,NA,"{huh_taxonomic_group: Vascular, huh_project_id: null, huh_project_name: null}",de84c616-3247-4199-b5c0-cf5c336766d9,barcode-00346547,NA,,C. G. Pringle,undetermined,NotDetermined,present,Sheet,in collection,,[see Simple Media extension],NA,1882-10-16,NA,NA,1882,10,16,,,,North America;United States of America;California;,North America,NA,NA,United States of America,US,California,,,Newhall,Newhall,,NA,NA,,NA,NA,,NA,,,,,NA,,Prunus ilicifolia (Nuttall ex Hooker & Arnott) D. N. F. Dietrich,Rosaceae,Prunus,ilicifolia,,(Nuttall ex Hooker & Arnott) D. N. F. Dietrich335,52451c23-0454-4b58-aeaf-42b50d7e4291,http://purl.org/dc/dcmitype/PhysicalObject,51:40.0,en,https://huh.harvard.edu/pages/use,President and Fellows of Harvard College,https://huh.harvard.edu/access-digital-reproductions-works-public-domain,http://data.huh.harvard.edu/52451c23-0454-4b58-aeaf-42b50d7e4291/image,urn:lsid:biocol.org:col:15406,urn:lsid:biocol.org:col:15406,NA,A,A,Harvard University Herbaria: All Records,PreservedSpecimen,NA,NA,"{huh_taxonomic_group: Vascular, huh_project_id: null, huh_project_name: null}",52451c23-0454-4b58-aeaf-42b50d7e4291,barcode-00346545,NA,,G. R. Vasey,undetermined,NotDetermined,present,Sheet,in collection,,[see Simple Media extension],NA,1880,NA,NA,1880,NA,NA,,,,North America;United States of America;California;,North America,NA,NA,United States of America,US,California,,,Santa Lucia Mts.,Santa Lucia Mts.,,NA,NA,,NA,NA,,NA,,,,,NA,,Prunus ilicifolia (Nuttall ex Hooker & Arnott) D. N. F. Dietrich,Rosaceae,Prunus,ilicifolia,,(Nuttall ex Hooker & Arnott) D. N. F. Dietrich336,91373e3e-7159-4ecf-b03f-07bd91512401,http://purl.org/dc/dcmitype/PhysicalObject,37:43.0,en,https://huh.harvard.edu/pages/use,President and Fellows of Harvard College,https://huh.harvard.edu/access-digital-reproductions-works-public-domain,http://data.huh.harvard.edu/91373e3e-7159-4ecf-b03f-07bd91512401/image,urn:lsid:biocol.org:col:15631,urn:lsid:biocol.org:col:15631,NA,GH,GH,Harvard University Herbaria: All Records,PreservedSpecimen,NA,NA,"{huh_taxonomic_group: Vascular, huh_project_id: null, huh_project_name: null}",91373e3e-7159-4ecf-b03f-07bd91512401,barcode-00303861,NA,,,,,present,Sheet,in collection,,[see Simple Media extension],NA,,NA,NA,NA,NA,NA,,,,North America;United States of America;California;,North America,NA,NA,United States of America,US,California,,,U. of Calif. St. Barbara,U. of Calif. St. Barbara,,NA,NA,,NA,NA,,NA,,,,,NA,Type,Prunus ilicifolia (Nuttall ex Hooker & Arnott) D. N. F. Dietrich,Rosaceae,Prunus,ilicifolia,,(Nuttall ex Hooker & Arnott) D. N. F. Dietrich337,922c463f-1240-4a18-9710-d4b63c2998b6,http://purl.org/dc/dcmitype/PhysicalObject,42:23.0,en,https://huh.harvard.edu/pages/use,President and Fellows of Harvard College,https://huh.harvard.edu/access-digital-reproductions-works-public-domain,http://data.huh.harvard.edu/922c463f-1240-4a18-9710-d4b63c2998b6/image,urn:lsid:biocol.org:col:15631,urn:lsid:biocol.org:col:15631,NA,GH,GH,Harvard University Herbaria: All Records,PreservedSpecimen,NA,NA,"{huh_taxonomic_group: Vascular, huh_project_id: null, huh_project_name: null}",922c463f-1240-4a18-9710-d4b63c2998b6,barcode-00102931,NA,2130,Edw. Palmer,undetermined,Fruit,present,Sheet,in collection,,[see Simple Media extension],NA,1880-07,NA,NA,1880,7,NA,,,2130,North America;Mexico;Coahuila;,North America,NA,NA,Mexico,MX,Coahuila,,,Lerios,Lerios,,NA,NA,,NA,NA,,NA,,,,,NA,Type,Prunus mexicana S. Watson,Rosaceae,Prunus,mexicana,,S. Watson338,41d6799c-dce7-4231-870a-c754e069ab37,http://purl.org/dc/dcmitype/PhysicalObject,57:41.0,en,https://huh.harvard.edu/pages/use,President and Fellows of Harvard College,https://huh.harvard.edu/access-digital-reproductions-works-public-domain,http://data.huh.harvard.edu/41d6799c-dce7-4231-870a-c754e069ab37/image,urn:lsid:biocol.org:col:15406,urn:lsid:biocol.org:col:15406,NA,A,A,Harvard University Herbaria: All Records,PreservedSpecimen,NA,NA,"{huh_taxonomic_group: Vascular, huh_project_id: 7, huh_project_name: US and Canada - Mass Digitization}",41d6799c-dce7-4231-870a-c754e069ab37,barcode-01722428,NA,,[data not captured],undetermined,NotDetermined,present,Sheet,in collection,,[see Simple Media extension],NA,,NA,NA,NA,NA,NA,,,,North America;United States of America;Arkansas;,North America,NA,NA,United States of America,US,Arkansas,,,[data not captured],[data not captured],,NA,NA,,NA,NA,,NA,,,,,NA,,Prunus mexicana S. Watson,Rosaceae,Prunus,mexicana,,S. Watson339,d65134f0-4fba-414a-908f-4e40c8db5275,http://purl.org/dc/dcmitype/PhysicalObject,57:57.0,en,https://huh.harvard.edu/pages/use,President and Fellows of Harvard College,https://huh.harvard.edu/access-digital-reproductions-works-public-domain,http://data.huh.harvard.edu/d65134f0-4fba-414a-908f-4e40c8db5275/image,urn:lsid:biocol.org:col:15406,urn:lsid:biocol.org:col:15406,NA,A,A,Harvard University Herbaria: All Records,PreservedSpecimen,NA,NA,"{huh_taxonomic_group: Vascular, huh_project_id: 7, huh_project_name: US and Canada - Mass Digitization}",d65134f0-4fba-414a-908f-4e40c8db5275,barcode-01722429,NA,,[data not captured],undetermined,NotDetermined,present,Sheet,in collection,,[see Simple Media extension],NA,,NA,NA,NA,NA,NA,,,,North America;United States of America;Arkansas;,North America,NA,NA,United States of America,US,Arkansas,,,[data not captured],[data not captured],,NA,NA,,NA,NA,,NA,,,,,NA,,Prunus mexicana S. Watson,Rosaceae,Prunus,mexicana,,S. Watson340,cde927a7-0085-4c73-9745-b2942911f046,http://purl.org/dc/dcmitype/PhysicalObject,58:14.0,en,https://huh.harvard.edu/pages/use,President and Fellows of Harvard College,https://huh.harvard.edu/access-digital-reproductions-works-public-domain,http://data.huh.harvard.edu/cde927a7-0085-4c73-9745-b2942911f046/image,urn:lsid:biocol.org:col:15406,urn:lsid:biocol.org:col:15406,NA,A,A,Harvard University Herbaria: All Records,PreservedSpecimen,NA,NA,"{huh_taxonomic_group: Vascular, huh_project_id: 7, huh_project_name: US and Canada - Mass Digitization}",cde927a7-0085-4c73-9745-b2942911f046,barcode-01722430,NA,,[data not captured],undetermined,NotDetermined,present,Sheet,in collection,,[see Simple Media extension],NA,,NA,NA,NA,NA,NA,,,,North America;United States of America;Arkansas;,North America,NA,NA,United States of America,US,Arkansas,,,[data not captured],[data not captured],,NA,NA,,NA,NA,,NA,,,,,NA,,Prunus mexicana S. Watson,Rosaceae,Prunus,mexicana,,S. Watson341,a88e0d5f-2357-4035-9b01-f4b90b3725ca,http://purl.org/dc/dcmitype/PhysicalObject,01:52.0,en,https://huh.harvard.edu/pages/use,President and Fellows of Harvard College,https://huh.harvard.edu/access-digital-reproductions-works-public-domain,http://data.huh.harvard.edu/a88e0d5f-2357-4035-9b01-f4b90b3725ca/image,urn:lsid:biocol.org:col:15406,urn:lsid:biocol.org:col:15406,NA,A,A,Harvard University Herbaria: All Records,PreservedSpecimen,NA,NA,"{huh_taxonomic_group: Vascular, huh_project_id: 7, huh_project_name: US and Canada - Mass Digitization}",a88e0d5f-2357-4035-9b01-f4b90b3725ca,barcode-01722436,NA,,[data not captured],undetermined,NotDetermined,present,Sheet,in collection,,[see Simple Media extension],NA,,NA,NA,NA,NA,NA,,,,North America;United States of America;Alabama;,North America,NA,NA,United States of America,US,Alabama,,,[data not captured],[data not captured],,NA,NA,,NA,NA,,NA,,,,,NA,,Prunus mexicana S. Watson,Rosaceae,Prunus,mexicana,,S. Watson342,c4824c37-2eaa-4289-aaef-ee5839079e05,http://purl.org/dc/dcmitype/PhysicalObject,04:45.0,en,https://huh.harvard.edu/pages/use,President and Fellows of Harvard College,https://huh.harvard.edu/access-digital-reproductions-works-public-domain,http://data.huh.harvard.edu/c4824c37-2eaa-4289-aaef-ee5839079e05/image,urn:lsid:biocol.org:col:15406,urn:lsid:biocol.org:col:15406,NA,A,A,Harvard University Herbaria: All Records,PreservedSpecimen,NA,NA,"{huh_taxonomic_group: Vascular, huh_project_id: 7, huh_project_name: US and Canada - Mass Digitization}",c4824c37-2eaa-4289-aaef-ee5839079e05,barcode-01722439,NA,,[data not captured],undetermined,NotDetermined,present,Sheet,in collection,,[see Simple Media extension],NA,,NA,NA,NA,NA,NA,,,,North America;United States of America;Arkansas;,North America,NA,NA,United States of America,US,Arkansas,,,[data not captured],[data not captured],,NA,NA,,NA,NA,,NA,,,,,NA,,Prunus mexicana S. Watson,Rosaceae,Prunus,mexicana,,S. Watson343,f50dfa43-f1ba-4df5-94fb-fec77d5e6de6,http://purl.org/dc/dcmitype/PhysicalObject,05:13.0,en,https://huh.harvard.edu/pages/use,President and Fellows of Harvard College,https://huh.harvard.edu/access-digital-reproductions-works-public-domain,http://data.huh.harvard.edu/f50dfa43-f1ba-4df5-94fb-fec77d5e6de6/image,urn:lsid:biocol.org:col:15406,urn:lsid:biocol.org:col:15406,NA,A,A,Harvard University Herbaria: All Records,PreservedSpecimen,NA,NA,"{huh_taxonomic_group: Vascular, huh_project_id: 7, huh_project_name: US and Canada - Mass Digitization}",f50dfa43-f1ba-4df5-94fb-fec77d5e6de6,barcode-01722440,NA,,[data not captured],undetermined,NotDetermined,present,Sheet,in collection,,[see Simple Media extension],NA,,NA,NA,NA,NA,NA,,,,North America;United States of America;Arkansas;,North America,NA,NA,United States of America,US,Arkansas,,,[data not captured],[data not captured],,NA,NA,,NA,NA,,NA,,,,,NA,,Prunus mexicana S. Watson,Rosaceae,Prunus,mexicana,,S. Watson344,ad691cc7-e574-40f9-863d-9b38ae92fd11,http://purl.org/dc/dcmitype/PhysicalObject,05:28.0,en,https://huh.harvard.edu/pages/use,President and Fellows of Harvard College,https://huh.harvard.edu/access-digital-reproductions-works-public-domain,http://data.huh.harvard.edu/ad691cc7-e574-40f9-863d-9b38ae92fd11/image,urn:lsid:biocol.org:col:15406,urn:lsid:biocol.org:col:15406,NA,A,A,Harvard University Herbaria: All Records,PreservedSpecimen,NA,NA,"{huh_taxonomic_group: Vascular, huh_project_id: 7, huh_project_name: US and Canada - Mass Digitization}",ad691cc7-e574-40f9-863d-9b38ae92fd11,barcode-01722441,NA,,[data not captured],undetermined,NotDetermined,present,Sheet,in collection,,[see Simple Media extension],NA,,NA,NA,NA,NA,NA,,,,North America;United States of America;Arkansas;,North America,NA,NA,United States of America,US,Arkansas,,,[data not captured],[data not captured],,NA,NA,,NA,NA,,NA,,,,,NA,,Prunus mexicana S. Watson,Rosaceae,Prunus,mexicana,,S. Watson345,7eb7fc87-cb70-4046-9329-b58eecf0e2b4,http://purl.org/dc/dcmitype/PhysicalObject,05:41.0,en,https://huh.harvard.edu/pages/use,President and Fellows of Harvard College,https://huh.harvard.edu/access-digital-reproductions-works-public-domain,http://data.huh.harvard.edu/7eb7fc87-cb70-4046-9329-b58eecf0e2b4/image,urn:lsid:biocol.org:col:15406,urn:lsid:biocol.org:col:15406,NA,A,A,Harvard University Herbaria: All Records,PreservedSpecimen,NA,NA,"{huh_taxonomic_group: Vascular, huh_project_id: 7, huh_project_name: US and Canada - Mass Digitization}",7eb7fc87-cb70-4046-9329-b58eecf0e2b4,barcode-01722442,NA,,[data not captured],undetermined,NotDetermined,present,Sheet,in collection,,[see Simple Media extension],NA,,NA,NA,NA,NA,NA,,,,North America;United States of America;Arkansas;,North America,NA,NA,United States of America,US,Arkansas,,,[data not captured],[data not captured],,NA,NA,,NA,NA,,NA,,,,,NA,,Prunus mexicana S. Watson,Rosaceae,Prunus,mexicana,,S. Watson346,9617e63c-065a-4cc8-a885-88383aab515d,http://purl.org/dc/dcmitype/PhysicalObject,12:50.0,en,https://huh.harvard.edu/pages/use,President and Fellows of Harvard College,https://huh.harvard.edu/access-digital-reproductions-works-public-domain,http://data.huh.harvard.edu/9617e63c-065a-4cc8-a885-88383aab515d/image,urn:lsid:biocol.org:col:15406,urn:lsid:biocol.org:col:15406,NA,A,A,Harvard University Herbaria: All Records,PreservedSpecimen,NA,NA,"{huh_taxonomic_group: Vascular, huh_project_id: 7, huh_project_name: US and Canada - Mass Digitization}",9617e63c-065a-4cc8-a885-88383aab515d,barcode-01722451,NA,,[data not captured],undetermined,NotDetermined,present,Sheet,in collection,,[see Simple Media extension],NA,,NA,NA,NA,NA,NA,,,,North America;United States of America;Arkansas;,North America,NA,NA,United States of America,US,Arkansas,,,[data not captured],[data not captured],,NA,NA,,NA,NA,,NA,,,,,NA,,Prunus mexicana S. Watson,Rosaceae,Prunus,mexicana,,S. Watson347,5c47b34c-6588-465b-8510-c3fd15a0463e,http://purl.org/dc/dcmitype/PhysicalObject,13:02.0,en,https://huh.harvard.edu/pages/use,President and Fellows of Harvard College,https://huh.harvard.edu/access-digital-reproductions-works-public-domain,http://data.huh.harvard.edu/5c47b34c-6588-465b-8510-c3fd15a0463e/image,urn:lsid:biocol.org:col:15406,urn:lsid:biocol.org:col:15406,NA,A,A,Harvard University Herbaria: All Records,PreservedSpecimen,NA,NA,"{huh_taxonomic_group: Vascular, huh_project_id: 7, huh_project_name: US and Canada - Mass Digitization}",5c47b34c-6588-465b-8510-c3fd15a0463e,barcode-01722452,NA,,[data not captured],undetermined,NotDetermined,present,Sheet,in collection,,[see Simple Media extension],NA,,NA,NA,NA,NA,NA,,,,North America;United States of America;Arkansas;,North America,NA,NA,United States of America,US,Arkansas,,,[data not captured],[data not captured],,NA,NA,,NA,NA,,NA,,,,,NA,,Prunus mexicana S. Watson,Rosaceae,Prunus,mexicana,,S. Watson348,69dad49a-78de-4a9c-a6cd-f395c07a4254,http://purl.org/dc/dcmitype/PhysicalObject,20:43.0,en,https://huh.harvard.edu/pages/use,President and Fellows of Harvard College,https://huh.harvard.edu/access-digital-reproductions-works-public-domain,http://data.huh.harvard.edu/69dad49a-78de-4a9c-a6cd-f395c07a4254/image,urn:lsid:biocol.org:col:15406,urn:lsid:biocol.org:col:15406,NA,A,A,Harvard University Herbaria: All Records,PreservedSpecimen,NA,NA,"{huh_taxonomic_group: Vascular, huh_project_id: 7, huh_project_name: US and Canada - Mass Digitization}",69dad49a-78de-4a9c-a6cd-f395c07a4254,barcode-01722461,NA,,[data not captured],undetermined,NotDetermined,present,Sheet,in collection,,[see Simple Media extension],NA,,NA,NA,NA,NA,NA,,,,North America;United States of America;Arkansas;,North America,NA,NA,United States of America,US,Arkansas,,,[data not captured],[data not captured],,NA,NA,,NA,NA,,NA,,,,,NA,,Prunus mexicana S. Watson,Rosaceae,Prunus,mexicana,,S. Watson349,fb9e1f24-ed2d-4bbf-b3a3-cf95c9cd50a3,http://purl.org/dc/dcmitype/PhysicalObject,21:02.0,en,https://huh.harvard.edu/pages/use,President and Fellows of Harvard College,https://huh.harvard.edu/access-digital-reproductions-works-public-domain,http://data.huh.harvard.edu/fb9e1f24-ed2d-4bbf-b3a3-cf95c9cd50a3/image,urn:lsid:biocol.org:col:15406,urn:lsid:biocol.org:col:15406,NA,A,A,Harvard University Herbaria: All Records,PreservedSpecimen,NA,NA,"{huh_taxonomic_group: Vascular, huh_project_id: 7, huh_project_name: US and Canada - Mass Digitization}",fb9e1f24-ed2d-4bbf-b3a3-cf95c9cd50a3,barcode-01722462,NA,,[data not captured],undetermined,NotDetermined,present,Sheet,in collection,,[see Simple Media extension],NA,,NA,NA,NA,NA,NA,,,,North America;United States of America;Arkansas;,North America,NA,NA,United States of America,US,Arkansas,,,[data not captured],[data not captured],,NA,NA,,NA,NA,,NA,,,,,NA,,Prunus mexicana S. Watson,Rosaceae,Prunus,mexicana,,S. Watson350,becc35ab-c426-446c-b9dd-7b46becc5ee3,http://purl.org/dc/dcmitype/PhysicalObject,21:21.0,en,https://huh.harvard.edu/pages/use,President and Fellows of Harvard College,https://huh.harvard.edu/access-digital-reproductions-works-public-domain,http://data.huh.harvard.edu/becc35ab-c426-446c-b9dd-7b46becc5ee3/image,urn:lsid:biocol.org:col:15406,urn:lsid:biocol.org:col:15406,NA,A,A,Harvard University Herbaria: All Records,PreservedSpecimen,NA,NA,"{huh_taxonomic_group: Vascular, huh_project_id: 7, huh_project_name: US and Canada - Mass Digitization}",becc35ab-c426-446c-b9dd-7b46becc5ee3,barcode-01722463,NA,,[data not captured],undetermined,NotDetermined,present,Sheet,in collection,,[see Simple Media extension],NA,,NA,NA,NA,NA,NA,,,,North America;United States of America;Arkansas;,North America,NA,NA,United States of America,US,Arkansas,,,[data not captured],[data not captured],,NA,NA,,NA,NA,,NA,,,,,NA,,Prunus mexicana S. Watson,Rosaceae,Prunus,mexicana,,S. Watson351,1522fac2-0af9-4a79-acae-8aea9983e67c,http://purl.org/dc/dcmitype/PhysicalObject,24:35.0,en,https://huh.harvard.edu/pages/use,President and Fellows of Harvard College,https://huh.harvard.edu/access-digital-reproductions-works-public-domain,http://data.huh.harvard.edu/1522fac2-0af9-4a79-acae-8aea9983e67c/image,urn:lsid:biocol.org:col:15406,urn:lsid:biocol.org:col:15406,NA,A,A,Harvard University Herbaria: All Records,PreservedSpecimen,NA,NA,"{huh_taxonomic_group: Vascular, huh_project_id: 7, huh_project_name: US and Canada - Mass Digitization}",1522fac2-0af9-4a79-acae-8aea9983e67c,barcode-01722470,NA,,[data not captured],undetermined,NotDetermined,present,Sheet,in collection,,[see Simple Media extension],NA,,NA,NA,NA,NA,NA,,,,North America;United States of America;Arkansas;,North America,NA,NA,United States of America,US,Arkansas,,,[data not captured],[data not captured],,NA,NA,,NA,NA,,NA,,,,,NA,,Prunus mexicana S. Watson,Rosaceae,Prunus,mexicana,,S. Watson352,ba776bfd-da34-418e-aa87-586a554874a0,http://purl.org/dc/dcmitype/PhysicalObject,26:46.0,en,https://huh.harvard.edu/pages/use,President and Fellows of Harvard College,https://huh.harvard.edu/access-digital-reproductions-works-public-domain,http://data.huh.harvard.edu/ba776bfd-da34-418e-aa87-586a554874a0/image,urn:lsid:biocol.org:col:15406,urn:lsid:biocol.org:col:15406,NA,A,A,Harvard University Herbaria: All Records,PreservedSpecimen,NA,NA,"{huh_taxonomic_group: Vascular, huh_project_id: 7, huh_project_name: US and Canada - Mass Digitization}",ba776bfd-da34-418e-aa87-586a554874a0,barcode-01722473,NA,,[data not captured],undetermined,NotDetermined,present,Sheet,in collection,,[see Simple Media extension],NA,,NA,NA,NA,NA,NA,,,,North America;United States of America;Arkansas;,North America,NA,NA,United States of America,US,Arkansas,,,[data not captured],[data not captured],,NA,NA,,NA,NA,,NA,,,,,NA,,Prunus mexicana S. Watson,Rosaceae,Prunus,mexicana,,S. Watson353,dca6967e-2227-434f-a6b5-bd85c124af99,http://purl.org/dc/dcmitype/PhysicalObject,27:02.0,en,https://huh.harvard.edu/pages/use,President and Fellows of Harvard College,https://huh.harvard.edu/access-digital-reproductions-works-public-domain,http://data.huh.harvard.edu/dca6967e-2227-434f-a6b5-bd85c124af99/image,urn:lsid:biocol.org:col:15406,urn:lsid:biocol.org:col:15406,NA,A,A,Harvard University Herbaria: All Records,PreservedSpecimen,NA,NA,"{huh_taxonomic_group: Vascular, huh_project_id: 7, huh_project_name: US and Canada - Mass Digitization}",dca6967e-2227-434f-a6b5-bd85c124af99,barcode-01722474,NA,,[data not captured],undetermined,NotDetermined,present,Sheet,in collection,,[see Simple Media extension],NA,,NA,NA,NA,NA,NA,,,,North America;United States of America;Arkansas;,North America,NA,NA,United States of America,US,Arkansas,,,[data not captured],[data not captured],,NA,NA,,NA,NA,,NA,,,,,NA,,Prunus mexicana S. Watson,Rosaceae,Prunus,mexicana,,S. Watson354,92d4d350-c0c6-4ae7-8480-b5ab824c7cd1,http://purl.org/dc/dcmitype/PhysicalObject,28:56.0,en,https://huh.harvard.edu/pages/use,President and Fellows of Harvard College,https://huh.harvard.edu/access-digital-reproductions-works-public-domain,http://data.huh.harvard.edu/92d4d350-c0c6-4ae7-8480-b5ab824c7cd1/image,urn:lsid:biocol.org:col:15406,urn:lsid:biocol.org:col:15406,NA,A,A,Harvard University Herbaria: All Records,PreservedSpecimen,NA,NA,"{huh_taxonomic_group: Vascular, huh_project_id: 7, huh_project_name: US and Canada - Mass Digitization}",92d4d350-c0c6-4ae7-8480-b5ab824c7cd1,barcode-01722475,NA,,[data not captured],undetermined,NotDetermined,present,Sheet,in collection,,[see Simple Media extension],NA,,NA,NA,NA,NA,NA,,,,North America;United States of America;Arkansas;,North America,NA,NA,United States of America,US,Arkansas,,,[data not captured],[data not captured],,NA,NA,,NA,NA,,NA,,,,,NA,,Prunus mexicana S. Watson,Rosaceae,Prunus,mexicana,,S. Watson355,1f9fd2fb-5008-4123-99d0-edd4a7b976ad,http://purl.org/dc/dcmitype/PhysicalObject,29:11.0,en,https://huh.harvard.edu/pages/use,President and Fellows of Harvard College,https://huh.harvard.edu/access-digital-reproductions-works-public-domain,http://data.huh.harvard.edu/1f9fd2fb-5008-4123-99d0-edd4a7b976ad/image,urn:lsid:biocol.org:col:15406,urn:lsid:biocol.org:col:15406,NA,A,A,Harvard University Herbaria: All Records,PreservedSpecimen,NA,NA,"{huh_taxonomic_group: Vascular, huh_project_id: 7, huh_project_name: US and Canada - Mass Digitization}",1f9fd2fb-5008-4123-99d0-edd4a7b976ad,barcode-01722476,NA,,[data not captured],undetermined,NotDetermined,present,Sheet,in collection,,[see Simple Media extension],NA,,NA,NA,NA,NA,NA,,,,North America;United States of America;Arkansas;,North America,NA,NA,United States of America,US,Arkansas,,,[data not captured],[data not captured],,NA,NA,,NA,NA,,NA,,,,,NA,,Prunus mexicana S. Watson,Rosaceae,Prunus,mexicana,,S. Watson356,3c3a6797-6f4b-4071-9365-044445439086,http://purl.org/dc/dcmitype/PhysicalObject,37:27.0,en,https://huh.harvard.edu/pages/use,President and Fellows of Harvard College,https://huh.harvard.edu/access-digital-reproductions-works-public-domain,http://data.huh.harvard.edu/3c3a6797-6f4b-4071-9365-044445439086/image,urn:lsid:biocol.org:col:15406,urn:lsid:biocol.org:col:15406,NA,A,A,Harvard University Herbaria: All Records,PreservedSpecimen,NA,NA,"{huh_taxonomic_group: Vascular, huh_project_id: 7, huh_project_name: US and Canada - Mass Digitization}",3c3a6797-6f4b-4071-9365-044445439086,barcode-01722477,NA,,[data not captured],undetermined,NotDetermined,present,Sheet,in collection,,[see Simple Media extension],NA,,NA,NA,NA,NA,NA,,,,North America;United States of America;Arkansas;,North America,NA,NA,United States of America,US,Arkansas,,,[data not captured],[data not captured],,NA,NA,,NA,NA,,NA,,,,,NA,,Prunus mexicana S. Watson,Rosaceae,Prunus,mexicana,,S. Watson357,e0b94a35-abef-449a-80bb-09f56500349d,http://purl.org/dc/dcmitype/PhysicalObject,38:34.0,en,https://huh.harvard.edu/pages/use,President and Fellows of Harvard College,https://huh.harvard.edu/access-digital-reproductions-works-public-domain,http://data.huh.harvard.edu/e0b94a35-abef-449a-80bb-09f56500349d/image,urn:lsid:biocol.org:col:15406,urn:lsid:biocol.org:col:15406,NA,A,A,Harvard University Herbaria: All Records,PreservedSpecimen,NA,NA,"{huh_taxonomic_group: Vascular, huh_project_id: 7, huh_project_name: US and Canada - Mass Digitization}",e0b94a35-abef-449a-80bb-09f56500349d,barcode-01722478,NA,,[data not captured],undetermined,NotDetermined,present,Sheet,in collection,,[see Simple Media extension],NA,,NA,NA,NA,NA,NA,,,,North America;United States of America;Arkansas;,North America,NA,NA,United States of America,US,Arkansas,,,[data not captured],[data not captured],,NA,NA,,NA,NA,,NA,,,,,NA,,Prunus mexicana S. Watson,Rosaceae,Prunus,mexicana,,S. Watson358,e6ca501d-3d9b-4a85-81df-bc71a6033cfb,http://purl.org/dc/dcmitype/PhysicalObject,41:49.0,en,https://huh.harvard.edu/pages/use,President and Fellows of Harvard College,https://huh.harvard.edu/access-digital-reproductions-works-public-domain,http://data.huh.harvard.edu/e6ca501d-3d9b-4a85-81df-bc71a6033cfb/image,urn:lsid:biocol.org:col:15406,urn:lsid:biocol.org:col:15406,NA,A,A,Harvard University Herbaria: All Records,PreservedSpecimen,NA,NA,"{huh_taxonomic_group: Vascular, huh_project_id: 7, huh_project_name: US and Canada - Mass Digitization}",e6ca501d-3d9b-4a85-81df-bc71a6033cfb,barcode-01722479,NA,,[data not captured],undetermined,NotDetermined,present,Sheet,in collection,,[see Simple Media extension],NA,,NA,NA,NA,NA,NA,,,,North America;United States of America;Arkansas;,North America,NA,NA,United States of America,US,Arkansas,,,[data not captured],[data not captured],,NA,NA,,NA,NA,,NA,,,,,NA,,Prunus mexicana S. Watson,Rosaceae,Prunus,mexicana,,S. Watson359,6856d4c9-4735-434a-8de2-0a009a1b95b6,http://purl.org/dc/dcmitype/PhysicalObject,42:08.0,en,https://huh.harvard.edu/pages/use,President and Fellows of Harvard College,https://huh.harvard.edu/access-digital-reproductions-works-public-domain,http://data.huh.harvard.edu/6856d4c9-4735-434a-8de2-0a009a1b95b6/image,urn:lsid:biocol.org:col:15406,urn:lsid:biocol.org:col:15406,NA,A,A,Harvard University Herbaria: All Records,PreservedSpecimen,NA,NA,"{huh_taxonomic_group: Vascular, huh_project_id: 7, huh_project_name: US and Canada - Mass Digitization}",6856d4c9-4735-434a-8de2-0a009a1b95b6,barcode-01722480,NA,,[data not captured],undetermined,NotDetermined,present,Sheet,in collection,,[see Simple Media extension],NA,,NA,NA,NA,NA,NA,,,,North America;United States of America;Arkansas;,North America,NA,NA,United States of America,US,Arkansas,,,[data not captured],[data not captured],,NA,NA,,NA,NA,,NA,,,,,NA,,Prunus mexicana S. Watson,Rosaceae,Prunus,mexicana,,S. Watson360,b1ce6555-0778-452f-98a9-7e25e6c50cfb,http://purl.org/dc/dcmitype/PhysicalObject,42:21.0,en,https://huh.harvard.edu/pages/use,President and Fellows of Harvard College,https://huh.harvard.edu/access-digital-reproductions-works-public-domain,http://data.huh.harvard.edu/b1ce6555-0778-452f-98a9-7e25e6c50cfb/image,urn:lsid:biocol.org:col:15406,urn:lsid:biocol.org:col:15406,NA,A,A,Harvard University Herbaria: All Records,PreservedSpecimen,NA,NA,"{huh_taxonomic_group: Vascular, huh_project_id: 7, huh_project_name: US and Canada - Mass Digitization}",b1ce6555-0778-452f-98a9-7e25e6c50cfb,barcode-01722481,NA,,[data not captured],undetermined,NotDetermined,present,Sheet,in collection,,[see Simple Media extension],NA,,NA,NA,NA,NA,NA,,,,North America;United States of America;Arkansas;,North America,NA,NA,United States of America,US,Arkansas,,,[data not captured],[data not captured],,NA,NA,,NA,NA,,NA,,,,,NA,,Prunus mexicana S. Watson,Rosaceae,Prunus,mexicana,,S. Watson361,3b58c898-3b09-4bdd-91ca-2049b2df0a61,http://purl.org/dc/dcmitype/PhysicalObject,43:17.0,en,https://huh.harvard.edu/pages/use,President and Fellows of Harvard College,https://huh.harvard.edu/access-digital-reproductions-works-public-domain,http://data.huh.harvard.edu/3b58c898-3b09-4bdd-91ca-2049b2df0a61/image,urn:lsid:biocol.org:col:15406,urn:lsid:biocol.org:col:15406,NA,A,A,Harvard University Herbaria: All Records,PreservedSpecimen,NA,NA,"{huh_taxonomic_group: Vascular, huh_project_id: 7, huh_project_name: US and Canada - Mass Digitization}",3b58c898-3b09-4bdd-91ca-2049b2df0a61,barcode-01722484,NA,,[data not captured],undetermined,NotDetermined,present,Sheet,in collection,,[see Simple Media extension],NA,,NA,NA,NA,NA,NA,,,,North America;United States of America;Arkansas;,North America,NA,NA,United States of America,US,Arkansas,,,[data not captured],[data not captured],,NA,NA,,NA,NA,,NA,,,,,NA,,Prunus mexicana S. Watson,Rosaceae,Prunus,mexicana,,S. Watson362,d7578fd0-2992-4d9a-a3c2-fade02f07fee,http://purl.org/dc/dcmitype/PhysicalObject,31:49.0,en,https://huh.harvard.edu/pages/use,President and Fellows of Harvard College,https://huh.harvard.edu/access-digital-reproductions-works-public-domain,http://data.huh.harvard.edu/d7578fd0-2992-4d9a-a3c2-fade02f07fee/image,urn:lsid:biocol.org:col:15406,urn:lsid:biocol.org:col:15406,NA,A,A,Harvard University Herbaria: All Records,PreservedSpecimen,NA,NA,"{huh_taxonomic_group: Vascular, huh_project_id: 7, huh_project_name: US and Canada - Mass Digitization}",d7578fd0-2992-4d9a-a3c2-fade02f07fee,barcode-01722493,NA,,T. V. Munson,undetermined,NotDetermined,present,Sheet,in collection,,[see Simple Media extension],NA,6/27/11,NA,NA,1911,6,27,,,,North America;United States of America;Kansas;,North America,NA,NA,United States of America,US,Kansas,,,2 miles S. E. Parsons,2 miles S. E. Parsons,,NA,NA,,NA,NA,,NA,,,,,NA,,Prunus mexicana S. Watson,Rosaceae,Prunus,mexicana,,S. Watson363,b96712c5-2c3f-47e1-ae39-953e97b1696f,http://purl.org/dc/dcmitype/PhysicalObject,32:54.0,en,https://huh.harvard.edu/pages/use,President and Fellows of Harvard College,https://huh.harvard.edu/access-digital-reproductions-works-public-domain,http://data.huh.harvard.edu/b96712c5-2c3f-47e1-ae39-953e97b1696f/image,urn:lsid:biocol.org:col:15406,urn:lsid:biocol.org:col:15406,NA,A,A,Harvard University Herbaria: All Records,PreservedSpecimen,NA,NA,"{huh_taxonomic_group: Vascular, huh_project_id: 7, huh_project_name: US and Canada - Mass Digitization}",b96712c5-2c3f-47e1-ae39-953e97b1696f,barcode-01722494,NA,,T. V. Munson,undetermined,NotDetermined,present,Sheet,in collection,,[see Simple Media extension],NA,6/27/11,NA,NA,1911,6,27,,,,North America;United States of America;Kansas;,North America,NA,NA,United States of America,US,Kansas,,,2 miles S. E. Parsons,2 miles S. E. Parsons,,NA,NA,,NA,NA,,NA,,,,,NA,,Prunus mexicana S. Watson,Rosaceae,Prunus,mexicana,,S. Watson364,3d55e11a-812e-4031-af52-6a37e6883225,http://purl.org/dc/dcmitype/PhysicalObject,58:00.0,en,https://huh.harvard.edu/pages/use,President and Fellows of Harvard College,https://huh.harvard.edu/access-digital-reproductions-works-public-domain,http://data.huh.harvard.edu/3d55e11a-812e-4031-af52-6a37e6883225/image,urn:lsid:biocol.org:col:15406,urn:lsid:biocol.org:col:15406,NA,A,A,Harvard University Herbaria: All Records,PreservedSpecimen,NA,NA,"{huh_taxonomic_group: Vascular, huh_project_id: 7, huh_project_name: US and Canada - Mass Digitization}",3d55e11a-812e-4031-af52-6a37e6883225,barcode-01722496,NA,,[data not captured],undetermined,NotDetermined,present,Sheet,in collection,,[see Simple Media extension],NA,,NA,NA,NA,NA,NA,,,,North America;United States of America;Louisiana;,North America,NA,NA,United States of America,US,Louisiana,,,[data not captured],[data not captured],,NA,NA,,NA,NA,,NA,,,,,NA,,Prunus mexicana S. Watson,Rosaceae,Prunus,mexicana,,S. Watson365,5cee91cc-0843-457f-bd2a-2ac76f7559f2,http://purl.org/dc/dcmitype/PhysicalObject,58:17.0,en,https://huh.harvard.edu/pages/use,President and Fellows of Harvard College,https://huh.harvard.edu/access-digital-reproductions-works-public-domain,http://data.huh.harvard.edu/5cee91cc-0843-457f-bd2a-2ac76f7559f2/image,urn:lsid:biocol.org:col:15406,urn:lsid:biocol.org:col:15406,NA,A,A,Harvard University Herbaria: All Records,PreservedSpecimen,NA,NA,"{huh_taxonomic_group: Vascular, huh_project_id: 7, huh_project_name: US and Canada - Mass Digitization}",5cee91cc-0843-457f-bd2a-2ac76f7559f2,barcode-01722497,NA,,[data not captured],undetermined,NotDetermined,present,Sheet,in collection,,[see Simple Media extension],NA,,NA,NA,NA,NA,NA,,,,North America;United States of America;Louisiana;,North America,NA,NA,United States of America,US,Louisiana,,,[data not captured],[data not captured],,NA,NA,,NA,NA,,NA,,,,,NA,,Prunus mexicana S. Watson,Rosaceae,Prunus,mexicana,,S. Watson366,6e05c222-d1c7-426d-9a82-9402fdc18cc9,http://purl.org/dc/dcmitype/PhysicalObject,58:38.0,en,https://huh.harvard.edu/pages/use,President and Fellows of Harvard College,https://huh.harvard.edu/access-digital-reproductions-works-public-domain,http://data.huh.harvard.edu/6e05c222-d1c7-426d-9a82-9402fdc18cc9/image,urn:lsid:biocol.org:col:15406,urn:lsid:biocol.org:col:15406,NA,A,A,Harvard University Herbaria: All Records,PreservedSpecimen,NA,NA,"{huh_taxonomic_group: Vascular, huh_project_id: 7, huh_project_name: US and Canada - Mass Digitization}",6e05c222-d1c7-426d-9a82-9402fdc18cc9,barcode-01722498,NA,,[data not captured],undetermined,NotDetermined,present,Sheet,in collection,,[see Simple Media extension],NA,,NA,NA,NA,NA,NA,,,,North America;United States of America;Louisiana;,North America,NA,NA,United States of America,US,Louisiana,,,[data not captured],[data not captured],,NA,NA,,NA,NA,,NA,,,,,NA,,Prunus mexicana S. Watson,Rosaceae,Prunus,mexicana,,S. Watson367,645e8db5-c980-4ff1-8caf-a1b43f1b5da9,http://purl.org/dc/dcmitype/PhysicalObject,58:59.0,en,https://huh.harvard.edu/pages/use,President and Fellows of Harvard College,https://huh.harvard.edu/access-digital-reproductions-works-public-domain,http://data.huh.harvard.edu/645e8db5-c980-4ff1-8caf-a1b43f1b5da9/image,urn:lsid:biocol.org:col:15406,urn:lsid:biocol.org:col:15406,NA,A,A,Harvard University Herbaria: All Records,PreservedSpecimen,NA,NA,"{huh_taxonomic_group: Vascular, huh_project_id: 7, huh_project_name: US and Canada - Mass Digitization}",645e8db5-c980-4ff1-8caf-a1b43f1b5da9,barcode-01722499,NA,,[data not captured],undetermined,NotDetermined,present,Sheet,in collection,,[see Simple Media extension],NA,,NA,NA,NA,NA,NA,,,,North America;United States of America;Louisiana;,North America,NA,NA,United States of America,US,Louisiana,,,[data not captured],[data not captured],,NA,NA,,NA,NA,,NA,,,,,NA,,Prunus mexicana S. Watson,Rosaceae,Prunus,mexicana,,S. Watson368,2e143c89-6e0a-4846-a510-b53577da7da2,http://purl.org/dc/dcmitype/PhysicalObject,59:16.0,en,https://huh.harvard.edu/pages/use,President and Fellows of Harvard College,https://huh.harvard.edu/access-digital-reproductions-works-public-domain,http://data.huh.harvard.edu/2e143c89-6e0a-4846-a510-b53577da7da2/image,urn:lsid:biocol.org:col:15406,urn:lsid:biocol.org:col:15406,NA,A,A,Harvard University Herbaria: All Records,PreservedSpecimen,NA,NA,"{huh_taxonomic_group: Vascular, huh_project_id: 7, huh_project_name: US and Canada - Mass Digitization}",2e143c89-6e0a-4846-a510-b53577da7da2,barcode-01722500,NA,,[data not captured],undetermined,NotDetermined,present,Sheet,in collection,,[see Simple Media extension],NA,,NA,NA,NA,NA,NA,,,,North America;United States of America;Louisiana;,North America,NA,NA,United States of America,US,Louisiana,,,[data not captured],[data not captured],,NA,NA,,NA,NA,,NA,,,,,NA,,Prunus mexicana S. Watson,Rosaceae,Prunus,mexicana,,S. Watson369,7528bbc7-09c8-4955-8238-c73a74de9f13,http://purl.org/dc/dcmitype/PhysicalObject,59:35.0,en,https://huh.harvard.edu/pages/use,President and Fellows of Harvard College,https://huh.harvard.edu/access-digital-reproductions-works-public-domain,http://data.huh.harvard.edu/7528bbc7-09c8-4955-8238-c73a74de9f13/image,urn:lsid:biocol.org:col:15406,urn:lsid:biocol.org:col:15406,NA,A,A,Harvard University Herbaria: All Records,PreservedSpecimen,NA,NA,"{huh_taxonomic_group: Vascular, huh_project_id: 7, huh_project_name: US and Canada - Mass Digitization}",7528bbc7-09c8-4955-8238-c73a74de9f13,barcode-01722501,NA,,[data not captured],undetermined,NotDetermined,present,Sheet,in collection,,[see Simple Media extension],NA,,NA,NA,NA,NA,NA,,,,North America;United States of America;Louisiana;,North America,NA,NA,United States of America,US,Louisiana,,,[data not captured],[data not captured],,NA,NA,,NA,NA,,NA,,,,,NA,,Prunus mexicana S. Watson,Rosaceae,Prunus,mexicana,,S. Watson370,3eccef78-30ef-4043-8f0d-9b79b4c7f21c,http://purl.org/dc/dcmitype/PhysicalObject,00:23.0,en,https://huh.harvard.edu/pages/use,President and Fellows of Harvard College,https://huh.harvard.edu/access-digital-reproductions-works-public-domain,http://data.huh.harvard.edu/3eccef78-30ef-4043-8f0d-9b79b4c7f21c/image,urn:lsid:biocol.org:col:15406,urn:lsid:biocol.org:col:15406,NA,A,A,Harvard University Herbaria: All Records,PreservedSpecimen,NA,NA,"{huh_taxonomic_group: Vascular, huh_project_id: 7, huh_project_name: US and Canada - Mass Digitization}",3eccef78-30ef-4043-8f0d-9b79b4c7f21c,barcode-01722503,NA,,[data not captured],undetermined,NotDetermined,present,Sheet,in collection,,[see Simple Media extension],NA,,NA,NA,NA,NA,NA,,,,North America;United States of America;Louisiana;,North America,NA,NA,United States of America,US,Louisiana,,,[data not captured],[data not captured],,NA,NA,,NA,NA,,NA,,,,,NA,,Prunus mexicana S. Watson,Rosaceae,Prunus,mexicana,,S. Watson371,87ca8c52-eada-4fe7-8b7e-d3000292d01d,http://purl.org/dc/dcmitype/PhysicalObject,00:56.0,en,https://huh.harvard.edu/pages/use,President and Fellows of Harvard College,https://huh.harvard.edu/access-digital-reproductions-works-public-domain,http://data.huh.harvard.edu/87ca8c52-eada-4fe7-8b7e-d3000292d01d/image,urn:lsid:biocol.org:col:15631,urn:lsid:biocol.org:col:15631,NA,GH,GH,Harvard University Herbaria: All Records,PreservedSpecimen,NA,NA,"{huh_taxonomic_group: Vascular, huh_project_id: 7, huh_project_name: US and Canada - Mass Digitization}",87ca8c52-eada-4fe7-8b7e-d3000292d01d,barcode-01722504,NA,,[data not captured],undetermined,NotDetermined,present,Sheet,in collection,,[see Simple Media extension],NA,,NA,NA,NA,NA,NA,,,,North America;United States of America;Louisiana;,North America,NA,NA,United States of America,US,Louisiana,,,[data not captured],[data not captured],,NA,NA,,NA,NA,,NA,,,,,NA,,Prunus mexicana S. Watson,Rosaceae,Prunus,mexicana,,S. Watson372,29e9d117-b815-4124-b160-9f4f61f9d6b7,http://purl.org/dc/dcmitype/PhysicalObject,01:07.0,en,https://huh.harvard.edu/pages/use,President and Fellows of Harvard College,https://huh.harvard.edu/access-digital-reproductions-works-public-domain,http://data.huh.harvard.edu/29e9d117-b815-4124-b160-9f4f61f9d6b7/image,urn:lsid:biocol.org:col:15631,urn:lsid:biocol.org:col:15631,NA,GH,GH,Harvard University Herbaria: All Records,PreservedSpecimen,NA,NA,"{huh_taxonomic_group: Vascular, huh_project_id: 7, huh_project_name: US and Canada - Mass Digitization}",29e9d117-b815-4124-b160-9f4f61f9d6b7,barcode-01722505,NA,,[data not captured],undetermined,NotDetermined,present,Sheet,in collection,,[see Simple Media extension],NA,,NA,NA,NA,NA,NA,,,,North America;United States of America;Louisiana;,North America,NA,NA,United States of America,US,Louisiana,,,[data not captured],[data not captured],,NA,NA,,NA,NA,,NA,,,,,NA,,Prunus mexicana S. Watson,Rosaceae,Prunus,mexicana,,S. Watson373,2271283d-111b-4a21-99fe-b5195f013c13,http://purl.org/dc/dcmitype/PhysicalObject,03:49.0,en,https://huh.harvard.edu/pages/use,President and Fellows of Harvard College,https://huh.harvard.edu/access-digital-reproductions-works-public-domain,http://data.huh.harvard.edu/2271283d-111b-4a21-99fe-b5195f013c13/image,urn:lsid:biocol.org:col:15631,urn:lsid:biocol.org:col:15631,NA,GH,GH,Harvard University Herbaria: All Records,PreservedSpecimen,NA,NA,"{huh_taxonomic_group: Vascular, huh_project_id: 7, huh_project_name: US and Canada - Mass Digitization}",2271283d-111b-4a21-99fe-b5195f013c13,barcode-01722509,NA,,[data not captured],undetermined,NotDetermined,present,Sheet,in collection,,[see Simple Media extension],NA,,NA,NA,NA,NA,NA,,,,North America;United States of America;Louisiana;,North America,NA,NA,United States of America,US,Louisiana,,,[data not captured],[data not captured],,NA,NA,,NA,NA,,NA,,,,,NA,,Prunus mexicana S. Watson,Rosaceae,Prunus,mexicana,,S. Watson374,20521062-1dc0-4f5b-ad79-37f49f51f5e3,http://purl.org/dc/dcmitype/PhysicalObject,09:34.0,en,https://huh.harvard.edu/pages/use,President and Fellows of Harvard College,https://huh.harvard.edu/access-digital-reproductions-works-public-domain,http://data.huh.harvard.edu/20521062-1dc0-4f5b-ad79-37f49f51f5e3/image,urn:lsid:biocol.org:col:15406,urn:lsid:biocol.org:col:15406,NA,A,A,Harvard University Herbaria: All Records,PreservedSpecimen,NA,NA,"{huh_taxonomic_group: Vascular, huh_project_id: 7, huh_project_name: US and Canada - Mass Digitization}",20521062-1dc0-4f5b-ad79-37f49f51f5e3,barcode-01722515,NA,,[data not captured],undetermined,NotDetermined,present,Sheet,in collection,,[see Simple Media extension],NA,,NA,NA,NA,NA,NA,,,,North America;United States of America;Missouri;,North America,NA,NA,United States of America,US,Missouri,,,[data not captured],[data not captured],,NA,NA,,NA,NA,,NA,,,,,NA,,Prunus mexicana S. Watson,Rosaceae,Prunus,mexicana,,S. Watson375,3a83d600-7f24-436c-80e4-b091422d45e6,http://purl.org/dc/dcmitype/PhysicalObject,14:37.0,en,https://huh.harvard.edu/pages/use,President and Fellows of Harvard College,https://huh.harvard.edu/access-digital-reproductions-works-public-domain,http://data.huh.harvard.edu/3a83d600-7f24-436c-80e4-b091422d45e6/image,urn:lsid:biocol.org:col:15406,urn:lsid:biocol.org:col:15406,NA,A,A,Harvard University Herbaria: All Records,PreservedSpecimen,NA,NA,"{huh_taxonomic_group: Vascular, huh_project_id: 7, huh_project_name: US and Canada - Mass Digitization}",3a83d600-7f24-436c-80e4-b091422d45e6,barcode-01722522,NA,,[data not captured],undetermined,NotDetermined,present,Sheet,in collection,,[see Simple Media extension],NA,,NA,NA,NA,NA,NA,,,,North America;United States of America;Missouri;,North America,NA,NA,United States of America,US,Missouri,,,[data not captured],[data not captured],,NA,NA,,NA,NA,,NA,,,,,NA,,Prunus mexicana S. Watson,Rosaceae,Prunus,mexicana,,S. Watson376,b38b84be-2b9b-47cc-933e-3bc38b25e7c8,http://purl.org/dc/dcmitype/PhysicalObject,14:50.0,en,https://huh.harvard.edu/pages/use,President and Fellows of Harvard College,https://huh.harvard.edu/access-digital-reproductions-works-public-domain,http://data.huh.harvard.edu/b38b84be-2b9b-47cc-933e-3bc38b25e7c8/image,urn:lsid:biocol.org:col:15406,urn:lsid:biocol.org:col:15406,NA,A,A,Harvard University Herbaria: All Records,PreservedSpecimen,NA,NA,"{huh_taxonomic_group: Vascular, huh_project_id: 7, huh_project_name: US and Canada - Mass Digitization}",b38b84be-2b9b-47cc-933e-3bc38b25e7c8,barcode-01722523,NA,,[data not captured],undetermined,NotDetermined,present,Sheet,in collection,,[see Simple Media extension],NA,,NA,NA,NA,NA,NA,,,,North America;United States of America;Missouri;,North America,NA,NA,United States of America,US,Missouri,,,[data not captured],[data not captured],,NA,NA,,NA,NA,,NA,,,,,NA,,Prunus mexicana S. Watson,Rosaceae,Prunus,mexicana,,S. Watson377,0f1f38ab-b71e-4c41-b5df-734c5be43328,http://purl.org/dc/dcmitype/PhysicalObject,38:36.0,en,https://huh.harvard.edu/pages/use,President and Fellows of Harvard College,https://huh.harvard.edu/access-digital-reproductions-works-public-domain,http://data.huh.harvard.edu/0f1f38ab-b71e-4c41-b5df-734c5be43328/image,urn:lsid:biocol.org:col:15406,urn:lsid:biocol.org:col:15406,NA,A,A,Harvard University Herbaria: All Records,PreservedSpecimen,NA,NA,"{huh_taxonomic_group: Vascular, huh_project_id: 7, huh_project_name: US and Canada - Mass Digitization}",0f1f38ab-b71e-4c41-b5df-734c5be43328,barcode-01722525,NA,403,B. H. Slavin,undetermined,NotDetermined,present,Sheet,in collection,,[see Simple Media extension],NA,4/12/17,NA,NA,1917,4,12,,,403,North America;United States of America;Oklahoma;,North America,NA,NA,United States of America,US,Oklahoma,,,"Wichita Mts., north of Cache","Wichita Mts., north of Cache",,NA,NA,,NA,NA,,NA,,,,,NA,,Prunus mexicana S. Watson,Rosaceae,Prunus,mexicana,,S. Watson378,084144e0-af34-4252-b5db-a4061e470423,http://purl.org/dc/dcmitype/PhysicalObject,46:50.0,en,https://huh.harvard.edu/pages/use,President and Fellows of Harvard College,https://huh.harvard.edu/access-digital-reproductions-works-public-domain,http://data.huh.harvard.edu/084144e0-af34-4252-b5db-a4061e470423/image,urn:lsid:biocol.org:col:15406,urn:lsid:biocol.org:col:15406,NA,A,A,Harvard University Herbaria: All Records,PreservedSpecimen,NA,NA,"{huh_taxonomic_group: Vascular, huh_project_id: 7, huh_project_name: US and Canada - Mass Digitization}",084144e0-af34-4252-b5db-a4061e470423,barcode-01722528,NA,,W. F. Wight,undetermined,NotDetermined,present,Sheet,in collection,,[see Simple Media extension],NA,8/24/10,NA,NA,1910,8,24,,,,North America;United States of America;Oklahoma;,North America,NA,NA,United States of America,US,Oklahoma,,,Tulsa,Tulsa,,NA,NA,,NA,NA,,NA,,,,,NA,,Prunus mexicana S. Watson,Rosaceae,Prunus,mexicana,,S. Watson379,ccdebb66-bc44-41e4-a668-8ebb60a82831,http://purl.org/dc/dcmitype/PhysicalObject,51:13.0,en,https://huh.harvard.edu/pages/use,President and Fellows of Harvard College,https://huh.harvard.edu/access-digital-reproductions-works-public-domain,http://data.huh.harvard.edu/ccdebb66-bc44-41e4-a668-8ebb60a82831/image,urn:lsid:biocol.org:col:15406,urn:lsid:biocol.org:col:15406,NA,A,A,Harvard University Herbaria: All Records,PreservedSpecimen,NA,NA,"{huh_taxonomic_group: Vascular, huh_project_id: 7, huh_project_name: US and Canada - Mass Digitization}",ccdebb66-bc44-41e4-a668-8ebb60a82831,barcode-01722529,NA,322,B. H. Slavin,undetermined,NotDetermined,present,Sheet,in collection,,[see Simple Media extension],NA,7/3/16,NA,NA,1916,7,3,,This tree grows in a ravine,322,North America;United States of America;Oklahoma;,North America,NA,NA,United States of America,US,Oklahoma,,,about 5 miles southwest of Minco,about 5 miles southwest of Minco,,NA,NA,,NA,NA,,NA,,,,,NA,,Prunus mexicana S. Watson,Rosaceae,Prunus,mexicana,,S. Watson380,9dbc1f43-ed8c-43c6-94ea-de973ec95cbc,http://purl.org/dc/dcmitype/PhysicalObject,47:54.0,en,https://huh.harvard.edu/pages/use,President and Fellows of Harvard College,https://huh.harvard.edu/access-digital-reproductions-works-public-domain,http://data.huh.harvard.edu/9dbc1f43-ed8c-43c6-94ea-de973ec95cbc/image,urn:lsid:biocol.org:col:15406,urn:lsid:biocol.org:col:15406,NA,A,A,Harvard University Herbaria: All Records,PreservedSpecimen,NA,NA,"{huh_taxonomic_group: Vascular, huh_project_id: 7, huh_project_name: US and Canada - Mass Digitization}",9dbc1f43-ed8c-43c6-94ea-de973ec95cbc,barcode-01722547,NA,22,B. H. Slavin,undetermined,NotDetermined,present,Sheet,in collection,,[see Simple Media extension],NA,6/26/14,NA,NA,1914,6,26,,,22,North America;United States of America;Oklahoma;,North America,NA,NA,United States of America,US,Oklahoma,,,S. of Muskogee,S. of Muskogee,,NA,NA,,NA,NA,,NA,,,,,NA,,Prunus mexicana S. Watson,Rosaceae,Prunus,mexicana,,S. Watson381,2e4fe6f7-14f7-417c-a945-8406fa521bb1,http://purl.org/dc/dcmitype/PhysicalObject,50:36.0,en,https://huh.harvard.edu/pages/use,President and Fellows of Harvard College,https://huh.harvard.edu/access-digital-reproductions-works-public-domain,http://data.huh.harvard.edu/2e4fe6f7-14f7-417c-a945-8406fa521bb1/image,urn:lsid:biocol.org:col:15406,urn:lsid:biocol.org:col:15406,NA,A,A,Harvard University Herbaria: All Records,PreservedSpecimen,NA,NA,"{huh_taxonomic_group: Vascular, huh_project_id: 7, huh_project_name: US and Canada - Mass Digitization}",2e4fe6f7-14f7-417c-a945-8406fa521bb1,barcode-01722548,NA,22,B. H. Slavin,undetermined,NotDetermined,present,Sheet,in collection,,[see Simple Media extension],NA,3/30/14,NA,NA,1914,3,30,,,22,North America;United States of America;Oklahoma;,North America,NA,NA,United States of America,US,Oklahoma,,,South of Muskogee,South of Muskogee,,NA,NA,,NA,NA,,NA,,,,,NA,,Prunus mexicana S. Watson,Rosaceae,Prunus,mexicana,,S. Watson382,2960f12e-0ffd-4910-8740-f3042aceca78,http://purl.org/dc/dcmitype/PhysicalObject,03:09.0,en,https://huh.harvard.edu/pages/use,President and Fellows of Harvard College,https://huh.harvard.edu/access-digital-reproductions-works-public-domain,http://data.huh.harvard.edu/2960f12e-0ffd-4910-8740-f3042aceca78/image,urn:lsid:biocol.org:col:15406,urn:lsid:biocol.org:col:15406,NA,A,A,Harvard University Herbaria: All Records,PreservedSpecimen,NA,NA,"{huh_taxonomic_group: Vascular, huh_project_id: 7, huh_project_name: US and Canada - Mass Digitization}",2960f12e-0ffd-4910-8740-f3042aceca78,barcode-01722549,NA,129,B. H. Slavin,undetermined,NotDetermined,present,Sheet,in collection,,[see Simple Media extension],NA,6/26/14,NA,NA,1914,6,26,,,129,North America;United States of America;Oklahoma;,North America,NA,NA,United States of America,US,Oklahoma,,,S. of Muskogee,S. of Muskogee,,NA,NA,,NA,NA,,NA,,,,,NA,,Prunus mexicana S. Watson,Rosaceae,Prunus,mexicana,,S. Watson383,beb30ca7-61e7-466c-8a85-3ad74dac39e4,http://purl.org/dc/dcmitype/PhysicalObject,04:05.0,en,https://huh.harvard.edu/pages/use,President and Fellows of Harvard College,https://huh.harvard.edu/access-digital-reproductions-works-public-domain,http://data.huh.harvard.edu/beb30ca7-61e7-466c-8a85-3ad74dac39e4/image,urn:lsid:biocol.org:col:15406,urn:lsid:biocol.org:col:15406,NA,A,A,Harvard University Herbaria: All Records,PreservedSpecimen,NA,NA,"{huh_taxonomic_group: Vascular, huh_project_id: 7, huh_project_name: US and Canada - Mass Digitization}",beb30ca7-61e7-466c-8a85-3ad74dac39e4,barcode-01722550,NA,16,B. H. Slavin,undetermined,NotDetermined,present,Sheet,in collection,,[see Simple Media extension],NA,4/14/13,NA,NA,1913,4,14,,,16,North America;United States of America;Oklahoma;,North America,NA,NA,United States of America,US,Oklahoma,,,Muskogee,Muskogee,,NA,NA,,NA,NA,,NA,,,,,NA,,Prunus mexicana S. Watson,Rosaceae,Prunus,mexicana,,S. Watson384,e8026733-9ffe-44ae-b62e-2fed8b00057d,http://purl.org/dc/dcmitype/PhysicalObject,04:53.0,en,https://huh.harvard.edu/pages/use,President and Fellows of Harvard College,https://huh.harvard.edu/access-digital-reproductions-works-public-domain,http://data.huh.harvard.edu/e8026733-9ffe-44ae-b62e-2fed8b00057d/image,urn:lsid:biocol.org:col:15406,urn:lsid:biocol.org:col:15406,NA,A,A,Harvard University Herbaria: All Records,PreservedSpecimen,NA,NA,"{huh_taxonomic_group: Vascular, huh_project_id: 7, huh_project_name: US and Canada - Mass Digitization}",e8026733-9ffe-44ae-b62e-2fed8b00057d,barcode-01722551,NA,19,B. H. Slavin,undetermined,NotDetermined,present,Sheet,in collection,,[see Simple Media extension],NA,4/14/13,NA,NA,1913,4,14,,,19,North America;United States of America;Oklahoma;,North America,NA,NA,United States of America,US,Oklahoma,,,Muskogee,Muskogee,,NA,NA,,NA,NA,,NA,,,,,NA,,Prunus mexicana S. Watson,Rosaceae,Prunus,mexicana,,S. Watson385,1f4bbd9f-4484-40a4-9c36-81701e240f36,http://purl.org/dc/dcmitype/PhysicalObject,06:04.0,en,https://huh.harvard.edu/pages/use,President and Fellows of Harvard College,https://huh.harvard.edu/access-digital-reproductions-works-public-domain,http://data.huh.harvard.edu/1f4bbd9f-4484-40a4-9c36-81701e240f36/image,urn:lsid:biocol.org:col:15406,urn:lsid:biocol.org:col:15406,NA,A,A,Harvard University Herbaria: All Records,PreservedSpecimen,NA,NA,"{huh_taxonomic_group: Vascular, huh_project_id: 7, huh_project_name: US and Canada - Mass Digitization}",1f4bbd9f-4484-40a4-9c36-81701e240f36,barcode-01722552,NA,22,B. H. Slavin,undetermined,NotDetermined,present,Sheet,in collection,,[see Simple Media extension],NA,4/14/13,NA,NA,1913,4,14,,,22,North America;United States of America;Oklahoma;,North America,NA,NA,United States of America,US,Oklahoma,,,Muskogee,Muskogee,,NA,NA,,NA,NA,,NA,,,,,NA,,Prunus mexicana S. Watson,Rosaceae,Prunus,mexicana,,S. Watson386,1d320d17-528d-48c9-a367-d7ef829ab0f6,http://purl.org/dc/dcmitype/PhysicalObject,06:43.0,en,https://huh.harvard.edu/pages/use,President and Fellows of Harvard College,https://huh.harvard.edu/access-digital-reproductions-works-public-domain,http://data.huh.harvard.edu/1d320d17-528d-48c9-a367-d7ef829ab0f6/image,urn:lsid:biocol.org:col:15406,urn:lsid:biocol.org:col:15406,NA,A,A,Harvard University Herbaria: All Records,PreservedSpecimen,NA,NA,"{huh_taxonomic_group: Vascular, huh_project_id: 7, huh_project_name: US and Canada - Mass Digitization}",1d320d17-528d-48c9-a367-d7ef829ab0f6,barcode-01722553,NA,23,B. H. Slavin,undetermined,NotDetermined,present,Sheet,in collection,,[see Simple Media extension],NA,4/14/13,NA,NA,1913,4,14,,,23,North America;United States of America;Oklahoma;,North America,NA,NA,United States of America,US,Oklahoma,,,Muskogee,Muskogee,,NA,NA,,NA,NA,,NA,,,,,NA,,Prunus mexicana S. Watson,Rosaceae,Prunus,mexicana,,S. Watson387,b984cb67-9e38-46e2-b231-73dac2d60923,http://purl.org/dc/dcmitype/PhysicalObject,07:15.0,en,https://huh.harvard.edu/pages/use,President and Fellows of Harvard College,https://huh.harvard.edu/access-digital-reproductions-works-public-domain,http://data.huh.harvard.edu/b984cb67-9e38-46e2-b231-73dac2d60923/image,urn:lsid:biocol.org:col:15406,urn:lsid:biocol.org:col:15406,NA,A,A,Harvard University Herbaria: All Records,PreservedSpecimen,NA,NA,"{huh_taxonomic_group: Vascular, huh_project_id: 7, huh_project_name: US and Canada - Mass Digitization}",b984cb67-9e38-46e2-b231-73dac2d60923,barcode-01722554,NA,24,B. H. Slavin,undetermined,NotDetermined,present,Sheet,in collection,,[see Simple Media extension],NA,4/14/13,NA,NA,1913,4,14,,,24,North America;United States of America;Oklahoma;,North America,NA,NA,United States of America,US,Oklahoma,,,Muskogee,Muskogee,,NA,NA,,NA,NA,,NA,,,,,NA,,Prunus mexicana S. Watson,Rosaceae,Prunus,mexicana,,S. Watson388,c531c265-2c03-4abc-ad83-e605d86b77aa,http://purl.org/dc/dcmitype/PhysicalObject,03:34.0,en,https://huh.harvard.edu/pages/use,President and Fellows of Harvard College,https://huh.harvard.edu/access-digital-reproductions-works-public-domain,http://data.huh.harvard.edu/c531c265-2c03-4abc-ad83-e605d86b77aa/image,urn:lsid:biocol.org:col:15406,urn:lsid:biocol.org:col:15406,NA,A,A,Harvard University Herbaria: All Records,PreservedSpecimen,NA,NA,"{huh_taxonomic_group: Vascular, huh_project_id: 7, huh_project_name: US and Canada - Mass Digitization}",c531c265-2c03-4abc-ad83-e605d86b77aa,barcode-01722571,NA,,B. H. Slavin & R. E. Horsey,undetermined,NotDetermined,present,Sheet,in collection,,[see Simple Media extension],NA,8/30/20,NA,NA,1920,8,30,,,,North America;United States of America;Oklahoma;,North America,NA,NA,United States of America,US,Oklahoma,,,Muskogee,Muskogee,,NA,NA,,NA,NA,,NA,,,,,NA,,Prunus mexicana S. Watson,Rosaceae,Prunus,mexicana,,S. Watson389,5d75b432-3103-4853-a75d-abff8333b446,http://purl.org/dc/dcmitype/PhysicalObject,05:22.0,en,https://huh.harvard.edu/pages/use,President and Fellows of Harvard College,https://huh.harvard.edu/access-digital-reproductions-works-public-domain,http://data.huh.harvard.edu/5d75b432-3103-4853-a75d-abff8333b446/image,urn:lsid:biocol.org:col:15406,urn:lsid:biocol.org:col:15406,NA,A,A,Harvard University Herbaria: All Records,PreservedSpecimen,NA,NA,"{huh_taxonomic_group: Vascular, huh_project_id: 7, huh_project_name: US and Canada - Mass Digitization}",5d75b432-3103-4853-a75d-abff8333b446,barcode-01722572,NA,116,B. H. Slavin,undetermined,NotDetermined,present,Sheet,in collection,,[see Simple Media extension],NA,3/29/14,NA,NA,1914,3,29,,,116,North America;United States of America;Oklahoma;,North America,NA,NA,United States of America,US,Oklahoma,,,Muskogee; North of Spaulding Bridge on the Arkansas River,Muskogee; North of Spaulding Bridge on the Arkansas River,,NA,NA,,NA,NA,,NA,,,,,NA,,Prunus mexicana S. Watson,Rosaceae,Prunus,mexicana,,S. Watson390,9c38673e-fb67-4d83-a540-2f21f5591ed2,http://purl.org/dc/dcmitype/PhysicalObject,06:26.0,en,https://huh.harvard.edu/pages/use,President and Fellows of Harvard College,https://huh.harvard.edu/access-digital-reproductions-works-public-domain,http://data.huh.harvard.edu/9c38673e-fb67-4d83-a540-2f21f5591ed2/image,urn:lsid:biocol.org:col:15406,urn:lsid:biocol.org:col:15406,NA,A,A,Harvard University Herbaria: All Records,PreservedSpecimen,NA,NA,"{huh_taxonomic_group: Vascular, huh_project_id: 7, huh_project_name: US and Canada - Mass Digitization}",9c38673e-fb67-4d83-a540-2f21f5591ed2,barcode-01722573,NA,116,B. H. Slavin,undetermined,NotDetermined,present,Sheet,in collection,,[see Simple Media extension],NA,6/27/14,NA,NA,1914,6,27,,,116,North America;United States of America;Oklahoma;,North America,NA,NA,United States of America,US,Oklahoma,,,Arkansas River,Arkansas River,,NA,NA,,NA,NA,,NA,,,,,NA,,Prunus mexicana S. Watson,Rosaceae,Prunus,mexicana,,S. Watson391,ab203918-aa35-481d-9fab-05a4b5d90379,http://purl.org/dc/dcmitype/PhysicalObject,11:17.0,en,https://huh.harvard.edu/pages/use,President and Fellows of Harvard College,https://huh.harvard.edu/access-digital-reproductions-works-public-domain,http://data.huh.harvard.edu/ab203918-aa35-481d-9fab-05a4b5d90379/image,urn:lsid:biocol.org:col:15406,urn:lsid:biocol.org:col:15406,NA,A,A,Harvard University Herbaria: All Records,PreservedSpecimen,NA,NA,"{huh_taxonomic_group: Vascular, huh_project_id: 7, huh_project_name: US and Canada - Mass Digitization}",ab203918-aa35-481d-9fab-05a4b5d90379,barcode-01722574,NA,124,B. H. Slavin,undetermined,NotDetermined,present,Sheet,in collection,,[see Simple Media extension],NA,3/30/14,NA,NA,1914,3,30,,,124,North America;United States of America;Oklahoma;,North America,NA,NA,United States of America,US,Oklahoma,,,South of Muskogee,South of Muskogee,,NA,NA,,NA,NA,,NA,,,,,NA,,Prunus mexicana S. Watson,Rosaceae,Prunus,mexicana,,S. Watson392,5774a5ae-589a-4dc0-b9d3-cbf2c335737e,http://purl.org/dc/dcmitype/PhysicalObject,11:59.0,en,https://huh.harvard.edu/pages/use,President and Fellows of Harvard College,https://huh.harvard.edu/access-digital-reproductions-works-public-domain,http://data.huh.harvard.edu/5774a5ae-589a-4dc0-b9d3-cbf2c335737e/image,urn:lsid:biocol.org:col:15406,urn:lsid:biocol.org:col:15406,NA,A,A,Harvard University Herbaria: All Records,PreservedSpecimen,NA,NA,"{huh_taxonomic_group: Vascular, huh_project_id: 7, huh_project_name: US and Canada - Mass Digitization}",5774a5ae-589a-4dc0-b9d3-cbf2c335737e,barcode-01722575,NA,124,B. H. Slavin,undetermined,NotDetermined,present,Sheet,in collection,,[see Simple Media extension],NA,6/26/14,NA,NA,1914,6,26,,,124,North America;United States of America;Oklahoma;,North America,NA,NA,United States of America,US,Oklahoma,,,S. of Muskogee,S. of Muskogee,,NA,NA,,NA,NA,,NA,,,,,NA,,Prunus mexicana S. Watson,Rosaceae,Prunus,mexicana,,S. Watson393,35bc242a-a312-4470-9706-183d1e1b2bca,http://purl.org/dc/dcmitype/PhysicalObject,13:51.0,en,https://huh.harvard.edu/pages/use,President and Fellows of Harvard College,https://huh.harvard.edu/access-digital-reproductions-works-public-domain,http://data.huh.harvard.edu/35bc242a-a312-4470-9706-183d1e1b2bca/image,urn:lsid:biocol.org:col:15406,urn:lsid:biocol.org:col:15406,NA,A,A,Harvard University Herbaria: All Records,PreservedSpecimen,NA,NA,"{huh_taxonomic_group: Vascular, huh_project_id: 7, huh_project_name: US and Canada - Mass Digitization}",35bc242a-a312-4470-9706-183d1e1b2bca,barcode-01722576,NA,126,B. H. Slavin,undetermined,NotDetermined,present,Sheet,in collection,,[see Simple Media extension],NA,3/30/14,NA,NA,1914,3,30,,,126,North America;United States of America;Oklahoma;,North America,NA,NA,United States of America,US,Oklahoma,,,about 10 miles south of Muskogee,about 10 miles south of Muskogee,,NA,NA,,NA,NA,,NA,,,,,NA,,Prunus mexicana S. Watson,Rosaceae,Prunus,mexicana,,S. Watson394,2e7e409f-dd44-42f0-a72c-98c52c115c14,http://purl.org/dc/dcmitype/PhysicalObject,15:08.0,en,https://huh.harvard.edu/pages/use,President and Fellows of Harvard College,https://huh.harvard.edu/access-digital-reproductions-works-public-domain,http://data.huh.harvard.edu/2e7e409f-dd44-42f0-a72c-98c52c115c14/image,urn:lsid:biocol.org:col:15406,urn:lsid:biocol.org:col:15406,NA,A,A,Harvard University Herbaria: All Records,PreservedSpecimen,NA,NA,"{huh_taxonomic_group: Vascular, huh_project_id: 7, huh_project_name: US and Canada - Mass Digitization}",2e7e409f-dd44-42f0-a72c-98c52c115c14,barcode-01722577,NA,126,B. H. Slavin,undetermined,NotDetermined,present,Sheet,in collection,,[see Simple Media extension],NA,6/26/14,NA,NA,1914,6,26,,,126,North America;United States of America;Oklahoma;,North America,NA,NA,United States of America,US,Oklahoma,,,S. of Muskogee,S. of Muskogee,,NA,NA,,NA,NA,,NA,,,,,NA,,Prunus mexicana S. Watson,Rosaceae,Prunus,mexicana,,S. Watson395,f987c885-6107-4628-8448-07cded10cc6e,http://purl.org/dc/dcmitype/PhysicalObject,49:59.0,en,https://huh.harvard.edu/pages/use,President and Fellows of Harvard College,https://huh.harvard.edu/access-digital-reproductions-works-public-domain,http://data.huh.harvard.edu/f987c885-6107-4628-8448-07cded10cc6e/image,urn:lsid:biocol.org:col:15406,urn:lsid:biocol.org:col:15406,NA,A,A,Harvard University Herbaria: All Records,PreservedSpecimen,NA,NA,"{huh_taxonomic_group: Vascular, huh_project_id: 7, huh_project_name: US and Canada - Mass Digitization}",f987c885-6107-4628-8448-07cded10cc6e,barcode-01722579,NA,3,T. V. Munson,undetermined,NotDetermined,present,Sheet,in collection,,[see Simple Media extension],NA,5/1/10,NA,NA,1910,5,1,,,3,North America;United States of America;Texas;,North America,NA,NA,United States of America,US,Texas,,,Cedar Creek Mill,Cedar Creek Mill,,NA,NA,,NA,NA,,NA,,,,,NA,,Prunus mexicana S. Watson,Rosaceae,Prunus,mexicana,,S. Watson396,80f08931-7f40-4b82-a1d0-598d2c061b0b,http://purl.org/dc/dcmitype/PhysicalObject,00:06.0,en,https://huh.harvard.edu/pages/use,President and Fellows of Harvard College,https://huh.harvard.edu/access-digital-reproductions-works-public-domain,http://data.huh.harvard.edu/80f08931-7f40-4b82-a1d0-598d2c061b0b/image,urn:lsid:biocol.org:col:15406,urn:lsid:biocol.org:col:15406,NA,A,A,Harvard University Herbaria: All Records,PreservedSpecimen,NA,NA,"{huh_taxonomic_group: Vascular, huh_project_id: 7, huh_project_name: US and Canada - Mass Digitization}",80f08931-7f40-4b82-a1d0-598d2c061b0b,barcode-01722587,NA,7,T. V. Munson,undetermined,NotDetermined,present,Sheet,in collection,,[see Simple Media extension],NA,5/25/10,NA,NA,1910,5,25,,,7,North America;United States of America;Texas;,North America,NA,NA,United States of America,US,Texas,,,Henrietta 2 1/2 mi. W,Henrietta 2 1/2 mi. W,,NA,NA,,NA,NA,,NA,,,,,NA,,Prunus mexicana S. Watson,Rosaceae,Prunus,mexicana,,S. Watson397,a93cb550-bfa3-42d2-a39d-688bec2d1513,http://purl.org/dc/dcmitype/PhysicalObject,00:56.0,en,https://huh.harvard.edu/pages/use,President and Fellows of Harvard College,https://huh.harvard.edu/access-digital-reproductions-works-public-domain,http://data.huh.harvard.edu/a93cb550-bfa3-42d2-a39d-688bec2d1513/image,urn:lsid:biocol.org:col:15406,urn:lsid:biocol.org:col:15406,NA,A,A,Harvard University Herbaria: All Records,PreservedSpecimen,NA,NA,"{huh_taxonomic_group: Vascular, huh_project_id: 7, huh_project_name: US and Canada - Mass Digitization}",a93cb550-bfa3-42d2-a39d-688bec2d1513,barcode-01722588,NA,7,T. V. Munson,undetermined,NotDetermined,present,Sheet,in collection,,[see Simple Media extension],NA,5/25/10,NA,NA,1910,5,25,,,7,North America;United States of America;Texas;,North America,NA,NA,United States of America,US,Texas,,,2 1/2 m. W. of Henrietta,2 1/2 m. W. of Henrietta,,NA,NA,,NA,NA,,NA,,,,,NA,,Prunus mexicana S. Watson,Rosaceae,Prunus,mexicana,,S. Watson398,63835649-6b45-476c-86a1-b7e969fd1b3e,http://purl.org/dc/dcmitype/PhysicalObject,02:51.0,en,https://huh.harvard.edu/pages/use,President and Fellows of Harvard College,https://huh.harvard.edu/access-digital-reproductions-works-public-domain,http://data.huh.harvard.edu/63835649-6b45-476c-86a1-b7e969fd1b3e/image,urn:lsid:biocol.org:col:15406,urn:lsid:biocol.org:col:15406,NA,A,A,Harvard University Herbaria: All Records,PreservedSpecimen,NA,NA,"{huh_taxonomic_group: Vascular, huh_project_id: 7, huh_project_name: US and Canada - Mass Digitization}",63835649-6b45-476c-86a1-b7e969fd1b3e,barcode-01722590,NA,106,B. H. Slavin,undetermined,NotDetermined,present,Sheet,in collection,,[see Simple Media extension],NA,6/23/14,NA,NA,1914,6,23,,,106,North America;United States of America;Texas;,North America,NA,NA,United States of America,US,Texas,,,E. of Henrietta,E. of Henrietta,,NA,NA,,NA,NA,,NA,,,,,NA,,Prunus mexicana S. Watson,Rosaceae,Prunus,mexicana,,S. Watson399,0236ce03-b72d-4270-9cb0-ce0ae4c4dba8,http://purl.org/dc/dcmitype/PhysicalObject,50:47.0,en,https://huh.harvard.edu/pages/use,President and Fellows of Harvard College,https://huh.harvard.edu/access-digital-reproductions-works-public-domain,http://data.huh.harvard.edu/0236ce03-b72d-4270-9cb0-ce0ae4c4dba8/image,urn:lsid:biocol.org:col:15406,urn:lsid:biocol.org:col:15406,NA,A,A,Harvard University Herbaria: All Records,PreservedSpecimen,NA,NA,"{huh_taxonomic_group: Vascular, huh_project_id: 7, huh_project_name: US and Canada - Mass Digitization}",0236ce03-b72d-4270-9cb0-ce0ae4c4dba8,barcode-01722592,NA,,[data not captured],undetermined,NotDetermined,present,Sheet,in collection,,[see Simple Media extension],NA,,NA,NA,NA,NA,NA,,,,North America;United States of America;Washington;,North America,NA,NA,United States of America,US,Washington,,,[data not captured],[data not captured],,NA,NA,,NA,NA,,NA,,,,,NA,,Prunus mexicana S. Watson,Rosaceae,Prunus,mexicana,,S. Watson400,a9be5ea0-fc01-4342-97c8-9ff2c9eda240,http://purl.org/dc/dcmitype/PhysicalObject,06:25.0,en,https://huh.harvard.edu/pages/use,President and Fellows of Harvard College,https://huh.harvard.edu/access-digital-reproductions-works-public-domain,http://data.huh.harvard.edu/a9be5ea0-fc01-4342-97c8-9ff2c9eda240/image,urn:lsid:biocol.org:col:15406,urn:lsid:biocol.org:col:15406,NA,A,A,Harvard University Herbaria: All Records,PreservedSpecimen,NA,NA,"{huh_taxonomic_group: Vascular, huh_project_id: 7, huh_project_name: US and Canada - Mass Digitization}",a9be5ea0-fc01-4342-97c8-9ff2c9eda240,barcode-01722594,NA,2994,J. Reverchon,undetermined,NotDetermined,present,Sheet,in collection,,[see Simple Media extension],NA,3/18/02,NA,NA,1902,3,18,,caleareaous soils,2994,North America;United States of America;Texas;,North America,NA,NA,United States of America,US,Texas,,,[no additional data],[no additional data],,NA,NA,,NA,NA,,NA,,,,,NA,,Prunus mexicana S. Watson,Rosaceae,Prunus,mexicana,,S. Watson401,db152e26-60f2-4739-a527-d51f65771632,http://purl.org/dc/dcmitype/PhysicalObject,22:52.0,en,https://huh.harvard.edu/pages/use,President and Fellows of Harvard College,https://huh.harvard.edu/access-digital-reproductions-works-public-domain,http://data.huh.harvard.edu/db152e26-60f2-4739-a527-d51f65771632/image,urn:lsid:biocol.org:col:15406,urn:lsid:biocol.org:col:15406,NA,A,A,Harvard University Herbaria: All Records,PreservedSpecimen,NA,NA,"{huh_taxonomic_group: Vascular, huh_project_id: 7, huh_project_name: US and Canada - Mass Digitization}",db152e26-60f2-4739-a527-d51f65771632,barcode-01722597,NA,2994,J. Reverchon,undetermined,NotDetermined,present,Sheet,in collection,,[see Simple Media extension],NA,10/18/02,NA,NA,1902,10,18,,,2994,North America;United States of America;Texas;,North America,NA,NA,United States of America,US,Texas,,,[no additional data],[no additional data],,NA,NA,,NA,NA,,NA,,,,,NA,,Prunus mexicana S. Watson,Rosaceae,Prunus,mexicana,,S. Watson402,5b70df8e-193f-407b-b88e-98a8ec86ee85,http://purl.org/dc/dcmitype/PhysicalObject,30:18.0,en,https://huh.harvard.edu/pages/use,President and Fellows of Harvard College,https://huh.harvard.edu/access-digital-reproductions-works-public-domain,http://data.huh.harvard.edu/5b70df8e-193f-407b-b88e-98a8ec86ee85/image,urn:lsid:biocol.org:col:15406,urn:lsid:biocol.org:col:15406,NA,A,A,Harvard University Herbaria: All Records,PreservedSpecimen,NA,NA,"{huh_taxonomic_group: Vascular, huh_project_id: 7, huh_project_name: US and Canada - Mass Digitization}",5b70df8e-193f-407b-b88e-98a8ec86ee85,barcode-01722601,NA,7,C. S. Sargent,undetermined,NotDetermined,present,Sheet,in collection,,[see Simple Media extension],NA,3/22/10,NA,NA,1910,3,22,,bottom of [illegible] creek,7,North America;United States of America;Texas;,North America,NA,NA,United States of America,US,Texas,,,7 miles west of Dallas,7 miles west of Dallas,,NA,NA,,NA,NA,,NA,,,,,NA,,Prunus mexicana S. Watson,Rosaceae,Prunus,mexicana,,S. Watson403,cc300557-892e-4908-8f38-65900526b985,http://purl.org/dc/dcmitype/PhysicalObject,32:13.0,en,https://huh.harvard.edu/pages/use,President and Fellows of Harvard College,https://huh.harvard.edu/access-digital-reproductions-works-public-domain,http://data.huh.harvard.edu/cc300557-892e-4908-8f38-65900526b985/image,urn:lsid:biocol.org:col:15406,urn:lsid:biocol.org:col:15406,NA,A,A,Harvard University Herbaria: All Records,PreservedSpecimen,NA,NA,"{huh_taxonomic_group: Vascular, huh_project_id: 7, huh_project_name: US and Canada - Mass Digitization}",cc300557-892e-4908-8f38-65900526b985,barcode-01722602,NA,,C. S. Sargent,undetermined,NotDetermined,present,Sheet,in collection,,[see Simple Media extension],NA,3/3/15,NA,NA,1915,3,3,,,,North America;United States of America;Texas;,North America,NA,NA,United States of America,US,Texas,,,[illegible] Cliff near Dallas,[illegible] Cliff near Dallas,,NA,NA,,NA,NA,,NA,,,,,NA,,Prunus mexicana S. Watson,Rosaceae,Prunus,mexicana,,S. Watson404,34cb6310-1518-4cf5-bebd-6b9453bf3420,http://purl.org/dc/dcmitype/PhysicalObject,34:03.0,en,https://huh.harvard.edu/pages/use,President and Fellows of Harvard College,https://huh.harvard.edu/access-digital-reproductions-works-public-domain,http://data.huh.harvard.edu/34cb6310-1518-4cf5-bebd-6b9453bf3420/image,urn:lsid:biocol.org:col:15406,urn:lsid:biocol.org:col:15406,NA,A,A,Harvard University Herbaria: All Records,PreservedSpecimen,NA,NA,"{huh_taxonomic_group: Vascular, huh_project_id: 7, huh_project_name: US and Canada - Mass Digitization}",34cb6310-1518-4cf5-bebd-6b9453bf3420,barcode-01722603,NA,3,C. S. Sargent,undetermined,NotDetermined,present,Sheet,in collection,,[see Simple Media extension],NA,3/22/10,NA,NA,1910,3,22,,,3,North America;United States of America;Texas;,North America,NA,NA,United States of America,US,Texas,,,in Cedar Creek [illegible] south west of Oak CLiff Dallas,in Cedar Creek [illegible] south west of Oak CLiff Dallas,,NA,NA,,NA,NA,,NA,,,,,NA,,Prunus mexicana S. Watson,Rosaceae,Prunus,mexicana,,S. Watson405,fd1c46cf-985a-4da1-a0dc-e4574377852c,http://purl.org/dc/dcmitype/PhysicalObject,04:20.0,en,https://huh.harvard.edu/pages/use,President and Fellows of Harvard College,https://huh.harvard.edu/access-digital-reproductions-works-public-domain,http://data.huh.harvard.edu/fd1c46cf-985a-4da1-a0dc-e4574377852c/image,urn:lsid:biocol.org:col:15406,urn:lsid:biocol.org:col:15406,NA,A,A,Harvard University Herbaria: All Records,PreservedSpecimen,NA,NA,"{huh_taxonomic_group: Vascular, huh_project_id: 7, huh_project_name: US and Canada - Mass Digitization}",fd1c46cf-985a-4da1-a0dc-e4574377852c,barcode-01722605,NA,,C. S. Sargent,undetermined,NotDetermined,present,Sheet,in collection,,[see Simple Media extension],NA,3/20/04,NA,NA,1904,3,20,,bank,,North America;United States of America;Texas;,North America,NA,NA,United States of America,US,Texas,,,Bluff of Cedar Creek near Dallas,Bluff of Cedar Creek near Dallas,,NA,NA,,NA,NA,,NA,,,,,NA,,Prunus mexicana S. Watson,Rosaceae,Prunus,mexicana,,S. Watson406,d0023af0-a4c8-4dc5-92ae-5c53e83da026,http://purl.org/dc/dcmitype/PhysicalObject,06:26.0,en,https://huh.harvard.edu/pages/use,President and Fellows of Harvard College,https://huh.harvard.edu/access-digital-reproductions-works-public-domain,http://data.huh.harvard.edu/d0023af0-a4c8-4dc5-92ae-5c53e83da026/image,urn:lsid:biocol.org:col:15406,urn:lsid:biocol.org:col:15406,NA,A,A,Harvard University Herbaria: All Records,PreservedSpecimen,NA,NA,"{huh_taxonomic_group: Vascular, huh_project_id: 7, huh_project_name: US and Canada - Mass Digitization}",d0023af0-a4c8-4dc5-92ae-5c53e83da026,barcode-01722606,NA,1,T. V. Munson,undetermined,NotDetermined,present,Sheet,in collection,,[see Simple Media extension],NA,3/25/15,NA,NA,1915,3,25,,by tree in riasing place,1,North America;United States of America;Texas;,North America,NA,NA,United States of America,US,Texas,,,SIn Sabo and Colorado River,SIn Sabo and Colorado River,,NA,NA,,NA,NA,,NA,,,,,NA,,Prunus mexicana S. Watson,Rosaceae,Prunus,mexicana,,S. Watson407,1caa67cc-7ca6-4dce-a9a3-38ec9910c57b,http://purl.org/dc/dcmitype/PhysicalObject,08:10.0,en,https://huh.harvard.edu/pages/use,President and Fellows of Harvard College,https://huh.harvard.edu/access-digital-reproductions-works-public-domain,http://data.huh.harvard.edu/1caa67cc-7ca6-4dce-a9a3-38ec9910c57b/image,urn:lsid:biocol.org:col:15406,urn:lsid:biocol.org:col:15406,NA,A,A,Harvard University Herbaria: All Records,PreservedSpecimen,NA,NA,"{huh_taxonomic_group: Vascular, huh_project_id: 7, huh_project_name: US and Canada - Mass Digitization}",1caa67cc-7ca6-4dce-a9a3-38ec9910c57b,barcode-01722607,NA,2,T. V. Munson,undetermined,NotDetermined,present,Sheet,in collection,,[see Simple Media extension],NA,3/10/10,NA,NA,1910,3,10,,river,2,North America;United States of America;Texas;,North America,NA,NA,United States of America,US,Texas,,,Resine [illegible],Resine [illegible],,NA,NA,,NA,NA,,NA,,,,,NA,,Prunus mexicana S. Watson,Rosaceae,Prunus,mexicana,,S. Watson408,49b7ef56-6070-4153-aa4a-17e90ac3222f,http://purl.org/dc/dcmitype/PhysicalObject,09:44.0,en,https://huh.harvard.edu/pages/use,President and Fellows of Harvard College,https://huh.harvard.edu/access-digital-reproductions-works-public-domain,http://data.huh.harvard.edu/49b7ef56-6070-4153-aa4a-17e90ac3222f/image,urn:lsid:biocol.org:col:15406,urn:lsid:biocol.org:col:15406,NA,A,A,Harvard University Herbaria: All Records,PreservedSpecimen,NA,NA,"{huh_taxonomic_group: Vascular, huh_project_id: 7, huh_project_name: US and Canada - Mass Digitization}",49b7ef56-6070-4153-aa4a-17e90ac3222f,barcode-01722608,NA,8,B. H. Slavin,undetermined,NotDetermined,present,Sheet,in collection,,[see Simple Media extension],NA,3/22/14,NA,NA,1914,3,22,,,8,North America;United States of America;Texas;,North America,NA,NA,United States of America,US,Texas,,,"Cook's Springs, south of Denison","Cook's Springs, south of Denison",,NA,NA,,NA,NA,,NA,,,,,NA,,Prunus mexicana S. Watson,Rosaceae,Prunus,mexicana,,S. Watson409,60fe66e4-127d-4af3-991b-3b8693f7b9d4,http://purl.org/dc/dcmitype/PhysicalObject,10:51.0,en,https://huh.harvard.edu/pages/use,President and Fellows of Harvard College,https://huh.harvard.edu/access-digital-reproductions-works-public-domain,http://data.huh.harvard.edu/60fe66e4-127d-4af3-991b-3b8693f7b9d4/image,urn:lsid:biocol.org:col:15406,urn:lsid:biocol.org:col:15406,NA,A,A,Harvard University Herbaria: All Records,PreservedSpecimen,NA,NA,"{huh_taxonomic_group: Vascular, huh_project_id: 7, huh_project_name: US and Canada - Mass Digitization}",60fe66e4-127d-4af3-991b-3b8693f7b9d4,barcode-01722609,NA,8,B. H. Slavin,undetermined,NotDetermined,present,Sheet,in collection,,[see Simple Media extension],NA,6/20/14,NA,NA,1914,6,20,,,8,North America;United States of America;Texas;,North America,NA,NA,United States of America,US,Texas,,,"Cook's Spring, S. of Denison","Cook's Spring, S. of Denison",,NA,NA,,NA,NA,,NA,,,,,NA,,Prunus mexicana S. Watson,Rosaceae,Prunus,mexicana,,S. Watson410,3a09da86-ec77-4872-923f-8070fccab398,http://purl.org/dc/dcmitype/PhysicalObject,11:10.0,en,https://huh.harvard.edu/pages/use,President and Fellows of Harvard College,https://huh.harvard.edu/access-digital-reproductions-works-public-domain,http://data.huh.harvard.edu/3a09da86-ec77-4872-923f-8070fccab398/image,urn:lsid:biocol.org:col:15406,urn:lsid:biocol.org:col:15406,NA,A,A,Harvard University Herbaria: All Records,PreservedSpecimen,NA,NA,"{huh_taxonomic_group: Vascular, huh_project_id: 7, huh_project_name: US and Canada - Mass Digitization}",3a09da86-ec77-4872-923f-8070fccab398,barcode-01722610,NA,,[data not captured],undetermined,NotDetermined,present,Sheet,in collection,,[see Simple Media extension],NA,,NA,NA,NA,NA,NA,,,,North America;US and Canada (countries only and not Greenland);,North America,NA,NA,,,,,,[data not captured],[data not captured],,NA,NA,,NA,NA,,NA,,,,,NA,,Prunus mexicana S. Watson,Rosaceae,Prunus,mexicana,,S. Watson411,7fcfbccc-3346-4f6b-af95-966b8c20f54d,http://purl.org/dc/dcmitype/PhysicalObject,11:53.0,en,https://huh.harvard.edu/pages/use,President and Fellows of Harvard College,https://huh.harvard.edu/access-digital-reproductions-works-public-domain,http://data.huh.harvard.edu/7fcfbccc-3346-4f6b-af95-966b8c20f54d/image,urn:lsid:biocol.org:col:15406,urn:lsid:biocol.org:col:15406,NA,A,A,Harvard University Herbaria: All Records,PreservedSpecimen,NA,NA,"{huh_taxonomic_group: Vascular, huh_project_id: 7, huh_project_name: US and Canada - Mass Digitization}",7fcfbccc-3346-4f6b-af95-966b8c20f54d,barcode-01722612,NA,,[data not captured],undetermined,NotDetermined,present,Sheet,in collection,,[see Simple Media extension],NA,,NA,NA,NA,NA,NA,,,,North America;US and Canada (countries only and not Greenland);,North America,NA,NA,,,,,,[data not captured],[data not captured],,NA,NA,,NA,NA,,NA,,,,,NA,,Prunus mexicana S. Watson,Rosaceae,Prunus,mexicana,,S. Watson412,fb4ff87c-ce3a-47b1-81c3-dd128cb51168,http://purl.org/dc/dcmitype/PhysicalObject,13:25.0,en,https://huh.harvard.edu/pages/use,President and Fellows of Harvard College,https://huh.harvard.edu/access-digital-reproductions-works-public-domain,http://data.huh.harvard.edu/fb4ff87c-ce3a-47b1-81c3-dd128cb51168/image,urn:lsid:biocol.org:col:15406,urn:lsid:biocol.org:col:15406,NA,A,A,Harvard University Herbaria: All Records,PreservedSpecimen,NA,NA,"{huh_taxonomic_group: Vascular, huh_project_id: 7, huh_project_name: US and Canada - Mass Digitization}",fb4ff87c-ce3a-47b1-81c3-dd128cb51168,barcode-01722613,NA,,T. V. Munson,undetermined,NotDetermined,present,Sheet,in collection,,[see Simple Media extension],NA,8/10/11,NA,NA,1911,8,10,,Bottom,,North America;United States of America;Texas;,North America,NA,NA,United States of America,US,Texas,,,5 1/2 m. N. W. Denison,5 1/2 m. N. W. Denison,,NA,NA,,NA,NA,,NA,,,,,NA,,Prunus mexicana S. Watson,Rosaceae,Prunus,mexicana,,S. Watson413,5b83f80b-f829-4610-ae3d-d9c79c3440e0,http://purl.org/dc/dcmitype/PhysicalObject,14:36.0,en,https://huh.harvard.edu/pages/use,President and Fellows of Harvard College,https://huh.harvard.edu/access-digital-reproductions-works-public-domain,http://data.huh.harvard.edu/5b83f80b-f829-4610-ae3d-d9c79c3440e0/image,urn:lsid:biocol.org:col:15406,urn:lsid:biocol.org:col:15406,NA,A,A,Harvard University Herbaria: All Records,PreservedSpecimen,NA,NA,"{huh_taxonomic_group: Vascular, huh_project_id: 7, huh_project_name: US and Canada - Mass Digitization}",5b83f80b-f829-4610-ae3d-d9c79c3440e0,barcode-01722614,NA,,T. V. Munson,undetermined,NotDetermined,present,Sheet,in collection,,[see Simple Media extension],NA,8/10/11,NA,NA,1911,8,10,,Bottom,,North America;United States of America;Texas;,North America,NA,NA,United States of America,US,Texas,,,5 m. N.W. of Dennison,5 m. N.W. of Dennison,,NA,NA,,NA,NA,,NA,,,,,NA,,Prunus mexicana S. Watson,Rosaceae,Prunus,mexicana,,S. Watson414,f77e49e0-b709-4aa8-a89b-e604e21bf89d,http://purl.org/dc/dcmitype/PhysicalObject,16:18.0,en,https://huh.harvard.edu/pages/use,President and Fellows of Harvard College,https://huh.harvard.edu/access-digital-reproductions-works-public-domain,http://data.huh.harvard.edu/f77e49e0-b709-4aa8-a89b-e604e21bf89d/image,urn:lsid:biocol.org:col:15406,urn:lsid:biocol.org:col:15406,NA,A,A,Harvard University Herbaria: All Records,PreservedSpecimen,NA,NA,"{huh_taxonomic_group: Vascular, huh_project_id: 7, huh_project_name: US and Canada - Mass Digitization}",f77e49e0-b709-4aa8-a89b-e604e21bf89d,barcode-01722615,NA,17c,T. V. Munson,undetermined,NotDetermined,present,Sheet,in collection,,[see Simple Media extension],NA,5/2/11,NA,NA,1911,5,2,,Bottoms,17c,North America;United States of America;Texas;,North America,NA,NA,United States of America,US,Texas,,,4 miles northwest of Dennison,4 miles northwest of Dennison,,NA,NA,,NA,NA,,NA,,,,,NA,,Prunus mexicana S. Watson,Rosaceae,Prunus,mexicana,,S. Watson415,4e5adddc-a2eb-4cfa-b0b1-900dcaf15687,http://purl.org/dc/dcmitype/PhysicalObject,16:20.0,en,https://huh.harvard.edu/pages/use,President and Fellows of Harvard College,https://huh.harvard.edu/access-digital-reproductions-works-public-domain,http://data.huh.harvard.edu/4e5adddc-a2eb-4cfa-b0b1-900dcaf15687/image,urn:lsid:biocol.org:col:15406,urn:lsid:biocol.org:col:15406,NA,A,A,Harvard University Herbaria: All Records,PreservedSpecimen,NA,NA,"{huh_taxonomic_group: Vascular, huh_project_id: 7, huh_project_name: US and Canada - Mass Digitization}",4e5adddc-a2eb-4cfa-b0b1-900dcaf15687,barcode-01722616,NA,,[data not captured],undetermined,NotDetermined,present,Sheet,in collection,,[see Simple Media extension],NA,,NA,NA,NA,NA,NA,,,,North America;US and Canada (countries only and not Greenland);,North America,NA,NA,,,,,,[data not captured],[data not captured],,NA,NA,,NA,NA,,NA,,,,,NA,,Prunus mexicana S. Watson,Rosaceae,Prunus,mexicana,,S. Watson416,93c5ff81-a035-4d43-82ff-e66e6fe4a2cb,http://purl.org/dc/dcmitype/PhysicalObject,18:05.0,en,https://huh.harvard.edu/pages/use,President and Fellows of Harvard College,https://huh.harvard.edu/access-digital-reproductions-works-public-domain,http://data.huh.harvard.edu/93c5ff81-a035-4d43-82ff-e66e6fe4a2cb/image,urn:lsid:biocol.org:col:15406,urn:lsid:biocol.org:col:15406,NA,A,A,Harvard University Herbaria: All Records,PreservedSpecimen,NA,NA,"{huh_taxonomic_group: Vascular, huh_project_id: 7, huh_project_name: US and Canada - Mass Digitization}",93c5ff81-a035-4d43-82ff-e66e6fe4a2cb,barcode-01722618,NA,17 A,C. S. Sargent,undetermined,NotDetermined,present,Sheet,in collection,,[see Simple Media extension],NA,3/19/11,NA,NA,1911,3,19,,Bottoms,17 A,North America;United States of America;Texas;,North America,NA,NA,United States of America,US,Texas,,,near Denison,near Denison,,NA,NA,,NA,NA,,NA,,,,,NA,,Prunus mexicana S. Watson,Rosaceae,Prunus,mexicana,,S. Watson417,f32e2304-1f4c-40b0-a1b0-af312f79ef37,http://purl.org/dc/dcmitype/PhysicalObject,19:50.0,en,https://huh.harvard.edu/pages/use,President and Fellows of Harvard College,https://huh.harvard.edu/access-digital-reproductions-works-public-domain,http://data.huh.harvard.edu/f32e2304-1f4c-40b0-a1b0-af312f79ef37/image,urn:lsid:biocol.org:col:15406,urn:lsid:biocol.org:col:15406,NA,A,A,Harvard University Herbaria: All Records,PreservedSpecimen,NA,NA,"{huh_taxonomic_group: Vascular, huh_project_id: 7, huh_project_name: US and Canada - Mass Digitization}",f32e2304-1f4c-40b0-a1b0-af312f79ef37,barcode-01722619,NA,17 B,C. S. Sargent,undetermined,NotDetermined,present,Sheet,in collection,,[see Simple Media extension],NA,3/19/11,NA,NA,1911,3,19,,Bottoma,17 B,North America;United States of America;Texas;,North America,NA,NA,United States of America,US,Texas,,,near Denison,near Denison,,NA,NA,,NA,NA,,NA,,,,,NA,,Prunus mexicana S. Watson,Rosaceae,Prunus,mexicana,,S. Watson418,f7cbc6f9-0bde-4cc1-92b1-09190687d8ed,http://purl.org/dc/dcmitype/PhysicalObject,25:23.0,en,https://huh.harvard.edu/pages/use,President and Fellows of Harvard College,https://huh.harvard.edu/access-digital-reproductions-works-public-domain,http://data.huh.harvard.edu/f7cbc6f9-0bde-4cc1-92b1-09190687d8ed/image,urn:lsid:biocol.org:col:15406,urn:lsid:biocol.org:col:15406,NA,A,A,Harvard University Herbaria: All Records,PreservedSpecimen,NA,NA,"{huh_taxonomic_group: Vascular, huh_project_id: 7, huh_project_name: US and Canada - Mass Digitization}",f7cbc6f9-0bde-4cc1-92b1-09190687d8ed,barcode-01722621,NA,6,C. S. Sargent,undetermined,NotDetermined,present,Sheet,in collection,,[see Simple Media extension],NA,3/21/11,NA,NA,1911,3,21,,on hill top,6,North America;United States of America;Texas;,North America,NA,NA,United States of America,US,Texas,,,near [illegible],near [illegible],,NA,NA,,NA,NA,,NA,,,,,NA,,Prunus mexicana S. Watson,Rosaceae,Prunus,mexicana,,S. Watson419,7f5f02b7-2581-4c67-b42c-885dc8f002a7,http://purl.org/dc/dcmitype/PhysicalObject,27:24.0,en,https://huh.harvard.edu/pages/use,President and Fellows of Harvard College,https://huh.harvard.edu/access-digital-reproductions-works-public-domain,http://data.huh.harvard.edu/7f5f02b7-2581-4c67-b42c-885dc8f002a7/image,urn:lsid:biocol.org:col:15406,urn:lsid:biocol.org:col:15406,NA,A,A,Harvard University Herbaria: All Records,PreservedSpecimen,NA,NA,"{huh_taxonomic_group: Vascular, huh_project_id: 7, huh_project_name: US and Canada - Mass Digitization}",7f5f02b7-2581-4c67-b42c-885dc8f002a7,barcode-01722623,NA,3,C. S. Sargent,undetermined,NotDetermined,present,Sheet,in collection,,[see Simple Media extension],NA,3/22/09,NA,NA,1909,3,22,,,3,North America;United States of America;Texas;,North America,NA,NA,United States of America,US,Texas,,,Ramsays [illegible],Ramsays [illegible],,NA,NA,,NA,NA,,NA,,,,,NA,,Prunus mexicana S. Watson,Rosaceae,Prunus,mexicana,,S. Watson420,54ab41f5-3cbc-4a5c-9f46-7575a050953c,http://purl.org/dc/dcmitype/PhysicalObject,33:12.0,en,https://huh.harvard.edu/pages/use,President and Fellows of Harvard College,https://huh.harvard.edu/access-digital-reproductions-works-public-domain,http://data.huh.harvard.edu/54ab41f5-3cbc-4a5c-9f46-7575a050953c/image,urn:lsid:biocol.org:col:15631,urn:lsid:biocol.org:col:15631,NA,GH,GH,Harvard University Herbaria: All Records,PreservedSpecimen,NA,NA,"{huh_taxonomic_group: Vascular, huh_project_id: 7, huh_project_name: US and Canada - Mass Digitization}",54ab41f5-3cbc-4a5c-9f46-7575a050953c,barcode-01722624,NA,37099,D. S. Correll,undetermined,NotDetermined,present,Sheet,in collection,,[see Simple Media extension],NA,4/26/69,NA,NA,1969,4,26,,"on wooded bluff, pine hardwood forests at bluffs",37099,North America;United States of America;Texas;,North America,NA,NA,United States of America,US,Texas,,,"Lamar-Red River Cos.: old Pine Bluff Ferry along Red River, about 3.5 mi. east of Kanawha","Lamar-Red River Cos.: old Pine Bluff Ferry along Red River, about 3.5 mi. east of Kanawha",,NA,NA,,NA,NA,,NA,,,,,NA,,Prunus mexicana S. Watson,Rosaceae,Prunus,mexicana,,S. Watson421,9a8e98f8-b2bc-47ad-bd2c-d6c24f62533e,http://purl.org/dc/dcmitype/PhysicalObject,34:40.0,en,https://huh.harvard.edu/pages/use,President and Fellows of Harvard College,https://huh.harvard.edu/access-digital-reproductions-works-public-domain,http://data.huh.harvard.edu/9a8e98f8-b2bc-47ad-bd2c-d6c24f62533e/image,urn:lsid:biocol.org:col:15406,urn:lsid:biocol.org:col:15406,NA,A,A,Harvard University Herbaria: All Records,PreservedSpecimen,NA,NA,"{huh_taxonomic_group: Vascular, huh_project_id: 7, huh_project_name: US and Canada - Mass Digitization}",9a8e98f8-b2bc-47ad-bd2c-d6c24f62533e,barcode-01722625,NA,,C. S. Sargent,undetermined,NotDetermined,present,Sheet,in collection,,[see Simple Media extension],NA,2/20/10,NA,NA,1910,2,20,,,,North America;United States of America;Texas;,North America,NA,NA,United States of America,US,Texas,,,Near Denison,Near Denison,,NA,NA,,NA,NA,,NA,,,,,NA,,Prunus mexicana S. Watson,Rosaceae,Prunus,mexicana,,S. Watson422,2210a253-5f6a-4999-895f-d09e3b93f6fe,http://purl.org/dc/dcmitype/PhysicalObject,36:53.0,en,https://huh.harvard.edu/pages/use,President and Fellows of Harvard College,https://huh.harvard.edu/access-digital-reproductions-works-public-domain,http://data.huh.harvard.edu/2210a253-5f6a-4999-895f-d09e3b93f6fe/image,urn:lsid:biocol.org:col:15406,urn:lsid:biocol.org:col:15406,NA,A,A,Harvard University Herbaria: All Records,PreservedSpecimen,NA,NA,"{huh_taxonomic_group: Vascular, huh_project_id: 7, huh_project_name: US and Canada - Mass Digitization}",2210a253-5f6a-4999-895f-d09e3b93f6fe,barcode-01722626,NA,,C. S. Sargent,undetermined,NotDetermined,present,Sheet,in collection,,[see Simple Media extension],NA,3/19/11,NA,NA,1911,3,19,,,,North America;United States of America;Texas;,North America,NA,NA,United States of America,US,Texas,,,Near Denison,Near Denison,,NA,NA,,NA,NA,,NA,,,,,NA,,Prunus mexicana S. Watson,Rosaceae,Prunus,mexicana,,S. Watson423,c1397810-37d8-4a7a-ace9-6f5716c8af20,http://purl.org/dc/dcmitype/PhysicalObject,38:10.0,en,https://huh.harvard.edu/pages/use,President and Fellows of Harvard College,https://huh.harvard.edu/access-digital-reproductions-works-public-domain,http://data.huh.harvard.edu/c1397810-37d8-4a7a-ace9-6f5716c8af20/image,urn:lsid:biocol.org:col:15406,urn:lsid:biocol.org:col:15406,NA,A,A,Harvard University Herbaria: All Records,PreservedSpecimen,NA,NA,"{huh_taxonomic_group: Vascular, huh_project_id: 7, huh_project_name: US and Canada - Mass Digitization}",c1397810-37d8-4a7a-ace9-6f5716c8af20,barcode-01722627,NA,,C. S. Sargent,undetermined,NotDetermined,present,Sheet,in collection,,[see Simple Media extension],NA,3/20/10,NA,NA,1910,3,20,,,,North America;United States of America;Texas;,North America,NA,NA,United States of America,US,Texas,,,near Denison,near Denison,,NA,NA,,NA,NA,,NA,,,,,NA,,Prunus mexicana S. Watson,Rosaceae,Prunus,mexicana,,S. Watson424,cbba41eb-bd21-4774-b1c4-f44e38c2d291,http://purl.org/dc/dcmitype/PhysicalObject,41:53.0,en,https://huh.harvard.edu/pages/use,President and Fellows of Harvard College,https://huh.harvard.edu/access-digital-reproductions-works-public-domain,http://data.huh.harvard.edu/cbba41eb-bd21-4774-b1c4-f44e38c2d291/image,urn:lsid:biocol.org:col:15406,urn:lsid:biocol.org:col:15406,NA,A,A,Harvard University Herbaria: All Records,PreservedSpecimen,NA,NA,"{huh_taxonomic_group: Vascular, huh_project_id: 7, huh_project_name: US and Canada - Mass Digitization}",cbba41eb-bd21-4774-b1c4-f44e38c2d291,barcode-01722628,NA,16,C. S. Sargent,undetermined,NotDetermined,present,Sheet,in collection,,[see Simple Media extension],NA,3/19/11,NA,NA,1911,3,19,,,16,North America;United States of America;Texas;,North America,NA,NA,United States of America,US,Texas,,,Near Denison,Near Denison,,NA,NA,,NA,NA,,NA,,,,,NA,,Prunus mexicana S. Watson,Rosaceae,Prunus,mexicana,,S. Watson425,7a2daf9a-0b9c-4ca2-98e2-34f312235a79,http://purl.org/dc/dcmitype/PhysicalObject,15:55.0,en,https://huh.harvard.edu/pages/use,President and Fellows of Harvard College,https://huh.harvard.edu/access-digital-reproductions-works-public-domain,http://data.huh.harvard.edu/7a2daf9a-0b9c-4ca2-98e2-34f312235a79/image,urn:lsid:biocol.org:col:15406,urn:lsid:biocol.org:col:15406,NA,A,A,Harvard University Herbaria: All Records,PreservedSpecimen,NA,NA,"{huh_taxonomic_group: Vascular, huh_project_id: 7, huh_project_name: US and Canada - Mass Digitization}",7a2daf9a-0b9c-4ca2-98e2-34f312235a79,barcode-01722629,NA,,T. V. Munson,undetermined,NotDetermined,present,Sheet,in collection,,[see Simple Media extension],NA,9/13/10,NA,NA,1910,9,13,,,,North America;United States of America;Texas;,North America,NA,NA,United States of America,US,Texas,,,[no additional data],[no additional data],,NA,NA,,NA,NA,,NA,,,,,NA,,Prunus mexicana S. Watson,Rosaceae,Prunus,mexicana,,S. Watson426,19aae446-b274-47f1-9830-27cf41f34f0d,http://purl.org/dc/dcmitype/PhysicalObject,17:08.0,en,https://huh.harvard.edu/pages/use,President and Fellows of Harvard College,https://huh.harvard.edu/access-digital-reproductions-works-public-domain,http://data.huh.harvard.edu/19aae446-b274-47f1-9830-27cf41f34f0d/image,urn:lsid:biocol.org:col:15406,urn:lsid:biocol.org:col:15406,NA,A,A,Harvard University Herbaria: All Records,PreservedSpecimen,NA,NA,"{huh_taxonomic_group: Vascular, huh_project_id: 7, huh_project_name: US and Canada - Mass Digitization}",19aae446-b274-47f1-9830-27cf41f34f0d,barcode-01722630,NA,,T. V. Munson,undetermined,NotDetermined,present,Sheet,in collection,,[see Simple Media extension],NA,9/13/10,NA,NA,1910,9,13,,,,North America;United States of America;Texas;,North America,NA,NA,United States of America,US,Texas,,,2 mi. W. of Therman,2 mi. W. of Therman,,NA,NA,,NA,NA,,NA,,,,,NA,,Prunus mexicana S. Watson,Rosaceae,Prunus,mexicana,,S. Watson427,40f6da02-e9f2-487c-85da-82987b6d5ca8,http://purl.org/dc/dcmitype/PhysicalObject,18:29.0,en,https://huh.harvard.edu/pages/use,President and Fellows of Harvard College,https://huh.harvard.edu/access-digital-reproductions-works-public-domain,http://data.huh.harvard.edu/40f6da02-e9f2-487c-85da-82987b6d5ca8/image,urn:lsid:biocol.org:col:15406,urn:lsid:biocol.org:col:15406,NA,A,A,Harvard University Herbaria: All Records,PreservedSpecimen,NA,NA,"{huh_taxonomic_group: Vascular, huh_project_id: 7, huh_project_name: US and Canada - Mass Digitization}",40f6da02-e9f2-487c-85da-82987b6d5ca8,barcode-01722631,NA,,T. V. Munson,undetermined,NotDetermined,present,Sheet,in collection,,[see Simple Media extension],NA,8/10/11,NA,NA,1911,8,10,,Upland,,North America;United States of America;Texas;,North America,NA,NA,United States of America,US,Texas,,,5 miles N.W. Denison,5 miles N.W. Denison,,NA,NA,,NA,NA,,NA,,,,,NA,,Prunus mexicana S. Watson,Rosaceae,Prunus,mexicana,,S. Watson428,63a32a15-6279-4369-828e-4deb96b81562,http://purl.org/dc/dcmitype/PhysicalObject,19:36.0,en,https://huh.harvard.edu/pages/use,President and Fellows of Harvard College,https://huh.harvard.edu/access-digital-reproductions-works-public-domain,http://data.huh.harvard.edu/63a32a15-6279-4369-828e-4deb96b81562/image,urn:lsid:biocol.org:col:15406,urn:lsid:biocol.org:col:15406,NA,A,A,Harvard University Herbaria: All Records,PreservedSpecimen,NA,NA,"{huh_taxonomic_group: Vascular, huh_project_id: 7, huh_project_name: US and Canada - Mass Digitization}",63a32a15-6279-4369-828e-4deb96b81562,barcode-01722633,NA,,[data not captured],undetermined,NotDetermined,present,Sheet,in collection,,[see Simple Media extension],NA,3/12/10,NA,NA,1910,3,12,,,,North America;United States of America;Texas;,North America,NA,NA,United States of America,US,Texas,,,Trinity River [illegible] 2 west of Dallas,Trinity River [illegible] 2 west of Dallas,,NA,NA,,NA,NA,,NA,,,,,NA,,Prunus mexicana S. Watson,Rosaceae,Prunus,mexicana,,S. Watson429,c1569d1f-f8b2-4942-834d-5ddad65cff4e,http://purl.org/dc/dcmitype/PhysicalObject,21:23.0,en,https://huh.harvard.edu/pages/use,President and Fellows of Harvard College,https://huh.harvard.edu/access-digital-reproductions-works-public-domain,http://data.huh.harvard.edu/c1569d1f-f8b2-4942-834d-5ddad65cff4e/image,urn:lsid:biocol.org:col:15406,urn:lsid:biocol.org:col:15406,NA,A,A,Harvard University Herbaria: All Records,PreservedSpecimen,NA,NA,"{huh_taxonomic_group: Vascular, huh_project_id: 7, huh_project_name: US and Canada - Mass Digitization}",c1569d1f-f8b2-4942-834d-5ddad65cff4e,barcode-01722634,NA,7,T. V. Munson,undetermined,NotDetermined,present,Sheet,in collection,,[see Simple Media extension],NA,1910,NA,NA,1910,NA,NA,,in bottoms of Creek,7,North America;United States of America;Texas;,North America,NA,NA,United States of America,US,Texas,,,"7 m. N Dallas White Rock Creek, right side of road going towards Richardson","7 m. N Dallas White Rock Creek, right side of road going towards Richardson",,NA,NA,,NA,NA,,NA,,,,,NA,,Prunus mexicana S. Watson,Rosaceae,Prunus,mexicana,,S. Watson430,ae7f109c-6d92-49c0-8888-5a73f427aac9,http://purl.org/dc/dcmitype/PhysicalObject,23:10.0,en,https://huh.harvard.edu/pages/use,President and Fellows of Harvard College,https://huh.harvard.edu/access-digital-reproductions-works-public-domain,http://data.huh.harvard.edu/ae7f109c-6d92-49c0-8888-5a73f427aac9/image,urn:lsid:biocol.org:col:15406,urn:lsid:biocol.org:col:15406,NA,A,A,Harvard University Herbaria: All Records,PreservedSpecimen,NA,NA,"{huh_taxonomic_group: Vascular, huh_project_id: 7, huh_project_name: US and Canada - Mass Digitization}",ae7f109c-6d92-49c0-8888-5a73f427aac9,barcode-01722636,NA,4521,[data not captured],undetermined,NotDetermined,present,Sheet,in collection,,[see Simple Media extension],NA,9/3/10,NA,NA,1910,9,3,,,4521,North America;United States of America;Texas;,North America,NA,NA,United States of America,US,Texas,,,Near Works Stations,Near Works Stations,,NA,NA,,NA,NA,,NA,,,,,NA,,Prunus mexicana S. Watson,Rosaceae,Prunus,mexicana,,S. Watson431,ae2df62a-33a0-47ff-bd9e-7715f3f0d950,http://purl.org/dc/dcmitype/PhysicalObject,30:31.0,en,https://huh.harvard.edu/pages/use,President and Fellows of Harvard College,https://huh.harvard.edu/access-digital-reproductions-works-public-domain,http://data.huh.harvard.edu/ae2df62a-33a0-47ff-bd9e-7715f3f0d950/image,urn:lsid:biocol.org:col:15406,urn:lsid:biocol.org:col:15406,NA,A,A,Harvard University Herbaria: All Records,PreservedSpecimen,NA,NA,"{huh_taxonomic_group: Vascular, huh_project_id: 7, huh_project_name: US and Canada - Mass Digitization}",ae2df62a-33a0-47ff-bd9e-7715f3f0d950,barcode-01722637,NA,4522,W. F. Wight,undetermined,NotDetermined,present,Sheet,in collection,,[see Simple Media extension],NA,8/3/10,NA,NA,1910,8,3,,,4522,North America;United States of America;Texas;,North America,NA,NA,United States of America,US,Texas,,,North of Vickery,North of Vickery,,NA,NA,,NA,NA,,NA,,,,,NA,,Prunus mexicana S. Watson,Rosaceae,Prunus,mexicana,,S. Watson432,7bf7160f-e790-4878-95af-4d332b6c5acd,http://purl.org/dc/dcmitype/PhysicalObject,33:16.0,en,https://huh.harvard.edu/pages/use,President and Fellows of Harvard College,https://huh.harvard.edu/access-digital-reproductions-works-public-domain,http://data.huh.harvard.edu/7bf7160f-e790-4878-95af-4d332b6c5acd/image,urn:lsid:biocol.org:col:15406,urn:lsid:biocol.org:col:15406,NA,A,A,Harvard University Herbaria: All Records,PreservedSpecimen,NA,NA,"{huh_taxonomic_group: Vascular, huh_project_id: 7, huh_project_name: US and Canada - Mass Digitization}",7bf7160f-e790-4878-95af-4d332b6c5acd,barcode-01722638,NA,4534,W. F. Wight,undetermined,NotDetermined,present,Sheet,in collection,,[see Simple Media extension],NA,8/3/10,NA,NA,1910,8,3,,,4534,North America;United States of America;Texas;,North America,NA,NA,United States of America,US,Texas,,,North of Vickery,North of Vickery,,NA,NA,,NA,NA,,NA,,,,,NA,,Prunus mexicana S. Watson,Rosaceae,Prunus,mexicana,,S. Watson433,ee38cd41-4233-4885-b276-ed5572644b4e,http://purl.org/dc/dcmitype/PhysicalObject,52:20.0,en,https://huh.harvard.edu/pages/use,President and Fellows of Harvard College,https://huh.harvard.edu/access-digital-reproductions-works-public-domain,http://data.huh.harvard.edu/ee38cd41-4233-4885-b276-ed5572644b4e/image,urn:lsid:biocol.org:col:15406,urn:lsid:biocol.org:col:15406,NA,A,A,Harvard University Herbaria: All Records,PreservedSpecimen,NA,NA,"{huh_taxonomic_group: Vascular, huh_project_id: 7, huh_project_name: US and Canada - Mass Digitization}",ee38cd41-4233-4885-b276-ed5572644b4e,barcode-01722641,NA,99,B. H. Slavin,undetermined,NotDetermined,present,Sheet,in collection,,[see Simple Media extension],NA,6/24/14,NA,NA,1914,6,24,,,99,North America;United States of America;Texas;,North America,NA,NA,United States of America,US,Texas,,,W. of Dallas,W. of Dallas,,NA,NA,,NA,NA,,NA,,,,,NA,,Prunus mexicana S. Watson,Rosaceae,Prunus,mexicana,,S. Watson434,7cd765a6-2b81-4ac7-a933-23660e09415c,http://purl.org/dc/dcmitype/PhysicalObject,56:23.0,en,https://huh.harvard.edu/pages/use,President and Fellows of Harvard College,https://huh.harvard.edu/access-digital-reproductions-works-public-domain,http://data.huh.harvard.edu/7cd765a6-2b81-4ac7-a933-23660e09415c/image,urn:lsid:biocol.org:col:15631,urn:lsid:biocol.org:col:15631,NA,GH,GH,Harvard University Herbaria: All Records,PreservedSpecimen,NA,NA,"{huh_taxonomic_group: Vascular, huh_project_id: 7, huh_project_name: US and Canada - Mass Digitization}",7cd765a6-2b81-4ac7-a933-23660e09415c,barcode-01722645,NA,7689,V. L. Cory,undetermined,NotDetermined,present,Sheet,in collection,,[see Simple Media extension],NA,10/27/33,NA,NA,1933,10,27,,,7689,North America;United States of America;Texas;,North America,NA,NA,United States of America,US,Texas,,,Cottonwood Springs,Cottonwood Springs,,NA,NA,,NA,NA,,NA,"H. J. Bickley, Jr. 1976-04",,,,NA,,Prunus mexicana S. Watson,Rosaceae,Prunus,mexicana,,S. Watson435,4ac1b7d4-646f-4ea3-80d9-920c393d977c,http://purl.org/dc/dcmitype/PhysicalObject,46:08.0,en,https://huh.harvard.edu/pages/use,President and Fellows of Harvard College,https://huh.harvard.edu/access-digital-reproductions-works-public-domain,http://data.huh.harvard.edu/4ac1b7d4-646f-4ea3-80d9-920c393d977c/image,urn:lsid:biocol.org:col:15631,urn:lsid:biocol.org:col:15631,NA,GH,GH,Harvard University Herbaria: All Records,PreservedSpecimen,NA,NA,"{huh_taxonomic_group: Vascular, huh_project_id: 7, huh_project_name: US and Canada - Mass Digitization}",4ac1b7d4-646f-4ea3-80d9-920c393d977c,barcode-01722648,NA,,[data not captured],undetermined,NotDetermined,present,Sheet,in collection,,[see Simple Media extension],NA,,NA,NA,NA,NA,NA,,,,North America;US and Canada (countries only and not Greenland);,North America,NA,NA,,,,,,[data not captured],[data not captured],,NA,NA,,NA,NA,,NA,,,,,NA,,Prunus mexicana S. Watson,Rosaceae,Prunus,mexicana,,S. Watson436,83149bb3-d254-4a0b-9e68-328da5460190,http://purl.org/dc/dcmitype/PhysicalObject,15:27.0,en,https://huh.harvard.edu/pages/use,President and Fellows of Harvard College,https://huh.harvard.edu/access-digital-reproductions-works-public-domain,http://data.huh.harvard.edu/83149bb3-d254-4a0b-9e68-328da5460190/image,urn:lsid:biocol.org:col:15406,urn:lsid:biocol.org:col:15406,NA,A,A,Harvard University Herbaria: All Records,PreservedSpecimen,NA,NA,"{huh_taxonomic_group: Vascular, huh_project_id: 7, huh_project_name: US and Canada - Mass Digitization}",83149bb3-d254-4a0b-9e68-328da5460190,barcode-01722649,NA,17a,T. V. Munson,undetermined,NotDetermined,present,Sheet,in collection,,[see Simple Media extension],NA,5/2/11,NA,NA,1911,5,2,,,17a,North America;United States of America;Texas;,North America,NA,NA,United States of America,US,Texas,,,4 miles northwest of Denison,4 miles northwest of Denison,,NA,NA,,NA,NA,,NA,,,,,NA,,Prunus mexicana S. Watson,Rosaceae,Prunus,mexicana,,S. Watson437,1a5e5b70-6635-4c04-981e-35f0c5d4fb13,http://purl.org/dc/dcmitype/PhysicalObject,16:06.0,en,https://huh.harvard.edu/pages/use,President and Fellows of Harvard College,https://huh.harvard.edu/access-digital-reproductions-works-public-domain,http://data.huh.harvard.edu/1a5e5b70-6635-4c04-981e-35f0c5d4fb13/image,urn:lsid:biocol.org:col:15406,urn:lsid:biocol.org:col:15406,NA,A,A,Harvard University Herbaria: All Records,PreservedSpecimen,NA,NA,"{huh_taxonomic_group: Vascular, huh_project_id: 7, huh_project_name: US and Canada - Mass Digitization}",1a5e5b70-6635-4c04-981e-35f0c5d4fb13,barcode-01722650,NA,89,B. H. Slavin,undetermined,NotDetermined,present,Sheet,in collection,,[see Simple Media extension],NA,6/22/14,NA,NA,1914,6,22,,,89,North America;United States of America;Texas;,North America,NA,NA,United States of America,US,Texas,,,N. of Denison,N. of Denison,,NA,NA,,NA,NA,,NA,,,,,NA,,Prunus mexicana S. Watson,Rosaceae,Prunus,mexicana,,S. Watson438,c8dc3ad4-ca49-4955-bf54-2cd7565e8019,http://purl.org/dc/dcmitype/PhysicalObject,21:19.0,en,https://huh.harvard.edu/pages/use,President and Fellows of Harvard College,https://huh.harvard.edu/access-digital-reproductions-works-public-domain,http://data.huh.harvard.edu/c8dc3ad4-ca49-4955-bf54-2cd7565e8019/image,urn:lsid:biocol.org:col:15406,urn:lsid:biocol.org:col:15406,NA,A,A,Harvard University Herbaria: All Records,PreservedSpecimen,NA,NA,"{huh_taxonomic_group: Vascular, huh_project_id: 7, huh_project_name: US and Canada - Mass Digitization}",c8dc3ad4-ca49-4955-bf54-2cd7565e8019,barcode-01722651,NA,89,B. H. Slavin,undetermined,NotDetermined,present,Sheet,in collection,,[see Simple Media extension],NA,3/23/14,NA,NA,1914,3,23,,,89,North America;United States of America;Oklahoma;,North America,NA,NA,United States of America,US,Oklahoma,,,"This tree stands on the Oklahoma side of the Red River north of Denison, Texas","This tree stands on the Oklahoma side of the Red River north of Denison, Texas",,NA,NA,,NA,NA,,NA,,,,,NA,,Prunus mexicana S. Watson,Rosaceae,Prunus,mexicana,,S. Watson439,72c2fd17-b248-4566-a729-93317b17b187,http://purl.org/dc/dcmitype/PhysicalObject,36:20.0,en,https://huh.harvard.edu/pages/use,President and Fellows of Harvard College,https://huh.harvard.edu/access-digital-reproductions-works-public-domain,http://data.huh.harvard.edu/72c2fd17-b248-4566-a729-93317b17b187/image,urn:lsid:biocol.org:col:15406,urn:lsid:biocol.org:col:15406,NA,A,A,Harvard University Herbaria: All Records,PreservedSpecimen,NA,NA,"{huh_taxonomic_group: Vascular, huh_project_id: 7, huh_project_name: US and Canada - Mass Digitization}",72c2fd17-b248-4566-a729-93317b17b187,barcode-01722652,NA,93,B. H. Slavin,undetermined,NotDetermined,present,Sheet,in collection,,[see Simple Media extension],NA,3/23/14,NA,NA,1914,3,23,,,93,North America;United States of America;Texas;,North America,NA,NA,United States of America,US,Texas,,,"on the wooded bank of Papaw Creek, east ofDenison","on the wooded bank of Papaw Creek, east ofDenison",,NA,NA,,NA,NA,,NA,,,,,NA,,Prunus mexicana S. Watson,Rosaceae,Prunus,mexicana,,S. Watson440,653f3d35-8f9b-40ff-b56c-f465e690948f,http://purl.org/dc/dcmitype/PhysicalObject,38:54.0,en,https://huh.harvard.edu/pages/use,President and Fellows of Harvard College,https://huh.harvard.edu/access-digital-reproductions-works-public-domain,http://data.huh.harvard.edu/653f3d35-8f9b-40ff-b56c-f465e690948f/image,urn:lsid:biocol.org:col:15406,urn:lsid:biocol.org:col:15406,NA,A,A,Harvard University Herbaria: All Records,PreservedSpecimen,NA,NA,"{huh_taxonomic_group: Vascular, huh_project_id: 7, huh_project_name: US and Canada - Mass Digitization}",653f3d35-8f9b-40ff-b56c-f465e690948f,barcode-01722653,NA,93,B. H. Slavin,undetermined,NotDetermined,present,Sheet,in collection,,[see Simple Media extension],NA,6/21/14,NA,NA,1914,6,21,,,93,North America;United States of America;Texas;,North America,NA,NA,United States of America,US,Texas,,,E. of Denison,E. of Denison,,NA,NA,,NA,NA,,NA,,,,,NA,,Prunus mexicana S. Watson,Rosaceae,Prunus,mexicana,,S. Watson441,008ac0e5-7cbd-49e6-807d-8a90a745528c,http://purl.org/dc/dcmitype/PhysicalObject,44:43.0,en,https://huh.harvard.edu/pages/use,President and Fellows of Harvard College,https://huh.harvard.edu/access-digital-reproductions-works-public-domain,http://data.huh.harvard.edu/008ac0e5-7cbd-49e6-807d-8a90a745528c/image,urn:lsid:biocol.org:col:15406,urn:lsid:biocol.org:col:15406,NA,A,A,Harvard University Herbaria: All Records,PreservedSpecimen,NA,NA,"{huh_taxonomic_group: Vascular, huh_project_id: 7, huh_project_name: US and Canada - Mass Digitization}",008ac0e5-7cbd-49e6-807d-8a90a745528c,barcode-01722655,NA,16,T. V. Munson,undetermined,NotDetermined,present,Sheet,in collection,,[see Simple Media extension],NA,5/4/11,NA,NA,1911,5,4,,,16,North America;United States of America;Texas;,North America,NA,NA,United States of America,US,Texas,,,near Denison,near Denison,,NA,NA,,NA,NA,,NA,,,,,NA,,Prunus mexicana S. Watson,Rosaceae,Prunus,mexicana,,S. Watson442,9aef2723-5f82-48ac-81cc-7ae409c68798,http://purl.org/dc/dcmitype/PhysicalObject,48:01.0,en,https://huh.harvard.edu/pages/use,President and Fellows of Harvard College,https://huh.harvard.edu/access-digital-reproductions-works-public-domain,http://data.huh.harvard.edu/9aef2723-5f82-48ac-81cc-7ae409c68798/image,urn:lsid:biocol.org:col:15406,urn:lsid:biocol.org:col:15406,NA,A,A,Harvard University Herbaria: All Records,PreservedSpecimen,NA,NA,"{huh_taxonomic_group: Vascular, huh_project_id: 7, huh_project_name: US and Canada - Mass Digitization}",9aef2723-5f82-48ac-81cc-7ae409c68798,barcode-01722656,NA,17a,T. V. Munson,undetermined,NotDetermined,present,Sheet,in collection,,[see Simple Media extension],NA,5/4/11,NA,NA,1911,5,4,,bottoms,17a,North America;United States of America;Texas;,North America,NA,NA,United States of America,US,Texas,,,near Denison,near Denison,,NA,NA,,NA,NA,,NA,,,,,NA,,Prunus mexicana S. Watson,Rosaceae,Prunus,mexicana,,S. Watson443,2e20ad31-e46e-42c7-ac2c-b2e09cda52e7,http://purl.org/dc/dcmitype/PhysicalObject,47:47.0,en,https://huh.harvard.edu/pages/use,President and Fellows of Harvard College,https://huh.harvard.edu/access-digital-reproductions-works-public-domain,http://data.huh.harvard.edu/2e20ad31-e46e-42c7-ac2c-b2e09cda52e7/image,urn:lsid:biocol.org:col:15406,urn:lsid:biocol.org:col:15406,NA,A,A,Harvard University Herbaria: All Records,PreservedSpecimen,NA,NA,"{huh_taxonomic_group: Vascular, huh_project_id: 7, huh_project_name: US and Canada - Mass Digitization}",2e20ad31-e46e-42c7-ac2c-b2e09cda52e7,barcode-01722657,NA,17B,T. V. Munson,undetermined,NotDetermined,present,Sheet,in collection,,[see Simple Media extension],NA,5/2/11,NA,NA,1911,5,2,,bottoms,17B,North America;United States of America;Texas;,North America,NA,NA,United States of America,US,Texas,,,near Denison,near Denison,,NA,NA,,NA,NA,,NA,,,,,NA,,Prunus mexicana S. Watson,Rosaceae,Prunus,mexicana,,S. Watson444,e310e9d2-7f99-4759-8022-da08c0a817e7,http://purl.org/dc/dcmitype/PhysicalObject,49:02.0,en,https://huh.harvard.edu/pages/use,President and Fellows of Harvard College,https://huh.harvard.edu/access-digital-reproductions-works-public-domain,http://data.huh.harvard.edu/e310e9d2-7f99-4759-8022-da08c0a817e7/image,urn:lsid:biocol.org:col:15406,urn:lsid:biocol.org:col:15406,NA,A,A,Harvard University Herbaria: All Records,PreservedSpecimen,NA,NA,"{huh_taxonomic_group: Vascular, huh_project_id: 7, huh_project_name: US and Canada - Mass Digitization}",e310e9d2-7f99-4759-8022-da08c0a817e7,barcode-01722658,NA,,T. V. Munson,undetermined,NotDetermined,present,Sheet,in collection,,[see Simple Media extension],NA,3/13/11,NA,NA,1911,3,13,,,,North America;United States of America;Texas;,North America,NA,NA,United States of America,US,Texas,,,5 miles N of Denison,5 miles N of Denison,,NA,NA,,NA,NA,,NA,,,,,NA,,Prunus mexicana S. Watson,Rosaceae,Prunus,mexicana,,S. Watson445,3c34040c-4c37-4579-81bf-c3cbb3888a46,http://purl.org/dc/dcmitype/PhysicalObject,50:10.0,en,https://huh.harvard.edu/pages/use,President and Fellows of Harvard College,https://huh.harvard.edu/access-digital-reproductions-works-public-domain,http://data.huh.harvard.edu/3c34040c-4c37-4579-81bf-c3cbb3888a46/image,urn:lsid:biocol.org:col:15406,urn:lsid:biocol.org:col:15406,NA,A,A,Harvard University Herbaria: All Records,PreservedSpecimen,NA,NA,"{huh_taxonomic_group: Vascular, huh_project_id: 7, huh_project_name: US and Canada - Mass Digitization}",3c34040c-4c37-4579-81bf-c3cbb3888a46,barcode-01722659,NA,4583,W. F. Wight,undetermined,NotDetermined,present,Sheet,in collection,,[see Simple Media extension],NA,8/12/10,NA,NA,1910,8,12,,,4583,North America;United States of America;Texas;,North America,NA,NA,United States of America,US,Texas,,,Rescue,Rescue,,NA,NA,,NA,NA,,NA,,,,,NA,,Prunus mexicana S. Watson,Rosaceae,Prunus,mexicana,,S. Watson446,12746a69-8987-477b-9382-e0d343b1425d,http://purl.org/dc/dcmitype/PhysicalObject,50:58.0,en,https://huh.harvard.edu/pages/use,President and Fellows of Harvard College,https://huh.harvard.edu/access-digital-reproductions-works-public-domain,http://data.huh.harvard.edu/12746a69-8987-477b-9382-e0d343b1425d/image,urn:lsid:biocol.org:col:15406,urn:lsid:biocol.org:col:15406,NA,A,A,Harvard University Herbaria: All Records,PreservedSpecimen,NA,NA,"{huh_taxonomic_group: Vascular, huh_project_id: 7, huh_project_name: US and Canada - Mass Digitization}",12746a69-8987-477b-9382-e0d343b1425d,barcode-01722660,NA,4582,W. F. Wight,undetermined,NotDetermined,present,Sheet,in collection,,[see Simple Media extension],NA,8/12/10,NA,NA,1910,8,12,,,4582,North America;United States of America;Texas;,North America,NA,NA,United States of America,US,Texas,,,Rescue,Rescue,,NA,NA,,NA,NA,,NA,,,,,NA,,Prunus mexicana S. Watson,Rosaceae,Prunus,mexicana,,S. Watson447,ccc8bf91-8dd0-41bb-911e-bd97a1912f71,http://purl.org/dc/dcmitype/PhysicalObject,51:45.0,en,https://huh.harvard.edu/pages/use,President and Fellows of Harvard College,https://huh.harvard.edu/access-digital-reproductions-works-public-domain,http://data.huh.harvard.edu/ccc8bf91-8dd0-41bb-911e-bd97a1912f71/image,urn:lsid:biocol.org:col:15406,urn:lsid:biocol.org:col:15406,NA,A,A,Harvard University Herbaria: All Records,PreservedSpecimen,NA,NA,"{huh_taxonomic_group: Vascular, huh_project_id: 7, huh_project_name: US and Canada - Mass Digitization}",ccc8bf91-8dd0-41bb-911e-bd97a1912f71,barcode-01722661,NA,4586,W. F. Wight,undetermined,NotDetermined,present,Sheet,in collection,,[see Simple Media extension],NA,8/12/10,NA,NA,1910,8,12,,,4586,North America;United States of America;Texas;,North America,NA,NA,United States of America,US,Texas,,,Rescue,Rescue,,NA,NA,,NA,NA,,NA,,,,,NA,,Prunus mexicana S. Watson,Rosaceae,Prunus,mexicana,,S. Watson448,36f4c273-2ecb-4d21-9ae9-870304404521,http://purl.org/dc/dcmitype/PhysicalObject,52:10.0,en,https://huh.harvard.edu/pages/use,President and Fellows of Harvard College,https://huh.harvard.edu/access-digital-reproductions-works-public-domain,http://data.huh.harvard.edu/36f4c273-2ecb-4d21-9ae9-870304404521/image,urn:lsid:biocol.org:col:15406,urn:lsid:biocol.org:col:15406,NA,A,A,Harvard University Herbaria: All Records,PreservedSpecimen,NA,NA,"{huh_taxonomic_group: Vascular, huh_project_id: 7, huh_project_name: US and Canada - Mass Digitization}",36f4c273-2ecb-4d21-9ae9-870304404521,barcode-01722662,NA,2,T. V. Munson,undetermined,NotDetermined,present,Sheet,in collection,,[see Simple Media extension],NA,3/10/10,NA,NA,1910,3,10,,,2,North America;United States of America;Texas;,North America,NA,NA,United States of America,US,Texas,,,Rescue,Rescue,,NA,NA,,NA,NA,,NA,,,,,NA,,Prunus mexicana S. Watson,Rosaceae,Prunus,mexicana,,S. Watson449,8e4b41bd-b68e-4d91-9d03-f9285c9f775f,http://purl.org/dc/dcmitype/PhysicalObject,59:25.0,en,https://huh.harvard.edu/pages/use,President and Fellows of Harvard College,https://huh.harvard.edu/access-digital-reproductions-works-public-domain,http://data.huh.harvard.edu/8e4b41bd-b68e-4d91-9d03-f9285c9f775f/image,urn:lsid:biocol.org:col:15406,urn:lsid:biocol.org:col:15406,NA,A,A,Harvard University Herbaria: All Records,PreservedSpecimen,NA,NA,"{huh_taxonomic_group: Vascular, huh_project_id: 7, huh_project_name: US and Canada - Mass Digitization}",8e4b41bd-b68e-4d91-9d03-f9285c9f775f,barcode-01722663,NA,3,T. V. Munson,undetermined,NotDetermined,present,Sheet,in collection,,[see Simple Media extension],NA,3/10/10,NA,NA,1910,3,10,,,3,North America;United States of America;Texas;,North America,NA,NA,United States of America,US,Texas,,,near Rescue,near Rescue,,NA,NA,,NA,NA,,NA,,,,,NA,,Prunus mexicana S. Watson,Rosaceae,Prunus,mexicana,,S. Watson450,66dd852c-f69f-4bcd-ae9d-bc769e2a690d,http://purl.org/dc/dcmitype/PhysicalObject,05:12.0,en,https://huh.harvard.edu/pages/use,President and Fellows of Harvard College,https://huh.harvard.edu/access-digital-reproductions-works-public-domain,http://data.huh.harvard.edu/66dd852c-f69f-4bcd-ae9d-bc769e2a690d/image,urn:lsid:biocol.org:col:15406,urn:lsid:biocol.org:col:15406,NA,A,A,Harvard University Herbaria: All Records,PreservedSpecimen,NA,NA,"{huh_taxonomic_group: Vascular, huh_project_id: 7, huh_project_name: US and Canada - Mass Digitization}",66dd852c-f69f-4bcd-ae9d-bc769e2a690d,barcode-01722671,NA,8,[no data available],undetermined,NotDetermined,present,Sheet,in collection,,[see Simple Media extension],NA,,NA,NA,NA,NA,NA,,in bottom of ravine,8,North America;United States of America;Texas;,North America,NA,NA,United States of America,US,Texas,,,at Dublin's Place,at Dublin's Place,,NA,NA,,NA,NA,,NA,,,,,NA,,Prunus mexicana S. Watson,Rosaceae,Prunus,mexicana,,S. Watson451,f0912108-c401-4bca-8143-d93246f72556,http://purl.org/dc/dcmitype/PhysicalObject,07:44.0,en,https://huh.harvard.edu/pages/use,President and Fellows of Harvard College,https://huh.harvard.edu/access-digital-reproductions-works-public-domain,http://data.huh.harvard.edu/f0912108-c401-4bca-8143-d93246f72556/image,urn:lsid:biocol.org:col:15406,urn:lsid:biocol.org:col:15406,NA,A,A,Harvard University Herbaria: All Records,PreservedSpecimen,NA,NA,"{huh_taxonomic_group: Vascular, huh_project_id: 7, huh_project_name: US and Canada - Mass Digitization}",f0912108-c401-4bca-8143-d93246f72556,barcode-01722672,NA,8,T. V. Munson,undetermined,NotDetermined,present,Sheet,in collection,,[see Simple Media extension],NA,1910,NA,NA,1910,NA,NA,,,8,North America;United States of America;Texas;,North America,NA,NA,United States of America,US,Texas,,,Larissa Dublins Place,Larissa Dublins Place,,NA,NA,,NA,NA,,NA,,,,,NA,,Prunus mexicana S. Watson,Rosaceae,Prunus,mexicana,,S. Watson452,07e87746-760d-4ecc-b44b-5363501589dd,http://purl.org/dc/dcmitype/PhysicalObject,10:56.0,en,https://huh.harvard.edu/pages/use,President and Fellows of Harvard College,https://huh.harvard.edu/access-digital-reproductions-works-public-domain,http://data.huh.harvard.edu/07e87746-760d-4ecc-b44b-5363501589dd/image,urn:lsid:biocol.org:col:15406,urn:lsid:biocol.org:col:15406,NA,A,A,Harvard University Herbaria: All Records,PreservedSpecimen,NA,NA,"{huh_taxonomic_group: Vascular, huh_project_id: 7, huh_project_name: US and Canada - Mass Digitization}",07e87746-760d-4ecc-b44b-5363501589dd,barcode-01722673,NA,5558,B. F. Bush,undetermined,NotDetermined,present,Sheet,in collection,,[see Simple Media extension],NA,4/30/09,NA,NA,1909,4,30,,Woods,5558,North America;United States of America;Texas;,North America,NA,NA,United States of America,US,Texas,,,Larissa,Larissa,,NA,NA,,NA,NA,,NA,,,,,NA,,Prunus mexicana S. Watson,Rosaceae,Prunus,mexicana,,S. Watson453,c8951dda-5f15-48db-a1a6-6e141f2ea97c,http://purl.org/dc/dcmitype/PhysicalObject,11:49.0,en,https://huh.harvard.edu/pages/use,President and Fellows of Harvard College,https://huh.harvard.edu/access-digital-reproductions-works-public-domain,http://data.huh.harvard.edu/c8951dda-5f15-48db-a1a6-6e141f2ea97c/image,urn:lsid:biocol.org:col:15406,urn:lsid:biocol.org:col:15406,NA,A,A,Harvard University Herbaria: All Records,PreservedSpecimen,NA,NA,"{huh_taxonomic_group: Vascular, huh_project_id: 7, huh_project_name: US and Canada - Mass Digitization}",c8951dda-5f15-48db-a1a6-6e141f2ea97c,barcode-01722674,NA,5974,B. F. Bush,undetermined,NotDetermined,present,Sheet,in collection,,[see Simple Media extension],NA,10/7/09,NA,NA,1909,10,7,,,5974,North America;United States of America;Texas;,North America,NA,NA,United States of America,US,Texas,,,Larissa,Larissa,,NA,NA,,NA,NA,,NA,,,,,NA,,Prunus mexicana S. Watson,Rosaceae,Prunus,mexicana,,S. Watson454,08e95ccb-b89f-43f6-85f8-c6503a591091,http://purl.org/dc/dcmitype/PhysicalObject,13:42.0,en,https://huh.harvard.edu/pages/use,President and Fellows of Harvard College,https://huh.harvard.edu/access-digital-reproductions-works-public-domain,http://data.huh.harvard.edu/08e95ccb-b89f-43f6-85f8-c6503a591091/image,urn:lsid:biocol.org:col:15406,urn:lsid:biocol.org:col:15406,NA,A,A,Harvard University Herbaria: All Records,PreservedSpecimen,NA,NA,"{huh_taxonomic_group: Vascular, huh_project_id: 7, huh_project_name: US and Canada - Mass Digitization}",08e95ccb-b89f-43f6-85f8-c6503a591091,barcode-01722675,NA,5558,B. F. Bush,undetermined,NotDetermined,present,Sheet,in collection,,[see Simple Media extension],NA,4/30/09,NA,NA,1909,4,30,,Woods,5558,North America;United States of America;Texas;,North America,NA,NA,United States of America,US,Texas,,,Larissa,Larissa,,NA,NA,,NA,NA,,NA,,,,,NA,,Prunus mexicana S. Watson,Rosaceae,Prunus,mexicana,,S. Watson455,1b733dba-f926-4c74-845b-bd7c3946b053,http://purl.org/dc/dcmitype/PhysicalObject,24:35.0,en,https://huh.harvard.edu/pages/use,President and Fellows of Harvard College,https://huh.harvard.edu/access-digital-reproductions-works-public-domain,http://data.huh.harvard.edu/1b733dba-f926-4c74-845b-bd7c3946b053/image,urn:lsid:biocol.org:col:15631,urn:lsid:biocol.org:col:15631,NA,GH,GH,Harvard University Herbaria: All Records,PreservedSpecimen,NA,NA,"{huh_taxonomic_group: Vascular, huh_project_id: 7, huh_project_name: US and Canada - Mass Digitization}",1b733dba-f926-4c74-845b-bd7c3946b053,barcode-01722697,NA,729a,J. Reverchon,undetermined,NotDetermined,present,Sheet,in collection,,[see Simple Media extension],NA,,NA,NA,NA,NA,NA,March & Sept.,Dry uplands,729a,North America;United States of America;Texas;,North America,NA,NA,United States of America,US,Texas,,,near Dallas,near Dallas,,NA,NA,,NA,NA,,NA,,,,,NA,,Prunus mexicana S. Watson,Rosaceae,Prunus,mexicana,,S. Watson456,63666f99-bea8-4939-ba2a-92883405beb2,http://purl.org/dc/dcmitype/PhysicalObject,25:17.0,en,https://huh.harvard.edu/pages/use,President and Fellows of Harvard College,https://huh.harvard.edu/access-digital-reproductions-works-public-domain,http://data.huh.harvard.edu/63666f99-bea8-4939-ba2a-92883405beb2/image,urn:lsid:biocol.org:col:15631,urn:lsid:biocol.org:col:15631,NA,GH,GH,Harvard University Herbaria: All Records,PreservedSpecimen,NA,NA,"{huh_taxonomic_group: Vascular, huh_project_id: 7, huh_project_name: US and Canada - Mass Digitization}",63666f99-bea8-4939-ba2a-92883405beb2,barcode-01722699,NA,33,M. S. Young,undetermined,NotDetermined,present,Sheet,in collection,,[see Simple Media extension],NA,4/15/18,NA,NA,1918,4,15,,deep ravine,33,North America;United States of America;Texas;,North America,NA,NA,United States of America,US,Texas,,,"in Edwards PLateau, near Austin","in Edwards PLateau, near Austin",,NA,NA,,NA,NA,,NA,,,,,NA,,Prunus mexicana S. Watson,Rosaceae,Prunus,mexicana,,S. Watson457,1aa7e588-6b1f-49ef-9f2f-5fc5a0f21707,http://purl.org/dc/dcmitype/PhysicalObject,27:14.0,en,https://huh.harvard.edu/pages/use,President and Fellows of Harvard College,https://huh.harvard.edu/access-digital-reproductions-works-public-domain,http://data.huh.harvard.edu/1aa7e588-6b1f-49ef-9f2f-5fc5a0f21707/image,urn:lsid:biocol.org:col:15406,urn:lsid:biocol.org:col:15406,NA,A,A,Harvard University Herbaria: All Records,PreservedSpecimen,NA,NA,"{huh_taxonomic_group: Vascular, huh_project_id: 7, huh_project_name: US and Canada - Mass Digitization}",1aa7e588-6b1f-49ef-9f2f-5fc5a0f21707,barcode-01722703,NA,98,B. H. Slavin,undetermined,NotDetermined,present,Sheet,in collection,,[see Simple Media extension],NA,6/24/14,NA,NA,1914,6,24,,,98,North America;United States of America;Texas;,North America,NA,NA,United States of America,US,Texas,,,S. of Sherman,S. of Sherman,,NA,NA,,NA,NA,,NA,,,,,NA,,Prunus mexicana S. Watson,Rosaceae,Prunus,mexicana,,S. Watson458,8733dd51-6824-4c6f-b982-e439888ca5d0,http://purl.org/dc/dcmitype/PhysicalObject,31:08.0,en,https://huh.harvard.edu/pages/use,President and Fellows of Harvard College,https://huh.harvard.edu/access-digital-reproductions-works-public-domain,http://data.huh.harvard.edu/8733dd51-6824-4c6f-b982-e439888ca5d0/image,urn:lsid:biocol.org:col:15406,urn:lsid:biocol.org:col:15406,NA,A,A,Harvard University Herbaria: All Records,PreservedSpecimen,NA,NA,"{huh_taxonomic_group: Vascular, huh_project_id: 7, huh_project_name: US and Canada - Mass Digitization}",8733dd51-6824-4c6f-b982-e439888ca5d0,barcode-01722704,NA,96,B. H. Slavin,undetermined,NotDetermined,present,Sheet,in collection,,[see Simple Media extension],NA,3/24/14,NA,NA,1914,3,24,,This tree stands on the bank of a small creek in a woods,96,North America;United States of America;Texas;,North America,NA,NA,United States of America,US,Texas,,,east of a powerhouse on the track south of Sherman,east of a powerhouse on the track south of Sherman,,NA,NA,,NA,NA,,NA,,,,,NA,,Prunus mexicana S. Watson,Rosaceae,Prunus,mexicana,,S. Watson459,5d194973-46bb-4840-9565-ed1a0e3d72b1,http://purl.org/dc/dcmitype/PhysicalObject,32:01.0,en,https://huh.harvard.edu/pages/use,President and Fellows of Harvard College,https://huh.harvard.edu/access-digital-reproductions-works-public-domain,http://data.huh.harvard.edu/5d194973-46bb-4840-9565-ed1a0e3d72b1/image,urn:lsid:biocol.org:col:15406,urn:lsid:biocol.org:col:15406,NA,A,A,Harvard University Herbaria: All Records,PreservedSpecimen,NA,NA,"{huh_taxonomic_group: Vascular, huh_project_id: 7, huh_project_name: US and Canada - Mass Digitization}",5d194973-46bb-4840-9565-ed1a0e3d72b1,barcode-01722705,NA,96,B. H. Slavin,undetermined,NotDetermined,present,Sheet,in collection,,[see Simple Media extension],NA,6/24/14,NA,NA,1914,6,24,,,96,North America;United States of America;Texas;,North America,NA,NA,United States of America,US,Texas,,,S. of Sherman,S. of Sherman,,NA,NA,,NA,NA,,NA,,,,,NA,,Prunus mexicana S. Watson,Rosaceae,Prunus,mexicana,,S. Watson460,64b5477b-60ed-4e7e-9817-5ec7e0c30119,http://purl.org/dc/dcmitype/PhysicalObject,42:48.0,en,https://huh.harvard.edu/pages/use,President and Fellows of Harvard College,https://huh.harvard.edu/access-digital-reproductions-works-public-domain,http://data.huh.harvard.edu/64b5477b-60ed-4e7e-9817-5ec7e0c30119/image,urn:lsid:biocol.org:col:15406,urn:lsid:biocol.org:col:15406,NA,A,A,Harvard University Herbaria: All Records,PreservedSpecimen,NA,NA,"{huh_taxonomic_group: Vascular, huh_project_id: 7, huh_project_name: US and Canada - Mass Digitization}",64b5477b-60ed-4e7e-9817-5ec7e0c30119,barcode-01722706,NA,98,B. H. Slavin,undetermined,NotDetermined,present,Sheet,in collection,,[see Simple Media extension],NA,3/28/14,NA,NA,1914,3,28,,in the woods,98,North America;United States of America;Texas;,North America,NA,NA,United States of America,US,Texas,,,This tree east of the powerhouse on the track south of Sherman,This tree east of the powerhouse on the track south of Sherman,,NA,NA,,NA,NA,,NA,,,,,NA,,Prunus mexicana S. Watson,Rosaceae,Prunus,mexicana,,S. Watson461,c512cf49-f2ee-45b8-8b80-d12118c7b275,http://purl.org/dc/dcmitype/PhysicalObject,43:42.0,en,https://huh.harvard.edu/pages/use,President and Fellows of Harvard College,https://huh.harvard.edu/access-digital-reproductions-works-public-domain,http://data.huh.harvard.edu/c512cf49-f2ee-45b8-8b80-d12118c7b275/image,urn:lsid:biocol.org:col:15406,urn:lsid:biocol.org:col:15406,NA,A,A,Harvard University Herbaria: All Records,PreservedSpecimen,NA,NA,"{huh_taxonomic_group: Vascular, huh_project_id: 7, huh_project_name: US and Canada - Mass Digitization}",c512cf49-f2ee-45b8-8b80-d12118c7b275,barcode-01722707,NA,,T. V. Munson,undetermined,NotDetermined,present,Sheet,in collection,,[see Simple Media extension],NA,3/26/10,NA,NA,1910,3,26,,by creek,,North America;United States of America;Texas;,North America,NA,NA,United States of America,US,Texas,,,1 miles south of Sherman,1 miles south of Sherman,,NA,NA,,NA,NA,,NA,,,,,NA,,Prunus mexicana S. Watson,Rosaceae,Prunus,mexicana,,S. Watson462,02a6025f-fdfd-4fb3-8cb0-89e3255f72e9,http://purl.org/dc/dcmitype/PhysicalObject,44:32.0,en,https://huh.harvard.edu/pages/use,President and Fellows of Harvard College,https://huh.harvard.edu/access-digital-reproductions-works-public-domain,http://data.huh.harvard.edu/02a6025f-fdfd-4fb3-8cb0-89e3255f72e9/image,urn:lsid:biocol.org:col:15406,urn:lsid:biocol.org:col:15406,NA,A,A,Harvard University Herbaria: All Records,PreservedSpecimen,NA,NA,"{huh_taxonomic_group: Vascular, huh_project_id: 7, huh_project_name: US and Canada - Mass Digitization}",02a6025f-fdfd-4fb3-8cb0-89e3255f72e9,barcode-01722708,NA,1,T. V. Munson,undetermined,NotDetermined,present,Sheet,in collection,,[see Simple Media extension],NA,9/13/10,NA,NA,1910,9,13,,,1,North America;United States of America;Texas;,North America,NA,NA,United States of America,US,Texas,,,of Sherman,of Sherman,,NA,NA,,NA,NA,,NA,,,,,NA,,Prunus mexicana S. Watson,Rosaceae,Prunus,mexicana,,S. Watson463,583f4eb9-2785-45fa-abd8-9341887b2320,http://purl.org/dc/dcmitype/PhysicalObject,45:49.0,en,https://huh.harvard.edu/pages/use,President and Fellows of Harvard College,https://huh.harvard.edu/access-digital-reproductions-works-public-domain,http://data.huh.harvard.edu/583f4eb9-2785-45fa-abd8-9341887b2320/image,urn:lsid:biocol.org:col:15406,urn:lsid:biocol.org:col:15406,NA,A,A,Harvard University Herbaria: All Records,PreservedSpecimen,NA,NA,"{huh_taxonomic_group: Vascular, huh_project_id: 7, huh_project_name: US and Canada - Mass Digitization}",583f4eb9-2785-45fa-abd8-9341887b2320,barcode-01722709,NA,1,T. V. Munson,undetermined,NotDetermined,present,Sheet,in collection,,[see Simple Media extension],NA,3/26/10,NA,NA,1910,3,26,,,1,North America;United States of America;Texas;,North America,NA,NA,United States of America,US,Texas,,,1 mile S.W. of Sherman,1 mile S.W. of Sherman,,NA,NA,,NA,NA,,NA,,,,,NA,,Prunus mexicana S. Watson,Rosaceae,Prunus,mexicana,,S. Watson464,4bff302f-4d70-4470-ab28-304c2e342df8,http://purl.org/dc/dcmitype/PhysicalObject,46:52.0,en,https://huh.harvard.edu/pages/use,President and Fellows of Harvard College,https://huh.harvard.edu/access-digital-reproductions-works-public-domain,http://data.huh.harvard.edu/4bff302f-4d70-4470-ab28-304c2e342df8/image,urn:lsid:biocol.org:col:15406,urn:lsid:biocol.org:col:15406,NA,A,A,Harvard University Herbaria: All Records,PreservedSpecimen,NA,NA,"{huh_taxonomic_group: Vascular, huh_project_id: 7, huh_project_name: US and Canada - Mass Digitization}",4bff302f-4d70-4470-ab28-304c2e342df8,barcode-01722710,NA,,T. V. Munson,undetermined,NotDetermined,present,Sheet,in collection,,[see Simple Media extension],NA,9/13/10,NA,NA,1910,9,13,,,,North America;United States of America;Texas;,North America,NA,NA,United States of America,US,Texas,,,growing near No 1. Sherman,growing near No 1. Sherman,,NA,NA,,NA,NA,,NA,,,,,NA,,Prunus mexicana S. Watson,Rosaceae,Prunus,mexicana,,S. Watson465,5b47b5fe-26cb-4f7e-91b6-9f2b07f7b6f0,http://purl.org/dc/dcmitype/PhysicalObject,48:28.0,en,https://huh.harvard.edu/pages/use,President and Fellows of Harvard College,https://huh.harvard.edu/access-digital-reproductions-works-public-domain,http://data.huh.harvard.edu/5b47b5fe-26cb-4f7e-91b6-9f2b07f7b6f0/image,urn:lsid:biocol.org:col:15406,urn:lsid:biocol.org:col:15406,NA,A,A,Harvard University Herbaria: All Records,PreservedSpecimen,NA,NA,"{huh_taxonomic_group: Vascular, huh_project_id: 7, huh_project_name: US and Canada - Mass Digitization}",5b47b5fe-26cb-4f7e-91b6-9f2b07f7b6f0,barcode-01722711,NA,,C. S. Sargent,undetermined,NotDetermined,present,Sheet,in collection,,[see Simple Media extension],NA,3/20/11,NA,NA,1911,3,20,,,,North America;United States of America;Texas;,North America,NA,NA,United States of America,US,Texas,,,near Sherman,near Sherman,,NA,NA,,NA,NA,,NA,,,,,NA,,Prunus mexicana S. Watson,Rosaceae,Prunus,mexicana,,S. Watson466,f13213df-d4a3-4417-8343-062b3bcc81e6,http://purl.org/dc/dcmitype/PhysicalObject,53:10.0,en,https://huh.harvard.edu/pages/use,President and Fellows of Harvard College,https://huh.harvard.edu/access-digital-reproductions-works-public-domain,http://data.huh.harvard.edu/f13213df-d4a3-4417-8343-062b3bcc81e6/image,urn:lsid:biocol.org:col:15406,urn:lsid:biocol.org:col:15406,NA,A,A,Harvard University Herbaria: All Records,PreservedSpecimen,NA,NA,"{huh_taxonomic_group: Vascular, huh_project_id: 7, huh_project_name: US and Canada - Mass Digitization}",f13213df-d4a3-4417-8343-062b3bcc81e6,barcode-01722712,NA,,C. S. Sargent,undetermined,NotDetermined,present,Sheet,in collection,,[see Simple Media extension],NA,3/20/11,NA,NA,1911,3,20,,,,North America;United States of America;Texas;,North America,NA,NA,United States of America,US,Texas,,,near Sherman,near Sherman,,NA,NA,,NA,NA,,NA,,,,,NA,,Prunus mexicana S. Watson,Rosaceae,Prunus,mexicana,,S. Watson467,7d6806a3-791a-4930-a470-f3c36adeab52,http://purl.org/dc/dcmitype/PhysicalObject,00:53.0,en,https://huh.harvard.edu/pages/use,President and Fellows of Harvard College,https://huh.harvard.edu/access-digital-reproductions-works-public-domain,http://data.huh.harvard.edu/7d6806a3-791a-4930-a470-f3c36adeab52/image,urn:lsid:biocol.org:col:15406,urn:lsid:biocol.org:col:15406,NA,A,A,Harvard University Herbaria: All Records,PreservedSpecimen,NA,NA,"{huh_taxonomic_group: Vascular, huh_project_id: 7, huh_project_name: US and Canada - Mass Digitization}",7d6806a3-791a-4930-a470-f3c36adeab52,barcode-01722713,NA,,C. S. Sargent,undetermined,NotDetermined,present,Sheet,in collection,,[see Simple Media extension],NA,3/30/13,NA,NA,1913,3,30,,[illegible],,North America;United States of America;Texas;,North America,NA,NA,United States of America,US,Texas,,,Sutherland Springs,Sutherland Springs,,NA,NA,,NA,NA,,NA,,,,,NA,,Prunus mexicana S. Watson,Rosaceae,Prunus,mexicana,,S. Watson468,eec28979-856c-4675-a2df-d78c961a88b1,http://purl.org/dc/dcmitype/PhysicalObject,00:39.0,en,https://huh.harvard.edu/pages/use,President and Fellows of Harvard College,https://huh.harvard.edu/access-digital-reproductions-works-public-domain,http://data.huh.harvard.edu/eec28979-856c-4675-a2df-d78c961a88b1/image,urn:lsid:biocol.org:col:15406,urn:lsid:biocol.org:col:15406,NA,A,A,Harvard University Herbaria: All Records,PreservedSpecimen,NA,NA,"{huh_taxonomic_group: Vascular, huh_project_id: 7, huh_project_name: US and Canada - Mass Digitization}",eec28979-856c-4675-a2df-d78c961a88b1,barcode-01722714,NA,,C. S. Sargent,undetermined,NotDetermined,present,Sheet,in collection,,[see Simple Media extension],NA,3/30/13,NA,NA,1913,3,30,,[illegible],,North America;United States of America;Texas;,North America,NA,NA,United States of America,US,Texas,,,Sutherland Springs,Sutherland Springs,,NA,NA,,NA,NA,,NA,,,,,NA,,Prunus mexicana S. Watson,Rosaceae,Prunus,mexicana,,S. Watson469,0881a144-2736-42fc-a59d-a5040bb49e0e,http://purl.org/dc/dcmitype/PhysicalObject,00:30.0,en,https://huh.harvard.edu/pages/use,President and Fellows of Harvard College,https://huh.harvard.edu/access-digital-reproductions-works-public-domain,http://data.huh.harvard.edu/0881a144-2736-42fc-a59d-a5040bb49e0e/image,urn:lsid:biocol.org:col:15406,urn:lsid:biocol.org:col:15406,NA,A,A,Harvard University Herbaria: All Records,PreservedSpecimen,NA,NA,"{huh_taxonomic_group: Vascular, huh_project_id: 7, huh_project_name: US and Canada - Mass Digitization}",0881a144-2736-42fc-a59d-a5040bb49e0e,barcode-01722715,NA,,C. S. Sargent,undetermined,NotDetermined,present,Sheet,in collection,,[see Simple Media extension],NA,4/8/15,NA,NA,1915,4,8,,,,North America;United States of America;Texas;,North America,NA,NA,United States of America,US,Texas,,,Sutherland Springs,Sutherland Springs,,NA,NA,,NA,NA,,NA,,,,,NA,,Prunus mexicana S. Watson,Rosaceae,Prunus,mexicana,,S. Watson470,badd8d6a-6684-4b3d-9954-b71791c07189,http://purl.org/dc/dcmitype/PhysicalObject,12:13.0,en,https://huh.harvard.edu/pages/use,President and Fellows of Harvard College,https://huh.harvard.edu/access-digital-reproductions-works-public-domain,http://data.huh.harvard.edu/badd8d6a-6684-4b3d-9954-b71791c07189/image,urn:lsid:biocol.org:col:15406,urn:lsid:biocol.org:col:15406,NA,A,A,Harvard University Herbaria: All Records,PreservedSpecimen,NA,NA,"{huh_taxonomic_group: Vascular, huh_project_id: 7, huh_project_name: US and Canada - Mass Digitization}",badd8d6a-6684-4b3d-9954-b71791c07189,barcode-01722729,NA,8=2,T. V. Munson,undetermined,NotDetermined,present,Sheet,in collection,,[see Simple Media extension],NA,1910,NA,NA,1910,NA,NA,,,8=2,North America;United States of America;Texas;,North America,NA,NA,United States of America,US,Texas,,,Dublin's Place Larissa,Dublin's Place Larissa,,NA,NA,,NA,NA,,NA,,,,,NA,,Prunus mexicana S. Watson,Rosaceae,Prunus,mexicana,,S. Watson471,249d7b06-e4b8-4af4-aac6-167d78e0cda1,http://purl.org/dc/dcmitype/PhysicalObject,14:44.0,en,https://huh.harvard.edu/pages/use,President and Fellows of Harvard College,https://huh.harvard.edu/access-digital-reproductions-works-public-domain,http://data.huh.harvard.edu/249d7b06-e4b8-4af4-aac6-167d78e0cda1/image,urn:lsid:biocol.org:col:15406,urn:lsid:biocol.org:col:15406,NA,A,A,Harvard University Herbaria: All Records,PreservedSpecimen,NA,NA,"{huh_taxonomic_group: Vascular, huh_project_id: 7, huh_project_name: US and Canada - Mass Digitization}",249d7b06-e4b8-4af4-aac6-167d78e0cda1,barcode-01722730,NA,6,T. V. Munson,undetermined,NotDetermined,present,Sheet,in collection,,[see Simple Media extension],NA,1910,NA,NA,1910,NA,NA,,On high bank,6,North America;United States of America;Texas;,North America,NA,NA,United States of America,US,Texas,,,right side going toward Larissa,right side going toward Larissa,,NA,NA,,NA,NA,,NA,,,,,NA,,Prunus mexicana S. Watson,Rosaceae,Prunus,mexicana,,S. Watson472,5db63f6d-c77d-46aa-beea-f05378a68fa6,http://purl.org/dc/dcmitype/PhysicalObject,16:05.0,en,https://huh.harvard.edu/pages/use,President and Fellows of Harvard College,https://huh.harvard.edu/access-digital-reproductions-works-public-domain,http://data.huh.harvard.edu/5db63f6d-c77d-46aa-beea-f05378a68fa6/image,urn:lsid:biocol.org:col:15406,urn:lsid:biocol.org:col:15406,NA,A,A,Harvard University Herbaria: All Records,PreservedSpecimen,NA,NA,"{huh_taxonomic_group: Vascular, huh_project_id: 7, huh_project_name: US and Canada - Mass Digitization}",5db63f6d-c77d-46aa-beea-f05378a68fa6,barcode-01722731,NA,8,T. V. Munson,undetermined,NotDetermined,present,Sheet,in collection,,[see Simple Media extension],NA,1910,NA,NA,1910,NA,NA,,,8,North America;United States of America;Texas;,North America,NA,NA,United States of America,US,Texas,,,at Dublin's Place,at Dublin's Place,,NA,NA,,NA,NA,,NA,,,,,NA,,Prunus mexicana S. Watson,Rosaceae,Prunus,mexicana,,S. Watson473,585c4386-50eb-44e3-9bd2-99e3093767cd,http://purl.org/dc/dcmitype/PhysicalObject,19:37.0,en,https://huh.harvard.edu/pages/use,President and Fellows of Harvard College,https://huh.harvard.edu/access-digital-reproductions-works-public-domain,http://data.huh.harvard.edu/585c4386-50eb-44e3-9bd2-99e3093767cd/image,urn:lsid:biocol.org:col:15406,urn:lsid:biocol.org:col:15406,NA,A,A,Harvard University Herbaria: All Records,PreservedSpecimen,NA,NA,"{huh_taxonomic_group: Vascular, huh_project_id: 7, huh_project_name: US and Canada - Mass Digitization}",585c4386-50eb-44e3-9bd2-99e3093767cd,barcode-01722732,NA,6,T. V. Munson,undetermined,NotDetermined,present,Sheet,in collection,,[see Simple Media extension],NA,1910,NA,NA,1910,NA,NA,,on high bank,6,North America;United States of America;Texas;,North America,NA,NA,United States of America,US,Texas,,,right side of road going toward Larissa,right side of road going toward Larissa,,NA,NA,,NA,NA,,NA,,,,,NA,,Prunus mexicana S. Watson,Rosaceae,Prunus,mexicana,,S. Watson474,38d637ed-ada7-45c4-9295-64d61fb526b9,http://purl.org/dc/dcmitype/PhysicalObject,21:23.0,en,https://huh.harvard.edu/pages/use,President and Fellows of Harvard College,https://huh.harvard.edu/access-digital-reproductions-works-public-domain,http://data.huh.harvard.edu/38d637ed-ada7-45c4-9295-64d61fb526b9/image,urn:lsid:biocol.org:col:15406,urn:lsid:biocol.org:col:15406,NA,A,A,Harvard University Herbaria: All Records,PreservedSpecimen,NA,NA,"{huh_taxonomic_group: Vascular, huh_project_id: 7, huh_project_name: US and Canada - Mass Digitization}",38d637ed-ada7-45c4-9295-64d61fb526b9,barcode-01722734,NA,6,C. S. Sargent,undetermined,NotDetermined,present,Sheet,in collection,,[see Simple Media extension],NA,3/24/10,NA,NA,1910,3,24,,,6,North America;United States of America;Texas;,North America,NA,NA,United States of America,US,Texas,,,Larissa,Larissa,,NA,NA,,NA,NA,,NA,,,,,NA,,Prunus mexicana S. Watson,Rosaceae,Prunus,mexicana,,S. Watson475,bd026c95-dfc6-4c58-adfb-071a46f62286,http://purl.org/dc/dcmitype/PhysicalObject,32:02.0,en,https://huh.harvard.edu/pages/use,President and Fellows of Harvard College,https://huh.harvard.edu/access-digital-reproductions-works-public-domain,http://data.huh.harvard.edu/bd026c95-dfc6-4c58-adfb-071a46f62286/image,urn:lsid:biocol.org:col:15406,urn:lsid:biocol.org:col:15406,NA,A,A,Harvard University Herbaria: All Records,PreservedSpecimen,NA,NA,"{huh_taxonomic_group: Vascular, huh_project_id: 7, huh_project_name: US and Canada - Mass Digitization}",bd026c95-dfc6-4c58-adfb-071a46f62286,barcode-01722735,NA,2,T. V. Munson,undetermined,NotDetermined,present,Sheet,in collection,,[see Simple Media extension],NA,1910,NA,NA,1910,NA,NA,,,2,North America;United States of America;Texas;,North America,NA,NA,United States of America,US,Texas,,,100 ft. N. of negro cabin 3 mi. N.W. of Jacksonville,100 ft. N. of negro cabin 3 mi. N.W. of Jacksonville,,NA,NA,,NA,NA,,NA,,,,,NA,,Prunus mexicana S. Watson,Rosaceae,Prunus,mexicana,,S. Watson476,89e0f180-552d-4dde-8341-904b9894e59f,http://purl.org/dc/dcmitype/PhysicalObject,51:47.0,en,https://huh.harvard.edu/pages/use,President and Fellows of Harvard College,https://huh.harvard.edu/access-digital-reproductions-works-public-domain,http://data.huh.harvard.edu/89e0f180-552d-4dde-8341-904b9894e59f/image,urn:lsid:biocol.org:col:15406,urn:lsid:biocol.org:col:15406,NA,A,A,Harvard University Herbaria: All Records,PreservedSpecimen,NA,NA,"{huh_taxonomic_group: Vascular, huh_project_id: 7, huh_project_name: US and Canada - Mass Digitization}",89e0f180-552d-4dde-8341-904b9894e59f,barcode-01722736,NA,2,T. V. Munson,undetermined,NotDetermined,present,Sheet,in collection,,[see Simple Media extension],NA,1910,NA,NA,1910,NA,NA,,,2,North America;United States of America;Texas;,North America,NA,NA,United States of America,US,Texas,,,100 ft. N. of negro cabin W. side of road. 3 mi. N.W. of Jacksonville,100 ft. N. of negro cabin W. side of road. 3 mi. N.W. of Jacksonville,,NA,NA,,NA,NA,,NA,,,,,NA,,Prunus mexicana S. Watson,Rosaceae,Prunus,mexicana,,S. Watson477,1eeafa69-6384-4cf6-b684-d7aeea31fcc7,http://purl.org/dc/dcmitype/PhysicalObject,52:52.0,en,https://huh.harvard.edu/pages/use,President and Fellows of Harvard College,https://huh.harvard.edu/access-digital-reproductions-works-public-domain,http://data.huh.harvard.edu/1eeafa69-6384-4cf6-b684-d7aeea31fcc7/image,urn:lsid:biocol.org:col:15406,urn:lsid:biocol.org:col:15406,NA,A,A,Harvard University Herbaria: All Records,PreservedSpecimen,NA,NA,"{huh_taxonomic_group: Vascular, huh_project_id: 7, huh_project_name: US and Canada - Mass Digitization}",1eeafa69-6384-4cf6-b684-d7aeea31fcc7,barcode-01722737,NA,2,T. V. Munson,undetermined,NotDetermined,present,Sheet,in collection,,[see Simple Media extension],NA,1910,NA,NA,1910,NA,NA,,,2,North America;United States of America;Texas;,North America,NA,NA,United States of America,US,Texas,,,3 mi. N.W. of Jacksonville 100 ft. N of negro cabin,3 mi. N.W. of Jacksonville 100 ft. N of negro cabin,,NA,NA,,NA,NA,,NA,,,,,NA,,Prunus mexicana S. Watson,Rosaceae,Prunus,mexicana,,S. Watson478,914045e6-49b4-4647-be3a-3a457df41ff9,http://purl.org/dc/dcmitype/PhysicalObject,44:57.0,en,https://huh.harvard.edu/pages/use,President and Fellows of Harvard College,https://huh.harvard.edu/access-digital-reproductions-works-public-domain,http://data.huh.harvard.edu/914045e6-49b4-4647-be3a-3a457df41ff9/image,urn:lsid:biocol.org:col:15406,urn:lsid:biocol.org:col:15406,NA,A,A,Harvard University Herbaria: All Records,PreservedSpecimen,NA,NA,"{huh_taxonomic_group: Vascular, huh_project_id: 7, huh_project_name: US and Canada - Mass Digitization}",914045e6-49b4-4647-be3a-3a457df41ff9,barcode-01722752,NA,,E. N. Krause,undetermined,NotDetermined,present,Sheet,in collection,,[see Simple Media extension],NA,,NA,NA,NA,NA,NA,Aug 30 '12,,,North America;United States of America;Texas;,North America,NA,NA,United States of America,US,Texas,,,Bay City,Bay City,,NA,NA,,NA,NA,,NA,,,,,NA,,Prunus mexicana S. Watson,Rosaceae,Prunus,mexicana,,S. Watson479,c352f49c-0835-4195-b451-fafb3f5a49df,http://purl.org/dc/dcmitype/PhysicalObject,45:34.0,en,https://huh.harvard.edu/pages/use,President and Fellows of Harvard College,https://huh.harvard.edu/access-digital-reproductions-works-public-domain,http://data.huh.harvard.edu/c352f49c-0835-4195-b451-fafb3f5a49df/image,urn:lsid:biocol.org:col:15406,urn:lsid:biocol.org:col:15406,NA,A,A,Harvard University Herbaria: All Records,PreservedSpecimen,NA,NA,"{huh_taxonomic_group: Vascular, huh_project_id: 7, huh_project_name: US and Canada - Mass Digitization}",c352f49c-0835-4195-b451-fafb3f5a49df,barcode-01722759,NA,,C. S. Sargent,undetermined,NotDetermined,present,Sheet,in collection,,[see Simple Media extension],NA,3/24/11,NA,NA,1911,3,24,,,,North America;United States of America;Texas;,North America,NA,NA,United States of America,US,Texas,,,Near Seguin,Near Seguin,,NA,NA,,NA,NA,,NA,,,,,NA,,Prunus mexicana S. Watson,Rosaceae,Prunus,mexicana,,S. Watson480,b5d052fd-d5f1-4331-8f3d-8758b975167a,http://purl.org/dc/dcmitype/PhysicalObject,46:36.0,en,https://huh.harvard.edu/pages/use,President and Fellows of Harvard College,https://huh.harvard.edu/access-digital-reproductions-works-public-domain,http://data.huh.harvard.edu/b5d052fd-d5f1-4331-8f3d-8758b975167a/image,urn:lsid:biocol.org:col:15406,urn:lsid:biocol.org:col:15406,NA,A,A,Harvard University Herbaria: All Records,PreservedSpecimen,NA,NA,"{huh_taxonomic_group: Vascular, huh_project_id: 7, huh_project_name: US and Canada - Mass Digitization}",b5d052fd-d5f1-4331-8f3d-8758b975167a,barcode-01722760,NA,8,C. S. Sargent,undetermined,NotDetermined,present,Sheet,in collection,,[see Simple Media extension],NA,3/24/10,NA,NA,1910,3,24,,,8,North America;United States of America;Texas;,North America,NA,NA,United States of America,US,Texas,,,About Selma,About Selma,,NA,NA,,NA,NA,,NA,,,,,NA,,Prunus mexicana S. Watson,Rosaceae,Prunus,mexicana,,S. Watson481,697b7aa5-2b96-4e8a-a1cc-a28b38034bfe,http://purl.org/dc/dcmitype/PhysicalObject,54:46.0,en,https://huh.harvard.edu/pages/use,President and Fellows of Harvard College,https://huh.harvard.edu/access-digital-reproductions-works-public-domain,http://data.huh.harvard.edu/697b7aa5-2b96-4e8a-a1cc-a28b38034bfe/image,urn:lsid:biocol.org:col:15406,urn:lsid:biocol.org:col:15406,NA,A,A,Harvard University Herbaria: All Records,PreservedSpecimen,NA,NA,"{huh_taxonomic_group: Vascular, huh_project_id: 7, huh_project_name: US and Canada - Mass Digitization}",697b7aa5-2b96-4e8a-a1cc-a28b38034bfe,barcode-01722766,NA,12,T. V. Munson,undetermined,NotDetermined,present,Sheet,in collection,,[see Simple Media extension],NA,5/18/10,NA,NA,1910,5,18,,near a post oak,12,North America;United States of America;Texas;,North America,NA,NA,United States of America,US,Texas,,,Right hand of road going towards Jacksonville near 2 m. S. W. of MT. Selman,Right hand of road going towards Jacksonville near 2 m. S. W. of MT. Selman,,NA,NA,,NA,NA,,NA,,,,,NA,,Prunus mexicana S. Watson,Rosaceae,Prunus,mexicana,,S. Watson